Unique_ID,Show_Name,Season,Episode,Line_Index,Start,End,Dialogue,Dialogue_lower,Dialogue_Set_Words,Dialogue_Words,Dialogue_Tokens_Text,Dialogue_Tokens_Lemmas,Dialogue_Tokens_POS_Tags,Dialogue_Lemmas_Pattern,Dialogue_POS_Tags_Pattern
Babylon_Berlin__S03E01.srt,Babylon Berlin,Babylon Berlin S03,Babylon Berlin E01,329,"0:28:33,360","0:28:36,120",Die Geschichte der Weltfinanz wird neu geschrieben.,die geschichte der weltfinanz wird neu geschrieben.,"['der', 'weltfinanz', 'neu', 'geschichte', 'die', 'wird', 'geschrieben']","['Die', 'Geschichte', 'der', 'Weltfinanz', 'wird', 'neu', 'geschrieben']","['Die', 'Geschichte', 'der', 'Weltfinanz', 'wird', 'neu', 'geschrieben', '.']","['der', 'Geschichte', 'der', 'Weltfinanz', 'werden', 'neu', 'schreiben', '.']","['DET', 'NOUN', 'DET', 'NOUN', 'AUX', 'ADV', 'VERB', 'PUNCT']",der Geschichte der Weltfinanz werden neu schreiben .,DET NOUN DET NOUN AUX ADV VERB PUNCT
Babylon_Berlin__S03E01.srt,Babylon Berlin,Babylon Berlin S03,Babylon Berlin E01,330,"0:28:36,200","0:28:39,320","Noch vor ein paar Monaten hat niemand geglaubt, dass jeder amerikanische","noch vor ein paar monaten hat niemand geglaubt, dass jeder amerikanische","['geglaubt', 'niemand', 'ein', 'dass', 'amerikanische', 'paar', 'vor', 'monaten', 'noch', 'jeder', 'hat']","['Noch', 'vor', 'ein', 'paar', 'Monaten', 'hat', 'niemand', 'geglaubt', 'dass', 'jeder', 'amerikanische']","['Noch', 'vor', 'ein', 'paar', 'Monaten', 'hat', 'niemand', 'geglaubt', ',', 'dass', 'jeder', 'amerikanische']","['Noch', 'vor', 'einen', 'paar', 'Monat', 'haben', 'niemand', 'glauben', ',', 'dass', 'jed', 'amerikanische']","['ADV', 'ADP', 'DET', 'DET', 'NOUN', 'AUX', 'PRON', 'VERB', 'PUNCT', 'SCONJ', 'DET', 'ADJ']","Noch vor einen paar Monat haben niemand glauben , dass jed amerikanische",ADV ADP DET DET NOUN AUX PRON VERB PUNCT SCONJ DET ADJ
Babylon_Berlin__S03E01.srt,Babylon Berlin,Babylon Berlin S03,Babylon Berlin E01,331,"0:28:39,400","0:28:42,640","Schornsteinfeger, jede deutsche Angestellte über Aktien verfügen würde.","schornsteinfeger, jede deutsche angestellte über aktien verfügen würde.","['schornsteinfeger', 'deutsche', 'würde', 'aktien', 'angestellte', 'jede', 'verfügen', 'über']","['Schornsteinfeger', 'jede', 'deutsche', 'Angestellte', 'über', 'Aktien', 'verfügen', 'würde']","['Schornsteinfeger', ',', 'jede', 'deutsche', 'Angestellte', 'über', 'Aktien', 'verfügen', 'würde', '.']","['Schornsteinfeger', ',', 'jed', 'deutsch', 'Angestellte', 'über', 'Aktie', 'verfügen', 'werden', '.']","['NOUN', 'PUNCT', 'DET', 'ADJ', 'NOUN', 'ADP', 'NOUN', 'VERB', 'AUX', 'PUNCT']","Schornsteinfeger , jed deutsch Angestellte über Aktie verfügen werden .",NOUN PUNCT DET ADJ NOUN ADP NOUN VERB AUX PUNCT
Babylon_Berlin__S03E01.srt,Babylon Berlin,Babylon Berlin S03,Babylon Berlin E01,332,"0:28:42,720","0:28:44,40",Unser Fonds setzt auf Wachstum.,unser fonds setzt auf wachstum.,"['fonds', 'wachstum', 'unser', 'auf', 'setzt']","['Unser', 'Fonds', 'setzt', 'auf', 'Wachstum']","['Unser', 'Fonds', 'setzt', 'auf', 'Wachstum', '.']","['sich', 'Fond', 'setzen', 'auf', 'Wachstum', '.']","['DET', 'NOUN', 'VERB', 'ADP', 'NOUN', 'PUNCT']",sich Fond setzen auf Wachstum .,DET NOUN VERB ADP NOUN PUNCT
Babylon_Berlin__S03E01.srt,Babylon Berlin,Babylon Berlin S03,Babylon Berlin E01,333,"0:28:44,120","0:28:46,440",Gerade für Großinvestoren wie Sie.,gerade für großinvestoren wie sie.,"['für', 'gerade', 'sie', 'wie', 'großinvestoren']","['Gerade', 'für', 'Großinvestoren', 'wie', 'Sie']","['Gerade', 'für', 'Großinvestoren', 'wie', 'Sie', '.']","['Gerade', 'für', 'Großinvestoren', 'wie', 'ich', '.']","['ADV', 'ADP', 'NOUN', 'ADP', 'PRON', 'PUNCT']",Gerade für Großinvestoren wie ich .,ADV ADP NOUN ADP PRON PUNCT
Babylon_Berlin__S03E01.srt,Babylon Berlin,Babylon Berlin S03,Babylon Berlin E01,334,"0:28:46,520","0:28:47,480","Herr Ahrensen,","herr ahrensen,","['herr', 'ahrensen']","['Herr', 'Ahrensen']","['Herr', 'Ahrensen', ',']","['Herr', 'Ahrensen', ',']","['NOUN', 'NOUN', 'PUNCT']","Herr Ahrensen ,",NOUN NOUN PUNCT
Babylon_Berlin__S03E01.srt,Babylon Berlin,Babylon Berlin S03,Babylon Berlin E01,335,"0:28:47,560","0:28:50,600",die Stiftung interessiert sich für das neue Angebot Ihres Konsortiums.,die stiftung interessiert sich für das neue angebot ihres konsortiums.,"['neue', 'für', 'das', 'sich', 'angebot', 'interessiert', 'ihres', 'die', 'stiftung', 'konsortiums']","['die', 'Stiftung', 'interessiert', 'sich', 'für', 'das', 'neue', 'Angebot', 'Ihres', 'Konsortiums']","['die', 'Stiftung', 'interessiert', 'sich', 'für', 'das', 'neue', 'Angebot', 'Ihres', 'Konsortiums', '.']","['der', 'Stiftung', 'interessieren', 'sich', 'für', 'der', 'neue', 'Angebot', 'mein', 'Konsortium', '.']","['DET', 'NOUN', 'VERB', 'PRON', 'ADP', 'DET', 'ADJ', 'NOUN', 'DET', 'NOUN', 'PUNCT']",der Stiftung interessieren sich für der neue Angebot mein Konsortium .,DET NOUN VERB PRON ADP DET ADJ NOUN DET NOUN PUNCT
Babylon_Berlin__S03E01.srt,Babylon Berlin,Babylon Berlin S03,Babylon Berlin E01,336,"0:28:52,560","0:28:53,960",Das ist erfreulich.,das ist erfreulich.,"['erfreulich', 'ist', 'das']","['Das', 'ist', 'erfreulich']","['Das', 'ist', 'erfreulich', '.']","['der', 'sein', 'erfreulich', '.']","['PRON', 'AUX', 'ADV', 'PUNCT']",der sein erfreulich .,PRON AUX ADV PUNCT
Babylon_Berlin__S03E01.srt,Babylon Berlin,Babylon Berlin S03,Babylon Berlin E01,337,"0:28:54,600","0:28:55,800",In welcher Höhe?,in welcher höhe?,"['welcher', 'höhe', 'in']","['In', 'welcher', 'Höhe']","['In', 'welcher', 'Höhe', '?']","['In', 'welch', 'Höhe', '?']","['ADP', 'DET', 'NOUN', 'PUNCT']",In welch Höhe ?,ADP DET NOUN PUNCT
Babylon_Berlin__S03E01.srt,Babylon Berlin,Babylon Berlin S03,Babylon Berlin E01,338,"0:29:0,600","0:29:3,240",45 Millionen amerikanische Dollar.,45 millionen amerikanische dollar.,"['45', 'amerikanische', 'dollar', 'millionen']","['45', 'Millionen', 'amerikanische', 'Dollar']","['45', 'Millionen', 'amerikanische', 'Dollar', '.']","['45', 'Million', 'amerikanische', 'Dollar', '.']","['NUM', 'NOUN', 'ADJ', 'NOUN', 'PUNCT']",45 Million amerikanische Dollar .,NUM NOUN ADJ NOUN PUNCT
Babylon_Berlin__S03E01.srt,Babylon Berlin,Babylon Berlin S03,Babylon Berlin E01,339,"0:29:11,120","0:29:13,120",Die Wirtschaft wächst.,die wirtschaft wächst.,"['wirtschaft', 'die', 'wächst']","['Die', 'Wirtschaft', 'wächst']","['Die', 'Wirtschaft', 'wächst', '.']","['der', 'Wirtschaft', 'wachsen', '.']","['DET', 'NOUN', 'VERB', 'PUNCT']",der Wirtschaft wachsen .,DET NOUN VERB PUNCT
Babylon_Berlin__S03E01.srt,Babylon Berlin,Babylon Berlin S03,Babylon Berlin E01,340,"0:29:13,680","0:29:15,320",Es geht immer bergauf.,es geht immer bergauf.,"['geht', 'immer', 'bergauf', 'es']","['Es', 'geht', 'immer', 'bergauf']","['Es', 'geht', 'immer', 'bergauf', '.']","['ich', 'gehen', 'immer', 'bergauf', '.']","['PRON', 'VERB', 'ADV', 'ADV', 'PUNCT']",ich gehen immer bergauf .,PRON VERB ADV ADV PUNCT
Babylon_Berlin__S03E01.srt,Babylon Berlin,Babylon Berlin S03,Babylon Berlin E01,341,"0:29:16,480","0:29:17,920",Wohlstand für alle.,wohlstand für alle.,"['wohlstand', 'für', 'alle']","['Wohlstand', 'für', 'alle']","['Wohlstand', 'für', 'alle', '.']","['Wohlstand', 'für', 'all', '.']","['NOUN', 'ADP', 'PRON', 'PUNCT']",Wohlstand für all .,NOUN ADP PRON PUNCT
Babylon_Berlin__S03E01.srt,Babylon Berlin,Babylon Berlin S03,Babylon Berlin E01,342,"0:29:19,240","0:29:20,600",Glauben Sie das?,glauben sie das?,"['sie', 'glauben', 'das']","['Glauben', 'Sie', 'das']","['Glauben', 'Sie', 'das', '?']","['Glaube', 'ich', 'der', '?']","['VERB', 'PRON', 'PRON', 'PUNCT']",Glaube ich der ?,VERB PRON PRON PUNCT
Babylon_Berlin__S03E01.srt,Babylon Berlin,Babylon Berlin S03,Babylon Berlin E01,343,"0:29:21,440","0:29:22,440",Wie bitte?,wie bitte?,"['wie', 'bitte']","['Wie', 'bitte']","['Wie', 'bitte', '?']","['Wie', 'bitte', '?']","['ADV', 'ADV', 'PUNCT']",Wie bitte ?,ADV ADV PUNCT
Babylon_Berlin__S03E01.srt,Babylon Berlin,Babylon Berlin S03,Babylon Berlin E01,344,"0:29:24,440","0:29:27,360","Sehen Sie, Wegener, ich bin einer, der zum Irrenarzt geht.","sehen sie, wegener, ich bin einer, der zum irrenarzt geht.","['sie', 'irrenarzt', 'der', 'bin', 'einer', 'geht', 'wegener', 'ich', 'sehen', 'zum']","['Sehen', 'Sie', 'Wegener', 'ich', 'bin', 'einer', 'der', 'zum', 'Irrenarzt', 'geht']","['Sehen', 'Sie', ',', 'Wegener', ',', 'ich', 'bin', 'einer', ',', 'der', 'zum', 'Irrenarzt', 'geht', '.']","['Sehen', 'ich', ',', 'Wegener', ',', 'ich', 'sein', 'einer', ',', 'der', 'zum', 'Irrenarzt', 'gehen', '.']","['VERB', 'PRON', 'PUNCT', 'NOUN', 'PUNCT', 'PRON', 'AUX', 'PRON', 'PUNCT', 'PRON', 'ADP', 'NOUN', 'VERB', 'PUNCT']","Sehen ich , Wegener , ich sein einer , der zum Irrenarzt gehen .",VERB PRON PUNCT NOUN PUNCT PRON AUX PRON PUNCT PRON ADP NOUN VERB PUNCT
Babylon_Berlin__S03E01.srt,Babylon Berlin,Babylon Berlin S03,Babylon Berlin E01,345,"0:29:28,400","0:29:31,80",Er nennt sich Psychotherapeut.,er nennt sich psychotherapeut.,"['nennt', 'sich', 'er', 'psychotherapeut']","['Er', 'nennt', 'sich', 'Psychotherapeut']","['Er', 'nennt', 'sich', 'Psychotherapeut', '.']","['ich', 'nennen', 'sich', 'Psychotherapeut', '.']","['PRON', 'VERB', 'PRON', 'PROPN', 'PUNCT']",ich nennen sich Psychotherapeut .,PRON VERB PRON PROPN PUNCT
Babylon_Berlin__S03E01.srt,Babylon Berlin,Babylon Berlin S03,Babylon Berlin E01,346,"0:29:32,40","0:29:33,760",Aber ich nenne ihn Irrenarzt.,aber ich nenne ihn irrenarzt.,"['irrenarzt', 'aber', 'nenne', 'ihn', 'ich']","['Aber', 'ich', 'nenne', 'ihn', 'Irrenarzt']","['Aber', 'ich', 'nenne', 'ihn', 'Irrenarzt', '.']","['aber', 'ich', 'nennen', 'ich', 'Irrenarzt', '.']","['CCONJ', 'PRON', 'VERB', 'PRON', 'NOUN', 'PUNCT']",aber ich nennen ich Irrenarzt .,CCONJ PRON VERB PRON NOUN PUNCT
Babylon_Berlin__S03E01.srt,Babylon Berlin,Babylon Berlin S03,Babylon Berlin E01,347,"0:29:34,440","0:29:36,720","Ich gehe dahin, weil ich auffällig war als Kind.","ich gehe dahin, weil ich auffällig war als kind.","['dahin', 'weil', 'war', 'gehe', 'kind', 'als', 'auffällig', 'ich']","['Ich', 'gehe', 'dahin', 'weil', 'ich', 'auffällig', 'war', 'als', 'Kind']","['Ich', 'gehe', 'dahin', ',', 'weil', 'ich', 'auffällig', 'war', 'als', 'Kind', '.']","['Ich', 'gehen', 'dahin', ',', 'weil', 'ich', 'auffällig', 'sein', 'als', 'Kind', '.']","['PRON', 'VERB', 'ADV', 'PUNCT', 'SCONJ', 'PRON', 'ADV', 'AUX', 'ADP', 'NOUN', 'PUNCT']","Ich gehen dahin , weil ich auffällig sein als Kind .",PRON VERB ADV PUNCT SCONJ PRON ADV AUX ADP NOUN PUNCT
Babylon_Berlin__S03E01.srt,Babylon Berlin,Babylon Berlin S03,Babylon Berlin E01,348,"0:29:37,80","0:29:39,80",Nie mit den anderen gespielt.,nie mit den anderen gespielt.,"['gespielt', 'nie', 'den', 'anderen', 'mit']","['Nie', 'mit', 'den', 'anderen', 'gespielt']","['Nie', 'mit', 'den', 'anderen', 'gespielt', '.']","['Nie', 'mit', 'der', 'ander', 'spielen', '.']","['ADV', 'ADP', 'DET', 'PRON', 'VERB', 'PUNCT']",Nie mit der ander spielen .,ADV ADP DET PRON VERB PUNCT
Babylon_Berlin__S03E01.srt,Babylon Berlin,Babylon Berlin S03,Babylon Berlin E01,349,"0:29:39,720","0:29:41,440","Hätte ja gern, aber...","hätte ja gern, aber...","['ja', 'hätte', 'gern', 'aber']","['Hätte', 'ja', 'gern', 'aber']","['Hätte', 'ja', 'gern', ',', 'aber', '...']","['haben', 'ja', 'gern', ',', 'aber', '...']","['AUX', 'ADV', 'ADV', 'PUNCT', 'CCONJ', 'PUNCT']","haben ja gern , aber ...",AUX ADV ADV PUNCT CCONJ PUNCT
Babylon_Berlin__S03E01.srt,Babylon Berlin,Babylon Berlin S03,Babylon Berlin E01,350,"0:29:42,320","0:29:43,800","Ich wusste nicht recht, wie.","ich wusste nicht recht, wie.","['wusste', 'wie', 'ich', 'nicht', 'recht']","['Ich', 'wusste', 'nicht', 'recht', 'wie']","['Ich', 'wusste', 'nicht', 'recht', ',', 'wie', '.']","['Ich', 'wusste', 'nicht', 'recht', ',', 'wie', '.']","['PRON', 'VERB', 'PART', 'NOUN', 'PUNCT', 'ADV', 'PUNCT']","Ich wusste nicht recht , wie .",PRON VERB PART NOUN PUNCT ADV PUNCT
Babylon_Berlin__S03E01.srt,Babylon Berlin,Babylon Berlin S03,Babylon Berlin E01,351,"0:29:44,640","0:29:45,760",Jedenfalls...,jedenfalls...,['jedenfalls'],['Jedenfalls'],"['Jedenfalls', '...']","['Jedenfalls', '...']","['ADV', 'PUNCT']",Jedenfalls ...,ADV PUNCT
Babylon_Berlin__S03E01.srt,Babylon Berlin,Babylon Berlin S03,Babylon Berlin E01,352,"0:29:47,840","0:29:50,880","...nennt er mich manisch, mein Irrenarzt.","...nennt er mich manisch, mein irrenarzt.","['mich', 'irrenarzt', 'nennt', 'mein', 'er', 'manisch']","['nennt', 'er', 'mich', 'manisch', 'mein', 'Irrenarzt']","['...', 'nennt', 'er', 'mich', 'manisch', ',', 'mein', 'Irrenarzt', '.']","['...', 'nennen', 'ich', 'sich', 'manisch', ',', 'meinen', 'Irrenarzt', '.']","['PUNCT', 'VERB', 'PRON', 'PRON', 'ADV', 'PUNCT', 'DET', 'NOUN', 'PUNCT']","... nennen ich sich manisch , meinen Irrenarzt .",PUNCT VERB PRON PRON ADV PUNCT DET NOUN PUNCT
Babylon_Berlin__S03E01.srt,Babylon Berlin,Babylon Berlin S03,Babylon Berlin E01,353,"0:29:50,960","0:29:54,840","Das ist, wenn man ganz viel, ganz schnell gleichzeitig machen und erreichen will.","das ist, wenn man ganz viel, ganz schnell gleichzeitig machen und erreichen will.","['ist', 'ganz', 'das', 'wenn', 'man', 'machen', 'will', 'schnell', 'gleichzeitig', 'und', 'viel', 'erreichen']","['Das', 'ist', 'wenn', 'man', 'ganz', 'viel', 'ganz', 'schnell', 'gleichzeitig', 'machen', 'und', 'erreichen', 'will']","['Das', 'ist', ',', 'wenn', 'man', 'ganz', 'viel', ',', 'ganz', 'schnell', 'gleichzeitig', 'machen', 'und', 'erreichen', 'will', '.']","['der', 'sein', ',', 'wenn', 'man', 'ganz', 'viel', ',', 'ganz', 'schnellen', 'gleichzeitig', 'machen', 'und', 'erreichen', 'wollen', '.']","['PRON', 'AUX', 'PUNCT', 'SCONJ', 'PRON', 'ADV', 'PRON', 'PUNCT', 'ADV', 'ADV', 'ADV', 'VERB', 'CCONJ', 'VERB', 'AUX', 'PUNCT']","der sein , wenn man ganz viel , ganz schnellen gleichzeitig machen und erreichen wollen .",PRON AUX PUNCT SCONJ PRON ADV PRON PUNCT ADV ADV ADV VERB CCONJ VERB AUX PUNCT
Babylon_Berlin__S03E01.srt,Babylon Berlin,Babylon Berlin S03,Babylon Berlin E01,354,"0:29:54,920","0:29:57,40","Aus dem Stand, ohne Übung, ohne Können.","aus dem stand, ohne übung, ohne können.","['dem', 'übung', 'können', 'aus', 'ohne', 'stand']","['Aus', 'dem', 'Stand', 'ohne', 'Übung', 'ohne', 'Können']","['Aus', 'dem', 'Stand', ',', 'ohne', 'Übung', ',', 'ohne', 'Können', '.']","['Aus', 'der', 'Stand', ',', 'ohne', 'Übung', ',', 'ohne', 'Können', '.']","['ADP', 'DET', 'NOUN', 'PUNCT', 'ADP', 'NOUN', 'PUNCT', 'ADP', 'NOUN', 'PUNCT']","Aus der Stand , ohne Übung , ohne Können .",ADP DET NOUN PUNCT ADP NOUN PUNCT ADP NOUN PUNCT
Babylon_Berlin__S03E01.srt,Babylon Berlin,Babylon Berlin S03,Babylon Berlin E01,355,"0:29:57,120","0:29:59,520","Man könnte auch sagen, größenwahnsinnig.","man könnte auch sagen, größenwahnsinnig.","['könnte', 'auch', 'sagen', 'man', 'größenwahnsinnig']","['Man', 'könnte', 'auch', 'sagen', 'größenwahnsinnig']","['Man', 'könnte', 'auch', 'sagen', ',', 'größenwahnsinnig', '.']","['Man', 'können', 'auch', 'sagen', ',', 'größenwahnsinnig', '.']","['PRON', 'AUX', 'ADV', 'VERB', 'PUNCT', 'ADV', 'PUNCT']","Man können auch sagen , größenwahnsinnig .",PRON AUX ADV VERB PUNCT ADV PUNCT
Babylon_Berlin__S03E01.srt,Babylon Berlin,Babylon Berlin S03,Babylon Berlin E01,356,"0:30:0,320","0:30:2,0",Und er nennt mich depressiv.,und er nennt mich depressiv.,"['mich', 'depressiv', 'nennt', 'und', 'er']","['Und', 'er', 'nennt', 'mich', 'depressiv']","['Und', 'er', 'nennt', 'mich', 'depressiv', '.']","['und', 'ich', 'nennen', 'sich', 'depressiv', '.']","['CCONJ', 'PRON', 'VERB', 'PRON', 'ADV', 'PUNCT']",und ich nennen sich depressiv .,CCONJ PRON VERB PRON ADV PUNCT
Babylon_Berlin__S03E01.srt,Babylon Berlin,Babylon Berlin S03,Babylon Berlin E01,357,"0:30:2,600","0:30:6,40","Das ist, wenn man eigentlich gar nichts machen oder erreichen will.","das ist, wenn man eigentlich gar nichts machen oder erreichen will.","['ist', 'das', 'oder', 'wenn', 'man', 'nichts', 'machen', 'eigentlich', 'will', 'erreichen', 'gar']","['Das', 'ist', 'wenn', 'man', 'eigentlich', 'gar', 'nichts', 'machen', 'oder', 'erreichen', 'will']","['Das', 'ist', ',', 'wenn', 'man', 'eigentlich', 'gar', 'nichts', 'machen', 'oder', 'erreichen', 'will', '.']","['der', 'sein', ',', 'wenn', 'man', 'eigentlich', 'gar', 'nichts', 'machen', 'oder', 'erreichen', 'wollen', '.']","['PRON', 'AUX', 'PUNCT', 'SCONJ', 'PRON', 'ADV', 'ADV', 'PRON', 'VERB', 'CCONJ', 'VERB', 'AUX', 'PUNCT']","der sein , wenn man eigentlich gar nichts machen oder erreichen wollen .",PRON AUX PUNCT SCONJ PRON ADV ADV PRON VERB CCONJ VERB AUX PUNCT
Babylon_Berlin__S03E01.srt,Babylon Berlin,Babylon Berlin S03,Babylon Berlin E01,358,"0:30:6,480","0:30:9,680",Außer vielleicht sterben oder einfach nur im Bett liegen.,außer vielleicht sterben oder einfach nur im bett liegen.,"['oder', 'nur', 'im', 'einfach', 'außer', 'sterben', 'vielleicht', 'liegen', 'bett']","['Außer', 'vielleicht', 'sterben', 'oder', 'einfach', 'nur', 'im', 'Bett', 'liegen']","['Außer', 'vielleicht', 'sterben', 'oder', 'einfach', 'nur', 'im', 'Bett', 'liegen', '.']","['außer', 'vielleicht', 'sterben', 'oder', 'einfach', 'nur', 'im', 'Bett', 'liegen', '.']","['ADP', 'ADV', 'VERB', 'CCONJ', 'ADV', 'ADV', 'ADP', 'NOUN', 'VERB', 'PUNCT']",außer vielleicht sterben oder einfach nur im Bett liegen .,ADP ADV VERB CCONJ ADV ADV ADP NOUN VERB PUNCT
Babylon_Berlin__S03E01.srt,Babylon Berlin,Babylon Berlin S03,Babylon Berlin E01,359,"0:30:10,280","0:30:13,320","Und diese beiden Phasen, die manische und die depressive,","und diese beiden phasen, die manische und die depressive,","['phasen', 'die', 'diese', 'depressive', 'und', 'beiden', 'manische']","['Und', 'diese', 'beiden', 'Phasen', 'die', 'manische', 'und', 'die', 'depressive']","['Und', 'diese', 'beiden', 'Phasen', ',', 'die', 'manische', 'und', 'die', 'depressive', ',']","['und', 'dies', 'beid', 'Phase', ',', 'der', 'manisch', 'und', 'der', 'depressive', ',']","['CCONJ', 'DET', 'DET', 'NOUN', 'PUNCT', 'PRON', 'ADJ', 'CCONJ', 'DET', 'ADJ', 'PUNCT']","und dies beid Phase , der manisch und der depressive ,",CCONJ DET DET NOUN PUNCT PRON ADJ CCONJ DET ADJ PUNCT
Babylon_Berlin__S03E01.srt,Babylon Berlin,Babylon Berlin S03,Babylon Berlin E01,360,"0:30:13,400","0:30:15,0",die wechseln sich bei mir ab.,die wechseln sich bei mir ab.,"['mir', 'sich', 'die', 'ab', 'bei', 'wechseln']","['die', 'wechseln', 'sich', 'bei', 'mir', 'ab']","['die', 'wechseln', 'sich', 'bei', 'mir', 'ab', '.']","['der', 'wechseln', 'sich', 'bei', 'sich', 'ab', '.']","['PRON', 'VERB', 'PRON', 'ADP', 'PRON', 'ADP', 'PUNCT']",der wechseln sich bei sich ab .,PRON VERB PRON ADP PRON ADP PUNCT
Babylon_Berlin__S03E01.srt,Babylon Berlin,Babylon Berlin S03,Babylon Berlin E01,361,"0:30:15,80","0:30:19,80","Und mein Irrenarzt, der ist dafür da, diese Wechsel kommen zu sehen und...","und mein irrenarzt, der ist dafür da, diese wechsel kommen zu sehen und...","['irrenarzt', 'ist', 'der', 'mein', 'da', 'dafür', 'wechsel', 'diese', 'zu', 'und', 'kommen', 'sehen']","['Und', 'mein', 'Irrenarzt', 'der', 'ist', 'dafür', 'da', 'diese', 'Wechsel', 'kommen', 'zu', 'sehen', 'und']","['Und', 'mein', 'Irrenarzt', ',', 'der', 'ist', 'dafür', 'da', ',', 'diese', 'Wechsel', 'kommen', 'zu', 'sehen', 'und', '...']","['und', 'meinen', 'Irrenarzt', ',', 'der', 'sein', 'dafür', 'da', ',', 'dies', 'Wechsel', 'kommen', 'zu', 'sehen', 'und', '...']","['CCONJ', 'DET', 'NOUN', 'PUNCT', 'PRON', 'AUX', 'ADV', 'ADV', 'PUNCT', 'DET', 'NOUN', 'VERB', 'PART', 'VERB', 'CCONJ', 'PUNCT']","und meinen Irrenarzt , der sein dafür da , dies Wechsel kommen zu sehen und ...",CCONJ DET NOUN PUNCT PRON AUX ADV ADV PUNCT DET NOUN VERB PART VERB CCONJ PUNCT
Babylon_Berlin__S03E01.srt,Babylon Berlin,Babylon Berlin S03,Babylon Berlin E01,362,"0:30:20,160","0:30:23,280",...meine Medizin danach auszurichten.,...meine medizin danach auszurichten.,"['danach', 'auszurichten', 'medizin', 'meine']","['meine', 'Medizin', 'danach', 'auszurichten']","['...', 'meine', 'Medizin', 'danach', 'auszurichten', '.']","['...', 'meinen', 'Medizin', 'danach', 'ausrichten', '.']","['PUNCT', 'DET', 'NOUN', 'ADV', 'VERB', 'PUNCT']",... meinen Medizin danach ausrichten .,PUNCT DET NOUN ADV VERB PUNCT
Babylon_Berlin__S03E01.srt,Babylon Berlin,Babylon Berlin S03,Babylon Berlin E01,363,"0:30:24,600","0:30:26,280","Jetzt zum Beispiel, Wegener,","jetzt zum beispiel, wegener,","['beispiel', 'wegener', 'jetzt', 'zum']","['Jetzt', 'zum', 'Beispiel', 'Wegener']","['Jetzt', 'zum', 'Beispiel', ',', 'Wegener', ',']","['Jetzt', 'zum', 'Beispiel', ',', 'Wegener', ',']","['ADV', 'ADP', 'NOUN', 'PUNCT', 'NOUN', 'PUNCT']","Jetzt zum Beispiel , Wegener ,",ADV ADP NOUN PUNCT NOUN PUNCT
Babylon_Berlin__S03E01.srt,Babylon Berlin,Babylon Berlin S03,Babylon Berlin E01,364,"0:30:26,360","0:30:28,0",naht eine manische Phase.,naht eine manische phase.,"['naht', 'eine', 'phase', 'manische']","['naht', 'eine', 'manische', 'Phase']","['naht', 'eine', 'manische', 'Phase', '.']","['naht', 'einen', 'manisch', 'Phase', '.']","['VERB', 'DET', 'ADJ', 'NOUN', 'PUNCT']",naht einen manisch Phase .,VERB DET ADJ NOUN PUNCT
Babylon_Berlin__S03E01.srt,Babylon Berlin,Babylon Berlin S03,Babylon Berlin E01,365,"0:30:28,800","0:30:29,840","Und wissen Sie,","und wissen sie,","['sie', 'und', 'wissen']","['Und', 'wissen', 'Sie']","['Und', 'wissen', 'Sie', ',']","['und', 'wissen', 'ich', ',']","['CCONJ', 'VERB', 'PRON', 'PUNCT']","und wissen ich ,",CCONJ VERB PRON PUNCT
Babylon_Berlin__S03E01.srt,Babylon Berlin,Babylon Berlin S03,Babylon Berlin E01,366,"0:30:30,640","0:30:32,560",woran man eine manische Phase erkennt?,woran man eine manische phase erkennt?,"['phase', 'eine', 'man', 'erkennt', 'woran', 'manische']","['woran', 'man', 'eine', 'manische', 'Phase', 'erkennt']","['woran', 'man', 'eine', 'manische', 'Phase', 'erkennt', '?']","['woran', 'man', 'einen', 'manisch', 'Phase', 'erkennen', '?']","['SCONJ', 'PRON', 'DET', 'ADJ', 'NOUN', 'VERB', 'PUNCT']",woran man einen manisch Phase erkennen ?,SCONJ PRON DET ADJ NOUN VERB PUNCT
Babylon_Berlin__S03E01.srt,Babylon Berlin,Babylon Berlin S03,Babylon Berlin E01,367,"0:30:34,520","0:30:37,280","Man erfasst plötzlich, wie alles zusammenhängt.","man erfasst plötzlich, wie alles zusammenhängt.","['plötzlich', 'erfasst', 'wie', 'man', 'alles', 'zusammenhängt']","['Man', 'erfasst', 'plötzlich', 'wie', 'alles', 'zusammenhängt']","['Man', 'erfasst', 'plötzlich', ',', 'wie', 'alles', 'zusammenhängt', '.']","['Man', 'erfasst', 'plötzlich', ',', 'wie', 'alle', 'zusammenhängen', '.']","['PRON', 'VERB', 'ADV', 'PUNCT', 'SCONJ', 'PRON', 'VERB', 'PUNCT']","Man erfasst plötzlich , wie alle zusammenhängen .",PRON VERB ADV PUNCT SCONJ PRON VERB PUNCT
Babylon_Berlin__S03E01.srt,Babylon Berlin,Babylon Berlin S03,Babylon Berlin E01,368,"0:30:37,360","0:30:41,960","Denn was wir gerade jetzt und hier erleben, das ist eine Manie an der Börse.","denn was wir gerade jetzt und hier erleben, das ist eine manie an der börse.","['an', 'manie', 'börse', 'was', 'gerade', 'erleben', 'wir', 'das', 'ist', 'der', 'eine', 'hier', 'jetzt', 'denn', 'und']","['Denn', 'was', 'wir', 'gerade', 'jetzt', 'und', 'hier', 'erleben', 'das', 'ist', 'eine', 'Manie', 'an', 'der', 'Börse']","['Denn', 'was', 'wir', 'gerade', 'jetzt', 'und', 'hier', 'erleben', ',', 'das', 'ist', 'eine', 'Manie', 'an', 'der', 'Börse', '.']","['denn', 'was', 'ich', 'gerade', 'jetzt', 'und', 'hier', 'erleben', ',', 'der', 'sein', 'einen', 'Manie', 'an', 'der', 'Börse', '.']","['CCONJ', 'PRON', 'PRON', 'ADV', 'ADV', 'CCONJ', 'ADV', 'VERB', 'PUNCT', 'PRON', 'AUX', 'DET', 'NOUN', 'ADP', 'DET', 'NOUN', 'PUNCT']","denn was ich gerade jetzt und hier erleben , der sein einen Manie an der Börse .",CCONJ PRON PRON ADV ADV CCONJ ADV VERB PUNCT PRON AUX DET NOUN ADP DET NOUN PUNCT
Babylon_Berlin__S03E01.srt,Babylon Berlin,Babylon Berlin S03,Babylon Berlin E01,369,"0:30:43,80","0:30:44,840",Hier wird etwas aufgebläht.,hier wird etwas aufgebläht.,"['etwas', 'wird', 'hier', 'aufgebläht']","['Hier', 'wird', 'etwas', 'aufgebläht']","['Hier', 'wird', 'etwas', 'aufgebläht', '.']","['Hier', 'werden', 'etwas', 'aufblähen', '.']","['ADV', 'AUX', 'PRON', 'VERB', 'PUNCT']",Hier werden etwas aufblähen .,ADV AUX PRON VERB PUNCT
Babylon_Berlin__S03E01.srt,Babylon Berlin,Babylon Berlin S03,Babylon Berlin E01,370,"0:30:45,520","0:30:49,840","Wegener, dieser Ahrensen und seine jüdische Finanzwirtschaft","wegener, dieser ahrensen und seine jüdische finanzwirtschaft","['dieser', 'seine', 'ahrensen', 'jüdische', 'wegener', 'und', 'finanzwirtschaft']","['Wegener', 'dieser', 'Ahrensen', 'und', 'seine', 'jüdische', 'Finanzwirtschaft']","['Wegener', ',', 'dieser', 'Ahrensen', 'und', 'seine', 'jüdische', 'Finanzwirtschaft']","['Wegener', ',', 'dies', 'Ahrensen', 'und', 'mein', 'jüdische', 'Finanzwirtschaft']","['NOUN', 'PUNCT', 'DET', 'NOUN', 'CCONJ', 'DET', 'ADJ', 'NOUN']","Wegener , dies Ahrensen und mein jüdische Finanzwirtschaft",NOUN PUNCT DET NOUN CCONJ DET ADJ NOUN
Babylon_Berlin__S03E01.srt,Babylon Berlin,Babylon Berlin S03,Babylon Berlin E01,371,"0:30:50,80","0:30:53,880","sind nichts anderes als eine staatlich subventionierte,","sind nichts anderes als eine staatlich subventionierte,","['staatlich', 'anderes', 'eine', 'sind', 'nichts', 'als', 'subventionierte']","['sind', 'nichts', 'anderes', 'als', 'eine', 'staatlich', 'subventionierte']","['sind', 'nichts', 'anderes', 'als', 'eine', 'staatlich', 'subventionierte', ',']","['sein', 'nichts', 'ander', 'als', 'einen', 'staatlich', 'subventionierte', ',']","['AUX', 'DET', 'PRON', 'ADP', 'DET', 'ADV', 'ADJ', 'PUNCT']","sein nichts ander als einen staatlich subventionierte ,",AUX DET PRON ADP DET ADV ADJ PUNCT
