Unique_ID,Show_Name,Season,Episode,Line_Index,Start,End,Dialogue,Dialogue_lower,Dialogue_Set_Words,Dialogue_Words,Dialogue_Tokens_Text,Dialogue_Tokens_Lemmas,Dialogue_Tokens_POS_Tags,Dialogue_Lemmas_Pattern,Dialogue_POS_Tags_Pattern
Babylon_Berlin__S03E01.srt,Babylon Berlin,Babylon Berlin S03,Babylon Berlin E01,187,"0:19:16,480","0:19:18,920","""Eine Zensur findet nicht statt.""  Jetzt reicht's.","""eine zensur findet nicht statt.""  jetzt reicht's.","['zensur', ""reicht's"", 'eine', 'jetzt', 'nicht', 'statt', 'findet']","['Eine', 'Zensur', 'findet', 'nicht', 'statt', 'Jetzt', ""reicht's""]","['""', 'Eine', 'Zensur', 'findet', 'nicht', 'statt', '.', '""', ' ', 'Jetzt', ""reicht's"", '.']","['""', 'Eine', 'Zensur', 'finden', 'nicht', 'statt', '.', '""', ' ', 'Jetzt', ""reicht's"", '.']","['PUNCT', 'DET', 'NOUN', 'VERB', 'PART', 'ADV', 'PUNCT', 'PUNCT', 'SPACE', 'ADV', 'ADV', 'PUNCT']",""" Eine Zensur finden nicht statt . ""   Jetzt reicht's .",PUNCT DET NOUN VERB PART ADV PUNCT PUNCT SPACE ADV ADV PUNCT
Babylon_Berlin__S03E01.srt,Babylon Berlin,Babylon Berlin S03,Babylon Berlin E01,188,"0:19:19,0","0:19:21,120","Reinhold, kannst du nicht irgendwas machen? Bitte.","reinhold, kannst du nicht irgendwas machen? bitte.","['du', 'irgendwas', 'bitte', 'machen', 'reinhold', 'nicht', 'kannst']","['Reinhold', 'kannst', 'du', 'nicht', 'irgendwas', 'machen', 'Bitte']","['Reinhold', ',', 'kannst', 'du', 'nicht', 'irgendwas', 'machen', '?', 'Bitte', '.']","['Reinhold', ',', 'können', 'du', 'nicht', 'irgendwas', 'machen', '?', 'Bitte', '.']","['PROPN', 'PUNCT', 'VERB', 'PRON', 'PART', 'ADV', 'VERB', 'PUNCT', 'PART', 'PUNCT']","Reinhold , können du nicht irgendwas machen ? Bitte .",PROPN PUNCT VERB PRON PART ADV VERB PUNCT PART PUNCT
Babylon_Berlin__S03E01.srt,Babylon Berlin,Babylon Berlin S03,Babylon Berlin E01,189,"0:19:21,200","0:19:22,280",Schließen.,schließen.,['schließen'],['Schließen'],"['Schließen', '.']","['Schließen', '.']","['NOUN', 'PUNCT']",Schließen .,NOUN PUNCT
Babylon_Berlin__S03E01.srt,Babylon Berlin,Babylon Berlin S03,Babylon Berlin E01,190,"0:19:27,600","0:19:28,840",Nichts anfassen.,nichts anfassen.,"['nichts', 'anfassen']","['Nichts', 'anfassen']","['Nichts', 'anfassen', '.']","['Nichts', 'anfassen', '.']","['PRON', 'VERB', 'PUNCT']",Nichts anfassen .,PRON VERB PUNCT
Babylon_Berlin__S03E01.srt,Babylon Berlin,Babylon Berlin S03,Babylon Berlin E01,191,"0:19:38,920","0:19:41,560","Mordkommission, guten Tag. Mord?","mordkommission, guten tag. mord?","['guten', 'mordkommission', 'mord', 'tag']","['Mordkommission', 'guten', 'Tag', 'Mord']","['Mordkommission', ',', 'guten', 'Tag', '.', 'Mord', '?']","['Mordkommission', ',', 'gut', 'Tag', '.', 'Mord', '?']","['NOUN', 'PUNCT', 'ADJ', 'NOUN', 'PUNCT', 'NOUN', 'PUNCT']","Mordkommission , gut Tag . Mord ?",NOUN PUNCT ADJ NOUN PUNCT NOUN PUNCT
Babylon_Berlin__S03E01.srt,Babylon Berlin,Babylon Berlin S03,Babylon Berlin E01,192,"0:19:42,560","0:19:43,920",Es war doch ein Unfall.,es war doch ein unfall.,"['doch', 'ein', 'unfall', 'war', 'es']","['Es', 'war', 'doch', 'ein', 'Unfall']","['Es', 'war', 'doch', 'ein', 'Unfall', '.']","['ich', 'sein', 'doch', 'einen', 'Unfall', '.']","['PRON', 'AUX', 'ADV', 'DET', 'NOUN', 'PUNCT']",ich sein doch einen Unfall .,PRON AUX ADV DET NOUN PUNCT
Babylon_Berlin__S03E01.srt,Babylon Berlin,Babylon Berlin S03,Babylon Berlin E01,193,"0:19:45,360","0:19:48,520","Wer sind Sie? Jo Bellmann, ich bin der Produzent.","wer sind sie? jo bellmann, ich bin der produzent.","['jo', 'sie', 'der', 'bin', 'produzent', 'sind', 'wer', 'ich', 'bellmann']","['Wer', 'sind', 'Sie', 'Jo', 'Bellmann', 'ich', 'bin', 'der', 'Produzent']","['Wer', 'sind', 'Sie', '?', 'Jo', 'Bellmann', ',', 'ich', 'bin', 'der', 'Produzent', '.']","['Wer', 'sein', 'ich', '?', 'Jo', 'Bellmann', ',', 'ich', 'sein', 'der', 'Produzent', '.']","['PRON', 'AUX', 'PRON', 'PUNCT', 'PROPN', 'PROPN', 'PUNCT', 'PRON', 'AUX', 'DET', 'NOUN', 'PUNCT']","Wer sein ich ? Jo Bellmann , ich sein der Produzent .",PRON AUX PRON PUNCT PROPN PROPN PUNCT PRON AUX DET NOUN PUNCT
Babylon_Berlin__S03E01.srt,Babylon Berlin,Babylon Berlin S03,Babylon Berlin E01,194,"0:19:48,720","0:19:51,120",Es war offensichtlich ein Unfall.,es war offensichtlich ein unfall.,"['ein', 'offensichtlich', 'unfall', 'war', 'es']","['Es', 'war', 'offensichtlich', 'ein', 'Unfall']","['Es', 'war', 'offensichtlich', 'ein', 'Unfall', '.']","['ich', 'sein', 'offensichtlich', 'einen', 'Unfall', '.']","['PRON', 'AUX', 'ADV', 'DET', 'NOUN', 'PUNCT']",ich sein offensichtlich einen Unfall .,PRON AUX ADV DET NOUN PUNCT
Babylon_Berlin__S03E01.srt,Babylon Berlin,Babylon Berlin S03,Babylon Berlin E01,195,"0:19:52,320","0:19:55,200","Wir alle haben es gesehen...  Um das zu klären, sind wir hier.","wir alle haben es gesehen...  um das zu klären, sind wir hier.","['wir', 'das', 'alle', 'klären', 'sind', 'hier', 'um', 'haben', 'gesehen', 'zu', 'es']","['Wir', 'alle', 'haben', 'es', 'gesehen', 'Um', 'das', 'zu', 'klären', 'sind', 'wir', 'hier']","['Wir', 'alle', 'haben', 'es', 'gesehen', '...', ' ', 'Um', 'das', 'zu', 'klären', ',', 'sind', 'wir', 'hier', '.']","['ich', 'all', 'haben', 'ich', 'sehen', '...', ' ', 'um', 'der', 'zu', 'klären', ',', 'sein', 'ich', 'hier', '.']","['PRON', 'PRON', 'AUX', 'PRON', 'VERB', 'PUNCT', 'SPACE', 'SCONJ', 'PRON', 'PART', 'VERB', 'PUNCT', 'AUX', 'PRON', 'ADV', 'PUNCT']","ich all haben ich sehen ...   um der zu klären , sein ich hier .",PRON PRON AUX PRON VERB PUNCT SPACE SCONJ PRON PART VERB PUNCT AUX PRON ADV PUNCT
Babylon_Berlin__S03E01.srt,Babylon Berlin,Babylon Berlin S03,Babylon Berlin E01,196,"0:19:55,280","0:19:58,720",Sie bleiben bei mir. Alle anderen warten bitte außerhalb der Dekoration.,sie bleiben bei mir. alle anderen warten bitte außerhalb der dekoration.,"['sie', 'mir', 'warten', 'alle', 'der', 'bitte', 'außerhalb', 'bei', 'bleiben', 'anderen', 'dekoration']","['Sie', 'bleiben', 'bei', 'mir', 'Alle', 'anderen', 'warten', 'bitte', 'außerhalb', 'der', 'Dekoration']","['Sie', 'bleiben', 'bei', 'mir', '.', 'Alle', 'anderen', 'warten', 'bitte', 'außerhalb', 'der', 'Dekoration', '.']","['ich', 'bleiben', 'bei', 'sich', '.', 'all', 'ander', 'warten', 'bitte', 'außerhalb', 'der', 'Dekoration', '.']","['PRON', 'VERB', 'ADP', 'PRON', 'PUNCT', 'DET', 'PRON', 'VERB', 'ADV', 'ADP', 'DET', 'NOUN', 'PUNCT']",ich bleiben bei sich . all ander warten bitte außerhalb der Dekoration .,PRON VERB ADP PRON PUNCT DET PRON VERB ADV ADP DET NOUN PUNCT
Babylon_Berlin__S03E01.srt,Babylon Berlin,Babylon Berlin S03,Babylon Berlin E01,197,"0:20:4,720","0:20:6,240",War doch ein Unfall.,war doch ein unfall.,"['doch', 'ein', 'war', 'unfall']","['War', 'doch', 'ein', 'Unfall']","['War', 'doch', 'ein', 'Unfall', '.']","['sein', 'doch', 'einen', 'Unfall', '.']","['AUX', 'ADV', 'DET', 'NOUN', 'PUNCT']",sein doch einen Unfall .,AUX ADV DET NOUN PUNCT
Babylon_Berlin__S03E01.srt,Babylon Berlin,Babylon Berlin S03,Babylon Berlin E01,198,"0:20:14,880","0:20:16,0",Also.,also.,['also'],['Also'],"['Also', '.']","['Also', '.']","['ADV', 'PUNCT']",Also .,ADV PUNCT
Babylon_Berlin__S03E01.srt,Babylon Berlin,Babylon Berlin S03,Babylon Berlin E01,199,"0:20:17,0","0:20:18,200",Was genau ist passiert?,was genau ist passiert?,"['passiert', 'was', 'ist', 'genau']","['Was', 'genau', 'ist', 'passiert']","['Was', 'genau', 'ist', 'passiert', '?']","['Was', 'genau', 'sein', 'passieren', '?']","['PRON', 'ADV', 'AUX', 'VERB', 'PUNCT']",Was genau sein passieren ?,PRON ADV AUX VERB PUNCT
Babylon_Berlin__S03E01.srt,Babylon Berlin,Babylon Berlin S03,Babylon Berlin E01,200,"0:20:18,880","0:20:21,800","Fallbeispiel 16. Lebloser Körper,","fallbeispiel 16. lebloser körper,","['fallbeispiel', 'körper', '16.', 'lebloser']","['Fallbeispiel', '16.', 'Lebloser', 'Körper']","['Fallbeispiel', '16.', 'Lebloser', 'Körper', ',']","['Fallbeispiel', '16.', 'Lebloser', 'Körper', ',']","['NOUN', 'ADJ', 'NOUN', 'NOUN', 'PUNCT']","Fallbeispiel 16. Lebloser Körper ,",NOUN ADJ NOUN NOUN PUNCT
Babylon_Berlin__S03E01.srt,Babylon Berlin,Babylon Berlin S03,Babylon Berlin E01,201,"0:20:21,880","0:20:27,280","am frühen Morgen gefunden vom Gärtner der Familie in der Garage des Anwesens,","am frühen morgen gefunden vom gärtner der familie in der garage des anwesens,","['morgen', 'gefunden', 'frühen', 'der', 'garage', 'familie', 'des', 'vom', 'gärtner', 'anwesens', 'in', 'am']","['am', 'frühen', 'Morgen', 'gefunden', 'vom', 'Gärtner', 'der', 'Familie', 'in', 'der', 'Garage', 'des', 'Anwesens']","['am', 'frühen', 'Morgen', 'gefunden', 'vom', 'Gärtner', 'der', 'Familie', 'in', 'der', 'Garage', 'des', 'Anwesens', ',']","['am', 'früh', 'Morgen', 'finden', 'vom', 'Gärtner', 'der', 'Familie', 'in', 'der', 'Garage', 'der', 'Anwesen', ',']","['ADP', 'ADJ', 'NOUN', 'VERB', 'ADP', 'NOUN', 'DET', 'NOUN', 'ADP', 'DET', 'NOUN', 'DET', 'NOUN', 'PUNCT']","am früh Morgen finden vom Gärtner der Familie in der Garage der Anwesen ,",ADP ADJ NOUN VERB ADP NOUN DET NOUN ADP DET NOUN DET NOUN PUNCT
Babylon_Berlin__S03E01.srt,Babylon Berlin,Babylon Berlin S03,Babylon Berlin E01,202,"0:20:27,360","0:20:31,40","identifiziert von der Ehefrau, die sogleich die Polizei informierte.","identifiziert von der ehefrau, die sogleich die polizei informierte.","['polizei', 'informierte', 'der', 'ehefrau', 'die', 'identifiziert', 'sogleich', 'von']","['identifiziert', 'von', 'der', 'Ehefrau', 'die', 'sogleich', 'die', 'Polizei', 'informierte']","['identifiziert', 'von', 'der', 'Ehefrau', ',', 'die', 'sogleich', 'die', 'Polizei', 'informierte', '.']","['identifizieren', 'von', 'der', 'Ehefrau', ',', 'der', 'sogleich', 'der', 'Polizei', 'informieren', '.']","['VERB', 'ADP', 'DET', 'NOUN', 'PUNCT', 'PRON', 'ADV', 'DET', 'NOUN', 'VERB', 'PUNCT']","identifizieren von der Ehefrau , der sogleich der Polizei informieren .",VERB ADP DET NOUN PUNCT PRON ADV DET NOUN VERB PUNCT
Babylon_Berlin__S03E01.srt,Babylon Berlin,Babylon Berlin S03,Babylon Berlin E01,203,"0:20:31,600","0:20:34,320",Alle äußeren Umstände deuten auf einen Selbstmord hin.,alle äußeren umstände deuten auf einen selbstmord hin.,"['selbstmord', 'alle', 'einen', 'deuten', 'hin', 'auf', 'umstände', 'äußeren']","['Alle', 'äußeren', 'Umstände', 'deuten', 'auf', 'einen', 'Selbstmord', 'hin']","['Alle', 'äußeren', 'Umstände', 'deuten', 'auf', 'einen', 'Selbstmord', 'hin', '.']","['all', 'äußer', 'Umstand', 'deuten', 'auf', 'ein', 'Selbstmord', 'hin', '.']","['DET', 'ADJ', 'NOUN', 'VERB', 'ADP', 'DET', 'NOUN', 'ADV', 'PUNCT']",all äußer Umstand deuten auf ein Selbstmord hin .,DET ADJ NOUN VERB ADP DET NOUN ADV PUNCT
Babylon_Berlin__S03E01.srt,Babylon Berlin,Babylon Berlin S03,Babylon Berlin E01,204,"0:20:38,440","0:20:39,600",Fräulein...,fräulein...,['fräulein'],['Fräulein'],"['Fräulein', '...']","['Fräulein', '...']","['NOUN', 'PUNCT']",Fräulein ...,NOUN PUNCT
Babylon_Berlin__S03E01.srt,Babylon Berlin,Babylon Berlin S03,Babylon Berlin E01,205,"0:20:39,680","0:20:41,640",Ritter. Charlotte Ritter.,ritter. charlotte ritter.,"['charlotte', 'ritter']","['Ritter', 'Charlotte', 'Ritter']","['Ritter', '.', 'Charlotte', 'Ritter', '.']","['Ritter', '.', 'Charlotte', 'Ritter', '.']","['NOUN', 'PUNCT', 'PROPN', 'PROPN', 'PUNCT']",Ritter . Charlotte Ritter .,NOUN PUNCT PROPN PROPN PUNCT
Babylon_Berlin__S03E01.srt,Babylon Berlin,Babylon Berlin S03,Babylon Berlin E01,206,"0:20:41,720","0:20:43,880","Bitte, Fräulein Ritter. Den Damen gilt der Vortritt.","bitte, fräulein ritter. den damen gilt der vortritt.","['gilt', 'vortritt', 'damen', 'der', 'fräulein', 'bitte', 'den', 'ritter']","['Bitte', 'Fräulein', 'Ritter', 'Den', 'Damen', 'gilt', 'der', 'Vortritt']","['Bitte', ',', 'Fräulein', 'Ritter', '.', 'Den', 'Damen', 'gilt', 'der', 'Vortritt', '.']","['Bitte', ',', 'Fräulein', 'Ritter', '.', 'der', 'Dame', 'gelten', 'der', 'Vortritt', '.']","['NOUN', 'PUNCT', 'PROPN', 'PROPN', 'PUNCT', 'DET', 'NOUN', 'VERB', 'DET', 'NOUN', 'PUNCT']","Bitte , Fräulein Ritter . der Dame gelten der Vortritt .",NOUN PUNCT PROPN PROPN PUNCT DET NOUN VERB DET NOUN PUNCT
Babylon_Berlin__S03E01.srt,Babylon Berlin,Babylon Berlin S03,Babylon Berlin E01,208,"0:20:49,80","0:20:52,680",Erläutern Sie die fünf Schritte des Todesermittlungsverfahrens.,erläutern sie die fünf schritte des todesermittlungsverfahrens.,"['fünf', 'schritte', 'sie', 'des', 'die', 'erläutern', 'todesermittlungsverfahrens']","['Erläutern', 'Sie', 'die', 'fünf', 'Schritte', 'des', 'Todesermittlungsverfahrens']","['Erläutern', 'Sie', 'die', 'fünf', 'Schritte', 'des', 'Todesermittlungsverfahrens', '.']","['Erläutern', 'ich', 'der', 'fünf', 'Schritt', 'der', 'Todesermittlungsverfahrens', '.']","['VERB', 'PRON', 'DET', 'NUM', 'NOUN', 'DET', 'NOUN', 'PUNCT']",Erläutern ich der fünf Schritt der Todesermittlungsverfahrens .,VERB PRON DET NUM NOUN DET NOUN PUNCT
Babylon_Berlin__S03E01.srt,Babylon Berlin,Babylon Berlin S03,Babylon Berlin E01,209,"0:20:52,760","0:20:54,80",Methode Gennat.,methode gennat.,"['gennat', 'methode']","['Methode', 'Gennat']","['Methode', 'Gennat', '.']","['Methode', 'Gennat', '.']","['NOUN', 'NOUN', 'PUNCT']",Methode Gennat .,NOUN NOUN PUNCT
Babylon_Berlin__S03E01.srt,Babylon Berlin,Babylon Berlin S03,Babylon Berlin E01,210,"0:20:55,40","0:20:59,120","Eins, ich verschaffe mir einen ersten, allgemeinen Überblick über den Tatort.","eins, ich verschaffe mir einen ersten, allgemeinen überblick über den tatort.","['eins', 'mir', 'einen', 'verschaffe', 'allgemeinen', 'den', 'ersten', 'überblick', 'über', 'ich', 'tatort']","['Eins', 'ich', 'verschaffe', 'mir', 'einen', 'ersten', 'allgemeinen', 'Überblick', 'über', 'den', 'Tatort']","['Eins', ',', 'ich', 'verschaffe', 'mir', 'einen', 'ersten', ',', 'allgemeinen', 'Überblick', 'über', 'den', 'Tatort', '.']","['Eins', ',', 'ich', 'verschaffen', 'sich', 'ein', 'erst', ',', 'allgemein', 'Überblick', 'über', 'der', 'Tatort', '.']","['PROPN', 'PUNCT', 'PRON', 'VERB', 'PRON', 'DET', 'ADJ', 'PUNCT', 'ADJ', 'NOUN', 'ADP', 'DET', 'NOUN', 'PUNCT']","Eins , ich verschaffen sich ein erst , allgemein Überblick über der Tatort .",PROPN PUNCT PRON VERB PRON DET ADJ PUNCT ADJ NOUN ADP DET NOUN PUNCT
Babylon_Berlin__S03E01.srt,Babylon Berlin,Babylon Berlin S03,Babylon Berlin E01,211,"0:21:1,960","0:21:4,560",Hier? Genau da.,hier? genau da.,"['da', 'hier', 'genau']","['Hier', 'Genau', 'da']","['Hier', '?', 'Genau', 'da', '.']","['Hier', '?', 'Genau', 'da', '.']","['ADV', 'PUNCT', 'ADV', 'ADV', 'PUNCT']",Hier ? Genau da .,ADV PUNCT ADV ADV PUNCT
Babylon_Berlin__S03E01.srt,Babylon Berlin,Babylon Berlin S03,Babylon Berlin E01,212,"0:21:4,760","0:21:6,160",Nicht anfassen bitte.,nicht anfassen bitte.,"['nicht', 'bitte', 'anfassen']","['Nicht', 'anfassen', 'bitte']","['Nicht', 'anfassen', 'bitte', '.']","['Nicht', 'anfassen', 'bitte', '.']","['PART', 'VERB', 'PART', 'PUNCT']",Nicht anfassen bitte .,PART VERB PART PUNCT
Babylon_Berlin__S03E01.srt,Babylon Berlin,Babylon Berlin S03,Babylon Berlin E01,213,"0:21:17,160","0:21:21,280","Zwei, die Mitarbeiter suchen nach Beweismitteln und Spuren.","zwei, die mitarbeiter suchen nach beweismitteln und spuren.","['beweismitteln', 'die', 'spuren', 'mitarbeiter', 'und', 'zwei', 'nach', 'suchen']","['Zwei', 'die', 'Mitarbeiter', 'suchen', 'nach', 'Beweismitteln', 'und', 'Spuren']","['Zwei', ',', 'die', 'Mitarbeiter', 'suchen', 'nach', 'Beweismitteln', 'und', 'Spuren', '.']","['Zwei', ',', 'der', 'Mitarbeiter', 'suchen', 'nach', 'Beweismitteln', 'und', 'Spur', '.']","['NUM', 'PUNCT', 'DET', 'NOUN', 'VERB', 'ADP', 'NOUN', 'CCONJ', 'NOUN', 'PUNCT']","Zwei , der Mitarbeiter suchen nach Beweismitteln und Spur .",NUM PUNCT DET NOUN VERB ADP NOUN CCONJ NOUN PUNCT
Babylon_Berlin__S03E01.srt,Babylon Berlin,Babylon Berlin S03,Babylon Berlin E01,214,"0:21:21,360","0:21:22,800",Wie kann das passiert sein?,wie kann das passiert sein?,"['sein', 'das', 'passiert', 'wie', 'kann']","['Wie', 'kann', 'das', 'passiert', 'sein']","['Wie', 'kann', 'das', 'passiert', 'sein', '?']","['Wie', 'können', 'der', 'passieren', 'mein', '?']","['ADV', 'AUX', 'PRON', 'VERB', 'AUX', 'PUNCT']",Wie können der passieren mein ?,ADV AUX PRON VERB AUX PUNCT
Babylon_Berlin__S03E01.srt,Babylon Berlin,Babylon Berlin S03,Babylon Berlin E01,215,"0:21:22,880","0:21:25,440","Die Lampe ist gekippt, die Schraubköpfe rausgerissen.","die lampe ist gekippt, die schraubköpfe rausgerissen.","['ist', 'die', 'lampe', 'rausgerissen', 'gekippt', 'schraubköpfe']","['Die', 'Lampe', 'ist', 'gekippt', 'die', 'Schraubköpfe', 'rausgerissen']","['Die', 'Lampe', 'ist', 'gekippt', ',', 'die', 'Schraubköpfe', 'rausgerissen', '.']","['der', 'Lampe', 'sein', 'kippen', ',', 'der', 'Schraubköpfe', 'rausgerissen', '.']","['DET', 'NOUN', 'AUX', 'VERB', 'PUNCT', 'DET', 'NOUN', 'VERB', 'PUNCT']","der Lampe sein kippen , der Schraubköpfe rausgerissen .",DET NOUN AUX VERB PUNCT DET NOUN VERB PUNCT
Babylon_Berlin__S03E01.srt,Babylon Berlin,Babylon Berlin S03,Babylon Berlin E01,216,"0:21:25,520","0:21:27,400","Wo ist das Kabel, das zum Scheinwerfer gehört?","wo ist das kabel, das zum scheinwerfer gehört?","['das', 'ist', 'kabel', 'scheinwerfer', 'gehört', 'wo', 'zum']","['Wo', 'ist', 'das', 'Kabel', 'das', 'zum', 'Scheinwerfer', 'gehört']","['Wo', 'ist', 'das', 'Kabel', ',', 'das', 'zum', 'Scheinwerfer', 'gehört', '?']","['wo', 'sein', 'der', 'Kabel', ',', 'der', 'zum', 'Scheinwerfer', 'hören', '?']","['ADV', 'AUX', 'DET', 'NOUN', 'PUNCT', 'PRON', 'ADP', 'NOUN', 'VERB', 'PUNCT']","wo sein der Kabel , der zum Scheinwerfer hören ?",ADV AUX DET NOUN PUNCT PRON ADP NOUN VERB PUNCT
Babylon_Berlin__S03E01.srt,Babylon Berlin,Babylon Berlin S03,Babylon Berlin E01,217,"0:21:27,480","0:21:29,480",Na hier. Nicht anfassen.,na hier. nicht anfassen.,"['nicht', 'na', 'hier', 'anfassen']","['Na', 'hier', 'Nicht', 'anfassen']","['Na', 'hier', '.', 'Nicht', 'anfassen', '.']","['Na', 'hier', '.', 'Nicht', 'anfassen', '.']","['PROPN', 'ADV', 'PUNCT', 'PART', 'VERB', 'PUNCT']",Na hier . Nicht anfassen .,PROPN ADV PUNCT PART VERB PUNCT
Babylon_Berlin__S03E01.srt,Babylon Berlin,Babylon Berlin S03,Babylon Berlin E01,218,"0:21:30,360","0:21:32,880","Ist ein ganz schöner Kawenzmann, so 'ne zehn kW.","ist ein ganz schöner kawenzmann, so 'ne zehn kw.","['so', 'ist', 'ganz', 'zehn', 'ein', 'schöner', 'kawenzmann', 'kw.', ""'ne""]","['Ist', 'ein', 'ganz', 'schöner', 'Kawenzmann', 'so', ""'ne"", 'zehn', 'kW.']","['Ist', 'ein', 'ganz', 'schöner', 'Kawenzmann', ',', 'so', ""'ne"", 'zehn', 'kW.']","['sein', 'einen', 'ganz', 'schön', 'Kawenzmann', ',', 'so', ""'ne"", 'zehn', 'kW.']","['AUX', 'DET', 'ADV', 'ADJ', 'NOUN', 'PUNCT', 'ADV', 'PROPN', 'NUM', 'VERB']","sein einen ganz schön Kawenzmann , so 'ne zehn kW.",AUX DET ADV ADJ NOUN PUNCT ADV PROPN NUM VERB
Babylon_Berlin__S03E01.srt,Babylon Berlin,Babylon Berlin S03,Babylon Berlin E01,219,"0:21:32,960","0:21:34,680","Chef, sollen wir loslegen?","chef, sollen wir loslegen?","['loslegen', 'sollen', 'chef', 'wir']","['Chef', 'sollen', 'wir', 'loslegen']","['Chef', ',', 'sollen', 'wir', 'loslegen', '?']","['Chef', ',', 'sollen', 'ich', 'loslegen', '?']","['NOUN', 'PUNCT', 'AUX', 'PRON', 'VERB', 'PUNCT']","Chef , sollen ich loslegen ?",NOUN PUNCT AUX PRON VERB PUNCT
Babylon_Berlin__S03E01.srt,Babylon Berlin,Babylon Berlin S03,Babylon Berlin E01,220,"0:21:34,760","0:21:37,920",Die Dekoration nach Spuren absuchen. Methode Gennat.,die dekoration nach spuren absuchen. methode gennat.,"['gennat', 'die', 'methode', 'spuren', 'absuchen', 'dekoration', 'nach']","['Die', 'Dekoration', 'nach', 'Spuren', 'absuchen', 'Methode', 'Gennat']","['Die', 'Dekoration', 'nach', 'Spuren', 'absuchen', '.', 'Methode', 'Gennat', '.']","['der', 'Dekoration', 'nach', 'Spur', 'absuchen', '.', 'Methode', 'Gennat', '.']","['DET', 'NOUN', 'ADP', 'NOUN', 'VERB', 'PUNCT', 'NOUN', 'NOUN', 'PUNCT']",der Dekoration nach Spur absuchen . Methode Gennat .,DET NOUN ADP NOUN VERB PUNCT NOUN NOUN PUNCT
Babylon_Berlin__S03E01.srt,Babylon Berlin,Babylon Berlin S03,Babylon Berlin E01,221,"0:21:38,0","0:21:39,960",Jawohl.  Handschuhe.,jawohl.  handschuhe.,"['handschuhe', 'jawohl']","['Jawohl', 'Handschuhe']","['Jawohl', '.', ' ', 'Handschuhe', '.']","['Jawohl', '.', ' ', 'Handschuhe', '.']","['PROPN', 'PUNCT', 'SPACE', 'NOUN', 'PUNCT']",Jawohl .   Handschuhe .,PROPN PUNCT SPACE NOUN PUNCT
Babylon_Berlin__S03E01.srt,Babylon Berlin,Babylon Berlin S03,Babylon Berlin E01,222,"0:21:43,160","0:21:44,440","Sehr gut, die Handschuhe.","sehr gut, die handschuhe.","['handschuhe', 'gut', 'die', 'sehr']","['Sehr', 'gut', 'die', 'Handschuhe']","['Sehr', 'gut', ',', 'die', 'Handschuhe', '.']","['Sehr', 'gut', ',', 'der', 'Handschuhe', '.']","['ADV', 'ADV', 'PUNCT', 'DET', 'NOUN', 'PUNCT']","Sehr gut , der Handschuhe .",ADV ADV PUNCT DET NOUN PUNCT
Babylon_Berlin__S03E01.srt,Babylon Berlin,Babylon Berlin S03,Babylon Berlin E01,223,"0:21:54,720","0:21:56,800",Jedes Detail wird gekennzeichnet.,jedes detail wird gekennzeichnet.,"['wird', 'detail', 'jedes', 'gekennzeichnet']","['Jedes', 'Detail', 'wird', 'gekennzeichnet']","['Jedes', 'Detail', 'wird', 'gekennzeichnet', '.']","['jed', 'Detail', 'werden', 'kennzeichnen', '.']","['DET', 'NOUN', 'AUX', 'VERB', 'PUNCT']",jed Detail werden kennzeichnen .,DET NOUN AUX VERB PUNCT
Babylon_Berlin__S03E01.srt,Babylon Berlin,Babylon Berlin S03,Babylon Berlin E01,224,"0:22:5,320","0:22:8,0",An diesen Schrauben war der Scheinwerfer befestigt.,an diesen schrauben war der scheinwerfer befestigt.,"['an', 'befestigt', 'der', 'diesen', 'schrauben', 'scheinwerfer', 'war']","['An', 'diesen', 'Schrauben', 'war', 'der', 'Scheinwerfer', 'befestigt']","['An', 'diesen', 'Schrauben', 'war', 'der', 'Scheinwerfer', 'befestigt', '.']","['an', 'dies', 'Schraube', 'sein', 'der', 'Scheinwerfer', 'befestigen', '.']","['ADP', 'DET', 'NOUN', 'AUX', 'DET', 'NOUN', 'VERB', 'PUNCT']",an dies Schraube sein der Scheinwerfer befestigen .,ADP DET NOUN AUX DET NOUN VERB PUNCT
Babylon_Berlin__S03E01.srt,Babylon Berlin,Babylon Berlin S03,Babylon Berlin E01,225,"0:22:8,80","0:22:9,400",Völlig intakt?,völlig intakt?,"['völlig', 'intakt']","['Völlig', 'intakt']","['Völlig', 'intakt', '?']","['Völlig', 'intakt', '?']","['ADV', 'ADV', 'PUNCT']",Völlig intakt ?,ADV ADV PUNCT
Babylon_Berlin__S03E01.srt,Babylon Berlin,Babylon Berlin S03,Babylon Berlin E01,226,"0:22:9,480","0:22:11,760","Und drei, der Tatort wird fotografiert.","und drei, der tatort wird fotografiert.","['der', 'wird', 'drei', 'fotografiert', 'und', 'tatort']","['Und', 'drei', 'der', 'Tatort', 'wird', 'fotografiert']","['Und', 'drei', ',', 'der', 'Tatort', 'wird', 'fotografiert', '.']","['und', 'drei', ',', 'der', 'Tatort', 'werden', 'fotografieren', '.']","['CCONJ', 'NUM', 'PUNCT', 'DET', 'NOUN', 'AUX', 'VERB', 'PUNCT']","und drei , der Tatort werden fotografieren .",CCONJ NUM PUNCT DET NOUN AUX VERB PUNCT
Babylon_Berlin__S03E01.srt,Babylon Berlin,Babylon Berlin S03,Babylon Berlin E01,227,"0:22:15,640","0:22:18,440","Viertens, die Zeugen werden vernommen.","viertens, die zeugen werden vernommen.","['werden', 'vernommen', 'viertens', 'die', 'zeugen']","['Viertens', 'die', 'Zeugen', 'werden', 'vernommen']","['Viertens', ',', 'die', 'Zeugen', 'werden', 'vernommen', '.']","['Viertens', ',', 'der', 'Zeuge', 'werden', 'vernehmen', '.']","['ADV', 'PUNCT', 'DET', 'NOUN', 'AUX', 'VERB', 'PUNCT']","Viertens , der Zeuge werden vernehmen .",ADV PUNCT DET NOUN AUX VERB PUNCT
Babylon_Berlin__S03E01.srt,Babylon Berlin,Babylon Berlin S03,Babylon Berlin E01,228,"0:22:18,520","0:22:20,600",Mein Mann war die ganze Nacht bei mir.,mein mann war die ganze nacht bei mir.,"['mir', 'mann', 'die', 'mein', 'war', 'bei', 'nacht', 'ganze']","['Mein', 'Mann', 'war', 'die', 'ganze', 'Nacht', 'bei', 'mir']","['Mein', 'Mann', 'war', 'die', 'ganze', 'Nacht', 'bei', 'mir', '.']","['mein', 'Mann', 'sein', 'der', 'ganze', 'Nacht', 'bei', 'sich', '.']","['DET', 'NOUN', 'AUX', 'DET', 'ADJ', 'NOUN', 'ADP', 'PRON', 'PUNCT']",mein Mann sein der ganze Nacht bei sich .,DET NOUN AUX DET ADJ NOUN ADP PRON PUNCT
Babylon_Berlin__S03E01.srt,Babylon Berlin,Babylon Berlin S03,Babylon Berlin E01,229,"0:22:21,0","0:22:24,360","Moment, Frau Klopsch. Erst die Frage, dann die Antwort.","moment, frau klopsch. erst die frage, dann die antwort.","['frage', 'erst', 'moment', 'antwort', 'die', 'klopsch', 'frau', 'dann']","['Moment', 'Frau', 'Klopsch', 'Erst', 'die', 'Frage', 'dann', 'die', 'Antwort']","['Moment', ',', 'Frau', 'Klopsch', '.', 'Erst', 'die', 'Frage', ',', 'dann', 'die', 'Antwort', '.']","['Moment', ',', 'Frau', 'Klopsch', '.', 'Erst', 'der', 'Frage', ',', 'dann', 'der', 'Antwort', '.']","['NOUN', 'PUNCT', 'NOUN', 'ADV', 'PUNCT', 'ADV', 'DET', 'NOUN', 'PUNCT', 'ADV', 'DET', 'NOUN', 'PUNCT']","Moment , Frau Klopsch . Erst der Frage , dann der Antwort .",NOUN PUNCT NOUN ADV PUNCT ADV DET NOUN PUNCT ADV DET NOUN PUNCT
Babylon_Berlin__S03E01.srt,Babylon Berlin,Babylon Berlin S03,Babylon Berlin E01,230,"0:22:24,440","0:22:25,400",Entschuldigung.,entschuldigung.,['entschuldigung'],['Entschuldigung'],"['Entschuldigung', '.']","['Entschuldigung', '.']","['NOUN', 'PUNCT']",Entschuldigung .,NOUN PUNCT
Babylon_Berlin__S03E01.srt,Babylon Berlin,Babylon Berlin S03,Babylon Berlin E01,231,"0:22:25,480","0:22:27,920",Wie heißen Sie? Tilly Brooks.,wie heißen sie? tilly brooks.,"['sie', 'tilly', 'heißen', 'wie', 'brooks']","['Wie', 'heißen', 'Sie', 'Tilly', 'Brooks']","['Wie', 'heißen', 'Sie', '?', 'Tilly', 'Brooks', '.']","['Wie', 'heiß', 'ich', '?', 'Tilly', 'Brooks', '.']","['ADV', 'VERB', 'PRON', 'PUNCT', 'PROPN', 'PROPN', 'PUNCT']",Wie heiß ich ? Tilly Brooks .,ADV VERB PRON PUNCT PROPN PROPN PUNCT
