Unique_ID,Show_Name,Season,Episode,Line_Index,Start,End,Dialogue,Dialogue_lower,Dialogue_Set_Words,Dialogue_Words,Dialogue_Tokens_Text,Dialogue_Tokens_Lemmas,Dialogue_Tokens_POS_Tags,Dialogue_Lemmas_Pattern,Dialogue_POS_Tags_Pattern
Babylon_Berlin__S01E06.srt,Babylon Berlin,Babylon Berlin S01,Babylon Berlin E06,207,"0:15:35,280","0:15:37,280","Wartet, ich krieg euch.","wartet, ich krieg euch.","['euch', 'wartet', 'krieg', 'ich']","['Wartet', 'ich', 'krieg', 'euch']","['Wartet', ',', 'ich', 'krieg', 'euch', '.']","['Wartet', ',', 'ich', 'krieg', 'sich', '.']","['VERB', 'PUNCT', 'PRON', 'VERB', 'PRON', 'PUNCT']","Wartet , ich krieg sich .",VERB PUNCT PRON VERB PRON PUNCT
Babylon_Berlin__S01E06.srt,Babylon Berlin,Babylon Berlin S01,Babylon Berlin E06,208,"0:15:39,400","0:15:40,600",Schneller!,schneller!,['schneller'],['Schneller'],"['Schneller', '!']","['Schneller', '!']","['ADV', 'PUNCT']",Schneller !,ADV PUNCT
Babylon_Berlin__S01E06.srt,Babylon Berlin,Babylon Berlin S01,Babylon Berlin E06,209,"0:15:42,440","0:15:45,400",Was machst du denn?  Hilf mir doch!,was machst du denn?  hilf mir doch!,"['doch', 'was', 'mir', 'du', 'hilf', 'machst', 'denn']","['Was', 'machst', 'du', 'denn', 'Hilf', 'mir', 'doch']","['Was', 'machst', 'du', 'denn', '?', ' ', 'Hilf', 'mir', 'doch', '!']","['Was', 'machen', 'du', 'denn', '?', ' ', 'Hilf', 'sich', 'doch', '!']","['PRON', 'VERB', 'PRON', 'ADV', 'PUNCT', 'SPACE', 'PROPN', 'PRON', 'ADV', 'PUNCT']",Was machen du denn ?   Hilf sich doch !,PRON VERB PRON ADV PUNCT SPACE PROPN PRON ADV PUNCT
Babylon_Berlin__S01E06.srt,Babylon Berlin,Babylon Berlin S01,Babylon Berlin E06,210,"0:15:45,480","0:15:48,320",Tu was!  Da musste jetzt durch.,tu was!  da musste jetzt durch.,"['was', 'da', 'durch', 'jetzt', 'musste', 'tu']","['Tu', 'was', 'Da', 'musste', 'jetzt', 'durch']","['Tu', 'was', '!', ' ', 'Da', 'musste', 'jetzt', 'durch', '.']","['Tu', 'was', '!', ' ', 'da', 'musste', 'jetzt', 'durch', '.']","['NOUN', 'PRON', 'PUNCT', 'SPACE', 'ADV', 'VERB', 'ADV', 'ADP', 'PUNCT']",Tu was !   da musste jetzt durch .,NOUN PRON PUNCT SPACE ADV VERB ADV ADP PUNCT
Babylon_Berlin__S01E06.srt,Babylon Berlin,Babylon Berlin S01,Babylon Berlin E06,212,"0:15:59,200","0:16:0,360",Die sind wir los.,die sind wir los.,"['los', 'sind', 'die', 'wir']","['Die', 'sind', 'wir', 'los']","['Die', 'sind', 'wir', 'los', '.']","['der', 'sein', 'ich', 'los', '.']","['PRON', 'AUX', 'PRON', 'ADV', 'PUNCT']",der sein ich los .,PRON AUX PRON ADV PUNCT
Babylon_Berlin__S01E06.srt,Babylon Berlin,Babylon Berlin S01,Babylon Berlin E06,213,"0:16:4,80","0:16:6,760",Ich bin der Fritz. Greta.,ich bin der fritz. greta.,"['greta', 'der', 'bin', 'fritz', 'ich']","['Ich', 'bin', 'der', 'Fritz', 'Greta']","['Ich', 'bin', 'der', 'Fritz', '.', 'Greta', '.']","['Ich', 'sein', 'der', 'Fritz', '.', 'Greta', '.']","['PRON', 'AUX', 'DET', 'PROPN', 'PUNCT', 'PROPN', 'PUNCT']",Ich sein der Fritz . Greta .,PRON AUX DET PROPN PUNCT PROPN PUNCT
Babylon_Berlin__S01E06.srt,Babylon Berlin,Babylon Berlin S01,Babylon Berlin E06,214,"0:16:8,400","0:16:10,600",Greta. Schöner Name.,greta. schöner name.,"['name', 'greta', 'schöner']","['Greta', 'Schöner', 'Name']","['Greta', '.', 'Schöner', 'Name', '.']","['Greta', '.', 'Schöner', 'Name', '.']","['PROPN', 'PUNCT', 'ADJ', 'NOUN', 'PUNCT']",Greta . Schöner Name .,PROPN PUNCT ADJ NOUN PUNCT
Babylon_Berlin__S01E06.srt,Babylon Berlin,Babylon Berlin S01,Babylon Berlin E06,215,"0:16:10,680","0:16:11,760",Otto.,otto.,['otto'],['Otto'],"['Otto', '.']","['Otto', '.']","['PROPN', 'PUNCT']",Otto .,PROPN PUNCT
Babylon_Berlin__S01E06.srt,Babylon Berlin,Babylon Berlin S01,Babylon Berlin E06,216,"0:16:13,40","0:16:14,120",Hallo.,hallo.,['hallo'],['Hallo'],"['Hallo', '.']","['Hallo', '.']","['PROPN', 'PUNCT']",Hallo .,PROPN PUNCT
Babylon_Berlin__S01E06.srt,Babylon Berlin,Babylon Berlin S01,Babylon Berlin E06,217,"0:16:26,520","0:16:28,760","Kalt, aber gerecht.","kalt, aber gerecht.","['gerecht', 'kalt', 'aber']","['Kalt', 'aber', 'gerecht']","['Kalt', ',', 'aber', 'gerecht', '.']","['Kalt', ',', 'aber', 'gerecht', '.']","['PROPN', 'PUNCT', 'CCONJ', 'ADV', 'PUNCT']","Kalt , aber gerecht .",PROPN PUNCT CCONJ ADV PUNCT
Babylon_Berlin__S01E06.srt,Babylon Berlin,Babylon Berlin S01,Babylon Berlin E06,218,"0:16:31,880","0:16:32,880",Sag mal...,sag mal...,"['mal', 'sag']","['Sag', 'mal']","['Sag', 'mal', '...']","['Sag', 'mal', '...']","['PROPN', 'ADV', 'PUNCT']",Sag mal ...,PROPN ADV PUNCT
Babylon_Berlin__S01E06.srt,Babylon Berlin,Babylon Berlin S01,Babylon Berlin E06,219,"0:16:34,320","0:16:38,240","Du studierst doch Medizin, oder? Kriminalpathologie bei Dr. Schwarz.","du studierst doch medizin, oder? kriminalpathologie bei dr. schwarz.","['doch', 'oder', 'du', 'dr.', 'kriminalpathologie', 'bei', 'medizin', 'studierst', 'schwarz']","['Du', 'studierst', 'doch', 'Medizin', 'oder', 'Kriminalpathologie', 'bei', 'Dr.', 'Schwarz']","['Du', 'studierst', 'doch', 'Medizin', ',', 'oder', '?', 'Kriminalpathologie', 'bei', 'Dr.', 'Schwarz', '.']","['Du', 'studieren', 'doch', 'Medizin', ',', 'oder', '?', 'Kriminalpathologie', 'bei', 'Dr.', 'Schwarz', '.']","['PRON', 'VERB', 'ADV', 'NOUN', 'PUNCT', 'CCONJ', 'PUNCT', 'NOUN', 'ADP', 'NOUN', 'PROPN', 'PUNCT']","Du studieren doch Medizin , oder ? Kriminalpathologie bei Dr. Schwarz .",PRON VERB ADV NOUN PUNCT CCONJ PUNCT NOUN ADP NOUN PROPN PUNCT
Babylon_Berlin__S01E06.srt,Babylon Berlin,Babylon Berlin S01,Babylon Berlin E06,220,"0:16:38,680","0:16:40,480",Schneidet ihr da Leichen auf und guckt rein?,schneidet ihr da leichen auf und guckt rein?,"['guckt', 'leichen', 'und', 'da', 'rein', 'ihr', 'schneidet', 'auf']","['Schneidet', 'ihr', 'da', 'Leichen', 'auf', 'und', 'guckt', 'rein']","['Schneidet', 'ihr', 'da', 'Leichen', 'auf', 'und', 'guckt', 'rein', '?']","['Schneidet', 'mein', 'da', 'Leiche', 'auf', 'und', 'gucken', 'rein', '?']","['ADV', 'PRON', 'ADV', 'NOUN', 'ADP', 'CCONJ', 'VERB', 'ADV', 'PUNCT']",Schneidet mein da Leiche auf und gucken rein ?,ADV PRON ADV NOUN ADP CCONJ VERB ADV PUNCT
Babylon_Berlin__S01E06.srt,Babylon Berlin,Babylon Berlin S01,Babylon Berlin E06,221,"0:16:40,560","0:16:42,80",Fast nichts anderes.,fast nichts anderes.,"['nichts', 'fast', 'anderes']","['Fast', 'nichts', 'anderes']","['Fast', 'nichts', 'anderes', '.']","['Fast', 'nichts', 'ander', '.']","['ADV', 'DET', 'PRON', 'PUNCT']",Fast nichts ander .,ADV DET PRON PUNCT
Babylon_Berlin__S01E06.srt,Babylon Berlin,Babylon Berlin S01,Babylon Berlin E06,222,"0:16:44,400","0:16:46,120",Im Ernst? Na aber.,im ernst? na aber.,"['im', 'na', 'aber', 'ernst']","['Im', 'Ernst', 'Na', 'aber']","['Im', 'Ernst', '?', 'Na', 'aber', '.']","['Im', 'Ernst', '?', 'Na', 'aber', '.']","['ADP', 'NOUN', 'PUNCT', 'INTJ', 'ADV', 'PUNCT']",Im Ernst ? Na aber .,ADP NOUN PUNCT INTJ ADV PUNCT
Babylon_Berlin__S01E06.srt,Babylon Berlin,Babylon Berlin S01,Babylon Berlin E06,223,"0:16:46,200","0:16:47,720",Aufschnibbeln kann ich im Schlaf.,aufschnibbeln kann ich im schlaf.,"['aufschnibbeln', 'im', 'kann', 'schlaf', 'ich']","['Aufschnibbeln', 'kann', 'ich', 'im', 'Schlaf']","['Aufschnibbeln', 'kann', 'ich', 'im', 'Schlaf', '.']","['Aufschnibbeln', 'können', 'ich', 'im', 'Schlaf', '.']","['NOUN', 'AUX', 'PRON', 'ADP', 'NOUN', 'PUNCT']",Aufschnibbeln können ich im Schlaf .,NOUN AUX PRON ADP NOUN PUNCT
Babylon_Berlin__S01E06.srt,Babylon Berlin,Babylon Berlin S01,Babylon Berlin E06,224,"0:16:48,760","0:16:50,200",Weshalb willst 'n das wissen?,weshalb willst 'n das wissen?,"['weshalb', 'das', 'willst', ""'n"", 'wissen']","['Weshalb', 'willst', ""'n"", 'das', 'wissen']","['Weshalb', 'willst', ""'n"", 'das', 'wissen', '?']","['weshalb', 'wollen', ""'n"", 'der', 'wissen', '?']","['ADV', 'AUX', 'PRON', 'PRON', 'VERB', 'PUNCT']",weshalb wollen 'n der wissen ?,ADV AUX PRON PRON VERB PUNCT
Babylon_Berlin__S01E06.srt,Babylon Berlin,Babylon Berlin S01,Babylon Berlin E06,225,"0:16:52,0","0:16:53,280",Nur so.,nur so.,"['nur', 'so']","['Nur', 'so']","['Nur', 'so', '.']","['Nur', 'so', '.']","['ADV', 'ADV', 'PUNCT']",Nur so .,ADV ADV PUNCT
Babylon_Berlin__S01E06.srt,Babylon Berlin,Babylon Berlin S01,Babylon Berlin E06,226,"0:16:53,680","0:16:56,0",Vielleicht haben wir zwei ja später noch was vor.,vielleicht haben wir zwei ja später noch was vor.,"['was', 'wir', 'ja', 'später', 'vielleicht', 'haben', 'vor', 'zwei', 'noch']","['Vielleicht', 'haben', 'wir', 'zwei', 'ja', 'später', 'noch', 'was', 'vor']","['Vielleicht', 'haben', 'wir', 'zwei', 'ja', 'später', 'noch', 'was', 'vor', '.']","['Vielleicht', 'haben', 'ich', 'zwei', 'ja', 'spät', 'noch', 'was', 'vor', '.']","['ADV', 'AUX', 'PRON', 'NUM', 'ADV', 'ADV', 'ADV', 'PRON', 'ADP', 'PUNCT']",Vielleicht haben ich zwei ja spät noch was vor .,ADV AUX PRON NUM ADV ADV ADV PRON ADP PUNCT
Babylon_Berlin__S01E06.srt,Babylon Berlin,Babylon Berlin S01,Babylon Berlin E06,227,"0:16:56,760","0:16:57,920","So, so.","so, so.",['so'],"['So', 'so']","['So', ',', 'so', '.']","['so', ',', 'so', '.']","['ADV', 'PUNCT', 'ADV', 'PUNCT']","so , so .",ADV PUNCT ADV PUNCT
Babylon_Berlin__S01E06.srt,Babylon Berlin,Babylon Berlin S01,Babylon Berlin E06,228,"0:17:2,440","0:17:3,960",Bitte bedienen Sie sich!,bitte bedienen sie sich!,"['sich', 'bedienen', 'sie', 'bitte']","['Bitte', 'bedienen', 'Sie', 'sich']","['Bitte', 'bedienen', 'Sie', 'sich', '!']","['Bitte', 'bedienen', 'ich', 'sich', '!']","['ADV', 'VERB', 'PRON', 'PRON', 'PUNCT']",Bitte bedienen ich sich !,ADV VERB PRON PRON PUNCT
Babylon_Berlin__S01E06.srt,Babylon Berlin,Babylon Berlin S01,Babylon Berlin E06,229,"0:17:4,240","0:17:7,760",Tut mir leid. Aber unser Dienstmädchen ist uns über Nacht weggeheiratet worden.,tut mir leid. aber unser dienstmädchen ist uns über nacht weggeheiratet worden.,"['weggeheiratet', 'dienstmädchen', 'mir', 'ist', 'aber', 'uns', 'leid', 'unser', 'worden', 'über', 'nacht', 'tut']","['Tut', 'mir', 'leid', 'Aber', 'unser', 'Dienstmädchen', 'ist', 'uns', 'über', 'Nacht', 'weggeheiratet', 'worden']","['Tut', 'mir', 'leid', '.', 'Aber', 'unser', 'Dienstmädchen', 'ist', 'uns', 'über', 'Nacht', 'weggeheiratet', 'worden', '.']","['Tut', 'sich', 'leid', '.', 'aber', 'sich', 'Dienstmädchen', 'sein', 'sich', 'über', 'Nacht', 'weggeheiratet', 'werden', '.']","['PROPN', 'PRON', 'ADV', 'PUNCT', 'CCONJ', 'DET', 'NOUN', 'AUX', 'PRON', 'ADP', 'NOUN', 'VERB', 'AUX', 'PUNCT']",Tut sich leid . aber sich Dienstmädchen sein sich über Nacht weggeheiratet werden .,PROPN PRON ADV PUNCT CCONJ DET NOUN AUX PRON ADP NOUN VERB AUX PUNCT
Babylon_Berlin__S01E06.srt,Babylon Berlin,Babylon Berlin S01,Babylon Berlin E06,230,"0:17:8,280","0:17:10,640","Kann ich Ihnen helfen? Nein, danke.","kann ich ihnen helfen? nein, danke.","['nein', 'danke', 'ihnen', 'helfen', 'kann', 'ich']","['Kann', 'ich', 'Ihnen', 'helfen', 'Nein', 'danke']","['Kann', 'ich', 'Ihnen', 'helfen', '?', 'Nein', ',', 'danke', '.']","['können', 'ich', 'ich', 'helfen', '?', 'Nein', ',', 'danke', '.']","['AUX', 'PRON', 'PRON', 'VERB', 'PUNCT', 'PART', 'PUNCT', 'VERB', 'PUNCT']","können ich ich helfen ? Nein , danke .",AUX PRON PRON VERB PUNCT PART PUNCT VERB PUNCT
Babylon_Berlin__S01E06.srt,Babylon Berlin,Babylon Berlin S01,Babylon Berlin E06,231,"0:17:11,120","0:17:12,880",Das verlernt eine Frau doch nicht.,das verlernt eine frau doch nicht.,"['doch', 'das', 'eine', 'verlernt', 'frau', 'nicht']","['Das', 'verlernt', 'eine', 'Frau', 'doch', 'nicht']","['Das', 'verlernt', 'eine', 'Frau', 'doch', 'nicht', '.']","['der', 'verlernen', 'einen', 'Frau', 'doch', 'nicht', '.']","['PRON', 'VERB', 'DET', 'NOUN', 'ADV', 'PART', 'PUNCT']",der verlernen einen Frau doch nicht .,PRON VERB DET NOUN ADV PART PUNCT
Babylon_Berlin__S01E06.srt,Babylon Berlin,Babylon Berlin S01,Babylon Berlin E06,232,"0:17:14,640","0:17:16,400","Ah, Rath, da sind Sie ja.","ah, rath, da sind sie ja.","['sie', 'ah', 'ja', 'sind', 'da', 'rath']","['Ah', 'Rath', 'da', 'sind', 'Sie', 'ja']","['Ah', ',', 'Rath', ',', 'da', 'sind', 'Sie', 'ja', '.']","['Ah', ',', 'Rath', ',', 'da', 'sein', 'ich', 'ja', '.']","['PROPN', 'PUNCT', 'PROPN', 'PUNCT', 'ADV', 'AUX', 'PRON', 'ADV', 'PUNCT']","Ah , Rath , da sein ich ja .",PROPN PUNCT PROPN PUNCT ADV AUX PRON ADV PUNCT
Babylon_Berlin__S01E06.srt,Babylon Berlin,Babylon Berlin S01,Babylon Berlin E06,233,"0:17:16,880","0:17:19,720",Haben Sie unseren obersten Dienstherren schon kennengelernt?,haben sie unseren obersten dienstherren schon kennengelernt?,"['obersten', 'sie', 'schon', 'dienstherren', 'haben', 'unseren', 'kennengelernt']","['Haben', 'Sie', 'unseren', 'obersten', 'Dienstherren', 'schon', 'kennengelernt']","['Haben', 'Sie', 'unseren', 'obersten', 'Dienstherren', 'schon', 'kennengelernt', '?']","['Haben', 'ich', 'mein', 'ober', 'Dienstherren', 'schon', 'kennenlernen', '?']","['AUX', 'PRON', 'DET', 'ADJ', 'NOUN', 'ADV', 'VERB', 'PUNCT']",Haben ich mein ober Dienstherren schon kennenlernen ?,AUX PRON DET ADJ NOUN ADV VERB PUNCT
Babylon_Berlin__S01E06.srt,Babylon Berlin,Babylon Berlin S01,Babylon Berlin E06,234,"0:17:20,80","0:17:22,80",Wir sind uns noch nicht vorgestellt worden.,wir sind uns noch nicht vorgestellt worden.,"['wir', 'sind', 'uns', 'worden', 'nicht', 'vorgestellt', 'noch']","['Wir', 'sind', 'uns', 'noch', 'nicht', 'vorgestellt', 'worden']","['Wir', 'sind', 'uns', 'noch', 'nicht', 'vorgestellt', 'worden', '.']","['ich', 'sein', 'sich', 'noch', 'nicht', 'vorstellen', 'werden', '.']","['PRON', 'AUX', 'PRON', 'ADV', 'PART', 'VERB', 'AUX', 'PUNCT']",ich sein sich noch nicht vorstellen werden .,PRON AUX PRON ADV PART VERB AUX PUNCT
Babylon_Berlin__S01E06.srt,Babylon Berlin,Babylon Berlin S01,Babylon Berlin E06,235,"0:17:22,400","0:17:25,680","Polizeipräsident Zörgiebel, Kommissar Rath aus Köln.","polizeipräsident zörgiebel, kommissar rath aus köln.","['köln', 'polizeipräsident', 'aus', 'zörgiebel', 'kommissar', 'rath']","['Polizeipräsident', 'Zörgiebel', 'Kommissar', 'Rath', 'aus', 'Köln']","['Polizeipräsident', 'Zörgiebel', ',', 'Kommissar', 'Rath', 'aus', 'Köln', '.']","['Polizeipräsident', 'Zörgiebel', ',', 'Kommissar', 'Rath', 'aus', 'Köln', '.']","['NOUN', 'PROPN', 'PUNCT', 'NOUN', 'PROPN', 'ADP', 'PROPN', 'PUNCT']","Polizeipräsident Zörgiebel , Kommissar Rath aus Köln .",NOUN PROPN PUNCT NOUN PROPN ADP PROPN PUNCT
Babylon_Berlin__S01E06.srt,Babylon Berlin,Babylon Berlin S01,Babylon Berlin E06,236,"0:17:25,760","0:17:26,720",Ist mir eine Ehre.,ist mir eine ehre.,"['ehre', 'eine', 'mir', 'ist']","['Ist', 'mir', 'eine', 'Ehre']","['Ist', 'mir', 'eine', 'Ehre', '.']","['sein', 'sich', 'einen', 'Ehre', '.']","['AUX', 'PRON', 'DET', 'NOUN', 'PUNCT']",sein sich einen Ehre .,AUX PRON DET NOUN PUNCT
Babylon_Berlin__S01E06.srt,Babylon Berlin,Babylon Berlin S01,Babylon Berlin E06,237,"0:17:27,560","0:17:29,880",Rath. Sohn von Engelbert.,rath. sohn von engelbert.,"['engelbert', 'sohn', 'von', 'rath']","['Rath', 'Sohn', 'von', 'Engelbert']","['Rath', '.', 'Sohn', 'von', 'Engelbert', '.']","['Rath', '.', 'Sohn', 'von', 'Engelbert', '.']","['PROPN', 'PUNCT', 'NOUN', 'ADP', 'PROPN', 'PUNCT']",Rath . Sohn von Engelbert .,PROPN PUNCT NOUN ADP PROPN PUNCT
Babylon_Berlin__S01E06.srt,Babylon Berlin,Babylon Berlin S01,Babylon Berlin E06,238,"0:17:30,960","0:17:33,920",Sie schulden mir noch ein Protokoll. Vom 1. Mai.,sie schulden mir noch ein protokoll. vom 1. mai.,"['mir', 'sie', 'protokoll', 'mai', 'schulden', '1.', 'ein', 'vom', 'noch']","['Sie', 'schulden', 'mir', 'noch', 'ein', 'Protokoll', 'Vom', '1.', 'Mai']","['Sie', 'schulden', 'mir', 'noch', 'ein', 'Protokoll', '.', 'Vom', '1.', 'Mai', '.']","['ich', 'schulden', 'sich', 'noch', 'einen', 'Protokoll', '.', 'Vom', '1.', 'Mai', '.']","['PRON', 'VERB', 'PRON', 'ADV', 'DET', 'NOUN', 'PUNCT', 'ADP', 'ADJ', 'NOUN', 'PUNCT']",ich schulden sich noch einen Protokoll . Vom 1. Mai .,PRON VERB PRON ADV DET NOUN PUNCT ADP ADJ NOUN PUNCT
Babylon_Berlin__S01E06.srt,Babylon Berlin,Babylon Berlin S01,Babylon Berlin E06,239,"0:17:34,360","0:17:36,0",Das... Das ist in Arbeit.,das... das ist in arbeit.,"['ist', 'arbeit', 'in', 'das']","['Das', 'Das', 'ist', 'in', 'Arbeit']","['Das', '...', 'Das', 'ist', 'in', 'Arbeit', '.']","['der', '...', 'der', 'sein', 'in', 'Arbeit', '.']","['PRON', 'PUNCT', 'PRON', 'AUX', 'ADP', 'NOUN', 'PUNCT']",der ... der sein in Arbeit .,PRON PUNCT PRON AUX ADP NOUN PUNCT
Babylon_Berlin__S01E06.srt,Babylon Berlin,Babylon Berlin S01,Babylon Berlin E06,240,"0:17:36,80","0:17:39,240","Die Tatsache, dass man Sie beschossen hat und die Gefahr,","die tatsache, dass man sie beschossen hat und die gefahr,","['gefahr', 'sie', 'dass', 'die', 'man', 'tatsache', 'und', 'hat', 'beschossen']","['Die', 'Tatsache', 'dass', 'man', 'Sie', 'beschossen', 'hat', 'und', 'die', 'Gefahr']","['Die', 'Tatsache', ',', 'dass', 'man', 'Sie', 'beschossen', 'hat', 'und', 'die', 'Gefahr', ',']","['der', 'Tatsache', ',', 'dass', 'man', 'ich', 'beschießen', 'haben', 'und', 'der', 'Gefahr', ',']","['DET', 'NOUN', 'PUNCT', 'SCONJ', 'PRON', 'PRON', 'VERB', 'AUX', 'CCONJ', 'DET', 'NOUN', 'PUNCT']","der Tatsache , dass man ich beschießen haben und der Gefahr ,",DET NOUN PUNCT SCONJ PRON PRON VERB AUX CCONJ DET NOUN PUNCT
Babylon_Berlin__S01E06.srt,Babylon Berlin,Babylon Berlin S01,Babylon Berlin E06,241,"0:17:39,920","0:17:43,960","die Notwehr, in der Sie und Ihr Kollege sich befunden haben,","die notwehr, in der sie und ihr kollege sich befunden haben,","['kollege', 'sie', 'befunden', 'der', 'sich', 'die', 'haben', 'notwehr', 'in', 'ihr', 'und']","['die', 'Notwehr', 'in', 'der', 'Sie', 'und', 'Ihr', 'Kollege', 'sich', 'befunden', 'haben']","['die', 'Notwehr', ',', 'in', 'der', 'Sie', 'und', 'Ihr', 'Kollege', 'sich', 'befunden', 'haben', ',']","['der', 'Notwehr', ',', 'in', 'der', 'ich', 'und', 'mein', 'Kollege', 'sich', 'befunden', 'haben', ',']","['DET', 'NOUN', 'PUNCT', 'ADP', 'PRON', 'PRON', 'CCONJ', 'DET', 'NOUN', 'PRON', 'VERB', 'AUX', 'PUNCT']","der Notwehr , in der ich und mein Kollege sich befunden haben ,",DET NOUN PUNCT ADP PRON PRON CCONJ DET NOUN PRON VERB AUX PUNCT
Babylon_Berlin__S01E06.srt,Babylon Berlin,Babylon Berlin S01,Babylon Berlin E06,242,"0:17:44,40","0:17:45,960",das kann nicht genug betont werden.,das kann nicht genug betont werden.,"['betont', 'das', 'werden', 'nicht', 'genug', 'kann']","['das', 'kann', 'nicht', 'genug', 'betont', 'werden']","['das', 'kann', 'nicht', 'genug', 'betont', 'werden', '.']","['der', 'können', 'nicht', 'genug', 'betonen', 'werden', '.']","['PRON', 'AUX', 'PART', 'ADV', 'VERB', 'AUX', 'PUNCT']",der können nicht genug betonen werden .,PRON AUX PART ADV VERB AUX PUNCT
Babylon_Berlin__S01E06.srt,Babylon Berlin,Babylon Berlin S01,Babylon Berlin E06,243,"0:17:46,560","0:17:51,640",Morgen früh erwarte ich Ihre schriftliche Aussage zu diesen Vorkommnissen.,morgen früh erwarte ich ihre schriftliche aussage zu diesen vorkommnissen.,"['ihre', 'morgen', 'schriftliche', 'früh', 'aussage', 'diesen', 'erwarte', 'zu', 'vorkommnissen', 'ich']","['Morgen', 'früh', 'erwarte', 'ich', 'Ihre', 'schriftliche', 'Aussage', 'zu', 'diesen', 'Vorkommnissen']","['Morgen', 'früh', 'erwarte', 'ich', 'Ihre', 'schriftliche', 'Aussage', 'zu', 'diesen', 'Vorkommnissen', '.']","['Morgen', 'früh', 'erwarten', 'ich', 'mein', 'schriftlich', 'Aussage', 'zu', 'dies', 'Vorkommnis', '.']","['NOUN', 'ADV', 'VERB', 'PRON', 'DET', 'ADJ', 'NOUN', 'ADP', 'DET', 'NOUN', 'PUNCT']",Morgen früh erwarten ich mein schriftlich Aussage zu dies Vorkommnis .,NOUN ADV VERB PRON DET ADJ NOUN ADP DET NOUN PUNCT
Babylon_Berlin__S01E06.srt,Babylon Berlin,Babylon Berlin S01,Babylon Berlin E06,245,"0:18:44,0","0:18:45,360",Du zitterst so.,du zitterst so.,"['du', 'so', 'zitterst']","['Du', 'zitterst', 'so']","['Du', 'zitterst', 'so', '.']","['Du', 'zittern', 'so', '.']","['PRON', 'VERB', 'ADV', 'PUNCT']",Du zittern so .,PRON VERB ADV PUNCT
Babylon_Berlin__S01E06.srt,Babylon Berlin,Babylon Berlin S01,Babylon Berlin E06,246,"0:18:46,560","0:18:48,120",Mir ist auch kalt.,mir ist auch kalt.,"['kalt', 'mir', 'auch', 'ist']","['Mir', 'ist', 'auch', 'kalt']","['Mir', 'ist', 'auch', 'kalt', '.']","['ich', 'sein', 'auch', 'kalt', '.']","['PRON', 'AUX', 'ADV', 'ADV', 'PUNCT']",ich sein auch kalt .,PRON AUX ADV ADV PUNCT
Babylon_Berlin__S01E06.srt,Babylon Berlin,Babylon Berlin S01,Babylon Berlin E06,247,"0:18:48,200","0:18:49,480",Wir brauchen Hilfe!,wir brauchen hilfe!,"['hilfe', 'wir', 'brauchen']","['Wir', 'brauchen', 'Hilfe']","['Wir', 'brauchen', 'Hilfe', '!']","['ich', 'brauchen', 'Hilfe', '!']","['PRON', 'VERB', 'NOUN', 'PUNCT']",ich brauchen Hilfe !,PRON VERB NOUN PUNCT
Babylon_Berlin__S01E06.srt,Babylon Berlin,Babylon Berlin S01,Babylon Berlin E06,249,"0:19:38,880","0:19:40,120",Das dürfen Sie nicht.,das dürfen sie nicht.,"['dürfen', 'nicht', 'sie', 'das']","['Das', 'dürfen', 'Sie', 'nicht']","['Das', 'dürfen', 'Sie', 'nicht', '.']","['der', 'dürfen', 'ich', 'nicht', '.']","['PRON', 'AUX', 'PRON', 'PART', 'PUNCT']",der dürfen ich nicht .,PRON AUX PRON PART PUNCT
Babylon_Berlin__S01E06.srt,Babylon Berlin,Babylon Berlin S01,Babylon Berlin E06,250,"0:19:40,880","0:19:42,0",Ich schon.,ich schon.,"['ich', 'schon']","['Ich', 'schon']","['Ich', 'schon', '.']","['Ich', 'schon', '.']","['PRON', 'ADV', 'PUNCT']",Ich schon .,PRON ADV PUNCT
Babylon_Berlin__S01E06.srt,Babylon Berlin,Babylon Berlin S01,Babylon Berlin E06,251,"0:20:13,680","0:20:15,120",Genau so.,genau so.,"['so', 'genau']","['Genau', 'so']","['Genau', 'so', '.']","['Genau', 'so', '.']","['ADV', 'ADV', 'PUNCT']",Genau so .,ADV ADV PUNCT
Babylon_Berlin__S01E06.srt,Babylon Berlin,Babylon Berlin S01,Babylon Berlin E06,252,"0:20:16,720","0:20:19,320","Bitte? Na, die Schupos.","bitte? na, die schupos.","['schupos', 'na', 'die', 'bitte']","['Bitte', 'Na', 'die', 'Schupos']","['Bitte', '?', 'Na', ',', 'die', 'Schupos', '.']","['Bitte', '?', 'Na', ',', 'der', 'Schupos', '.']","['NOUN', 'PUNCT', 'INTJ', 'PUNCT', 'DET', 'NOUN', 'PUNCT']","Bitte ? Na , der Schupos .",NOUN PUNCT INTJ PUNCT DET NOUN PUNCT
Babylon_Berlin__S01E06.srt,Babylon Berlin,Babylon Berlin S01,Babylon Berlin E06,253,"0:20:20,120","0:20:21,960",Von da haben sie geballert.,von da haben sie geballert.,"['sie', 'da', 'haben', 'geballert', 'von']","['Von', 'da', 'haben', 'sie', 'geballert']","['Von', 'da', 'haben', 'sie', 'geballert', '.']","['Von', 'da', 'haben', 'ich', 'ballern', '.']","['ADP', 'ADV', 'AUX', 'PRON', 'VERB', 'PUNCT']",Von da haben ich ballern .,ADP ADV AUX PRON VERB PUNCT
Babylon_Berlin__S01E06.srt,Babylon Berlin,Babylon Berlin S01,Babylon Berlin E06,254,"0:20:24,480","0:20:25,640",Und tot waren sie.,und tot waren sie.,"['sie', 'und', 'tot', 'waren']","['Und', 'tot', 'waren', 'sie']","['Und', 'tot', 'waren', 'sie', '.']","['und', 'tot', 'sein', 'ich', '.']","['CCONJ', 'ADV', 'AUX', 'PRON', 'PUNCT']",und tot sein ich .,CCONJ ADV AUX PRON PUNCT
Babylon_Berlin__S01E06.srt,Babylon Berlin,Babylon Berlin S01,Babylon Berlin E06,255,"0:20:31,400","0:20:32,720","Aber ""Keine Revolution"",","aber ""keine revolution"",","['keine', 'revolution', 'aber']","['Aber', 'Keine', 'Revolution']","['Aber', '""', 'Keine', 'Revolution', '""', ',']","['aber', '""', 'kein', 'Revolution', '""', ',']","['CCONJ', 'PUNCT', 'DET', 'NOUN', 'PUNCT', 'PUNCT']","aber "" kein Revolution "" ,",CCONJ PUNCT DET NOUN PUNCT PUNCT
Babylon_Berlin__S01E06.srt,Babylon Berlin,Babylon Berlin S01,Babylon Berlin E06,256,"0:20:32,800","0:20:34,80",sagt die Partei.,sagt die partei.,"['partei', 'sagt', 'die']","['sagt', 'die', 'Partei']","['sagt', 'die', 'Partei', '.']","['sagen', 'der', 'Partei', '.']","['VERB', 'DET', 'NOUN', 'PUNCT']",sagen der Partei .,VERB DET NOUN PUNCT
Babylon_Berlin__S01E06.srt,Babylon Berlin,Babylon Berlin S01,Babylon Berlin E06,258,"0:20:52,160","0:20:53,600",Was machen Sie denn hier?,was machen sie denn hier?,"['was', 'sie', 'hier', 'machen', 'denn']","['Was', 'machen', 'Sie', 'denn', 'hier']","['Was', 'machen', 'Sie', 'denn', 'hier', '?']","['Was', 'machen', 'ich', 'denn', 'hier', '?']","['PRON', 'VERB', 'PRON', 'ADV', 'ADV', 'PUNCT']",Was machen ich denn hier ?,PRON VERB PRON ADV ADV PUNCT
Babylon_Berlin__S01E06.srt,Babylon Berlin,Babylon Berlin S01,Babylon Berlin E06,259,"0:20:54,40","0:20:56,0",Herr Nowak. Schnüffeln Sie hier rum?,herr nowak. schnüffeln sie hier rum?,"['sie', 'nowak', 'hier', 'herr', 'rum', 'schnüffeln']","['Herr', 'Nowak', 'Schnüffeln', 'Sie', 'hier', 'rum']","['Herr', 'Nowak', '.', 'Schnüffeln', 'Sie', 'hier', 'rum', '?']","['Herr', 'Nowak', '.', 'Schnüffeln', 'ich', 'hier', 'rum', '?']","['NOUN', 'PROPN', 'PUNCT', 'VERB', 'PRON', 'ADV', 'ADV', 'PUNCT']",Herr Nowak . Schnüffeln ich hier rum ?,NOUN PROPN PUNCT VERB PRON ADV ADV PUNCT
Babylon_Berlin__S01E06.srt,Babylon Berlin,Babylon Berlin S01,Babylon Berlin E06,260,"0:20:56,80","0:20:58,280",Entschuldigen Sie. Das ist einer von denen!,entschuldigen sie. das ist einer von denen!,"['sie', 'denen', 'ist', 'das', 'entschuldigen', 'einer', 'von']","['Entschuldigen', 'Sie', 'Das', 'ist', 'einer', 'von', 'denen']","['Entschuldigen', 'Sie', '.', 'Das', 'ist', 'einer', 'von', 'denen', '!']","['Entschuldigen', 'ich', '.', 'der', 'sein', 'einer', 'von', 'der', '!']","['NOUN', 'PRON', 'PUNCT', 'PRON', 'AUX', 'PRON', 'ADP', 'PRON', 'PUNCT']",Entschuldigen ich . der sein einer von der !,NOUN PRON PUNCT PRON AUX PRON ADP PRON PUNCT
Babylon_Berlin__S01E06.srt,Babylon Berlin,Babylon Berlin S01,Babylon Berlin E06,261,"0:20:58,960","0:21:0,360",'n Polyp? Ja.,'n polyp? ja.,"['ja', ""'n"", 'polyp']","[""'n"", 'Polyp', 'Ja']","[""'n"", 'Polyp', '?', 'Ja', '.']","[""'n"", 'Polyp', '?', 'Ja', '.']","['DET', 'NOUN', 'PUNCT', 'PART', 'PUNCT']",'n Polyp ? Ja .,DET NOUN PUNCT PART PUNCT
