Unique_ID,Show_Name,Season,Episode,Line_Index,Start,End,Dialogue,Dialogue_lower,Dialogue_Set_Words,Dialogue_Words,Dialogue_Tokens_Text,Dialogue_Tokens_Lemmas,Dialogue_Tokens_POS_Tags,Dialogue_Lemmas_Pattern,Dialogue_POS_Tags_Pattern
Dark__S01E06.srt,Dark,Dark S01,Dark E06,145,"0:13:14,542","0:13:16,42",Aber am Ende...,aber am ende...,"['ende', 'am', 'aber']","['Aber', 'am', 'Ende']","['Aber', 'am', 'Ende', '...']","['aber', 'am', 'Ende', '...']","['CCONJ', 'ADP', 'NOUN', 'PUNCT']",aber am Ende ...,CCONJ ADP NOUN PUNCT
Dark__S01E06.srt,Dark,Dark S01,Dark E06,146,"0:13:16,667","0:13:18,583",...war es nur ein kleiner Schnitt.,...war es nur ein kleiner schnitt.,"['nur', 'ein', 'schnitt', 'kleiner', 'war', 'es']","['war', 'es', 'nur', 'ein', 'kleiner', 'Schnitt']","['...', 'war', 'es', 'nur', 'ein', 'kleiner', 'Schnitt', '.']","['...', 'sein', 'ich', 'nur', 'einen', 'klein', 'Schnitt', '.']","['PUNCT', 'AUX', 'PRON', 'ADV', 'DET', 'ADJ', 'NOUN', 'PUNCT']",... sein ich nur einen klein Schnitt .,PUNCT AUX PRON ADV DET ADJ NOUN PUNCT
Dark__S01E06.srt,Dark,Dark S01,Dark E06,147,"0:13:19,375","0:13:21,0",Unten am Kinn.,unten am kinn.,"['unten', 'kinn', 'am']","['Unten', 'am', 'Kinn']","['Unten', 'am', 'Kinn', '.']","['Unten', 'am', 'Kinn', '.']","['NOUN', 'ADP', 'NOUN', 'PUNCT']",Unten am Kinn .,NOUN ADP NOUN PUNCT
Dark__S01E06.srt,Dark,Dark S01,Dark E06,148,"0:13:21,83","0:13:23,417",Ihr beide habt euch kaputtgelacht.,ihr beide habt euch kaputtgelacht.,"['kaputtgelacht', 'habt', 'euch', 'beide', 'ihr']","['Ihr', 'beide', 'habt', 'euch', 'kaputtgelacht']","['Ihr', 'beide', 'habt', 'euch', 'kaputtgelacht', '.']","['mein', 'beid', 'haben', 'sich', 'kaputtlachen', '.']","['PRON', 'PRON', 'AUX', 'PRON', 'VERB', 'PUNCT']",mein beid haben sich kaputtlachen .,PRON PRON AUX PRON VERB PUNCT
Dark__S01E06.srt,Dark,Dark S01,Dark E06,149,"0:13:23,500","0:13:25,125",So wart ihr.,so wart ihr.,"['wart', 'ihr', 'so']","['So', 'wart', 'ihr']","['So', 'wart', 'ihr', '.']","['so', 'sein', 'mein', '.']","['ADV', 'VERB', 'PRON', 'PUNCT']",so sein mein .,ADV VERB PRON PUNCT
Dark__S01E06.srt,Dark,Dark S01,Dark E06,150,"0:13:25,708","0:13:28,292","In der einen Sekunde spinnefeind,","in der einen sekunde spinnefeind,","['der', 'einen', 'sekunde', 'in', 'spinnefeind']","['In', 'der', 'einen', 'Sekunde', 'spinnefeind']","['In', 'der', 'einen', 'Sekunde', 'spinnefeind', ',']","['In', 'der', 'ein', 'Sekunde', 'spinnefeind', ',']","['ADP', 'DET', 'ADJ', 'NOUN', 'VERB', 'PUNCT']","In der ein Sekunde spinnefeind ,",ADP DET ADJ NOUN VERB PUNCT
Dark__S01E06.srt,Dark,Dark S01,Dark E06,151,"0:13:28,375","0:13:30,250",dann die besten Freunde.,dann die besten freunde.,"['freunde', 'dann', 'besten', 'die']","['dann', 'die', 'besten', 'Freunde']","['dann', 'die', 'besten', 'Freunde', '.']","['dann', 'der', 'gut', 'Freund', '.']","['ADV', 'DET', 'ADJ', 'NOUN', 'PUNCT']",dann der gut Freund .,ADV DET ADJ NOUN PUNCT
Dark__S01E06.srt,Dark,Dark S01,Dark E06,152,"0:13:31,292","0:13:32,708",Warum hast du gelogen?,warum hast du gelogen?,"['du', 'hast', 'warum', 'gelogen']","['Warum', 'hast', 'du', 'gelogen']","['Warum', 'hast', 'du', 'gelogen', '?']","['warum', 'haben', 'du', 'lügen', '?']","['ADV', 'AUX', 'PRON', 'VERB', 'PUNCT']",warum haben du lügen ?,ADV AUX PRON VERB PUNCT
Dark__S01E06.srt,Dark,Dark S01,Dark E06,153,"0:13:34,83","0:13:38,333","Papa war an dem Abend nicht zu Hause. Du hast Egon aber gesagt, er war bei uns.","papa war an dem abend nicht zu hause. du hast egon aber gesagt, er war bei uns.","['an', 'gesagt', 'dem', 'abend', 'egon', 'du', 'hause', 'aber', 'bei', 'uns', 'hast', 'papa', 'zu', 'nicht', 'er', 'war']","['Papa', 'war', 'an', 'dem', 'Abend', 'nicht', 'zu', 'Hause', 'Du', 'hast', 'Egon', 'aber', 'gesagt', 'er', 'war', 'bei', 'uns']","['Papa', 'war', 'an', 'dem', 'Abend', 'nicht', 'zu', 'Hause', '.', 'Du', 'hast', 'Egon', 'aber', 'gesagt', ',', 'er', 'war', 'bei', 'uns', '.']","['Papa', 'sein', 'an', 'der', 'Abend', 'nicht', 'zu', 'Haus', '.', 'Du', 'haben', 'Egon', 'aber', 'sagen', ',', 'ich', 'sein', 'bei', 'sich', '.']","['NOUN', 'AUX', 'ADP', 'DET', 'NOUN', 'PART', 'ADP', 'NOUN', 'PUNCT', 'PRON', 'AUX', 'PROPN', 'ADV', 'VERB', 'PUNCT', 'PRON', 'AUX', 'ADP', 'PRON', 'PUNCT']","Papa sein an der Abend nicht zu Haus . Du haben Egon aber sagen , ich sein bei sich .",NOUN AUX ADP DET NOUN PART ADP NOUN PUNCT PRON AUX PROPN ADV VERB PUNCT PRON AUX ADP PRON PUNCT
Dark__S01E06.srt,Dark,Dark S01,Dark E06,154,"0:13:38,417","0:13:41,292",Ich habe die Aufnahme gehört. Warum hast du gelogen?,ich habe die aufnahme gehört. warum hast du gelogen?,"['du', 'die', 'ich', 'warum', 'hast', 'habe', 'gelogen', 'gehört', 'aufnahme']","['Ich', 'habe', 'die', 'Aufnahme', 'gehört', 'Warum', 'hast', 'du', 'gelogen']","['Ich', 'habe', 'die', 'Aufnahme', 'gehört', '.', 'Warum', 'hast', 'du', 'gelogen', '?']","['Ich', 'habe', 'der', 'Aufnahme', 'hören', '.', 'warum', 'haben', 'du', 'lügen', '?']","['PRON', 'AUX', 'DET', 'NOUN', 'VERB', 'PUNCT', 'ADV', 'AUX', 'PRON', 'VERB', 'PUNCT']",Ich habe der Aufnahme hören . warum haben du lügen ?,PRON AUX DET NOUN VERB PUNCT ADV AUX PRON VERB PUNCT
Dark__S01E06.srt,Dark,Dark S01,Dark E06,155,"0:13:48,333","0:13:50,750","Wusstest du, dass ich ihn verlassen wollte?","wusstest du, dass ich ihn verlassen wollte?","['wollte', 'wusstest', 'du', 'verlassen', 'dass', 'ihn', 'ich']","['Wusstest', 'du', 'dass', 'ich', 'ihn', 'verlassen', 'wollte']","['Wusstest', 'du', ',', 'dass', 'ich', 'ihn', 'verlassen', 'wollte', '?']","['Wusstest', 'du', ',', 'dass', 'ich', 'ich', 'verlassen', 'wollen', '?']","['VERB', 'PRON', 'PUNCT', 'SCONJ', 'PRON', 'PRON', 'VERB', 'AUX', 'PUNCT']","Wusstest du , dass ich ich verlassen wollen ?",VERB PRON PUNCT SCONJ PRON PRON VERB AUX PUNCT
Dark__S01E06.srt,Dark,Dark S01,Dark E06,156,"0:13:52,792","0:13:55,208",Bevor das alles passiert ist.,bevor das alles passiert ist.,"['ist', 'das', 'passiert', 'bevor', 'alles']","['Bevor', 'das', 'alles', 'passiert', 'ist']","['Bevor', 'das', 'alles', 'passiert', 'ist', '.']","['bevor', 'der', 'alle', 'passieren', 'sein', '.']","['SCONJ', 'PRON', 'PRON', 'VERB', 'AUX', 'PUNCT']",bevor der alle passieren sein .,SCONJ PRON PRON VERB AUX PUNCT
Dark__S01E06.srt,Dark,Dark S01,Dark E06,157,"0:13:55,292","0:13:56,875",Er hatte eine Affäre.,er hatte eine affäre.,"['eine', 'affäre', 'er', 'hatte']","['Er', 'hatte', 'eine', 'Affäre']","['Er', 'hatte', 'eine', 'Affäre', '.']","['ich', 'haben', 'einen', 'Affäre', '.']","['PRON', 'AUX', 'DET', 'NOUN', 'PUNCT']",ich haben einen Affäre .,PRON AUX DET NOUN PUNCT
Dark__S01E06.srt,Dark,Dark S01,Dark E06,158,"0:13:58,83","0:13:59,750",Es war nicht die erste.,es war nicht die erste.,"['die', 'erste', 'nicht', 'war', 'es']","['Es', 'war', 'nicht', 'die', 'erste']","['Es', 'war', 'nicht', 'die', 'erste', '.']","['ich', 'sein', 'nicht', 'der', 'erste', '.']","['PRON', 'AUX', 'PART', 'DET', 'ADJ', 'PUNCT']",ich sein nicht der erste .,PRON AUX PART DET ADJ PUNCT
Dark__S01E06.srt,Dark,Dark S01,Dark E06,159,"0:14:1,0","0:14:4,42","Und in der Nacht, in der Mads verschwunden ist, da...","und in der nacht, in der mads verschwunden ist, da...","['ist', 'der', 'verschwunden', 'mads', 'da', 'in', 'nacht', 'und']","['Und', 'in', 'der', 'Nacht', 'in', 'der', 'Mads', 'verschwunden', 'ist', 'da']","['Und', 'in', 'der', 'Nacht', ',', 'in', 'der', 'Mads', 'verschwunden', 'ist', ',', 'da', '...']","['und', 'in', 'der', 'Nacht', ',', 'in', 'der', 'Mads', 'verschwinden', 'sein', ',', 'da', '...']","['CCONJ', 'ADP', 'DET', 'NOUN', 'PUNCT', 'ADP', 'DET', 'NOUN', 'VERB', 'AUX', 'PUNCT', 'ADV', 'PUNCT']","und in der Nacht , in der Mads verschwinden sein , da ...",CCONJ ADP DET NOUN PUNCT ADP DET NOUN VERB AUX PUNCT ADV PUNCT
Dark__S01E06.srt,Dark,Dark S01,Dark E06,160,"0:14:4,917","0:14:6,500",Da war er bei ihr.,da war er bei ihr.,"['da', 'bei', 'ihr', 'er', 'war']","['Da', 'war', 'er', 'bei', 'ihr']","['Da', 'war', 'er', 'bei', 'ihr', '.']","['da', 'sein', 'ich', 'bei', 'mein', '.']","['ADV', 'AUX', 'PRON', 'ADP', 'PRON', 'PUNCT']",da sein ich bei mein .,ADV AUX PRON ADP PRON PUNCT
Dark__S01E06.srt,Dark,Dark S01,Dark E06,161,"0:14:7,667","0:14:11,375","Als dein Bruder verschwand, hat er es mit einer anderen getrieben.","als dein bruder verschwand, hat er es mit einer anderen getrieben.","['getrieben', 'dein', 'er', 'als', 'einer', 'anderen', 'mit', 'bruder', 'verschwand', 'hat', 'es']","['Als', 'dein', 'Bruder', 'verschwand', 'hat', 'er', 'es', 'mit', 'einer', 'anderen', 'getrieben']","['Als', 'dein', 'Bruder', 'verschwand', ',', 'hat', 'er', 'es', 'mit', 'einer', 'anderen', 'getrieben', '.']","['als', 'mein', 'Bruder', 'verschwinden', ',', 'haben', 'ich', 'ich', 'mit', 'einer', 'ander', 'getrieben', '.']","['SCONJ', 'DET', 'NOUN', 'VERB', 'PUNCT', 'AUX', 'PRON', 'PRON', 'ADP', 'DET', 'ADJ', 'VERB', 'PUNCT']","als mein Bruder verschwinden , haben ich ich mit einer ander getrieben .",SCONJ DET NOUN VERB PUNCT AUX PRON PRON ADP DET ADJ VERB PUNCT
Dark__S01E06.srt,Dark,Dark S01,Dark E06,162,"0:14:15,958","0:14:17,500","Weißt du, mit wem?","weißt du, mit wem?","['weißt', 'du', 'mit', 'wem']","['Weißt', 'du', 'mit', 'wem']","['Weißt', 'du', ',', 'mit', 'wem', '?']","['Weißt', 'du', ',', 'mit', 'wer', '?']","['VERB', 'PRON', 'PUNCT', 'ADP', 'PRON', 'PUNCT']","Weißt du , mit wer ?",VERB PRON PUNCT ADP PRON PUNCT
Dark__S01E06.srt,Dark,Dark S01,Dark E06,163,"0:14:21,83","0:14:22,500",Claudia.,claudia.,['claudia'],['Claudia'],"['Claudia', '.']","['Claudia', '.']","['PROPN', 'PUNCT']",Claudia .,PROPN PUNCT
Dark__S01E06.srt,Dark,Dark S01,Dark E06,164,"0:14:25,458","0:14:27,250",Claudia Tiedemann.,claudia tiedemann.,"['tiedemann', 'claudia']","['Claudia', 'Tiedemann']","['Claudia', 'Tiedemann', '.']","['Claudia', 'Tiedemann', '.']","['PROPN', 'PROPN', 'PUNCT']",Claudia Tiedemann .,PROPN PROPN PUNCT
Dark__S01E06.srt,Dark,Dark S01,Dark E06,165,"0:14:28,458","0:14:31,42",Und wer hat Mads zuletzt gesehen an dem Abend?,und wer hat mads zuletzt gesehen an dem abend?,"['an', 'zuletzt', 'dem', 'abend', 'und', 'wer', 'gesehen', 'mads', 'hat']","['Und', 'wer', 'hat', 'Mads', 'zuletzt', 'gesehen', 'an', 'dem', 'Abend']","['Und', 'wer', 'hat', 'Mads', 'zuletzt', 'gesehen', 'an', 'dem', 'Abend', '?']","['und', 'wer', 'haben', 'Mads', 'zuletzt', 'sehen', 'an', 'der', 'Abend', '?']","['CCONJ', 'PRON', 'AUX', 'PROPN', 'ADV', 'VERB', 'ADP', 'DET', 'NOUN', 'PUNCT']",und wer haben Mads zuletzt sehen an der Abend ?,CCONJ PRON AUX PROPN ADV VERB ADP DET NOUN PUNCT
Dark__S01E06.srt,Dark,Dark S01,Dark E06,166,"0:14:32,750","0:14:34,417",Das war Regina.,das war regina.,"['regina', 'war', 'das']","['Das', 'war', 'Regina']","['Das', 'war', 'Regina', '.']","['der', 'sein', 'Regina', '.']","['PRON', 'AUX', 'PROPN', 'PUNCT']",der sein Regina .,PRON AUX PROPN PUNCT
Dark__S01E06.srt,Dark,Dark S01,Dark E06,167,"0:14:34,500","0:14:37,833",Regina Tiedemann. Claudias Tochter.,regina tiedemann. claudias tochter.,"['tiedemann', 'regina', 'tochter', 'claudias']","['Regina', 'Tiedemann', 'Claudias', 'Tochter']","['Regina', 'Tiedemann', '.', 'Claudias', 'Tochter', '.']","['Regina', 'Tiedemann', '.', 'Claudia', 'Tochter', '.']","['PROPN', 'PROPN', 'PUNCT', 'PROPN', 'NOUN', 'PUNCT']",Regina Tiedemann . Claudia Tochter .,PROPN PROPN PUNCT PROPN NOUN PUNCT
Dark__S01E06.srt,Dark,Dark S01,Dark E06,169,"0:15:4,250","0:15:8,875",Hier ist Aleksander Tiedemann. Nachrichten bitte nach dem Signalton.,hier ist aleksander tiedemann. nachrichten bitte nach dem signalton.,"['dem', 'nachrichten', 'ist', 'hier', 'bitte', 'signalton', 'tiedemann', 'aleksander', 'nach']","['Hier', 'ist', 'Aleksander', 'Tiedemann', 'Nachrichten', 'bitte', 'nach', 'dem', 'Signalton']","['Hier', 'ist', 'Aleksander', 'Tiedemann', '.', 'Nachrichten', 'bitte', 'nach', 'dem', 'Signalton', '.']","['Hier', 'sein', 'Aleksander', 'Tiedemann', '.', 'Nachricht', 'bitte', 'nach', 'der', 'Signalton', '.']","['ADV', 'AUX', 'PROPN', 'PROPN', 'PUNCT', 'NOUN', 'ADV', 'ADP', 'DET', 'PROPN', 'PUNCT']",Hier sein Aleksander Tiedemann . Nachricht bitte nach der Signalton .,ADV AUX PROPN PROPN PUNCT NOUN ADV ADP DET PROPN PUNCT
Dark__S01E06.srt,Dark,Dark S01,Dark E06,175,"0:17:4,292","0:17:5,625",Hey.,hey.,['hey'],['Hey'],"['Hey', '.']","['Hey', '.']","['PROPN', 'PUNCT']",Hey .,PROPN PUNCT
Dark__S01E06.srt,Dark,Dark S01,Dark E06,176,"0:17:5,708","0:17:6,833",Hey.,hey.,['hey'],['Hey'],"['Hey', '.']","['Hey', '.']","['PROPN', 'PUNCT']",Hey .,PROPN PUNCT
Dark__S01E06.srt,Dark,Dark S01,Dark E06,177,"0:17:13,375","0:17:14,792",Wie geht's dir?,wie geht's dir?,"['dir', ""geht's"", 'wie']","['Wie', ""geht's"", 'dir']","['Wie', ""geht's"", 'dir', '?']","['Wie', ""geht's"", 'sich', '?']","['ADV', 'NOUN', 'PRON', 'PUNCT']",Wie geht's sich ?,ADV NOUN PRON PUNCT
Dark__S01E06.srt,Dark,Dark S01,Dark E06,178,"0:17:15,500","0:17:16,500",Gut.,gut.,['gut'],['Gut'],"['Gut', '.']","['Gut', '.']","['ADV', 'PUNCT']",Gut .,ADV PUNCT
Dark__S01E06.srt,Dark,Dark S01,Dark E06,179,"0:17:24,875","0:17:29,0",Du hast mich nicht zurückgerufen. Ich hab mir Sorgen gemacht.,du hast mich nicht zurückgerufen. ich hab mir sorgen gemacht.,"['mich', 'sorgen', 'mir', 'gemacht', 'zurückgerufen', 'du', 'hast', 'nicht', 'ich', 'hab']","['Du', 'hast', 'mich', 'nicht', 'zurückgerufen', 'Ich', 'hab', 'mir', 'Sorgen', 'gemacht']","['Du', 'hast', 'mich', 'nicht', 'zurückgerufen', '.', 'Ich', 'hab', 'mir', 'Sorgen', 'gemacht', '.']","['Du', 'haben', 'sich', 'nicht', 'zurückrufen', '.', 'Ich', 'hab', 'sich', 'Sorge', 'machen', '.']","['PRON', 'AUX', 'PRON', 'PART', 'VERB', 'PUNCT', 'PRON', 'VERB', 'PRON', 'NOUN', 'VERB', 'PUNCT']",Du haben sich nicht zurückrufen . Ich hab sich Sorge machen .,PRON AUX PRON PART VERB PUNCT PRON VERB PRON NOUN VERB PUNCT
Dark__S01E06.srt,Dark,Dark S01,Dark E06,180,"0:17:31,42","0:17:32,333",Ich...,ich...,['ich'],['Ich'],"['Ich', '...']","['Ich', '...']","['PRON', 'PUNCT']",Ich ...,PRON PUNCT
Dark__S01E06.srt,Dark,Dark S01,Dark E06,181,"0:17:33,500","0:17:35,208",Es tut mir alles so leid.,es tut mir alles so leid.,"['so', 'mir', 'leid', 'alles', 'tut', 'es']","['Es', 'tut', 'mir', 'alles', 'so', 'leid']","['Es', 'tut', 'mir', 'alles', 'so', 'leid', '.']","['ich', 'tun', 'sich', 'alle', 'so', 'leid', '.']","['PRON', 'VERB', 'PRON', 'PRON', 'ADV', 'ADV', 'PUNCT']",ich tun sich alle so leid .,PRON VERB PRON PRON ADV ADV PUNCT
Dark__S01E06.srt,Dark,Dark S01,Dark E06,182,"0:17:35,875","0:17:37,458",Es ist meine Schuld.,es ist meine schuld.,"['schuld', 'ist', 'meine', 'es']","['Es', 'ist', 'meine', 'Schuld']","['Es', 'ist', 'meine', 'Schuld', '.']","['ich', 'sein', 'meinen', 'Schuld', '.']","['PRON', 'AUX', 'DET', 'NOUN', 'PUNCT']",ich sein meinen Schuld .,PRON AUX DET NOUN PUNCT
Dark__S01E06.srt,Dark,Dark S01,Dark E06,183,"0:17:38,375","0:17:41,292",Hätte ich nur nicht diese Idee mit den Höhlen gehabt.,hätte ich nur nicht diese idee mit den höhlen gehabt.,"['gehabt', 'hätte', 'nur', 'idee', 'den', 'höhlen', 'diese', 'nicht', 'mit', 'ich']","['Hätte', 'ich', 'nur', 'nicht', 'diese', 'Idee', 'mit', 'den', 'Höhlen', 'gehabt']","['Hätte', 'ich', 'nur', 'nicht', 'diese', 'Idee', 'mit', 'den', 'Höhlen', 'gehabt', '.']","['haben', 'ich', 'nur', 'nicht', 'dies', 'Idee', 'mit', 'der', 'Höhle', 'haben', '.']","['VERB', 'PRON', 'ADV', 'PART', 'DET', 'NOUN', 'ADP', 'DET', 'NOUN', 'VERB', 'PUNCT']",haben ich nur nicht dies Idee mit der Höhle haben .,VERB PRON ADV PART DET NOUN ADP DET NOUN VERB PUNCT
Dark__S01E06.srt,Dark,Dark S01,Dark E06,184,"0:17:45,125","0:17:46,292",Hey.,hey.,['hey'],['Hey'],"['Hey', '.']","['Hey', '.']","['PROPN', 'PUNCT']",Hey .,PROPN PUNCT
Dark__S01E06.srt,Dark,Dark S01,Dark E06,185,"0:17:46,417","0:17:47,875",Sag doch was.,sag doch was.,"['doch', 'was', 'sag']","['Sag', 'doch', 'was']","['Sag', 'doch', 'was', '.']","['Sag', 'doch', 'was', '.']","['PROPN', 'ADV', 'PRON', 'PUNCT']",Sag doch was .,PROPN ADV PRON PUNCT
Dark__S01E06.srt,Dark,Dark S01,Dark E06,186,"0:17:49,667","0:17:51,375",Bist du sauer auf mich?,bist du sauer auf mich?,"['mich', 'sauer', 'du', 'auf', 'bist']","['Bist', 'du', 'sauer', 'auf', 'mich']","['Bist', 'du', 'sauer', 'auf', 'mich', '?']","['sein', 'du', 'sauern', 'auf', 'sich', '?']","['AUX', 'PRON', 'ADV', 'ADP', 'PRON', 'PUNCT']",sein du sauern auf sich ?,AUX PRON ADV ADP PRON PUNCT
Dark__S01E06.srt,Dark,Dark S01,Dark E06,187,"0:17:53,542","0:17:55,250",Nee.,nee.,['nee'],['Nee'],"['Nee', '.']","['Nee', '.']","['NOUN', 'PUNCT']",Nee .,NOUN PUNCT
Dark__S01E06.srt,Dark,Dark S01,Dark E06,188,"0:17:55,333","0:17:57,125",Warum sollte ich sauer sein?,warum sollte ich sauer sein?,"['sein', 'sauer', 'sollte', 'warum', 'ich']","['Warum', 'sollte', 'ich', 'sauer', 'sein']","['Warum', 'sollte', 'ich', 'sauer', 'sein', '?']","['warum', 'sollen', 'ich', 'sauern', 'mein', '?']","['ADV', 'AUX', 'PRON', 'ADV', 'AUX', 'PUNCT']",warum sollen ich sauern mein ?,ADV AUX PRON ADV AUX PUNCT
Dark__S01E06.srt,Dark,Dark S01,Dark E06,189,"0:18:2,667","0:18:4,917","Sorry, ich kann das grad nicht.","sorry, ich kann das grad nicht.","['sorry', 'das', 'grad', 'nicht', 'kann', 'ich']","['Sorry', 'ich', 'kann', 'das', 'grad', 'nicht']","['Sorry', ',', 'ich', 'kann', 'das', 'grad', 'nicht', '.']","['Sorry', ',', 'ich', 'können', 'der', 'grad', 'nicht', '.']","['PROPN', 'PUNCT', 'PRON', 'AUX', 'PRON', 'ADV', 'PART', 'PUNCT']","Sorry , ich können der grad nicht .",PROPN PUNCT PRON AUX PRON ADV PART PUNCT
Dark__S01E06.srt,Dark,Dark S01,Dark E06,190,"0:18:11,458","0:18:13,0",Willst du weg?,willst du weg?,"['du', 'willst', 'weg']","['Willst', 'du', 'weg']","['Willst', 'du', 'weg', '?']","['wollen', 'du', 'weg', '?']","['VERB', 'PRON', 'ADV', 'PUNCT']",wollen du weg ?,VERB PRON ADV PUNCT
Dark__S01E06.srt,Dark,Dark S01,Dark E06,191,"0:18:13,542","0:18:14,667",Ich hau ab mit dir.,ich hau ab mit dir.,"['hau', 'ab', 'dir', 'mit', 'ich']","['Ich', 'hau', 'ab', 'mit', 'dir']","['Ich', 'hau', 'ab', 'mit', 'dir', '.']","['Ich', 'hau', 'ab', 'mit', 'sich', '.']","['PRON', 'VERB', 'ADP', 'ADP', 'PRON', 'PUNCT']",Ich hau ab mit sich .,PRON VERB ADP ADP PRON PUNCT
Dark__S01E06.srt,Dark,Dark S01,Dark E06,192,"0:18:15,833","0:18:17,292",Ehrlich.,ehrlich.,['ehrlich'],['Ehrlich'],"['Ehrlich', '.']","['Ehrlich', '.']","['ADV', 'PUNCT']",Ehrlich .,ADV PUNCT
Dark__S01E06.srt,Dark,Dark S01,Dark E06,193,"0:18:17,375","0:18:19,83",Das Stück fängt doch gleich an.,das stück fängt doch gleich an.,"['an', 'doch', 'gleich', 'das', 'stück', 'fängt']","['Das', 'Stück', 'fängt', 'doch', 'gleich', 'an']","['Das', 'Stück', 'fängt', 'doch', 'gleich', 'an', '.']","['der', 'Stück', 'fangen', 'doch', 'gleichen', 'an', '.']","['DET', 'NOUN', 'VERB', 'ADV', 'ADV', 'ADP', 'PUNCT']",der Stück fangen doch gleichen an .,DET NOUN VERB ADV ADV ADP PUNCT
Dark__S01E06.srt,Dark,Dark S01,Dark E06,194,"0:18:26,500","0:18:28,208",Hast du Jonas gesehen?,hast du jonas gesehen?,"['du', 'gesehen', 'hast', 'jonas']","['Hast', 'du', 'Jonas', 'gesehen']","['Hast', 'du', 'Jonas', 'gesehen', '?']","['haben', 'du', 'Jonas', 'sehen', '?']","['VERB', 'PRON', 'PROPN', 'VERB', 'PUNCT']",haben du Jonas sehen ?,VERB PRON PROPN VERB PUNCT
Dark__S01E06.srt,Dark,Dark S01,Dark E06,195,"0:18:29,875","0:18:31,417",Wieso?,wieso?,['wieso'],['Wieso'],"['Wieso', '?']","['Wieso', '?']","['PROPN', 'PUNCT']",Wieso ?,PROPN PUNCT
Dark__S01E06.srt,Dark,Dark S01,Dark E06,196,"0:18:31,500","0:18:32,833",Nur so.,nur so.,"['nur', 'so']","['Nur', 'so']","['Nur', 'so', '.']","['Nur', 'so', '.']","['ADV', 'ADV', 'PUNCT']",Nur so .,ADV ADV PUNCT
Dark__S01E06.srt,Dark,Dark S01,Dark E06,197,"0:18:32,917","0:18:35,125",Der Arsch hat mich gestern versetzt.,der arsch hat mich gestern versetzt.,"['mich', 'versetzt', 'der', 'arsch', 'gestern', 'hat']","['Der', 'Arsch', 'hat', 'mich', 'gestern', 'versetzt']","['Der', 'Arsch', 'hat', 'mich', 'gestern', 'versetzt', '.']","['der', 'Arsch', 'haben', 'sich', 'gestern', 'versetzen', '.']","['DET', 'NOUN', 'AUX', 'PRON', 'ADV', 'VERB', 'PUNCT']",der Arsch haben sich gestern versetzen .,DET NOUN AUX PRON ADV VERB PUNCT
Dark__S01E06.srt,Dark,Dark S01,Dark E06,198,"0:18:35,208","0:18:36,667","Na, egal.","na, egal.","['egal', 'na']","['Na', 'egal']","['Na', ',', 'egal', '.']","['Na', ',', 'egal', '.']","['PROPN', 'PUNCT', 'ADV', 'PUNCT']","Na , egal .",PROPN PUNCT ADV PUNCT
Dark__S01E06.srt,Dark,Dark S01,Dark E06,199,"0:18:37,500","0:18:38,958",Kommt bestimmt später.,kommt bestimmt später.,"['bestimmt', 'später', 'kommt']","['Kommt', 'bestimmt', 'später']","['Kommt', 'bestimmt', 'später', '.']","['Kommt', 'bestimmen', 'spät', '.']","['VERB', 'ADV', 'ADV', 'PUNCT']",Kommt bestimmen spät .,VERB ADV ADV PUNCT
Dark__S01E06.srt,Dark,Dark S01,Dark E06,206,"0:20:20,458","0:20:22,458",8855...,8855...,['8855'],['8855'],"['8855', '...']","['8855', '...']","['NUM', 'PUNCT']",8855 ...,NUM PUNCT
Dark__S01E06.srt,Dark,Dark S01,Dark E06,207,"0:20:24,42","0:20:25,500",8855.,8855.,['8855.'],['8855.'],['8855.'],['8855.'],['PROPN'],8855.,PROPN
Dark__S01E06.srt,Dark,Dark S01,Dark E06,209,"0:20:40,500","0:20:41,708",Hallo?,hallo?,['hallo'],['Hallo'],"['Hallo', '?']","['Hallo', '?']","['PROPN', 'PUNCT']",Hallo ?,PROPN PUNCT
Dark__S01E06.srt,Dark,Dark S01,Dark E06,210,"0:20:44,958","0:20:46,250",Ulrich?,ulrich?,['ulrich'],['Ulrich'],"['Ulrich', '?']","['Ulrich', '?']","['PROPN', 'PUNCT']",Ulrich ?,PROPN PUNCT
Dark__S01E06.srt,Dark,Dark S01,Dark E06,214,"0:21:38,125","0:21:39,792",Was willst du denn hier?,was willst du denn hier?,"['was', 'du', 'willst', 'hier', 'denn']","['Was', 'willst', 'du', 'denn', 'hier']","['Was', 'willst', 'du', 'denn', 'hier', '?']","['Was', 'wollen', 'du', 'denn', 'hier', '?']","['PRON', 'VERB', 'PRON', 'ADV', 'ADV', 'PUNCT']",Was wollen du denn hier ?,PRON VERB PRON ADV ADV PUNCT
Dark__S01E06.srt,Dark,Dark S01,Dark E06,215,"0:21:43,83","0:21:47,375","1986. In der Nacht, als mein Bruder verschwunden ist.","1986. in der nacht, als mein bruder verschwunden ist.","['bruder', 'ist', 'der', 'mein', 'verschwunden', 'als', '1986.', 'in', 'nacht']","['1986.', 'In', 'der', 'Nacht', 'als', 'mein', 'Bruder', 'verschwunden', 'ist']","['1986.', 'In', 'der', 'Nacht', ',', 'als', 'mein', 'Bruder', 'verschwunden', 'ist', '.']","['1986.', 'In', 'der', 'Nacht', ',', 'als', 'meinen', 'Bruder', 'verschwinden', 'sein', '.']","['X', 'ADP', 'DET', 'NOUN', 'PUNCT', 'SCONJ', 'DET', 'NOUN', 'VERB', 'AUX', 'PUNCT']","1986. In der Nacht , als meinen Bruder verschwinden sein .",X ADP DET NOUN PUNCT SCONJ DET NOUN VERB AUX PUNCT
Dark__S01E06.srt,Dark,Dark S01,Dark E06,216,"0:21:47,833","0:21:49,500",Was ist wirklich passiert?,was ist wirklich passiert?,"['passiert', 'wirklich', 'was', 'ist']","['Was', 'ist', 'wirklich', 'passiert']","['Was', 'ist', 'wirklich', 'passiert', '?']","['Was', 'sein', 'wirklich', 'passieren', '?']","['PRON', 'AUX', 'ADV', 'VERB', 'PUNCT']",Was sein wirklich passieren ?,PRON AUX ADV VERB PUNCT
Dark__S01E06.srt,Dark,Dark S01,Dark E06,217,"0:21:50,208","0:21:54,0",Das ist über 30 Jahre her. Du hast ihn damals als Letzte gesehen.,das ist über 30 jahre her. du hast ihn damals als letzte gesehen.,"['her', 'jahre', 'ist', 'das', 'du', 'damals', 'gesehen', 'als', 'hast', 'ihn', 'über', 'letzte', '30']","['Das', 'ist', 'über', '30', 'Jahre', 'her', 'Du', 'hast', 'ihn', 'damals', 'als', 'Letzte', 'gesehen']","['Das', 'ist', 'über', '30', 'Jahre', 'her', '.', 'Du', 'hast', 'ihn', 'damals', 'als', 'Letzte', 'gesehen', '.']","['der', 'sein', 'über', '30', 'Jahr', 'her', '.', 'Du', 'haben', 'ich', 'damals', 'als', 'Letzter', 'sehen', '.']","['PRON', 'AUX', 'ADV', 'NUM', 'NOUN', 'ADV', 'PUNCT', 'PRON', 'AUX', 'PRON', 'ADV', 'ADP', 'NOUN', 'VERB', 'PUNCT']",der sein über 30 Jahr her . Du haben ich damals als Letzter sehen .,PRON AUX ADV NUM NOUN ADV PUNCT PRON AUX PRON ADV ADP NOUN VERB PUNCT
Dark__S01E06.srt,Dark,Dark S01,Dark E06,218,"0:21:54,83","0:21:56,250",Ist dir an dem Tag etwas aufgefallen?,ist dir an dem tag etwas aufgefallen?,"['an', 'dem', 'ist', 'aufgefallen', 'etwas', 'dir', 'tag']","['Ist', 'dir', 'an', 'dem', 'Tag', 'etwas', 'aufgefallen']","['Ist', 'dir', 'an', 'dem', 'Tag', 'etwas', 'aufgefallen', '?']","['sein', 'sich', 'an', 'der', 'Tag', 'etwas', 'auffallen', '?']","['AUX', 'PRON', 'ADP', 'DET', 'NOUN', 'PRON', 'VERB', 'PUNCT']",sein sich an der Tag etwas auffallen ?,AUX PRON ADP DET NOUN PRON VERB PUNCT
Dark__S01E06.srt,Dark,Dark S01,Dark E06,219,"0:21:56,333","0:21:59,292","Hat er was gesagt? Was Komisches, irgendetwas?","hat er was gesagt? was komisches, irgendetwas?","['gesagt', 'was', 'irgendetwas', 'komisches', 'er', 'hat']","['Hat', 'er', 'was', 'gesagt', 'Was', 'Komisches', 'irgendetwas']","['Hat', 'er', 'was', 'gesagt', '?', 'Was', 'Komisches', ',', 'irgendetwas', '?']","['haben', 'ich', 'was', 'sagen', '?', 'Was', 'Komisches', ',', 'irgendetwas', '?']","['AUX', 'PRON', 'PRON', 'VERB', 'PUNCT', 'PRON', 'NOUN', 'PUNCT', 'PRON', 'PUNCT']","haben ich was sagen ? Was Komisches , irgendetwas ?",AUX PRON PRON VERB PUNCT PRON NOUN PUNCT PRON PUNCT
Dark__S01E06.srt,Dark,Dark S01,Dark E06,220,"0:22:5,250","0:22:7,542","Wusstest du, dass sie eine Affäre hatten?","wusstest du, dass sie eine affäre hatten?","['sie', 'wusstest', 'du', 'affäre', 'eine', 'dass', 'hatten']","['Wusstest', 'du', 'dass', 'sie', 'eine', 'Affäre', 'hatten']","['Wusstest', 'du', ',', 'dass', 'sie', 'eine', 'Affäre', 'hatten', '?']","['Wusstest', 'du', ',', 'dass', 'ich', 'einen', 'Affäre', 'haben', '?']","['VERB', 'PRON', 'PUNCT', 'SCONJ', 'PRON', 'DET', 'NOUN', 'VERB', 'PUNCT']","Wusstest du , dass ich einen Affäre haben ?",VERB PRON PUNCT SCONJ PRON DET NOUN VERB PUNCT
Dark__S01E06.srt,Dark,Dark S01,Dark E06,221,"0:22:9,458","0:22:11,208",Deine Mutter und mein Vater?,deine mutter und mein vater?,"['vater', 'mutter', 'mein', 'deine', 'und']","['Deine', 'Mutter', 'und', 'mein', 'Vater']","['Deine', 'Mutter', 'und', 'mein', 'Vater', '?']","['mein', 'Mutter', 'und', 'meinen', 'Vater', '?']","['ADJ', 'NOUN', 'CCONJ', 'DET', 'NOUN', 'PUNCT']",mein Mutter und meinen Vater ?,ADJ NOUN CCONJ DET NOUN PUNCT
