Unique_ID,Show_Name,Season,Episode,Line_Index,Start,End,Dialogue,Dialogue_lower,Dialogue_Set_Words,Dialogue_Words,Dialogue_Tokens_Text,Dialogue_Tokens_Lemmas,Dialogue_Tokens_POS_Tags,Dialogue_Lemmas_Pattern,Dialogue_POS_Tags_Pattern
Dark__S01E07.srt,Dark,Dark S01,Dark E07,7,"0:0:45,417","0:0:46,917",Ich erinnere mich.,ich erinnere mich.,"['mich', 'ich', 'erinnere']","['Ich', 'erinnere', 'mich']","['Ich', 'erinnere', 'mich', '.']","['Ich', 'erinnern', 'sich', '.']","['PRON', 'VERB', 'PRON', 'PUNCT']",Ich erinnern sich .,PRON VERB PRON PUNCT
Dark__S01E07.srt,Dark,Dark S01,Dark E07,8,"0:0:49,500","0:0:51,417",Ich erinnere mich an alles.,ich erinnere mich an alles.,"['an', 'mich', 'erinnere', 'alles', 'ich']","['Ich', 'erinnere', 'mich', 'an', 'alles']","['Ich', 'erinnere', 'mich', 'an', 'alles', '.']","['Ich', 'erinnern', 'sich', 'an', 'alle', '.']","['PRON', 'VERB', 'PRON', 'ADP', 'PRON', 'PUNCT']",Ich erinnern sich an alle .,PRON VERB PRON ADP PRON PUNCT
Dark__S01E07.srt,Dark,Dark S01,Dark E07,32,"0:4:16,542","0:4:17,667",Was machst du hier?,was machst du hier?,"['du', 'was', 'hier', 'machst']","['Was', 'machst', 'du', 'hier']","['Was', 'machst', 'du', 'hier', '?']","['Was', 'machen', 'du', 'hier', '?']","['PRON', 'VERB', 'PRON', 'ADV', 'PUNCT']",Was machen du hier ?,PRON VERB PRON ADV PUNCT
Dark__S01E07.srt,Dark,Dark S01,Dark E07,33,"0:4:18,500","0:4:20,917","Der Junge, den wir gefunden haben. Mhm?","der junge, den wir gefunden haben. mhm?","['gefunden', 'wir', 'der', 'den', 'haben', 'mhm', 'junge']","['Der', 'Junge', 'den', 'wir', 'gefunden', 'haben', 'Mhm']","['Der', 'Junge', ',', 'den', 'wir', 'gefunden', 'haben', '.', 'Mhm', '?']","['der', 'Junge', ',', 'der', 'ich', 'finden', 'haben', '.', 'Mhm', '?']","['DET', 'NOUN', 'PUNCT', 'PRON', 'PRON', 'VERB', 'AUX', 'PUNCT', 'PROPN', 'PUNCT']","der Junge , der ich finden haben . Mhm ?",DET NOUN PUNCT PRON PRON VERB AUX PUNCT PROPN PUNCT
Dark__S01E07.srt,Dark,Dark S01,Dark E07,34,"0:4:22,417","0:4:24,667",Was passiert jetzt mit dem?,was passiert jetzt mit dem?,"['dem', 'was', 'passiert', 'jetzt', 'mit']","['Was', 'passiert', 'jetzt', 'mit', 'dem']","['Was', 'passiert', 'jetzt', 'mit', 'dem', '?']","['Was', 'passieren', 'jetzt', 'mit', 'der', '?']","['PRON', 'VERB', 'ADV', 'ADP', 'PRON', 'PUNCT']",Was passieren jetzt mit der ?,PRON VERB ADV ADP PRON PUNCT
Dark__S01E07.srt,Dark,Dark S01,Dark E07,35,"0:4:24,750","0:4:29,0",Ohne Identifizierung wird er eingeäschert und bekommt ein anonymes Grab.,ohne identifizierung wird er eingeäschert und bekommt ein anonymes grab.,"['bekommt', 'anonymes', 'ein', 'grab', 'wird', 'identifizierung', 'eingeäschert', 'ohne', 'und', 'er']","['Ohne', 'Identifizierung', 'wird', 'er', 'eingeäschert', 'und', 'bekommt', 'ein', 'anonymes', 'Grab']","['Ohne', 'Identifizierung', 'wird', 'er', 'eingeäschert', 'und', 'bekommt', 'ein', 'anonymes', 'Grab', '.']","['ohne', 'Identifizierung', 'werden', 'ich', 'einäschern', 'und', 'bekommen', 'einen', 'anonym', 'Grab', '.']","['ADP', 'NOUN', 'AUX', 'PRON', 'VERB', 'CCONJ', 'VERB', 'DET', 'ADJ', 'NOUN', 'PUNCT']",ohne Identifizierung werden ich einäschern und bekommen einen anonym Grab .,ADP NOUN AUX PRON VERB CCONJ VERB DET ADJ NOUN PUNCT
Dark__S01E07.srt,Dark,Dark S01,Dark E07,36,"0:4:29,83","0:4:32,750",Wie lange ist er tot? Das steht in meinem Bericht.,wie lange ist er tot? das steht in meinem bericht.,"['lange', 'tot', 'ist', 'das', 'bericht', 'wie', 'steht', 'meinem', 'in', 'er']","['Wie', 'lange', 'ist', 'er', 'tot', 'Das', 'steht', 'in', 'meinem', 'Bericht']","['Wie', 'lange', 'ist', 'er', 'tot', '?', 'Das', 'steht', 'in', 'meinem', 'Bericht', '.']","['Wie', 'lang', 'sein', 'ich', 'tot', '?', 'der', 'stehen', 'in', 'mein', 'Bericht', '.']","['ADV', 'ADV', 'AUX', 'PRON', 'ADV', 'PUNCT', 'PRON', 'VERB', 'ADP', 'DET', 'NOUN', 'PUNCT']",Wie lang sein ich tot ? der stehen in mein Bericht .,ADV ADV AUX PRON ADV PUNCT PRON VERB ADP DET NOUN PUNCT
Dark__S01E07.srt,Dark,Dark S01,Dark E07,37,"0:4:32,833","0:4:35,792","Als ihr ihn gefunden habt, zehn Stunden, plus/minus.","als ihr ihn gefunden habt, zehn stunden, plus/minus.","['minus', 'gefunden', 'habt', 'stunden', 'plus', 'zehn', 'als', 'ihn', 'ihr']","['Als', 'ihr', 'ihn', 'gefunden', 'habt', 'zehn', 'Stunden', 'plus', 'minus']","['Als', 'ihr', 'ihn', 'gefunden', 'habt', ',', 'zehn', 'Stunden', ',', 'plus', '/', 'minus', '.']","['als', 'mein', 'ich', 'finden', 'haben', ',', 'zehn', 'Stunde', ',', 'plus', '/', 'minus', '.']","['SCONJ', 'PRON', 'PRON', 'VERB', 'AUX', 'PUNCT', 'NUM', 'NOUN', 'PUNCT', 'ADV', 'PUNCT', 'ADP', 'PUNCT']","als mein ich finden haben , zehn Stunde , plus / minus .",SCONJ PRON PRON VERB AUX PUNCT NUM NOUN PUNCT ADV PUNCT ADP PUNCT
Dark__S01E07.srt,Dark,Dark S01,Dark E07,38,"0:4:36,458","0:4:38,625","Ist es möglich, dass er...","ist es möglich, dass er...","['ist', 'dass', 'möglich', 'er', 'es']","['Ist', 'es', 'möglich', 'dass', 'er']","['Ist', 'es', 'möglich', ',', 'dass', 'er', '...']","['sein', 'ich', 'möglich', ',', 'dass', 'ich', '...']","['AUX', 'PRON', 'ADV', 'PUNCT', 'SCONJ', 'PRON', 'PUNCT']","sein ich möglich , dass ich ...",AUX PRON ADV PUNCT SCONJ PRON PUNCT
Dark__S01E07.srt,Dark,Dark S01,Dark E07,39,"0:4:40,417","0:4:41,833",Also rein theoretisch.,also rein theoretisch.,"['also', 'theoretisch', 'rein']","['Also', 'rein', 'theoretisch']","['Also', 'rein', 'theoretisch', '.']","['Also', 'rein', 'theoretisch', '.']","['ADV', 'ADV', 'ADV', 'PUNCT']",Also rein theoretisch .,ADV ADV ADV PUNCT
Dark__S01E07.srt,Dark,Dark S01,Dark E07,40,"0:4:43,417","0:4:46,667",Dass er schon länger tot ist und konserviert wurde?,dass er schon länger tot ist und konserviert wurde?,"['tot', 'ist', 'wurde', 'länger', 'dass', 'schon', 'konserviert', 'und', 'er']","['Dass', 'er', 'schon', 'länger', 'tot', 'ist', 'und', 'konserviert', 'wurde']","['Dass', 'er', 'schon', 'länger', 'tot', 'ist', 'und', 'konserviert', 'wurde', '?']","['dass', 'ich', 'schon', 'lang', 'tot', 'sein', 'und', 'konserviert', 'werden', '?']","['SCONJ', 'PRON', 'ADV', 'ADV', 'ADV', 'AUX', 'CCONJ', 'VERB', 'AUX', 'PUNCT']",dass ich schon lang tot sein und konserviert werden ?,SCONJ PRON ADV ADV ADV AUX CCONJ VERB AUX PUNCT
Dark__S01E07.srt,Dark,Dark S01,Dark E07,41,"0:4:46,750","0:4:48,167",Konserviert?,konserviert?,['konserviert'],['Konserviert'],"['Konserviert', '?']","['Konserviert', '?']","['PROPN', 'PUNCT']",Konserviert ?,PROPN PUNCT
Dark__S01E07.srt,Dark,Dark S01,Dark E07,42,"0:4:48,250","0:4:49,542",Wie tiefgefroren?,wie tiefgefroren?,"['wie', 'tiefgefroren']","['Wie', 'tiefgefroren']","['Wie', 'tiefgefroren', '?']","['Wie', 'tiefgefroren', '?']","['ADV', 'VERB', 'PUNCT']",Wie tiefgefroren ?,ADV VERB PUNCT
Dark__S01E07.srt,Dark,Dark S01,Dark E07,44,"0:4:51,708","0:4:53,958",Dann hätte ich Spuren im Gewebe gesehen.,dann hätte ich spuren im gewebe gesehen.,"['hätte', 'gewebe', 'im', 'dann', 'gesehen', 'spuren', 'ich']","['Dann', 'hätte', 'ich', 'Spuren', 'im', 'Gewebe', 'gesehen']","['Dann', 'hätte', 'ich', 'Spuren', 'im', 'Gewebe', 'gesehen', '.']","['Dann', 'haben', 'ich', 'Spur', 'im', 'Gewebe', 'sehen', '.']","['ADV', 'AUX', 'PRON', 'NOUN', 'ADP', 'NOUN', 'VERB', 'PUNCT']",Dann haben ich Spur im Gewebe sehen .,ADV AUX PRON NOUN ADP NOUN VERB PUNCT
Dark__S01E07.srt,Dark,Dark S01,Dark E07,45,"0:4:54,42","0:4:56,792",Gefrorenes Steak sieht ja auch nicht frisch aus.,gefrorenes steak sieht ja auch nicht frisch aus.,"['auch', 'ja', 'steak', 'aus', 'gefrorenes', 'frisch', 'nicht', 'sieht']","['Gefrorenes', 'Steak', 'sieht', 'ja', 'auch', 'nicht', 'frisch', 'aus']","['Gefrorenes', 'Steak', 'sieht', 'ja', 'auch', 'nicht', 'frisch', 'aus', '.']","['Gefrorenes', 'Steak', 'sehen', 'ja', 'auch', 'nicht', 'frischen', 'aus', '.']","['PROPN', 'NOUN', 'VERB', 'ADV', 'ADV', 'PART', 'ADV', 'ADP', 'PUNCT']",Gefrorenes Steak sehen ja auch nicht frischen aus .,PROPN NOUN VERB ADV ADV PART ADV ADP PUNCT
Dark__S01E07.srt,Dark,Dark S01,Dark E07,46,"0:4:57,333","0:5:0,583","Also nicht. Nee. Nicht, dass ich wüsste.","also nicht. nee. nicht, dass ich wüsste.","['also', 'dass', 'nee', 'wüsste', 'nicht', 'ich']","['Also', 'nicht', 'Nee', 'Nicht', 'dass', 'ich', 'wüsste']","['Also', 'nicht', '.', 'Nee', '.', 'Nicht', ',', 'dass', 'ich', 'wüsste', '.']","['Also', 'nicht', '.', 'Nee', '.', 'Nicht', ',', 'dass', 'ich', 'wüsste', '.']","['ADV', 'PART', 'PUNCT', 'NOUN', 'PUNCT', 'PART', 'PUNCT', 'SCONJ', 'PRON', 'VERB', 'PUNCT']","Also nicht . Nee . Nicht , dass ich wüsste .",ADV PART PUNCT NOUN PUNCT PART PUNCT SCONJ PRON VERB PUNCT
Dark__S01E07.srt,Dark,Dark S01,Dark E07,47,"0:5:4,500","0:5:7,417",Von welchem Konservierungszeitraum sprechen wir?,von welchem konservierungszeitraum sprechen wir?,"['wir', 'welchem', 'sprechen', 'konservierungszeitraum', 'von']","['Von', 'welchem', 'Konservierungszeitraum', 'sprechen', 'wir']","['Von', 'welchem', 'Konservierungszeitraum', 'sprechen', 'wir', '?']","['Von', 'welch', 'Konservierungszeitraum', 'sprechen', 'ich', '?']","['ADP', 'DET', 'NOUN', 'VERB', 'PRON', 'PUNCT']",Von welch Konservierungszeitraum sprechen ich ?,ADP DET NOUN VERB PRON PUNCT
Dark__S01E07.srt,Dark,Dark S01,Dark E07,48,"0:5:8,792","0:5:11,375",33 Jahre. 33 Jahre?,33 jahre. 33 jahre?,"['33', 'jahre']","['33', 'Jahre', '33', 'Jahre']","['33', 'Jahre', '.', '33', 'Jahre', '?']","['33', 'Jahr', '.', '33', 'Jahr', '?']","['NUM', 'NOUN', 'PUNCT', 'NUM', 'NOUN', 'PUNCT']",33 Jahr . 33 Jahr ?,NUM NOUN PUNCT NUM NOUN PUNCT
Dark__S01E07.srt,Dark,Dark S01,Dark E07,49,"0:5:12,83","0:5:15,292",So wie der aussieht? Das ist eher unmöglich.,so wie der aussieht? das ist eher unmöglich.,"['so', 'das', 'ist', 'der', 'wie', 'eher', 'unmöglich', 'aussieht']","['So', 'wie', 'der', 'aussieht', 'Das', 'ist', 'eher', 'unmöglich']","['So', 'wie', 'der', 'aussieht', '?', 'Das', 'ist', 'eher', 'unmöglich', '.']","['so', 'wie', 'der', 'aussehen', '?', 'der', 'sein', 'eher', 'unmöglich', '.']","['ADV', 'ADP', 'PRON', 'VERB', 'PUNCT', 'PRON', 'AUX', 'ADV', 'ADV', 'PUNCT']",so wie der aussehen ? der sein eher unmöglich .,ADV ADP PRON VERB PUNCT PRON AUX ADV ADV PUNCT
Dark__S01E07.srt,Dark,Dark S01,Dark E07,58,"0:6:6,0","0:6:9,42",Welcher Tag ist heute?,welcher tag ist heute?,"['welcher', 'heute', 'tag', 'ist']","['Welcher', 'Tag', 'ist', 'heute']","['Welcher', 'Tag', 'ist', 'heute', '?']","['welch', 'Tag', 'sein', 'heute', '?']","['DET', 'NOUN', 'AUX', 'ADV', 'PUNCT']",welch Tag sein heute ?,DET NOUN AUX ADV PUNCT
Dark__S01E07.srt,Dark,Dark S01,Dark E07,59,"0:6:10,333","0:6:12,667",Bitte? Welcher Tag ist heute?,bitte? welcher tag ist heute?,"['ist', 'bitte', 'heute', 'welcher', 'tag']","['Bitte', 'Welcher', 'Tag', 'ist', 'heute']","['Bitte', '?', 'Welcher', 'Tag', 'ist', 'heute', '?']","['Bitte', '?', 'welch', 'Tag', 'sein', 'heute', '?']","['NOUN', 'PUNCT', 'DET', 'NOUN', 'AUX', 'ADV', 'PUNCT']",Bitte ? welch Tag sein heute ?,NOUN PUNCT DET NOUN AUX ADV PUNCT
Dark__S01E07.srt,Dark,Dark S01,Dark E07,60,"0:6:14,500","0:6:17,750","9. November. Ich weiß, es klingt bescheuert...","9. november. ich weiß, es klingt bescheuert...","['weiß', 'bescheuert', 'november', '9.', 'klingt', 'ich', 'es']","['9.', 'November', 'Ich', 'weiß', 'es', 'klingt', 'bescheuert']","['9.', 'November', '.', 'Ich', 'weiß', ',', 'es', 'klingt', 'bescheuert', '...']","['9.', 'November', '.', 'Ich', 'weiß', ',', 'ich', 'klingen', 'bescheuert', '...']","['ADJ', 'NOUN', 'PUNCT', 'PRON', 'VERB', 'PUNCT', 'PRON', 'VERB', 'VERB', 'PUNCT']","9. November . Ich weiß , ich klingen bescheuert ...",ADJ NOUN PUNCT PRON VERB PUNCT PRON VERB VERB PUNCT
Dark__S01E07.srt,Dark,Dark S01,Dark E07,61,"0:6:19,792","0:6:20,958",Aber welches Jahr?,aber welches jahr?,"['jahr', 'welches', 'aber']","['Aber', 'welches', 'Jahr']","['Aber', 'welches', 'Jahr', '?']","['aber', 'welch', 'Jahr', '?']","['CCONJ', 'DET', 'NOUN', 'PUNCT']",aber welch Jahr ?,CCONJ DET NOUN PUNCT
Dark__S01E07.srt,Dark,Dark S01,Dark E07,62,"0:6:22,125","0:6:23,125",'86.,'86.,['86.'],['86.'],"[""'"", '86.']","[""'"", '86.']","['PUNCT', 'ADJ']",' 86.,PUNCT ADJ
Dark__S01E07.srt,Dark,Dark S01,Dark E07,63,"0:6:26,125","0:6:27,42",Danke.,danke.,['danke'],['Danke'],"['Danke', '.']","['Dank', '.']","['NOUN', 'PUNCT']",Dank .,NOUN PUNCT
Dark__S01E07.srt,Dark,Dark S01,Dark E07,64,"0:6:28,250","0:6:29,458",Warte.,warte.,['warte'],['Warte'],"['Warte', '.']","['Warte', '.']","['NOUN', 'PUNCT']",Warte .,NOUN PUNCT
Dark__S01E07.srt,Dark,Dark S01,Dark E07,65,"0:6:31,167","0:6:32,667",Suchst du jemanden?,suchst du jemanden?,"['du', 'suchst', 'jemanden']","['Suchst', 'du', 'jemanden']","['Suchst', 'du', 'jemanden', '?']","['Suchst', 'du', 'jemand', '?']","['PROPN', 'PRON', 'PRON', 'PUNCT']",Suchst du jemand ?,PROPN PRON PRON PUNCT
Dark__S01E07.srt,Dark,Dark S01,Dark E07,66,"0:6:35,0","0:6:36,42",Ja.,ja.,['ja'],['Ja'],"['Ja', '.']","['Ja', '.']","['PART', 'PUNCT']",Ja .,PART PUNCT
Dark__S01E07.srt,Dark,Dark S01,Dark E07,67,"0:6:37,417","0:6:38,583",Einen Freund.,einen freund.,"['einen', 'freund']","['Einen', 'Freund']","['Einen', 'Freund', '.']","['einer', 'Freund', '.']","['DET', 'NOUN', 'PUNCT']",einer Freund .,DET NOUN PUNCT
Dark__S01E07.srt,Dark,Dark S01,Dark E07,68,"0:6:39,750","0:6:40,792",Michael Kahnwald.,michael kahnwald.,"['michael', 'kahnwald']","['Michael', 'Kahnwald']","['Michael', 'Kahnwald', '.']","['Michael', 'Kahnwald', '.']","['PROPN', 'PROPN', 'PUNCT']",Michael Kahnwald .,PROPN PROPN PUNCT
Dark__S01E07.srt,Dark,Dark S01,Dark E07,69,"0:6:42,375","0:6:43,375",Kenn ich nicht.,kenn ich nicht.,"['nicht', 'kenn', 'ich']","['Kenn', 'ich', 'nicht']","['Kenn', 'ich', 'nicht', '.']","['Kenn', 'ich', 'nicht', '.']","['SCONJ', 'PRON', 'PART', 'PUNCT']",Kenn ich nicht .,SCONJ PRON PART PUNCT
Dark__S01E07.srt,Dark,Dark S01,Dark E07,70,"0:6:44,708","0:6:47,583",Ines Kahnwalds Sohn? Die Krankenschwester?,ines kahnwalds sohn? die krankenschwester?,"['kahnwalds', 'die', 'ines', 'sohn', 'krankenschwester']","['Ines', 'Kahnwalds', 'Sohn', 'Die', 'Krankenschwester']","['Ines', 'Kahnwalds', 'Sohn', '?', 'Die', 'Krankenschwester', '?']","['Ines', 'Kahnwalds', 'Sohn', '?', 'der', 'Krankenschwester', '?']","['PROPN', 'PROPN', 'NOUN', 'PUNCT', 'DET', 'NOUN', 'PUNCT']",Ines Kahnwalds Sohn ? der Krankenschwester ?,PROPN PROPN NOUN PUNCT DET NOUN PUNCT
Dark__S01E07.srt,Dark,Dark S01,Dark E07,71,"0:6:48,333","0:6:50,0",Die hat keine Kinder.,die hat keine kinder.,"['kinder', 'keine', 'hat', 'die']","['Die', 'hat', 'keine', 'Kinder']","['Die', 'hat', 'keine', 'Kinder', '.']","['der', 'haben', 'kein', 'Kind', '.']","['PRON', 'VERB', 'DET', 'NOUN', 'PUNCT']",der haben kein Kind .,PRON VERB DET NOUN PUNCT
Dark__S01E07.srt,Dark,Dark S01,Dark E07,73,"0:6:53,167","0:6:55,208","Weißt du, wo ich Ines finden kann?","weißt du, wo ich ines finden kann?","['finden', 'weißt', 'du', 'ines', 'wo', 'kann', 'ich']","['Weißt', 'du', 'wo', 'ich', 'Ines', 'finden', 'kann']","['Weißt', 'du', ',', 'wo', 'ich', 'Ines', 'finden', 'kann', '?']","['Weißt', 'du', ',', 'wo', 'ich', 'Ines', 'finden', 'können', '?']","['VERB', 'PRON', 'PUNCT', 'SCONJ', 'PRON', 'PRON', 'VERB', 'AUX', 'PUNCT']","Weißt du , wo ich Ines finden können ?",VERB PRON PUNCT SCONJ PRON PRON VERB AUX PUNCT
Dark__S01E07.srt,Dark,Dark S01,Dark E07,74,"0:6:56,458","0:6:57,875",Im Krankenhaus?,im krankenhaus?,"['krankenhaus', 'im']","['Im', 'Krankenhaus']","['Im', 'Krankenhaus', '?']","['Im', 'Krankenhaus', '?']","['ADP', 'NOUN', 'PUNCT']",Im Krankenhaus ?,ADP NOUN PUNCT
Dark__S01E07.srt,Dark,Dark S01,Dark E07,75,"0:7:0,750","0:7:2,625","Also, wir sehen uns.","also, wir sehen uns.","['also', 'sehen', 'wir', 'uns']","['Also', 'wir', 'sehen', 'uns']","['Also', ',', 'wir', 'sehen', 'uns', '.']","['Also', ',', 'ich', 'sehen', 'sich', '.']","['ADV', 'PUNCT', 'PRON', 'VERB', 'PRON', 'PUNCT']","Also , ich sehen sich .",ADV PUNCT PRON VERB PRON PUNCT
Dark__S01E07.srt,Dark,Dark S01,Dark E07,76,"0:7:3,417","0:7:5,292","Ey, Regina, du Brillenschlange!","ey, regina, du brillenschlange!","['du', 'brillenschlange', 'ey', 'regina']","['Ey', 'Regina', 'du', 'Brillenschlange']","['Ey', ',', 'Regina', ',', 'du', 'Brillenschlange', '!']","['Ey', ',', 'Regina', ',', 'du', 'Brillenschlange', '!']","['PART', 'PUNCT', 'PROPN', 'PUNCT', 'PRON', 'NOUN', 'PUNCT']","Ey , Regina , du Brillenschlange !",PART PUNCT PROPN PUNCT PRON NOUN PUNCT
Dark__S01E07.srt,Dark,Dark S01,Dark E07,77,"0:7:15,542","0:7:19,875","Die AKWSchichtpläne für die Nacht, in der Mads verschwunden ist.","die akwschichtpläne für die nacht, in der mads verschwunden ist.","['für', 'ist', 'der', 'die', 'verschwunden', 'mads', 'in', 'nacht', 'akwschichtpläne']","['Die', 'AKWSchichtpläne', 'für', 'die', 'Nacht', 'in', 'der', 'Mads', 'verschwunden', 'ist']","['Die', 'AKWSchichtpläne', 'für', 'die', 'Nacht', ',', 'in', 'der', 'Mads', 'verschwunden', 'ist', '.']","['der', 'AKWSchichtpläne', 'für', 'der', 'Nacht', ',', 'in', 'der', 'Mads', 'verschwinden', 'sein', '.']","['DET', 'NOUN', 'ADP', 'DET', 'NOUN', 'PUNCT', 'ADP', 'DET', 'NOUN', 'VERB', 'AUX', 'PUNCT']","der AKWSchichtpläne für der Nacht , in der Mads verschwinden sein .",DET NOUN ADP DET NOUN PUNCT ADP DET NOUN VERB AUX PUNCT
Dark__S01E07.srt,Dark,Dark S01,Dark E07,78,"0:7:19,958","0:7:23,125",Mach du die Befragung. Wir prüfen Wege und Zeiten.,mach du die befragung. wir prüfen wege und zeiten.,"['mach', 'wir', 'du', 'die', 'befragung', 'prüfen', 'wege', 'zeiten', 'und']","['Mach', 'du', 'die', 'Befragung', 'Wir', 'prüfen', 'Wege', 'und', 'Zeiten']","['Mach', 'du', 'die', 'Befragung', '.', 'Wir', 'prüfen', 'Wege', 'und', 'Zeiten', '.']","['Mach', 'du', 'der', 'Befragung', '.', 'ich', 'prüfen', 'Weg', 'und', 'Zeit', '.']","['X', 'PRON', 'DET', 'NOUN', 'PUNCT', 'PRON', 'VERB', 'NOUN', 'CCONJ', 'NOUN', 'PUNCT']",Mach du der Befragung . ich prüfen Weg und Zeit .,X PRON DET NOUN PUNCT PRON VERB NOUN CCONJ NOUN PUNCT
Dark__S01E07.srt,Dark,Dark S01,Dark E07,79,"0:7:23,208","0:7:26,750",Vielleicht finden wir was. Kann das wer anders übernehmen?,vielleicht finden wir was. kann das wer anders übernehmen?,"['was', 'wir', 'das', 'finden', 'wer', 'vielleicht', 'übernehmen', 'kann', 'anders']","['Vielleicht', 'finden', 'wir', 'was', 'Kann', 'das', 'wer', 'anders', 'übernehmen']","['Vielleicht', 'finden', 'wir', 'was', '.', 'Kann', 'das', 'wer', 'anders', 'übernehmen', '?']","['Vielleicht', 'finden', 'ich', 'was', '.', 'können', 'der', 'wer', 'anders', 'übernehmen', '?']","['ADV', 'VERB', 'PRON', 'PRON', 'PUNCT', 'AUX', 'PRON', 'PRON', 'ADV', 'VERB', 'PUNCT']",Vielleicht finden ich was . können der wer anders übernehmen ?,ADV VERB PRON PRON PUNCT AUX PRON PRON ADV VERB PUNCT
Dark__S01E07.srt,Dark,Dark S01,Dark E07,80,"0:7:28,0","0:7:32,0",Ich bin an dem Fall mit dem Bruder dran. Anzeige wegen Vergewaltigung.,ich bin an dem fall mit dem bruder dran. anzeige wegen vergewaltigung.,"['an', 'dem', 'wegen', 'vergewaltigung', 'bin', 'anzeige', 'fall', 'bruder', 'mit', 'ich', 'dran']","['Ich', 'bin', 'an', 'dem', 'Fall', 'mit', 'dem', 'Bruder', 'dran', 'Anzeige', 'wegen', 'Vergewaltigung']","['Ich', 'bin', 'an', 'dem', 'Fall', 'mit', 'dem', 'Bruder', 'dran', '.', 'Anzeige', 'wegen', 'Vergewaltigung', '.']","['Ich', 'sein', 'an', 'der', 'Fall', 'mit', 'der', 'Bruder', 'dran', '.', 'Anzeige', 'wegen', 'Vergewaltigung', '.']","['PRON', 'AUX', 'ADP', 'DET', 'NOUN', 'ADP', 'DET', 'NOUN', 'ADV', 'PUNCT', 'NOUN', 'ADP', 'NOUN', 'PUNCT']",Ich sein an der Fall mit der Bruder dran . Anzeige wegen Vergewaltigung .,PRON AUX ADP DET NOUN ADP DET NOUN ADV PUNCT NOUN ADP NOUN PUNCT
Dark__S01E07.srt,Dark,Dark S01,Dark E07,81,"0:7:32,83","0:7:34,250","Wir haben nie in Betracht gezogen,","wir haben nie in betracht gezogen,","['betracht', 'wir', 'nie', 'gezogen', 'haben', 'in']","['Wir', 'haben', 'nie', 'in', 'Betracht', 'gezogen']","['Wir', 'haben', 'nie', 'in', 'Betracht', 'gezogen', ',']","['ich', 'haben', 'nie', 'in', 'Betracht', 'ziehen', ',']","['PRON', 'AUX', 'ADV', 'ADP', 'NOUN', 'VERB', 'PUNCT']","ich haben nie in Betracht ziehen ,",PRON AUX ADV ADP NOUN VERB PUNCT
Dark__S01E07.srt,Dark,Dark S01,Dark E07,82,"0:7:34,333","0:7:37,833",ob der mit dem Verschwinden seines Bruders was zu tun hat.,ob der mit dem verschwinden seines bruders was zu tun hat.,"['verschwinden', 'dem', 'was', 'tun', 'der', 'seines', 'bruders', 'ob', 'zu', 'mit', 'hat']","['ob', 'der', 'mit', 'dem', 'Verschwinden', 'seines', 'Bruders', 'was', 'zu', 'tun', 'hat']","['ob', 'der', 'mit', 'dem', 'Verschwinden', 'seines', 'Bruders', 'was', 'zu', 'tun', 'hat', '.']","['ob', 'der', 'mit', 'der', 'Verschwinden', 'mein', 'Bruder', 'was', 'zu', 'tun', 'haben', '.']","['SCONJ', 'DET', 'ADP', 'DET', 'NOUN', 'DET', 'NOUN', 'PRON', 'PART', 'VERB', 'AUX', 'PUNCT']",ob der mit der Verschwinden mein Bruder was zu tun haben .,SCONJ DET ADP DET NOUN DET NOUN PRON PART VERB AUX PUNCT
Dark__S01E07.srt,Dark,Dark S01,Dark E07,83,"0:7:37,917","0:7:39,167",Ja.,ja.,['ja'],['Ja'],"['Ja', '.']","['Ja', '.']","['PART', 'PUNCT']",Ja .,PART PUNCT
Dark__S01E07.srt,Dark,Dark S01,Dark E07,84,"0:7:39,250","0:7:40,375",Egon?,egon?,['egon'],['Egon'],"['Egon', '?']","['Egon', '?']","['PROPN', 'PUNCT']",Egon ?,PROPN PUNCT
Dark__S01E07.srt,Dark,Dark S01,Dark E07,85,"0:7:41,83","0:7:42,500",Das sind nicht die 50er.,das sind nicht die 50er.,"['das', 'sind', 'die', 'nicht', '50er']","['Das', 'sind', 'nicht', 'die', '50er']","['Das', 'sind', 'nicht', 'die', '50er', '.']","['der', 'sein', 'nicht', 'der', '50er', '.']","['PRON', 'AUX', 'PART', 'DET', 'NOUN', 'PUNCT']",der sein nicht der 50er .,PRON AUX PART DET NOUN PUNCT
Dark__S01E07.srt,Dark,Dark S01,Dark E07,86,"0:7:42,875","0:7:45,750","Wir richten uns nach Indizien, nicht nach Gefühlen.","wir richten uns nach indizien, nicht nach gefühlen.","['wir', 'richten', 'indizien', 'uns', 'gefühlen', 'nicht', 'nach']","['Wir', 'richten', 'uns', 'nach', 'Indizien', 'nicht', 'nach', 'Gefühlen']","['Wir', 'richten', 'uns', 'nach', 'Indizien', ',', 'nicht', 'nach', 'Gefühlen', '.']","['ich', 'richten', 'sich', 'nach', 'Indiz', ',', 'nicht', 'nach', 'Gefühl', '.']","['PRON', 'VERB', 'PRON', 'ADP', 'NOUN', 'PUNCT', 'PART', 'ADP', 'NOUN', 'PUNCT']","ich richten sich nach Indiz , nicht nach Gefühl .",PRON VERB PRON ADP NOUN PUNCT PART ADP NOUN PUNCT
Dark__S01E07.srt,Dark,Dark S01,Dark E07,87,"0:7:45,833","0:7:49,542","In drei Monaten wirst du pensioniert und kannst tun, was du willst.","in drei monaten wirst du pensioniert und kannst tun, was du willst.","['was', 'tun', 'du', 'willst', 'drei', 'wirst', 'kannst', 'in', 'pensioniert', 'monaten', 'und']","['In', 'drei', 'Monaten', 'wirst', 'du', 'pensioniert', 'und', 'kannst', 'tun', 'was', 'du', 'willst']","['In', 'drei', 'Monaten', 'wirst', 'du', 'pensioniert', 'und', 'kannst', 'tun', ',', 'was', 'du', 'willst', '.']","['In', 'drei', 'Monat', 'werden', 'du', 'pensionieren', 'und', 'können', 'tun', ',', 'was', 'du', 'wollen', '.']","['ADP', 'NUM', 'NOUN', 'AUX', 'PRON', 'VERB', 'CCONJ', 'ADV', 'VERB', 'PUNCT', 'PRON', 'PRON', 'VERB', 'PUNCT']","In drei Monat werden du pensionieren und können tun , was du wollen .",ADP NUM NOUN AUX PRON VERB CCONJ ADV VERB PUNCT PRON PRON VERB PUNCT
Dark__S01E07.srt,Dark,Dark S01,Dark E07,88,"0:7:49,625","0:7:51,458","Bis dahin tust du, was ich will.","bis dahin tust du, was ich will.","['dahin', 'was', 'tust', 'du', 'bis', 'will', 'ich']","['Bis', 'dahin', 'tust', 'du', 'was', 'ich', 'will']","['Bis', 'dahin', 'tust', 'du', ',', 'was', 'ich', 'will', '.']","['bis', 'dahin', 'tun', 'du', ',', 'was', 'ich', 'wollen', '.']","['ADP', 'ADV', 'VERB', 'PRON', 'PUNCT', 'PRON', 'PRON', 'VERB', 'PUNCT']","bis dahin tun du , was ich wollen .",ADP ADV VERB PRON PUNCT PRON PRON VERB PUNCT
Dark__S01E07.srt,Dark,Dark S01,Dark E07,89,"0:8:16,333","0:8:17,708",'86.,'86.,['86.'],['86.'],"[""'"", '86.']","[""'"", '86.']","['PUNCT', 'ADJ']",' 86.,PUNCT ADJ
Dark__S01E07.srt,Dark,Dark S01,Dark E07,90,"0:8:20,292","0:8:22,708",'86...,'86...,['86'],['86'],"[""'"", '86', '...']","[""'"", '86', '...']","['PUNCT', 'NUM', 'PUNCT']",' 86 ...,PUNCT NUM PUNCT
Dark__S01E07.srt,Dark,Dark S01,Dark E07,91,"0:8:23,542","0:8:26,83","Ich sage nur, gestern hat der Boden vibriert.","ich sage nur, gestern hat der boden vibriert.","['sage', 'nur', 'der', 'boden', 'vibriert', 'gestern', 'ich', 'hat']","['Ich', 'sage', 'nur', 'gestern', 'hat', 'der', 'Boden', 'vibriert']","['Ich', 'sage', 'nur', ',', 'gestern', 'hat', 'der', 'Boden', 'vibriert', '.']","['Ich', 'sage', 'nur', ',', 'gestern', 'haben', 'der', 'Boden', 'vibriert', '.']","['PRON', 'VERB', 'ADV', 'PUNCT', 'ADV', 'AUX', 'DET', 'NOUN', 'VERB', 'PUNCT']","Ich sage nur , gestern haben der Boden vibriert .",PRON VERB ADV PUNCT ADV AUX DET NOUN VERB PUNCT
Dark__S01E07.srt,Dark,Dark S01,Dark E07,92,"0:8:26,458","0:8:29,125","Ich weiß, dass hier kein Erdbebengebiet ist.","ich weiß, dass hier kein erdbebengebiet ist.","['kein', 'weiß', 'ist', 'hier', 'dass', 'erdbebengebiet', 'ich']","['Ich', 'weiß', 'dass', 'hier', 'kein', 'Erdbebengebiet', 'ist']","['Ich', 'weiß', ',', 'dass', 'hier', 'kein', 'Erdbebengebiet', 'ist', '.']","['Ich', 'weiß', ',', 'dass', 'hier', 'kein', 'Erdbebengebiet', 'sein', '.']","['PRON', 'VERB', 'PUNCT', 'SCONJ', 'ADV', 'DET', 'NOUN', 'AUX', 'PUNCT']","Ich weiß , dass hier kein Erdbebengebiet sein .",PRON VERB PUNCT SCONJ ADV DET NOUN AUX PUNCT
Dark__S01E07.srt,Dark,Dark S01,Dark E07,93,"0:8:29,208","0:8:32,167",Der Durchsuchungsbefehl für das AKW. Ich muss los.,der durchsuchungsbefehl für das akw. ich muss los.,"['für', 'durchsuchungsbefehl', 'das', 'der', 'muss', 'akw', 'los', 'ich']","['Der', 'Durchsuchungsbefehl', 'für', 'das', 'AKW', 'Ich', 'muss', 'los']","['Der', 'Durchsuchungsbefehl', 'für', 'das', 'AKW', '.', 'Ich', 'muss', 'los', '.']","['der', 'Durchsuchungsbefehl', 'für', 'der', 'AKW', '.', 'Ich', 'muss', 'los', '.']","['DET', 'NOUN', 'ADP', 'DET', 'NOUN', 'PUNCT', 'PRON', 'VERB', 'ADV', 'PUNCT']",der Durchsuchungsbefehl für der AKW . Ich muss los .,DET NOUN ADP DET NOUN PUNCT PRON VERB ADV PUNCT
