Unique_ID,Show_Name,Season,Episode,Line_Index,Start,End,Dialogue,Dialogue_lower,Dialogue_Set_Words,Dialogue_Words,Dialogue_Tokens_Text,Dialogue_Tokens_Lemmas,Dialogue_Tokens_POS_Tags,Dialogue_Lemmas_Pattern,Dialogue_POS_Tags_Pattern
Dark__S01E08.srt,Dark,Dark S01,Dark E08,5,"0:1:21,167","0:1:24,833","Danke, dass du so schnell da warst, Egon.","danke, dass du so schnell da warst, egon.","['so', 'egon', 'du', 'warst', 'dass', 'danke', 'da', 'schnell']","['Danke', 'dass', 'du', 'so', 'schnell', 'da', 'warst', 'Egon']","['Danke', ',', 'dass', 'du', 'so', 'schnell', 'da', 'warst', ',', 'Egon', '.']","['Dank', ',', 'dass', 'du', 'so', 'schnellen', 'da', 'sein', ',', 'Egon', '.']","['NOUN', 'PUNCT', 'SCONJ', 'PRON', 'ADV', 'ADV', 'ADV', 'ADV', 'PUNCT', 'PROPN', 'PUNCT']","Dank , dass du so schnellen da sein , Egon .",NOUN PUNCT SCONJ PRON ADV ADV ADV ADV PUNCT PROPN PUNCT
Dark__S01E08.srt,Dark,Dark S01,Dark E08,6,"0:1:24,917","0:1:27,583",Die Arbeiter fanden diese beiden Leichen.,die arbeiter fanden diese beiden leichen.,"['die', 'fanden', 'arbeiter', 'leichen', 'diese', 'beiden']","['Die', 'Arbeiter', 'fanden', 'diese', 'beiden', 'Leichen']","['Die', 'Arbeiter', 'fanden', 'diese', 'beiden', 'Leichen', '.']","['der', 'Arbeiter', 'finden', 'dies', 'beid', 'Leiche', '.']","['DET', 'NOUN', 'VERB', 'DET', 'DET', 'NOUN', 'PUNCT']",der Arbeiter finden dies beid Leiche .,DET NOUN VERB DET DET NOUN PUNCT
Dark__S01E08.srt,Dark,Dark S01,Dark E08,8,"0:1:34,208","0:1:35,542",Das sind ja noch Kinder.,das sind ja noch kinder.,"['kinder', 'das', 'ja', 'sind', 'noch']","['Das', 'sind', 'ja', 'noch', 'Kinder']","['Das', 'sind', 'ja', 'noch', 'Kinder', '.']","['der', 'sein', 'ja', 'noch', 'Kind', '.']","['PRON', 'AUX', 'ADV', 'ADV', 'NOUN', 'PUNCT']",der sein ja noch Kind .,PRON AUX ADV ADV NOUN PUNCT
Dark__S01E08.srt,Dark,Dark S01,Dark E08,9,"0:1:35,625","0:1:38,542","Die sehen seltsam aus, wie verkleidet.","die sehen seltsam aus, wie verkleidet.","['wie', 'aus', 'die', 'seltsam', 'verkleidet', 'sehen']","['Die', 'sehen', 'seltsam', 'aus', 'wie', 'verkleidet']","['Die', 'sehen', 'seltsam', 'aus', ',', 'wie', 'verkleidet', '.']","['der', 'sehen', 'seltsam', 'aus', ',', 'wie', 'verkleiden', '.']","['PRON', 'VERB', 'ADV', 'ADP', 'PUNCT', 'SCONJ', 'VERB', 'PUNCT']","der sehen seltsam aus , wie verkleiden .",PRON VERB ADV ADP PUNCT SCONJ VERB PUNCT
Dark__S01E08.srt,Dark,Dark S01,Dark E08,10,"0:1:40,708","0:1:42,208",Oh Gott.,oh gott.,"['gott', 'oh']","['Oh', 'Gott']","['Oh', 'Gott', '.']","['Oh', 'Gott', '.']","['PROPN', 'NOUN', 'PUNCT']",Oh Gott .,PROPN NOUN PUNCT
Dark__S01E08.srt,Dark,Dark S01,Dark E08,32,"0:3:44,208","0:3:46,125",Pünktlich wie ein Uhrwerk.,pünktlich wie ein uhrwerk.,"['ein', 'uhrwerk', 'pünktlich', 'wie']","['Pünktlich', 'wie', 'ein', 'Uhrwerk']","['Pünktlich', 'wie', 'ein', 'Uhrwerk', '.']","['Pünktlich', 'wie', 'einen', 'Uhrwerk', '.']","['ADV', 'ADP', 'DET', 'NOUN', 'PUNCT']",Pünktlich wie einen Uhrwerk .,ADV ADP DET NOUN PUNCT
Dark__S01E08.srt,Dark,Dark S01,Dark E08,33,"0:3:53,83","0:3:55,208",Wo waren wir stehen geblieben?,wo waren wir stehen geblieben?,"['geblieben', 'wir', 'waren', 'stehen', 'wo']","['Wo', 'waren', 'wir', 'stehen', 'geblieben']","['Wo', 'waren', 'wir', 'stehen', 'geblieben', '?']","['wo', 'sein', 'ich', 'stehen', 'bleiben', '?']","['ADV', 'AUX', 'PRON', 'VERB', 'VERB', 'PUNCT']",wo sein ich stehen bleiben ?,ADV AUX PRON VERB VERB PUNCT
Dark__S01E08.srt,Dark,Dark S01,Dark E08,34,"0:3:56,0","0:3:57,833",Bei der EinsteinRosenBrücke.,bei der einsteinrosenbrücke.,"['bei', 'der', 'einsteinrosenbrücke']","['Bei', 'der', 'EinsteinRosenBrücke']","['Bei', 'der', 'EinsteinRosenBrücke', '.']","['Bei', 'der', 'EinsteinRosenBrücke', '.']","['ADP', 'DET', 'PROPN', 'PUNCT']",Bei der EinsteinRosenBrücke .,ADP DET PROPN PUNCT
Dark__S01E08.srt,Dark,Dark S01,Dark E08,35,"0:3:59,333","0:4:1,0",Eine Passage,eine passage,"['eine', 'passage']","['Eine', 'Passage']","['Eine', 'Passage']","['Eine', 'Passage']","['DET', 'NOUN']",Eine Passage,DET NOUN
Dark__S01E08.srt,Dark,Dark S01,Dark E08,36,"0:4:1,83","0:4:3,958","zwischen einem schwarzen Loch, dem Eintrittsloch,","zwischen einem schwarzen loch, dem eintrittsloch,","['schwarzen', 'dem', 'zwischen', 'loch', 'eintrittsloch', 'einem']","['zwischen', 'einem', 'schwarzen', 'Loch', 'dem', 'Eintrittsloch']","['zwischen', 'einem', 'schwarzen', 'Loch', ',', 'dem', 'Eintrittsloch', ',']","['zwischen', 'einer', 'schwarz', 'Loch', ',', 'der', 'Eintrittsloch', ',']","['ADP', 'DET', 'ADJ', 'NOUN', 'PUNCT', 'DET', 'NOUN', 'PUNCT']","zwischen einer schwarz Loch , der Eintrittsloch ,",ADP DET ADJ NOUN PUNCT DET NOUN PUNCT
Dark__S01E08.srt,Dark,Dark S01,Dark E08,37,"0:4:4,42","0:4:6,417","und einem weißen Loch, dem Austrittsloch...","und einem weißen loch, dem austrittsloch...","['dem', 'loch', 'austrittsloch', 'weißen', 'und', 'einem']","['und', 'einem', 'weißen', 'Loch', 'dem', 'Austrittsloch']","['und', 'einem', 'weißen', 'Loch', ',', 'dem', 'Austrittsloch', '...']","['und', 'einer', 'weiß', 'Loch', ',', 'der', 'Austrittsloch', '...']","['CCONJ', 'DET', 'ADJ', 'NOUN', 'PUNCT', 'DET', 'NOUN', 'PUNCT']","und einer weiß Loch , der Austrittsloch ...",CCONJ DET ADJ NOUN PUNCT DET NOUN PUNCT
Dark__S01E08.srt,Dark,Dark S01,Dark E08,38,"0:4:7,667","0:4:11,583",...die Raum und Zeit miteinander verbindet.,...die raum und zeit miteinander verbindet.,"['zeit', 'raum', 'die', 'verbindet', 'miteinander', 'und']","['die', 'Raum', 'und', 'Zeit', 'miteinander', 'verbindet']","['...', 'die', 'Raum', 'und', 'Zeit', 'miteinander', 'verbindet', '.']","['...', 'der', 'Raum', 'und', 'Zeit', 'miteinander', 'verbinden', '.']","['PUNCT', 'DET', 'NOUN', 'CCONJ', 'NOUN', 'ADV', 'VERB', 'PUNCT']",... der Raum und Zeit miteinander verbinden .,PUNCT DET NOUN CCONJ NOUN ADV VERB PUNCT
Dark__S01E08.srt,Dark,Dark S01,Dark E08,39,"0:4:12,792","0:4:15,875","Wer sie durchquert, reist durch die Zeit.","wer sie durchquert, reist durch die zeit.","['durchquert', 'zeit', 'sie', 'die', 'wer', 'durch', 'reist']","['Wer', 'sie', 'durchquert', 'reist', 'durch', 'die', 'Zeit']","['Wer', 'sie', 'durchquert', ',', 'reist', 'durch', 'die', 'Zeit', '.']","['Wer', 'ich', 'durchqueren', ',', 'reisen', 'durch', 'der', 'Zeit', '.']","['PRON', 'PRON', 'VERB', 'PUNCT', 'VERB', 'ADP', 'DET', 'NOUN', 'PUNCT']","Wer ich durchqueren , reisen durch der Zeit .",PRON PRON VERB PUNCT VERB ADP DET NOUN PUNCT
Dark__S01E08.srt,Dark,Dark S01,Dark E08,40,"0:4:16,792","0:4:18,500","Tick, tack.","tick, tack.","['tack', 'tick']","['Tick', 'tack']","['Tick', ',', 'tack', '.']","['Tick', ',', 'tack', '.']","['NOUN', 'PUNCT', 'ADV', 'PUNCT']","Tick , tack .",NOUN PUNCT ADV PUNCT
Dark__S01E08.srt,Dark,Dark S01,Dark E08,43,"0:5:10,0","0:5:13,500",Unser Denken ist vom Dualismus geprägt.,unser denken ist vom dualismus geprägt.,"['ist', 'geprägt', 'vom', 'unser', 'dualismus', 'denken']","['Unser', 'Denken', 'ist', 'vom', 'Dualismus', 'geprägt']","['Unser', 'Denken', 'ist', 'vom', 'Dualismus', 'geprägt', '.']","['sich', 'Denken', 'sein', 'vom', 'Dualismus', 'prägen', '.']","['DET', 'NOUN', 'AUX', 'ADP', 'NOUN', 'VERB', 'PUNCT']",sich Denken sein vom Dualismus prägen .,DET NOUN AUX ADP NOUN VERB PUNCT
Dark__S01E08.srt,Dark,Dark S01,Dark E08,44,"0:5:14,542","0:5:17,875","Eingang, Ausgang. Schwarz, weiß. Gut, böse.","eingang, ausgang. schwarz, weiß. gut, böse.","['eingang', 'weiß', 'gut', 'böse', 'schwarz', 'ausgang']","['Eingang', 'Ausgang', 'Schwarz', 'weiß', 'Gut', 'böse']","['Eingang', ',', 'Ausgang', '.', 'Schwarz', ',', 'weiß', '.', 'Gut', ',', 'böse', '.']","['Eingang', ',', 'Ausgang', '.', 'Schwarz', ',', 'weiß', '.', 'Gut', ',', 'böse', '.']","['NOUN', 'PUNCT', 'NOUN', 'PUNCT', 'ADV', 'PUNCT', 'VERB', 'PUNCT', 'ADV', 'PUNCT', 'ADV', 'PUNCT']","Eingang , Ausgang . Schwarz , weiß . Gut , böse .",NOUN PUNCT NOUN PUNCT ADV PUNCT VERB PUNCT ADV PUNCT ADV PUNCT
Dark__S01E08.srt,Dark,Dark S01,Dark E08,45,"0:5:17,958","0:5:21,250",Alles kommt in Paaren daher.,alles kommt in paaren daher.,"['paaren', 'kommt', 'daher', 'in', 'alles']","['Alles', 'kommt', 'in', 'Paaren', 'daher']","['Alles', 'kommt', 'in', 'Paaren', 'daher', '.']","['alle', 'kommen', 'in', 'Paar', 'daher', '.']","['PRON', 'VERB', 'ADP', 'NOUN', 'ADV', 'PUNCT']",alle kommen in Paar daher .,PRON VERB ADP NOUN ADV PUNCT
Dark__S01E08.srt,Dark,Dark S01,Dark E08,46,"0:5:22,750","0:5:24,625",Aber das ist falsch.,aber das ist falsch.,"['ist', 'falsch', 'aber', 'das']","['Aber', 'das', 'ist', 'falsch']","['Aber', 'das', 'ist', 'falsch', '.']","['aber', 'der', 'sein', 'falsch', '.']","['CCONJ', 'PRON', 'AUX', 'ADV', 'PUNCT']",aber der sein falsch .,CCONJ PRON AUX ADV PUNCT
Dark__S01E08.srt,Dark,Dark S01,Dark E08,47,"0:5:27,125","0:5:30,208",Haben Sie schon mal was von der Triqueta gehört?,haben sie schon mal was von der triqueta gehört?,"['mal', 'was', 'sie', 'der', 'triqueta', 'schon', 'haben', 'gehört', 'von']","['Haben', 'Sie', 'schon', 'mal', 'was', 'von', 'der', 'Triqueta', 'gehört']","['Haben', 'Sie', 'schon', 'mal', 'was', 'von', 'der', 'Triqueta', 'gehört', '?']","['Haben', 'ich', 'schon', 'mal', 'was', 'von', 'der', 'Triqueta', 'hören', '?']","['AUX', 'PRON', 'ADV', 'ADV', 'PRON', 'ADP', 'DET', 'NOUN', 'VERB', 'PUNCT']",Haben ich schon mal was von der Triqueta hören ?,AUX PRON ADV ADV PRON ADP DET NOUN VERB PUNCT
Dark__S01E08.srt,Dark,Dark S01,Dark E08,48,"0:5:31,125","0:5:32,917",Der Knoten der Dreisamkeit.,der knoten der dreisamkeit.,"['der', 'dreisamkeit', 'knoten']","['Der', 'Knoten', 'der', 'Dreisamkeit']","['Der', 'Knoten', 'der', 'Dreisamkeit', '.']","['der', 'Knoten', 'der', 'Dreisamkeit', '.']","['DET', 'NOUN', 'DET', 'NOUN', 'PUNCT']",der Knoten der Dreisamkeit .,DET NOUN DET NOUN PUNCT
Dark__S01E08.srt,Dark,Dark S01,Dark E08,49,"0:5:33,0","0:5:36,375",Ohne eine dritte Dimension ist nichts vollkommen.,ohne eine dritte dimension ist nichts vollkommen.,"['vollkommen', 'ist', 'eine', 'nichts', 'dimension', 'dritte', 'ohne']","['Ohne', 'eine', 'dritte', 'Dimension', 'ist', 'nichts', 'vollkommen']","['Ohne', 'eine', 'dritte', 'Dimension', 'ist', 'nichts', 'vollkommen', '.']","['ohne', 'einen', 'dritt', 'Dimension', 'sein', 'nichts', 'vollkommen', '.']","['ADP', 'DET', 'ADJ', 'NOUN', 'AUX', 'PRON', 'ADV', 'PUNCT']",ohne einen dritt Dimension sein nichts vollkommen .,ADP DET ADJ NOUN AUX PRON ADV PUNCT
Dark__S01E08.srt,Dark,Dark S01,Dark E08,50,"0:5:36,458","0:5:39,583",Es gibt nicht nur ein Oben und ein Unten.,es gibt nicht nur ein oben und ein unten.,"['unten', 'nur', 'ein', 'oben', 'nicht', 'und', 'gibt', 'es']","['Es', 'gibt', 'nicht', 'nur', 'ein', 'Oben', 'und', 'ein', 'Unten']","['Es', 'gibt', 'nicht', 'nur', 'ein', 'Oben', 'und', 'ein', 'Unten', '.']","['ich', 'geben', 'nicht', 'nur', 'einen', 'Oben', 'und', 'einen', 'Unten', '.']","['PRON', 'VERB', 'PART', 'ADV', 'DET', 'NOUN', 'CCONJ', 'DET', 'NOUN', 'PUNCT']",ich geben nicht nur einen Oben und einen Unten .,PRON VERB PART ADV DET NOUN CCONJ DET NOUN PUNCT
Dark__S01E08.srt,Dark,Dark S01,Dark E08,51,"0:5:40,83","0:5:42,208",Es gibt auch eine Mitte.,es gibt auch eine mitte.,"['mitte', 'auch', 'eine', 'gibt', 'es']","['Es', 'gibt', 'auch', 'eine', 'Mitte']","['Es', 'gibt', 'auch', 'eine', 'Mitte', '.']","['ich', 'geben', 'auch', 'einen', 'Mitte', '.']","['PRON', 'VERB', 'ADV', 'DET', 'NOUN', 'PUNCT']",ich geben auch einen Mitte .,PRON VERB ADV DET NOUN PUNCT
Dark__S01E08.srt,Dark,Dark S01,Dark E08,52,"0:5:42,958","0:5:47,250","Ich glaube, dass Einstein und Rosen etwas übersehen haben.","ich glaube, dass einstein und rosen etwas übersehen haben.","['übersehen', 'dass', 'haben', 'etwas', 'einstein', 'und', 'rosen', 'ich', 'glaube']","['Ich', 'glaube', 'dass', 'Einstein', 'und', 'Rosen', 'etwas', 'übersehen', 'haben']","['Ich', 'glaube', ',', 'dass', 'Einstein', 'und', 'Rosen', 'etwas', 'übersehen', 'haben', '.']","['Ich', 'glauben', ',', 'dass', 'Einstein', 'und', 'Rose', 'etwas', 'übersehen', 'haben', '.']","['PRON', 'VERB', 'PUNCT', 'SCONJ', 'NOUN', 'CCONJ', 'NOUN', 'PRON', 'VERB', 'AUX', 'PUNCT']","Ich glauben , dass Einstein und Rose etwas übersehen haben .",PRON VERB PUNCT SCONJ NOUN CCONJ NOUN PRON VERB AUX PUNCT
Dark__S01E08.srt,Dark,Dark S01,Dark E08,53,"0:5:51,208","0:5:52,833","""Sic mundus..","""sic mundus..","['mundus', 'sic']","['Sic', 'mundus']","['""', 'Sic', 'mundus', '..']","['""', 'Sic', 'mundus', '..']","['PUNCT', 'X', 'X', 'PUNCT']",""" Sic mundus ..",PUNCT X X PUNCT
Dark__S01E08.srt,Dark,Dark S01,Dark E08,54,"0:5:54,417","0:5:56,625","...creatus est.""","...creatus est.""","['creatus', 'est']","['creatus', 'est']","['...', 'creatus', 'est', '.', '""']","['...', 'creatus', 'est', '.', '""']","['PUNCT', 'X', 'X', 'PUNCT', 'PUNCT']","... creatus est . """,PUNCT X X PUNCT PUNCT
Dark__S01E08.srt,Dark,Dark S01,Dark E08,55,"0:5:56,708","0:5:59,958","Ein Wurmloch verbindet nicht nur zwei,","ein wurmloch verbindet nicht nur zwei,","['nur', 'ein', 'verbindet', 'nicht', 'zwei', 'wurmloch']","['Ein', 'Wurmloch', 'verbindet', 'nicht', 'nur', 'zwei']","['Ein', 'Wurmloch', 'verbindet', 'nicht', 'nur', 'zwei', ',']","['Ein', 'Wurmloch', 'verbinden', 'nicht', 'nur', 'zwei', ',']","['DET', 'NOUN', 'VERB', 'PART', 'ADV', 'NUM', 'PUNCT']","Ein Wurmloch verbinden nicht nur zwei ,",DET NOUN VERB PART ADV NUM PUNCT
Dark__S01E08.srt,Dark,Dark S01,Dark E08,56,"0:6:0,42","0:6:2,250",sondern drei Dimensionen miteinander.,sondern drei dimensionen miteinander.,"['dimensionen', 'drei', 'sondern', 'miteinander']","['sondern', 'drei', 'Dimensionen', 'miteinander']","['sondern', 'drei', 'Dimensionen', 'miteinander', '.']","['sondern', 'drei', 'Dimension', 'miteinander', '.']","['CCONJ', 'NUM', 'NOUN', 'ADV', 'PUNCT']",sondern drei Dimension miteinander .,CCONJ NUM NOUN ADV PUNCT
Dark__S01E08.srt,Dark,Dark S01,Dark E08,57,"0:6:2,958","0:6:4,458","Zukunft,","zukunft,",['zukunft'],['Zukunft'],"['Zukunft', ',']","['Zukunft', ',']","['NOUN', 'PUNCT']","Zukunft ,",NOUN PUNCT
Dark__S01E08.srt,Dark,Dark S01,Dark E08,58,"0:6:4,542","0:6:5,958",Gegenwart...,gegenwart...,['gegenwart'],['Gegenwart'],"['Gegenwart', '...']","['Gegenwart', '...']","['NOUN', 'PUNCT']",Gegenwart ...,NOUN PUNCT
Dark__S01E08.srt,Dark,Dark S01,Dark E08,59,"0:6:7,333","0:6:8,917",...und Vergangenheit.,...und vergangenheit.,"['und', 'vergangenheit']","['und', 'Vergangenheit']","['...', 'und', 'Vergangenheit', '.']","['...', 'und', 'Vergangenheit', '.']","['PUNCT', 'CCONJ', 'NOUN', 'PUNCT']",... und Vergangenheit .,PUNCT CCONJ NOUN PUNCT
Dark__S01E08.srt,Dark,Dark S01,Dark E08,64,"0:7:11,333","0:7:12,833",Helge?,helge?,['helge'],['Helge'],"['Helge', '?']","['Helge', '?']","['NOUN', 'PUNCT']",Helge ?,NOUN PUNCT
Dark__S01E08.srt,Dark,Dark S01,Dark E08,67,"0:7:20,708","0:7:21,750",Herrgott.,herrgott.,['herrgott'],['Herrgott'],"['Herrgott', '.']","['Herrgott', '.']","['NOUN', 'PUNCT']",Herrgott .,NOUN PUNCT
Dark__S01E08.srt,Dark,Dark S01,Dark E08,68,"0:7:22,583","0:7:24,458",Wie schaust du denn wieder aus?,wie schaust du denn wieder aus?,"['du', 'wie', 'aus', 'wieder', 'denn', 'schaust']","['Wie', 'schaust', 'du', 'denn', 'wieder', 'aus']","['Wie', 'schaust', 'du', 'denn', 'wieder', 'aus', '?']","['Wie', 'schauen', 'du', 'denn', 'wieder', 'aus', '?']","['ADV', 'VERB', 'PRON', 'ADV', 'ADV', 'ADP', 'PUNCT']",Wie schauen du denn wieder aus ?,ADV VERB PRON ADV ADV ADP PUNCT
Dark__S01E08.srt,Dark,Dark S01,Dark E08,70,"0:7:27,83","0:7:28,83",Ich...,ich...,['ich'],['Ich'],"['Ich', '...']","['Ich', '...']","['PRON', 'PUNCT']",Ich ...,PRON PUNCT
Dark__S01E08.srt,Dark,Dark S01,Dark E08,72,"0:7:30,0","0:7:32,0",Ich... ich war auf der Baustelle.,ich... ich war auf der baustelle.,"['der', 'ich', 'auf', 'baustelle', 'war']","['Ich', 'ich', 'war', 'auf', 'der', 'Baustelle']","['Ich', '...', 'ich', 'war', 'auf', 'der', 'Baustelle', '.']","['Ich', '...', 'ich', 'sein', 'auf', 'der', 'Baustelle', '.']","['PRON', 'PUNCT', 'PRON', 'AUX', 'ADP', 'DET', 'NOUN', 'PUNCT']",Ich ... ich sein auf der Baustelle .,PRON PUNCT PRON AUX ADP DET NOUN PUNCT
Dark__S01E08.srt,Dark,Dark S01,Dark E08,73,"0:7:32,83","0:7:34,167",Dort haben sie was... Ausziehen.,dort haben sie was... ausziehen.,"['was', 'sie', 'haben', 'ausziehen', 'dort']","['Dort', 'haben', 'sie', 'was', 'Ausziehen']","['Dort', 'haben', 'sie', 'was', '...', 'Ausziehen', '.']","['Dort', 'haben', 'ich', 'was', '...', 'Ausziehen', '.']","['ADV', 'AUX', 'PRON', 'PRON', 'PUNCT', 'NOUN', 'PUNCT']",Dort haben ich was ... Ausziehen .,ADV AUX PRON PRON PUNCT NOUN PUNCT
Dark__S01E08.srt,Dark,Dark S01,Dark E08,76,"0:7:41,875","0:7:44,583","Ich sagte, du sollst dich ausziehen.","ich sagte, du sollst dich ausziehen.","['sagte', 'du', 'dich', 'sollst', 'ausziehen', 'ich']","['Ich', 'sagte', 'du', 'sollst', 'dich', 'ausziehen']","['Ich', 'sagte', ',', 'du', 'sollst', 'dich', 'ausziehen', '.']","['Ich', 'sagen', ',', 'du', 'sollen', 'sich', 'ausziehen', '.']","['PRON', 'VERB', 'PUNCT', 'PRON', 'VERB', 'PRON', 'VERB', 'PUNCT']","Ich sagen , du sollen sich ausziehen .",PRON VERB PUNCT PRON VERB PRON VERB PUNCT
Dark__S01E08.srt,Dark,Dark S01,Dark E08,85,"0:8:24,625","0:8:26,417",Weiter.,weiter.,['weiter'],['Weiter'],"['Weiter', '.']","['Weiter', '.']","['ADV', 'PUNCT']",Weiter .,ADV PUNCT
Dark__S01E08.srt,Dark,Dark S01,Dark E08,88,"0:8:38,958","0:8:40,208",Du wartest hier.,du wartest hier.,"['du', 'hier', 'wartest']","['Du', 'wartest', 'hier']","['Du', 'wartest', 'hier', '.']","['Du', 'warten', 'hier', '.']","['PRON', 'VERB', 'ADV', 'PUNCT']",Du warten hier .,PRON VERB ADV PUNCT
Dark__S01E08.srt,Dark,Dark S01,Dark E08,90,"0:9:1,625","0:9:5,125","Na, mein Junge. Was hast du denn wieder angestellt?","na, mein junge. was hast du denn wieder angestellt?","['was', 'du', 'mein', 'na', 'hast', 'wieder', 'denn', 'angestellt', 'junge']","['Na', 'mein', 'Junge', 'Was', 'hast', 'du', 'denn', 'wieder', 'angestellt']","['Na', ',', 'mein', 'Junge', '.', 'Was', 'hast', 'du', 'denn', 'wieder', 'angestellt', '?']","['Na', ',', 'meinen', 'Junge', '.', 'Was', 'haben', 'du', 'denn', 'wieder', 'anstellen', '?']","['PROPN', 'PUNCT', 'DET', 'NOUN', 'PUNCT', 'PRON', 'AUX', 'PRON', 'ADV', 'ADV', 'VERB', 'PUNCT']","Na , meinen Junge . Was haben du denn wieder anstellen ?",PROPN PUNCT DET NOUN PUNCT PRON AUX PRON ADV ADV VERB PUNCT
Dark__S01E08.srt,Dark,Dark S01,Dark E08,91,"0:9:5,542","0:9:8,83","Ich war auf der Baustelle. Ja, schön.","ich war auf der baustelle. ja, schön.","['der', 'ja', 'schön', 'ich', 'auf', 'baustelle', 'war']","['Ich', 'war', 'auf', 'der', 'Baustelle', 'Ja', 'schön']","['Ich', 'war', 'auf', 'der', 'Baustelle', '.', 'Ja', ',', 'schön', '.']","['Ich', 'sein', 'auf', 'der', 'Baustelle', '.', 'Ja', ',', 'schön', '.']","['PRON', 'AUX', 'ADP', 'DET', 'NOUN', 'PUNCT', 'PART', 'PUNCT', 'ADV', 'PUNCT']","Ich sein auf der Baustelle . Ja , schön .",PRON AUX ADP DET NOUN PUNCT PART PUNCT ADV PUNCT
Dark__S01E08.srt,Dark,Dark S01,Dark E08,92,"0:9:8,167","0:9:11,208",Da haben sie was gefunden.  Was denn?,da haben sie was gefunden.  was denn?,"['was', 'gefunden', 'sie', 'da', 'haben', 'denn']","['Da', 'haben', 'sie', 'was', 'gefunden', 'Was', 'denn']","['Da', 'haben', 'sie', 'was', 'gefunden', '.', ' ', 'Was', 'denn', '?']","['da', 'haben', 'ich', 'was', 'finden', '.', ' ', 'Was', 'denn', '?']","['ADV', 'AUX', 'PRON', 'PRON', 'VERB', 'PUNCT', 'SPACE', 'PRON', 'ADV', 'PUNCT']",da haben ich was finden .   Was denn ?,ADV AUX PRON PRON VERB PUNCT SPACE PRON ADV PUNCT
Dark__S01E08.srt,Dark,Dark S01,Dark E08,93,"0:9:11,292","0:9:12,625",Rumgekrochen ist er.,rumgekrochen ist er.,"['er', 'ist', 'rumgekrochen']","['Rumgekrochen', 'ist', 'er']","['Rumgekrochen', 'ist', 'er', '.']","['Rumgekrochen', 'sein', 'ich', '.']","['VERB', 'AUX', 'PRON', 'PUNCT']",Rumgekrochen sein ich .,VERB AUX PRON PUNCT
Dark__S01E08.srt,Dark,Dark S01,Dark E08,94,"0:9:15,458","0:9:17,208","Sag, was haben sie gefunden?","sag, was haben sie gefunden?","['was', 'gefunden', 'sag', 'sie', 'haben']","['Sag', 'was', 'haben', 'sie', 'gefunden']","['Sag', ',', 'was', 'haben', 'sie', 'gefunden', '?']","['Sag', ',', 'was', 'haben', 'ich', 'finden', '?']","['PROPN', 'PUNCT', 'PRON', 'AUX', 'PRON', 'VERB', 'PUNCT']","Sag , was haben ich finden ?",PROPN PUNCT PRON AUX PRON VERB PUNCT
Dark__S01E08.srt,Dark,Dark S01,Dark E08,95,"0:9:17,292","0:9:19,667",Auf der Baustelle war überall Polizei.,auf der baustelle war überall polizei.,"['überall', 'polizei', 'der', 'auf', 'baustelle', 'war']","['Auf', 'der', 'Baustelle', 'war', 'überall', 'Polizei']","['Auf', 'der', 'Baustelle', 'war', 'überall', 'Polizei', '.']","['Auf', 'der', 'Baustelle', 'sein', 'überall', 'Polizei', '.']","['ADP', 'DET', 'NOUN', 'AUX', 'ADV', 'NOUN', 'PUNCT']",Auf der Baustelle sein überall Polizei .,ADP DET NOUN AUX ADV NOUN PUNCT
Dark__S01E08.srt,Dark,Dark S01,Dark E08,96,"0:9:20,83","0:9:21,625",Polizei? Zwei Leichen.,polizei? zwei leichen.,"['zwei', 'polizei', 'leichen']","['Polizei', 'Zwei', 'Leichen']","['Polizei', '?', 'Zwei', 'Leichen', '.']","['Polizei', '?', 'Zwei', 'Leiche', '.']","['NOUN', 'PUNCT', 'NUM', 'NOUN', 'PUNCT']",Polizei ? Zwei Leiche .,NOUN PUNCT NUM NOUN PUNCT
Dark__S01E08.srt,Dark,Dark S01,Dark E08,97,"0:9:21,708","0:9:24,917",Mitten auf der Baustelle.  Was redest du da?,mitten auf der baustelle.  was redest du da?,"['redest', 'was', 'der', 'du', 'da', 'baustelle', 'mitten', 'auf']","['Mitten', 'auf', 'der', 'Baustelle', 'Was', 'redest', 'du', 'da']","['Mitten', 'auf', 'der', 'Baustelle', '.', ' ', 'Was', 'redest', 'du', 'da', '?']","['Mitte', 'auf', 'der', 'Baustelle', '.', ' ', 'Was', 'reden', 'du', 'da', '?']","['ADV', 'ADP', 'DET', 'NOUN', 'PUNCT', 'SPACE', 'PRON', 'VERB', 'PRON', 'ADV', 'PUNCT']",Mitte auf der Baustelle .   Was reden du da ?,ADV ADP DET NOUN PUNCT SPACE PRON VERB PRON ADV PUNCT
Dark__S01E08.srt,Dark,Dark S01,Dark E08,98,"0:9:25,0","0:9:27,0",Die sahen aus wie Kinder.,die sahen aus wie kinder.,"['kinder', 'sahen', 'aus', 'die', 'wie']","['Die', 'sahen', 'aus', 'wie', 'Kinder']","['Die', 'sahen', 'aus', 'wie', 'Kinder', '.']","['der', 'sehen', 'aus', 'wie', 'Kind', '.']","['PRON', 'VERB', 'ADP', 'ADP', 'NOUN', 'PUNCT']",der sehen aus wie Kind .,PRON VERB ADP ADP NOUN PUNCT
Dark__S01E08.srt,Dark,Dark S01,Dark E08,99,"0:9:27,83","0:9:29,667",Was? Bist du dir sicher? Ja.,was? bist du dir sicher? ja.,"['was', 'sicher', 'du', 'ja', 'dir', 'bist']","['Was', 'Bist', 'du', 'dir', 'sicher', 'Ja']","['Was', '?', 'Bist', 'du', 'dir', 'sicher', '?', 'Ja', '.']","['Was', '?', 'sein', 'du', 'sich', 'sichern', '?', 'Ja', '.']","['PRON', 'PUNCT', 'AUX', 'PRON', 'PRON', 'ADV', 'PUNCT', 'PART', 'PUNCT']",Was ? sein du sich sichern ? Ja .,PRON PUNCT AUX PRON PRON ADV PUNCT PART PUNCT
Dark__S01E08.srt,Dark,Dark S01,Dark E08,102,"0:9:39,375","0:9:41,0",Du lügst nicht?,du lügst nicht?,"['nicht', 'du', 'lügst']","['Du', 'lügst', 'nicht']","['Du', 'lügst', 'nicht', '?']","['Du', 'lügen', 'nicht', '?']","['PRON', 'ADV', 'PART', 'PUNCT']",Du lügen nicht ?,PRON ADV PART PUNCT
Dark__S01E08.srt,Dark,Dark S01,Dark E08,103,"0:9:42,583","0:9:43,917",Mm.,mm.,['mm'],['Mm'],"['Mm', '.']","['Mm', '.']","['PROPN', 'PUNCT']",Mm .,PROPN PUNCT
Dark__S01E08.srt,Dark,Dark S01,Dark E08,104,"0:9:57,417","0:9:58,500",Du bist spät.,du bist spät.,"['du', 'spät', 'bist']","['Du', 'bist', 'spät']","['Du', 'bist', 'spät', '.']","['Du', 'sein', 'spät', '.']","['PRON', 'AUX', 'ADV', 'PUNCT']",Du sein spät .,PRON AUX ADV PUNCT
Dark__S01E08.srt,Dark,Dark S01,Dark E08,105,"0:9:58,583","0:10:1,208",Die Groschen für Claudia liegen auf dem Tisch.,die groschen für claudia liegen auf dem tisch.,"['für', 'dem', 'groschen', 'die', 'tisch', 'liegen', 'auf', 'claudia']","['Die', 'Groschen', 'für', 'Claudia', 'liegen', 'auf', 'dem', 'Tisch']","['Die', 'Groschen', 'für', 'Claudia', 'liegen', 'auf', 'dem', 'Tisch', '.']","['der', 'Groschen', 'für', 'Claudia', 'liegen', 'auf', 'der', 'Tisch', '.']","['DET', 'NOUN', 'ADP', 'PROPN', 'VERB', 'ADP', 'DET', 'NOUN', 'PUNCT']",der Groschen für Claudia liegen auf der Tisch .,DET NOUN ADP PROPN VERB ADP DET NOUN PUNCT
Dark__S01E08.srt,Dark,Dark S01,Dark E08,107,"0:10:8,583","0:10:11,875",So eine Verbrennung sah ich noch nie.,so eine verbrennung sah ich noch nie.,"['so', 'noch', 'nie', 'eine', 'ich', 'verbrennung', 'sah']","['So', 'eine', 'Verbrennung', 'sah', 'ich', 'noch', 'nie']","['So', 'eine', 'Verbrennung', 'sah', 'ich', 'noch', 'nie', '.']","['so', 'einen', 'Verbrennung', 'sehen', 'ich', 'noch', 'nie', '.']","['ADV', 'DET', 'NOUN', 'VERB', 'PRON', 'ADV', 'ADV', 'PUNCT']",so einen Verbrennung sehen ich noch nie .,ADV DET NOUN VERB PRON ADV ADV PUNCT
Dark__S01E08.srt,Dark,Dark S01,Dark E08,108,"0:10:12,625","0:10:14,375",Vielleicht eine Brandgranate.,vielleicht eine brandgranate.,"['vielleicht', 'eine', 'brandgranate']","['Vielleicht', 'eine', 'Brandgranate']","['Vielleicht', 'eine', 'Brandgranate', '.']","['Vielleicht', 'einen', 'Brandgranate', '.']","['ADV', 'DET', 'NOUN', 'PUNCT']",Vielleicht einen Brandgranate .,ADV DET NOUN PUNCT
Dark__S01E08.srt,Dark,Dark S01,Dark E08,109,"0:10:15,125","0:10:18,417","Interessant auch, dass die Ohren völlig zerstört sind.","interessant auch, dass die ohren völlig zerstört sind.","['auch', 'interessant', 'sind', 'dass', 'die', 'völlig', 'ohren', 'zerstört']","['Interessant', 'auch', 'dass', 'die', 'Ohren', 'völlig', 'zerstört', 'sind']","['Interessant', 'auch', ',', 'dass', 'die', 'Ohren', 'völlig', 'zerstört', 'sind', '.']","['Interessant', 'auch', ',', 'dass', 'der', 'Ohr', 'völlig', 'zerstören', 'sein', '.']","['ADV', 'ADV', 'PUNCT', 'SCONJ', 'DET', 'NOUN', 'ADV', 'VERB', 'AUX', 'PUNCT']","Interessant auch , dass der Ohr völlig zerstören sein .",ADV ADV PUNCT SCONJ DET NOUN ADV VERB AUX PUNCT
