Unique_ID,Show_Name,Season,Episode,Line_Index,Start,End,Dialogue,Dialogue_lower,Dialogue_Set_Words,Dialogue_Words,Dialogue_Tokens_Text,Dialogue_Tokens_Lemmas,Dialogue_Tokens_POS_Tags,Dialogue_Lemmas_Pattern,Dialogue_POS_Tags_Pattern
Dark__S01E07.srt,Dark,Dark S01,Dark E07,221,"0:21:39,292","0:21:42,375",Polizei. Nur ein paar Fragen.  Ich kenne Sie!,polizei. nur ein paar fragen.  ich kenne sie!,"['polizei', 'sie', 'nur', 'ein', 'fragen', 'paar', 'kenne', 'ich']","['Polizei', 'Nur', 'ein', 'paar', 'Fragen', 'Ich', 'kenne', 'Sie']","['Polizei', '.', 'Nur', 'ein', 'paar', 'Fragen', '.', ' ', 'Ich', 'kenne', 'Sie', '!']","['Polizei', '.', 'Nur', 'einen', 'paar', 'Frage', '.', ' ', 'Ich', 'kennen', 'ich', '!']","['NOUN', 'PUNCT', 'ADV', 'DET', 'DET', 'NOUN', 'PUNCT', 'SPACE', 'PRON', 'VERB', 'PRON', 'PUNCT']",Polizei . Nur einen paar Frage .   Ich kennen ich !,NOUN PUNCT ADV DET DET NOUN PUNCT SPACE PRON VERB PRON PUNCT
Dark__S01E07.srt,Dark,Dark S01,Dark E07,222,"0:21:42,458","0:21:44,708",Was? Was haben Sie gerade gesagt?,was? was haben sie gerade gesagt?,"['gesagt', 'was', 'gerade', 'sie', 'haben']","['Was', 'Was', 'haben', 'Sie', 'gerade', 'gesagt']","['Was', '?', 'Was', 'haben', 'Sie', 'gerade', 'gesagt', '?']","['Was', '?', 'Was', 'haben', 'ich', 'gerade', 'sagen', '?']","['PRON', 'PUNCT', 'PRON', 'AUX', 'PRON', 'ADV', 'VERB', 'PUNCT']",Was ? Was haben ich gerade sagen ?,PRON PUNCT PRON AUX PRON ADV VERB PUNCT
Dark__S01E07.srt,Dark,Dark S01,Dark E07,223,"0:21:44,792","0:21:47,375",Gehen Sie! Warum waren Sie vorgeladen?,gehen sie! warum waren sie vorgeladen?,"['sie', 'gehen', 'waren', 'warum', 'vorgeladen']","['Gehen', 'Sie', 'Warum', 'waren', 'Sie', 'vorgeladen']","['Gehen', 'Sie', '!', 'Warum', 'waren', 'Sie', 'vorgeladen', '?']","['Gehen', 'ich', '!', 'warum', 'sein', 'ich', 'vorladen', '?']","['VERB', 'PRON', 'PUNCT', 'ADV', 'AUX', 'PRON', 'VERB', 'PUNCT']",Gehen ich ! warum sein ich vorladen ?,VERB PRON PUNCT ADV AUX PRON VERB PUNCT
Dark__S01E07.srt,Dark,Dark S01,Dark E07,224,"0:21:47,458","0:21:50,375",Ich kann die Vergangenheit ändern.,ich kann die vergangenheit ändern.,"['vergangenheit', 'die', 'ändern', 'kann', 'ich']","['Ich', 'kann', 'die', 'Vergangenheit', 'ändern']","['Ich', 'kann', 'die', 'Vergangenheit', 'ändern', '.']","['Ich', 'können', 'der', 'Vergangenheit', 'ändern', '.']","['PRON', 'AUX', 'DET', 'NOUN', 'VERB', 'PUNCT']",Ich können der Vergangenheit ändern .,PRON AUX DET NOUN VERB PUNCT
Dark__S01E07.srt,Dark,Dark S01,Dark E07,225,"0:21:50,792","0:21:51,958",Und die Zukunft.,und die zukunft.,"['und', 'zukunft', 'die']","['Und', 'die', 'Zukunft']","['Und', 'die', 'Zukunft', '.']","['und', 'der', 'Zukunft', '.']","['CCONJ', 'DET', 'NOUN', 'PUNCT']",und der Zukunft .,CCONJ DET NOUN PUNCT
Dark__S01E07.srt,Dark,Dark S01,Dark E07,226,"0:21:52,42","0:21:55,83",Was hast du gesagt? Wo ist Mikkel?,was hast du gesagt? wo ist mikkel?,"['gesagt', 'was', 'ist', 'du', 'hast', 'wo', 'mikkel']","['Was', 'hast', 'du', 'gesagt', 'Wo', 'ist', 'Mikkel']","['Was', 'hast', 'du', 'gesagt', '?', 'Wo', 'ist', 'Mikkel', '?']","['Was', 'haben', 'du', 'sagen', '?', 'wo', 'sein', 'Mikkel', '?']","['PRON', 'AUX', 'PRON', 'VERB', 'PUNCT', 'ADV', 'AUX', 'PROPN', 'PUNCT']",Was haben du sagen ? wo sein Mikkel ?,PRON AUX PRON VERB PUNCT ADV AUX PROPN PUNCT
Dark__S01E07.srt,Dark,Dark S01,Dark E07,227,"0:21:55,167","0:21:58,125",Lassen Sie ihn los! Wo ist mein Sohn?,lassen sie ihn los! wo ist mein sohn?,"['sie', 'ist', 'mein', 'lassen', 'ihn', 'wo', 'sohn', 'los']","['Lassen', 'Sie', 'ihn', 'los', 'Wo', 'ist', 'mein', 'Sohn']","['Lassen', 'Sie', 'ihn', 'los', '!', 'Wo', 'ist', 'mein', 'Sohn', '?']","['Lassen', 'ich', 'ich', 'los', '!', 'wo', 'sein', 'meinen', 'Sohn', '?']","['VERB', 'PRON', 'PRON', 'ADV', 'PUNCT', 'ADV', 'AUX', 'DET', 'NOUN', 'PUNCT']",Lassen ich ich los ! wo sein meinen Sohn ?,VERB PRON PRON ADV PUNCT ADV AUX DET NOUN PUNCT
Dark__S01E07.srt,Dark,Dark S01,Dark E07,228,"0:22:1,83","0:22:4,167","Lasst mich los! Sagen Sie mir, wo mein Sohn ist!","lasst mich los! sagen sie mir, wo mein sohn ist!","['mich', 'sie', 'mir', 'ist', 'sagen', 'lasst', 'mein', 'wo', 'sohn', 'los']","['Lasst', 'mich', 'los', 'Sagen', 'Sie', 'mir', 'wo', 'mein', 'Sohn', 'ist']","['Lasst', 'mich', 'los', '!', 'Sagen', 'Sie', 'mir', ',', 'wo', 'mein', 'Sohn', 'ist', '!']","['Lasst', 'sich', 'los', '!', 'Sage', 'ich', 'sich', ',', 'wo', 'meinen', 'Sohn', 'sein', '!']","['NOUN', 'PRON', 'ADV', 'PUNCT', 'VERB', 'PRON', 'PRON', 'PUNCT', 'SCONJ', 'DET', 'NOUN', 'AUX', 'PUNCT']","Lasst sich los ! Sage ich sich , wo meinen Sohn sein !",NOUN PRON ADV PUNCT VERB PRON PRON PUNCT SCONJ DET NOUN AUX PUNCT
Dark__S01E07.srt,Dark,Dark S01,Dark E07,229,"0:22:4,250","0:22:8,83",Wo ist mein Sohn? Wo ist Mikkel?  Lasst mich!,wo ist mein sohn? wo ist mikkel?  lasst mich!,"['mich', 'ist', 'mein', 'lasst', 'wo', 'sohn', 'mikkel']","['Wo', 'ist', 'mein', 'Sohn', 'Wo', 'ist', 'Mikkel', 'Lasst', 'mich']","['Wo', 'ist', 'mein', 'Sohn', '?', 'Wo', 'ist', 'Mikkel', '?', ' ', 'Lasst', 'mich', '!']","['wo', 'sein', 'meinen', 'Sohn', '?', 'wo', 'sein', 'Mikkel', '?', ' ', 'Lasst', 'sich', '!']","['ADV', 'AUX', 'DET', 'NOUN', 'PUNCT', 'ADV', 'AUX', 'PROPN', 'PUNCT', 'SPACE', 'NOUN', 'PRON', 'PUNCT']",wo sein meinen Sohn ? wo sein Mikkel ?   Lasst sich !,ADV AUX DET NOUN PUNCT ADV AUX PROPN PUNCT SPACE NOUN PRON PUNCT
Dark__S01E07.srt,Dark,Dark S01,Dark E07,230,"0:22:8,750","0:22:10,542",Ich kann das ändern.,ich kann das ändern.,"['ändern', 'kann', 'ich', 'das']","['Ich', 'kann', 'das', 'ändern']","['Ich', 'kann', 'das', 'ändern', '.']","['Ich', 'können', 'der', 'ändern', '.']","['PRON', 'AUX', 'PRON', 'VERB', 'PUNCT']",Ich können der ändern .,PRON AUX PRON VERB PUNCT
Dark__S01E07.srt,Dark,Dark S01,Dark E07,231,"0:22:11,583","0:22:13,542",Ich kann die Vergangenheit ändern.,ich kann die vergangenheit ändern.,"['vergangenheit', 'die', 'ändern', 'kann', 'ich']","['Ich', 'kann', 'die', 'Vergangenheit', 'ändern']","['Ich', 'kann', 'die', 'Vergangenheit', 'ändern', '.']","['Ich', 'können', 'der', 'Vergangenheit', 'ändern', '.']","['PRON', 'AUX', 'DET', 'NOUN', 'VERB', 'PUNCT']",Ich können der Vergangenheit ändern .,PRON AUX DET NOUN VERB PUNCT
Dark__S01E07.srt,Dark,Dark S01,Dark E07,232,"0:22:14,333","0:22:15,917",Und die Zukunft.,und die zukunft.,"['und', 'zukunft', 'die']","['Und', 'die', 'Zukunft']","['Und', 'die', 'Zukunft', '.']","['und', 'der', 'Zukunft', '.']","['CCONJ', 'DET', 'NOUN', 'PUNCT']",und der Zukunft .,CCONJ DET NOUN PUNCT
Dark__S01E07.srt,Dark,Dark S01,Dark E07,233,"0:22:17,0","0:22:18,417","Tick, tack.","tick, tack.","['tack', 'tick']","['Tick', 'tack']","['Tick', ',', 'tack', '.']","['Tick', ',', 'tack', '.']","['NOUN', 'PUNCT', 'ADV', 'PUNCT']","Tick , tack .",NOUN PUNCT ADV PUNCT
Dark__S01E07.srt,Dark,Dark S01,Dark E07,234,"0:22:18,958","0:22:20,167","Tick, tack.","tick, tack.","['tack', 'tick']","['Tick', 'tack']","['Tick', ',', 'tack', '.']","['Tick', ',', 'tack', '.']","['NOUN', 'PUNCT', 'ADV', 'PUNCT']","Tick , tack .",NOUN PUNCT ADV PUNCT
Dark__S01E07.srt,Dark,Dark S01,Dark E07,235,"0:22:20,750","0:22:22,208","Tick, tack.","tick, tack.","['tack', 'tick']","['Tick', 'tack']","['Tick', ',', 'tack', '.']","['Tick', ',', 'tack', '.']","['NOUN', 'PUNCT', 'ADV', 'PUNCT']","Tick , tack .",NOUN PUNCT ADV PUNCT
Dark__S01E07.srt,Dark,Dark S01,Dark E07,236,"0:22:22,875","0:22:24,625",Tick... tack.,tick... tack.,"['tack', 'tick']","['Tick', 'tack']","['Tick', '...', 'tack', '.']","['Tick', '...', 'tack', '.']","['NOUN', 'PUNCT', 'ADV', 'PUNCT']",Tick ... tack .,NOUN PUNCT ADV PUNCT
Dark__S01E07.srt,Dark,Dark S01,Dark E07,237,"0:22:27,208","0:22:29,458",Ich hab doch noch einen gefunden.,ich hab doch noch einen gefunden.,"['doch', 'gefunden', 'einen', 'ich', 'hab', 'noch']","['Ich', 'hab', 'doch', 'noch', 'einen', 'gefunden']","['Ich', 'hab', 'doch', 'noch', 'einen', 'gefunden', '.']","['Ich', 'hab', 'doch', 'noch', 'ein', 'finden', '.']","['PRON', 'VERB', 'ADV', 'ADV', 'DET', 'VERB', 'PUNCT']",Ich hab doch noch ein finden .,PRON VERB ADV ADV DET VERB PUNCT
Dark__S01E07.srt,Dark,Dark S01,Dark E07,238,"0:22:40,583","0:22:43,250",Wie wenig wir von der Welt verstehen.,wie wenig wir von der welt verstehen.,"['wenig', 'wir', 'welt', 'der', 'wie', 'verstehen', 'von']","['Wie', 'wenig', 'wir', 'von', 'der', 'Welt', 'verstehen']","['Wie', 'wenig', 'wir', 'von', 'der', 'Welt', 'verstehen', '.']","['Wie', 'wenig', 'ich', 'von', 'der', 'Welt', 'verstehen', '.']","['ADV', 'PRON', 'PRON', 'ADP', 'DET', 'NOUN', 'VERB', 'PUNCT']",Wie wenig ich von der Welt verstehen .,ADV PRON PRON ADP DET NOUN VERB PUNCT
Dark__S01E07.srt,Dark,Dark S01,Dark E07,239,"0:22:50,708","0:22:55,333","Ist das hier echt? Oder bin ich verrückt, wie mein Vater?","ist das hier echt? oder bin ich verrückt, wie mein vater?","['verrückt', 'oder', 'das', 'ist', 'bin', 'vater', 'hier', 'wie', 'echt', 'mein', 'ich']","['Ist', 'das', 'hier', 'echt', 'Oder', 'bin', 'ich', 'verrückt', 'wie', 'mein', 'Vater']","['Ist', 'das', 'hier', 'echt', '?', 'Oder', 'bin', 'ich', 'verrückt', ',', 'wie', 'mein', 'Vater', '?']","['sein', 'der', 'hier', 'echt', '?', 'Oder', 'sein', 'ich', 'verrücken', ',', 'wie', 'meinen', 'Vater', '?']","['AUX', 'PRON', 'ADV', 'ADV', 'PUNCT', 'CCONJ', 'AUX', 'PRON', 'ADV', 'PUNCT', 'SCONJ', 'DET', 'NOUN', 'PUNCT']","sein der hier echt ? Oder sein ich verrücken , wie meinen Vater ?",AUX PRON ADV ADV PUNCT CCONJ AUX PRON ADV PUNCT SCONJ DET NOUN PUNCT
Dark__S01E07.srt,Dark,Dark S01,Dark E07,240,"0:22:55,417","0:22:59,750","Existieren Sie, oder sind Sie eine Wahnvorstellung von einem Bekloppten?","existieren sie, oder sind sie eine wahnvorstellung von einem bekloppten?","['wahnvorstellung', 'sie', 'oder', 'eine', 'sind', 'einem', 'bekloppten', 'existieren', 'von']","['Existieren', 'Sie', 'oder', 'sind', 'Sie', 'eine', 'Wahnvorstellung', 'von', 'einem', 'Bekloppten']","['Existieren', 'Sie', ',', 'oder', 'sind', 'Sie', 'eine', 'Wahnvorstellung', 'von', 'einem', 'Bekloppten', '?']","['Existieren', 'ich', ',', 'oder', 'sein', 'ich', 'einen', 'Wahnvorstellung', 'von', 'einer', 'Bekloppte', '?']","['VERB', 'PRON', 'PUNCT', 'CCONJ', 'AUX', 'PRON', 'DET', 'NOUN', 'ADP', 'DET', 'NOUN', 'PUNCT']","Existieren ich , oder sein ich einen Wahnvorstellung von einer Bekloppte ?",VERB PRON PUNCT CCONJ AUX PRON DET NOUN ADP DET NOUN PUNCT
Dark__S01E07.srt,Dark,Dark S01,Dark E07,241,"0:22:59,833","0:23:2,417",Du bist genauso wenig verrückt wie dein Vater.,du bist genauso wenig verrückt wie dein vater.,"['verrückt', 'wenig', 'vater', 'du', 'genauso', 'wie', 'dein', 'bist']","['Du', 'bist', 'genauso', 'wenig', 'verrückt', 'wie', 'dein', 'Vater']","['Du', 'bist', 'genauso', 'wenig', 'verrückt', 'wie', 'dein', 'Vater', '.']","['Du', 'sein', 'genauso', 'wenig', 'verrücken', 'wie', 'mein', 'Vater', '.']","['PRON', 'AUX', 'ADV', 'ADV', 'ADV', 'ADP', 'DET', 'NOUN', 'PUNCT']",Du sein genauso wenig verrücken wie mein Vater .,PRON AUX ADV ADV ADV ADP DET NOUN PUNCT
Dark__S01E07.srt,Dark,Dark S01,Dark E07,242,"0:23:2,500","0:23:3,958","Es ist schwer, zu begreifen,","es ist schwer, zu begreifen,","['begreifen', 'ist', 'schwer', 'zu', 'es']","['Es', 'ist', 'schwer', 'zu', 'begreifen']","['Es', 'ist', 'schwer', ',', 'zu', 'begreifen', ',']","['ich', 'sein', 'schwer', ',', 'zu', 'begreifen', ',']","['PRON', 'AUX', 'ADV', 'PUNCT', 'PART', 'VERB', 'PUNCT']","ich sein schwer , zu begreifen ,",PRON AUX ADV PUNCT PART VERB PUNCT
Dark__S01E07.srt,Dark,Dark S01,Dark E07,243,"0:23:4,42","0:23:7,333","was gegen das spricht, wozu der Verstand konditioniert ist.","was gegen das spricht, wozu der verstand konditioniert ist.","['was', 'das', 'ist', 'der', 'verstand', 'spricht', 'wozu', 'gegen', 'konditioniert']","['was', 'gegen', 'das', 'spricht', 'wozu', 'der', 'Verstand', 'konditioniert', 'ist']","['was', 'gegen', 'das', 'spricht', ',', 'wozu', 'der', 'Verstand', 'konditioniert', 'ist', '.']","['was', 'gegen', 'der', 'sprechen', ',', 'wozu', 'der', 'Verstand', 'konditionieren', 'sein', '.']","['PRON', 'ADP', 'PRON', 'VERB', 'PUNCT', 'SCONJ', 'DET', 'NOUN', 'VERB', 'AUX', 'PUNCT']","was gegen der sprechen , wozu der Verstand konditionieren sein .",PRON ADP PRON VERB PUNCT SCONJ DET NOUN VERB AUX PUNCT
Dark__S01E07.srt,Dark,Dark S01,Dark E07,244,"0:23:7,833","0:23:11,667","Wie war es wohl für die Menschen, als es hieß, die Erde sei eine Kugel?","wie war es wohl für die menschen, als es hieß, die erde sei eine kugel?","['für', 'menschen', 'erde', 'sei', 'wie', 'die', 'eine', 'als', 'hieß', 'wohl', 'kugel', 'war', 'es']","['Wie', 'war', 'es', 'wohl', 'für', 'die', 'Menschen', 'als', 'es', 'hieß', 'die', 'Erde', 'sei', 'eine', 'Kugel']","['Wie', 'war', 'es', 'wohl', 'für', 'die', 'Menschen', ',', 'als', 'es', 'hieß', ',', 'die', 'Erde', 'sei', 'eine', 'Kugel', '?']","['Wie', 'sein', 'ich', 'wohl', 'für', 'der', 'Mensch', ',', 'als', 'ich', 'heißen', ',', 'der', 'Erde', 'sein', 'einen', 'Kugel', '?']","['ADV', 'AUX', 'PRON', 'ADV', 'ADP', 'DET', 'NOUN', 'PUNCT', 'SCONJ', 'PRON', 'VERB', 'PUNCT', 'DET', 'NOUN', 'AUX', 'DET', 'NOUN', 'PUNCT']","Wie sein ich wohl für der Mensch , als ich heißen , der Erde sein einen Kugel ?",ADV AUX PRON ADV ADP DET NOUN PUNCT SCONJ PRON VERB PUNCT DET NOUN AUX DET NOUN PUNCT
Dark__S01E07.srt,Dark,Dark S01,Dark E07,246,"0:23:14,625","0:23:17,583",Doch. Das ist total verrückt. Und wenn nicht?,doch. das ist total verrückt. und wenn nicht?,"['doch', 'verrückt', 'ist', 'das', 'wenn', 'total', 'nicht', 'und']","['Doch', 'Das', 'ist', 'total', 'verrückt', 'Und', 'wenn', 'nicht']","['Doch', '.', 'Das', 'ist', 'total', 'verrückt', '.', 'Und', 'wenn', 'nicht', '?']","['doch', '.', 'der', 'sein', 'total', 'verrücken', '.', 'und', 'wenn', 'nicht', '?']","['CCONJ', 'PUNCT', 'PRON', 'AUX', 'ADV', 'ADV', 'PUNCT', 'CCONJ', 'SCONJ', 'PART', 'PUNCT']",doch . der sein total verrücken . und wenn nicht ?,CCONJ PUNCT PRON AUX ADV ADV PUNCT CCONJ SCONJ PART PUNCT
Dark__S01E07.srt,Dark,Dark S01,Dark E07,247,"0:23:18,208","0:23:21,833",Wie soll das gehen? In der Höhle ist ein Riss in der Zeit?,wie soll das gehen? in der höhle ist ein riss in der zeit?,"['höhle', 'zeit', 'gehen', 'das', 'ist', 'der', 'ein', 'wie', 'soll', 'in', 'riss']","['Wie', 'soll', 'das', 'gehen', 'In', 'der', 'Höhle', 'ist', 'ein', 'Riss', 'in', 'der', 'Zeit']","['Wie', 'soll', 'das', 'gehen', '?', 'In', 'der', 'Höhle', 'ist', 'ein', 'Riss', 'in', 'der', 'Zeit', '?']","['Wie', 'soll', 'der', 'gehen', '?', 'In', 'der', 'Höhle', 'sein', 'einen', 'Riss', 'in', 'der', 'Zeit', '?']","['ADV', 'AUX', 'PRON', 'VERB', 'PUNCT', 'ADP', 'DET', 'NOUN', 'AUX', 'DET', 'NOUN', 'ADP', 'DET', 'NOUN', 'PUNCT']",Wie soll der gehen ? In der Höhle sein einen Riss in der Zeit ?,ADV AUX PRON VERB PUNCT ADP DET NOUN AUX DET NOUN ADP DET NOUN PUNCT
Dark__S01E07.srt,Dark,Dark S01,Dark E07,248,"0:23:21,917","0:23:24,333",Und Mikkel ist hier und wird zu meinem Vater?,und mikkel ist hier und wird zu meinem vater?,"['mikkel', 'ist', 'vater', 'hier', 'wird', 'meinem', 'zu', 'und']","['Und', 'Mikkel', 'ist', 'hier', 'und', 'wird', 'zu', 'meinem', 'Vater']","['Und', 'Mikkel', 'ist', 'hier', 'und', 'wird', 'zu', 'meinem', 'Vater', '?']","['und', 'Mikkel', 'sein', 'hier', 'und', 'werden', 'zu', 'mein', 'Vater', '?']","['CCONJ', 'PROPN', 'AUX', 'ADV', 'CCONJ', 'AUX', 'ADP', 'DET', 'NOUN', 'PUNCT']",und Mikkel sein hier und werden zu mein Vater ?,CCONJ PROPN AUX ADV CCONJ AUX ADP DET NOUN PUNCT
Dark__S01E07.srt,Dark,Dark S01,Dark E07,249,"0:23:24,417","0:23:27,583","Auch wenn du es jetzt nicht glaubst, das da ist dein Vater.","auch wenn du es jetzt nicht glaubst, das da ist dein vater.","['auch', 'das', 'ist', 'du', 'vater', 'wenn', 'dein', 'da', 'glaubst', 'jetzt', 'nicht', 'es']","['Auch', 'wenn', 'du', 'es', 'jetzt', 'nicht', 'glaubst', 'das', 'da', 'ist', 'dein', 'Vater']","['Auch', 'wenn', 'du', 'es', 'jetzt', 'nicht', 'glaubst', ',', 'das', 'da', 'ist', 'dein', 'Vater', '.']","['Auch', 'wenn', 'du', 'ich', 'jetzt', 'nicht', 'glauben', ',', 'der', 'da', 'sein', 'mein', 'Vater', '.']","['ADV', 'SCONJ', 'PRON', 'PRON', 'ADV', 'PART', 'ADV', 'PUNCT', 'PRON', 'ADV', 'AUX', 'DET', 'NOUN', 'PUNCT']","Auch wenn du ich jetzt nicht glauben , der da sein mein Vater .",ADV SCONJ PRON PRON ADV PART ADV PUNCT PRON ADV AUX DET NOUN PUNCT
Dark__S01E07.srt,Dark,Dark S01,Dark E07,250,"0:23:36,125","0:23:37,375",Das bedeutet...,das bedeutet...,"['bedeutet', 'das']","['Das', 'bedeutet']","['Das', 'bedeutet', '...']","['der', 'bedeuten', '...']","['PRON', 'VERB', 'PUNCT']",der bedeuten ...,PRON VERB PUNCT
Dark__S01E07.srt,Dark,Dark S01,Dark E07,251,"0:23:39,625","0:23:41,958",...dass Ulrich mein Großvater ist und...,...dass ulrich mein großvater ist und...,"['ulrich', 'ist', 'mein', 'dass', 'großvater', 'und']","['dass', 'Ulrich', 'mein', 'Großvater', 'ist', 'und']","['...', 'dass', 'Ulrich', 'mein', 'Großvater', 'ist', 'und', '...']","['...', 'dass', 'Ulrich', 'meinen', 'Großvater', 'sein', 'und', '...']","['PUNCT', 'SCONJ', 'PROPN', 'DET', 'NOUN', 'AUX', 'CCONJ', 'PUNCT']",... dass Ulrich meinen Großvater sein und ...,PUNCT SCONJ PROPN DET NOUN AUX CCONJ PUNCT
Dark__S01E07.srt,Dark,Dark S01,Dark E07,252,"0:23:42,833","0:23:44,458",...Martha deine Tante.,...martha deine tante.,"['deine', 'martha', 'tante']","['Martha', 'deine', 'Tante']","['...', 'Martha', 'deine', 'Tante', '.']","['...', 'Martha', 'mein', 'Tante', '.']","['PUNCT', 'PROPN', 'DET', 'NOUN', 'PUNCT']",... Martha mein Tante .,PUNCT PROPN DET NOUN PUNCT
Dark__S01E07.srt,Dark,Dark S01,Dark E07,253,"0:23:46,667","0:23:47,833",Das ist Schwachsinn!,das ist schwachsinn!,"['schwachsinn', 'ist', 'das']","['Das', 'ist', 'Schwachsinn']","['Das', 'ist', 'Schwachsinn', '!']","['der', 'sein', 'Schwachsinn', '!']","['PRON', 'AUX', 'NOUN', 'PUNCT']",der sein Schwachsinn !,PRON AUX NOUN PUNCT
Dark__S01E07.srt,Dark,Dark S01,Dark E07,254,"0:23:49,917","0:23:52,42",Ich bringe Mikkel wieder zurück.,ich bringe mikkel wieder zurück.,"['zurück', 'wieder', 'mikkel', 'ich', 'bringe']","['Ich', 'bringe', 'Mikkel', 'wieder', 'zurück']","['Ich', 'bringe', 'Mikkel', 'wieder', 'zurück', '.']","['Ich', 'bringen', 'Mikkel', 'wieder', 'zurück', '.']","['PRON', 'VERB', 'PROPN', 'ADV', 'ADV', 'PUNCT']",Ich bringen Mikkel wieder zurück .,PRON VERB PROPN ADV ADV PUNCT
Dark__S01E07.srt,Dark,Dark S01,Dark E07,255,"0:23:52,125","0:23:53,792",Hast du es nicht verstanden?,hast du es nicht verstanden?,"['du', 'verstanden', 'hast', 'nicht', 'es']","['Hast', 'du', 'es', 'nicht', 'verstanden']","['Hast', 'du', 'es', 'nicht', 'verstanden', '?']","['haben', 'du', 'ich', 'nicht', 'verstehen', '?']","['VERB', 'PRON', 'PRON', 'PART', 'VERB', 'PUNCT']",haben du ich nicht verstehen ?,VERB PRON PRON PART VERB PUNCT
Dark__S01E07.srt,Dark,Dark S01,Dark E07,256,"0:23:54,667","0:23:57,917","Wenn du das jetzt tust, greifst du in den Lauf der Dinge ein.","wenn du das jetzt tust, greifst du in den lauf der dinge ein.","['tust', 'das', 'du', 'lauf', 'wenn', 'der', 'ein', 'greifst', 'den', 'jetzt', 'in', 'dinge']","['Wenn', 'du', 'das', 'jetzt', 'tust', 'greifst', 'du', 'in', 'den', 'Lauf', 'der', 'Dinge', 'ein']","['Wenn', 'du', 'das', 'jetzt', 'tust', ',', 'greifst', 'du', 'in', 'den', 'Lauf', 'der', 'Dinge', 'ein', '.']","['Wenn', 'du', 'der', 'jetzt', 'tun', ',', 'greifen', 'du', 'in', 'der', 'Lauf', 'der', 'Ding', 'einen', '.']","['SCONJ', 'PRON', 'PRON', 'ADV', 'VERB', 'PUNCT', 'ADV', 'PRON', 'ADP', 'DET', 'NOUN', 'DET', 'NOUN', 'ADV', 'PUNCT']","Wenn du der jetzt tun , greifen du in der Lauf der Ding einen .",SCONJ PRON PRON ADV VERB PUNCT ADV PRON ADP DET NOUN DET NOUN ADV PUNCT
Dark__S01E07.srt,Dark,Dark S01,Dark E07,257,"0:23:59,250","0:24:2,333","Deine Eltern verlieben sich nicht, sie heiraten nicht.","deine eltern verlieben sich nicht, sie heiraten nicht.","['sie', 'eltern', 'sich', 'heiraten', 'deine', 'nicht', 'verlieben']","['Deine', 'Eltern', 'verlieben', 'sich', 'nicht', 'sie', 'heiraten', 'nicht']","['Deine', 'Eltern', 'verlieben', 'sich', 'nicht', ',', 'sie', 'heiraten', 'nicht', '.']","['mein', 'Eltern', 'verlieben', 'sich', 'nicht', ',', 'ich', 'heiraten', 'nicht', '.']","['DET', 'NOUN', 'VERB', 'PRON', 'PART', 'PUNCT', 'PRON', 'VERB', 'PART', 'PUNCT']","mein Eltern verlieben sich nicht , ich heiraten nicht .",DET NOUN VERB PRON PART PUNCT PRON VERB PART PUNCT
Dark__S01E07.srt,Dark,Dark S01,Dark E07,258,"0:24:2,417","0:24:4,958",Und du wirst nicht geboren!,und du wirst nicht geboren!,"['geboren', 'du', 'nicht', 'wirst', 'und']","['Und', 'du', 'wirst', 'nicht', 'geboren']","['Und', 'du', 'wirst', 'nicht', 'geboren', '!']","['und', 'du', 'werden', 'nicht', 'gebären', '!']","['CCONJ', 'PRON', 'AUX', 'PART', 'VERB', 'PUNCT']",und du werden nicht gebären !,CCONJ PRON AUX PART VERB PUNCT
Dark__S01E07.srt,Dark,Dark S01,Dark E07,259,"0:24:6,875","0:24:10,917","Bringst du ihn jetzt zurück, löschst du deine eigene Existenz aus.","bringst du ihn jetzt zurück, löschst du deine eigene existenz aus.","['löschst', 'deine', 'zurück', 'du', 'aus', 'eigene', 'existenz', 'jetzt', 'ihn', 'bringst']","['Bringst', 'du', 'ihn', 'jetzt', 'zurück', 'löschst', 'du', 'deine', 'eigene', 'Existenz', 'aus']","['Bringst', 'du', 'ihn', 'jetzt', 'zurück', ',', 'löschst', 'du', 'deine', 'eigene', 'Existenz', 'aus', '.']","['Bringst', 'du', 'ich', 'jetzt', 'zurück', ',', 'löschen', 'du', 'mein', 'eigene', 'Existenz', 'aus', '.']","['ADV', 'PRON', 'PRON', 'ADV', 'ADV', 'PUNCT', 'VERB', 'PRON', 'DET', 'ADJ', 'NOUN', 'ADP', 'PUNCT']","Bringst du ich jetzt zurück , löschen du mein eigene Existenz aus .",ADV PRON PRON ADV ADV PUNCT VERB PRON DET ADJ NOUN ADP PUNCT
Dark__S01E07.srt,Dark,Dark S01,Dark E07,260,"0:24:12,250","0:24:15,375","Deine Rolle in all dem ist viel größer, als du denkst.","deine rolle in all dem ist viel größer, als du denkst.","['rolle', 'dem', 'ist', 'du', 'all', 'als', 'denkst', 'in', 'deine', 'größer', 'viel']","['Deine', 'Rolle', 'in', 'all', 'dem', 'ist', 'viel', 'größer', 'als', 'du', 'denkst']","['Deine', 'Rolle', 'in', 'all', 'dem', 'ist', 'viel', 'größer', ',', 'als', 'du', 'denkst', '.']","['mein', 'Rolle', 'in', 'all', 'der', 'sein', 'viel', 'groß', ',', 'als', 'du', 'denken', '.']","['ADJ', 'NOUN', 'ADP', 'DET', 'PRON', 'AUX', 'ADV', 'ADV', 'PUNCT', 'SCONJ', 'PRON', 'VERB', 'PUNCT']","mein Rolle in all der sein viel groß , als du denken .",ADJ NOUN ADP DET PRON AUX ADV ADV PUNCT SCONJ PRON VERB PUNCT
Dark__S01E07.srt,Dark,Dark S01,Dark E07,261,"0:24:19,833","0:24:24,292",Aber jede Entscheidung für etwas ist auch eine Entscheidung gegen etwas.,aber jede entscheidung für etwas ist auch eine entscheidung gegen etwas.,"['für', 'auch', 'ist', 'eine', 'aber', 'entscheidung', 'gegen', 'jede', 'etwas']","['Aber', 'jede', 'Entscheidung', 'für', 'etwas', 'ist', 'auch', 'eine', 'Entscheidung', 'gegen', 'etwas']","['Aber', 'jede', 'Entscheidung', 'für', 'etwas', 'ist', 'auch', 'eine', 'Entscheidung', 'gegen', 'etwas', '.']","['aber', 'jed', 'Entscheidung', 'für', 'etwas', 'sein', 'auch', 'einen', 'Entscheidung', 'gegen', 'etwas', '.']","['CCONJ', 'DET', 'NOUN', 'ADP', 'PRON', 'AUX', 'ADV', 'DET', 'NOUN', 'ADP', 'PRON', 'PUNCT']",aber jed Entscheidung für etwas sein auch einen Entscheidung gegen etwas .,CCONJ DET NOUN ADP PRON AUX ADV DET NOUN ADP PRON PUNCT
Dark__S01E07.srt,Dark,Dark S01,Dark E07,262,"0:24:29,83","0:24:31,625",Ein Leben für ein Leben.,ein leben für ein leben.,"['für', 'leben', 'ein']","['Ein', 'Leben', 'für', 'ein', 'Leben']","['Ein', 'Leben', 'für', 'ein', 'Leben', '.']","['Ein', 'Leben', 'für', 'einen', 'Leben', '.']","['DET', 'NOUN', 'ADP', 'DET', 'NOUN', 'PUNCT']",Ein Leben für einen Leben .,DET NOUN ADP DET NOUN PUNCT
Dark__S01E07.srt,Dark,Dark S01,Dark E07,263,"0:24:33,333","0:24:35,42",Wofür entscheidest du dich?,wofür entscheidest du dich?,"['entscheidest', 'du', 'wofür', 'dich']","['Wofür', 'entscheidest', 'du', 'dich']","['Wofür', 'entscheidest', 'du', 'dich', '?']","['Wofür', 'entscheiden', 'du', 'sich', '?']","['ADV', 'ADV', 'PRON', 'PRON', 'PUNCT']",Wofür entscheiden du sich ?,ADV ADV PRON PRON PUNCT
Dark__S01E07.srt,Dark,Dark S01,Dark E07,265,"0:24:58,375","0:25:1,208","Was soll das? Erst das AKW, jetzt das.","was soll das? erst das akw, jetzt das.","['was', 'erst', 'das', 'jetzt', 'soll', 'akw']","['Was', 'soll', 'das', 'Erst', 'das', 'AKW', 'jetzt', 'das']","['Was', 'soll', 'das', '?', 'Erst', 'das', 'AKW', ',', 'jetzt', 'das', '.']","['Was', 'soll', 'der', '?', 'Erst', 'der', 'AKW', ',', 'jetzt', 'der', '.']","['PRON', 'AUX', 'PRON', 'PUNCT', 'ADV', 'DET', 'NOUN', 'PUNCT', 'ADV', 'PRON', 'PUNCT']","Was soll der ? Erst der AKW , jetzt der .",PRON AUX PRON PUNCT ADV DET NOUN PUNCT ADV PRON PUNCT
Dark__S01E07.srt,Dark,Dark S01,Dark E07,266,"0:25:2,625","0:25:6,292",Ich muss dich suspendieren. Die Ereignisse machen keinen Sinn.,ich muss dich suspendieren. die ereignisse machen keinen sinn.,"['ereignisse', 'suspendieren', 'keinen', 'dich', 'muss', 'die', 'machen', 'sinn', 'ich']","['Ich', 'muss', 'dich', 'suspendieren', 'Die', 'Ereignisse', 'machen', 'keinen', 'Sinn']","['Ich', 'muss', 'dich', 'suspendieren', '.', 'Die', 'Ereignisse', 'machen', 'keinen', 'Sinn', '.']","['Ich', 'muss', 'sich', 'suspendieren', '.', 'der', 'Ereignis', 'machen', 'kein', 'Sinn', '.']","['PRON', 'VERB', 'PRON', 'VERB', 'PUNCT', 'DET', 'NOUN', 'VERB', 'DET', 'NOUN', 'PUNCT']",Ich muss sich suspendieren . der Ereignis machen kein Sinn .,PRON VERB PRON VERB PUNCT DET NOUN VERB DET NOUN PUNCT
Dark__S01E07.srt,Dark,Dark S01,Dark E07,267,"0:25:7,167","0:25:9,208",Vielleicht werde ich auch verrückt.,vielleicht werde ich auch verrückt.,"['verrückt', 'auch', 'vielleicht', 'werde', 'ich']","['Vielleicht', 'werde', 'ich', 'auch', 'verrückt']","['Vielleicht', 'werde', 'ich', 'auch', 'verrückt', '.']","['Vielleicht', 'werden', 'ich', 'auch', 'verrücken', '.']","['ADV', 'AUX', 'PRON', 'ADV', 'ADV', 'PUNCT']",Vielleicht werden ich auch verrücken .,ADV AUX PRON ADV ADV PUNCT
