Unique_ID,Show_Name,Season,Episode,Line_Index,Start,End,Dialogue,Dialogue_lower,Dialogue_Set_Words,Dialogue_Words,Dialogue_Tokens_Text,Dialogue_Tokens_Lemmas,Dialogue_Tokens_POS_Tags,Dialogue_Lemmas_Pattern,Dialogue_POS_Tags_Pattern
Dark__S01E06.srt,Dark,Dark S01,Dark E06,222,"0:22:12,708","0:22:14,292",Mhm.,mhm.,['mhm'],['Mhm'],"['Mhm', '.']","['Mhm', '.']","['PROPN', 'PUNCT']",Mhm .,PROPN PUNCT
Dark__S01E06.srt,Dark,Dark S01,Dark E06,223,"0:22:19,583","0:22:20,917","Mads war der Einzige,","mads war der einzige,","['der', 'mads', 'war', 'einzige']","['Mads', 'war', 'der', 'Einzige']","['Mads', 'war', 'der', 'Einzige', ',']","['Mads', 'sein', 'der', 'Einzige', ',']","['PROPN', 'AUX', 'DET', 'NOUN', 'PUNCT']","Mads sein der Einzige ,",PROPN AUX DET NOUN PUNCT
Dark__S01E06.srt,Dark,Dark S01,Dark E06,224,"0:22:21,0","0:22:23,792",der nie ein schlechtes Wort über andere sprach.,der nie ein schlechtes wort über andere sprach.,"['andere', 'schlechtes', 'der', 'wort', 'nie', 'ein', 'über', 'sprach']","['der', 'nie', 'ein', 'schlechtes', 'Wort', 'über', 'andere', 'sprach']","['der', 'nie', 'ein', 'schlechtes', 'Wort', 'über', 'andere', 'sprach', '.']","['der', 'nie', 'einen', 'schlecht', 'Wort', 'über', 'ander', 'sprechen', '.']","['DET', 'ADV', 'DET', 'ADJ', 'NOUN', 'ADP', 'PRON', 'VERB', 'PUNCT']",der nie einen schlecht Wort über ander sprechen .,DET ADV DET ADJ NOUN ADP PRON VERB PUNCT
Dark__S01E06.srt,Dark,Dark S01,Dark E06,225,"0:22:26,458","0:22:29,208","Ich habe mich immer gefragt, warum gerade er.","ich habe mich immer gefragt, warum gerade er.","['mich', 'gerade', 'immer', 'gefragt', 'warum', 'habe', 'er', 'ich']","['Ich', 'habe', 'mich', 'immer', 'gefragt', 'warum', 'gerade', 'er']","['Ich', 'habe', 'mich', 'immer', 'gefragt', ',', 'warum', 'gerade', 'er', '.']","['Ich', 'habe', 'sich', 'immer', 'fragen', ',', 'warum', 'gerade', 'ich', '.']","['PRON', 'AUX', 'PRON', 'ADV', 'VERB', 'PUNCT', 'SCONJ', 'ADV', 'PRON', 'PUNCT']","Ich habe sich immer fragen , warum gerade ich .",PRON AUX PRON ADV VERB PUNCT SCONJ ADV PRON PUNCT
Dark__S01E06.srt,Dark,Dark S01,Dark E06,226,"0:22:31,542","0:22:35,333","Ich habe mir immer vorgestellt, dass es dich hätte treffen sollen.","ich habe mir immer vorgestellt, dass es dich hätte treffen sollen.","['hätte', 'mir', 'immer', 'sollen', 'dich', 'treffen', 'dass', 'habe', 'vorgestellt', 'ich', 'es']","['Ich', 'habe', 'mir', 'immer', 'vorgestellt', 'dass', 'es', 'dich', 'hätte', 'treffen', 'sollen']","['Ich', 'habe', 'mir', 'immer', 'vorgestellt', ',', 'dass', 'es', 'dich', 'hätte', 'treffen', 'sollen', '.']","['Ich', 'habe', 'sich', 'immer', 'vorstellen', ',', 'dass', 'ich', 'sich', 'haben', 'treffen', 'sollen', '.']","['PRON', 'AUX', 'PRON', 'ADV', 'VERB', 'PUNCT', 'SCONJ', 'PRON', 'PRON', 'AUX', 'VERB', 'AUX', 'PUNCT']","Ich habe sich immer vorstellen , dass ich sich haben treffen sollen .",PRON AUX PRON ADV VERB PUNCT SCONJ PRON PRON AUX VERB AUX PUNCT
Dark__S01E06.srt,Dark,Dark S01,Dark E06,227,"0:22:36,42","0:22:38,333",Aber die Welt ist eben nicht gerecht.,aber die welt ist eben nicht gerecht.,"['gerecht', 'ist', 'welt', 'die', 'aber', 'eben', 'nicht']","['Aber', 'die', 'Welt', 'ist', 'eben', 'nicht', 'gerecht']","['Aber', 'die', 'Welt', 'ist', 'eben', 'nicht', 'gerecht', '.']","['aber', 'der', 'Welt', 'sein', 'eben', 'nicht', 'gerecht', '.']","['CCONJ', 'DET', 'NOUN', 'AUX', 'ADV', 'PART', 'ADV', 'PUNCT']",aber der Welt sein eben nicht gerecht .,CCONJ DET NOUN AUX ADV PART ADV PUNCT
Dark__S01E06.srt,Dark,Dark S01,Dark E06,228,"0:22:38,417","0:22:40,292","Und das Absurde ist,","und das absurde ist,","['und', 'ist', 'absurde', 'das']","['Und', 'das', 'Absurde', 'ist']","['Und', 'das', 'Absurde', 'ist', ',']","['und', 'der', 'Absurde', 'sein', ',']","['CCONJ', 'DET', 'NOUN', 'AUX', 'PUNCT']","und der Absurde sein ,",CCONJ DET NOUN AUX PUNCT
Dark__S01E06.srt,Dark,Dark S01,Dark E06,229,"0:22:40,375","0:22:44,542",dass Mads ohne dich und Katharina vielleicht nie verschwunden wäre.,dass mads ohne dich und katharina vielleicht nie verschwunden wäre.,"['dich', 'nie', 'dass', 'und', 'verschwunden', 'vielleicht', 'wäre', 'katharina', 'ohne', 'mads']","['dass', 'Mads', 'ohne', 'dich', 'und', 'Katharina', 'vielleicht', 'nie', 'verschwunden', 'wäre']","['dass', 'Mads', 'ohne', 'dich', 'und', 'Katharina', 'vielleicht', 'nie', 'verschwunden', 'wäre', '.']","['dass', 'Mads', 'ohne', 'sich', 'und', 'Katharina', 'vielleicht', 'nie', 'verschwinden', 'sein', '.']","['SCONJ', 'PROPN', 'ADP', 'PRON', 'CCONJ', 'PROPN', 'ADV', 'ADV', 'VERB', 'AUX', 'PUNCT']",dass Mads ohne sich und Katharina vielleicht nie verschwinden sein .,SCONJ PROPN ADP PRON CCONJ PROPN ADV ADV VERB AUX PUNCT
Dark__S01E06.srt,Dark,Dark S01,Dark E06,230,"0:22:44,625","0:22:48,417","Mads wusste, dass ich mich nicht allein nach Hause traue wegen euch.","mads wusste, dass ich mich nicht allein nach hause traue wegen euch.","['mich', 'nach', 'wegen', 'allein', 'euch', 'wusste', 'dass', 'hause', 'traue', 'nicht', 'mads', 'ich']","['Mads', 'wusste', 'dass', 'ich', 'mich', 'nicht', 'allein', 'nach', 'Hause', 'traue', 'wegen', 'euch']","['Mads', 'wusste', ',', 'dass', 'ich', 'mich', 'nicht', 'allein', 'nach', 'Hause', 'traue', 'wegen', 'euch', '.']","['Mads', 'wusste', ',', 'dass', 'ich', 'sich', 'nicht', 'allein', 'nach', 'Haus', 'trauen', 'wegen', 'sich', '.']","['PROPN', 'VERB', 'PUNCT', 'SCONJ', 'PRON', 'PRON', 'PART', 'ADV', 'ADP', 'NOUN', 'VERB', 'ADP', 'PRON', 'PUNCT']","Mads wusste , dass ich sich nicht allein nach Haus trauen wegen sich .",PROPN VERB PUNCT SCONJ PRON PRON PART ADV ADP NOUN VERB ADP PRON PUNCT
Dark__S01E06.srt,Dark,Dark S01,Dark E06,231,"0:22:48,500","0:22:51,250","Wegen dem, was ihr mit mir gemacht habt.","wegen dem, was ihr mit mir gemacht habt.","['was', 'dem', 'wegen', 'mir', 'habt', 'ihr', 'mit', 'gemacht']","['Wegen', 'dem', 'was', 'ihr', 'mit', 'mir', 'gemacht', 'habt']","['Wegen', 'dem', ',', 'was', 'ihr', 'mit', 'mir', 'gemacht', 'habt', '.']","['Weg', 'der', ',', 'was', 'mein', 'mit', 'sich', 'machen', 'haben', '.']","['ADP', 'PRON', 'PUNCT', 'PRON', 'PRON', 'ADP', 'PRON', 'VERB', 'AUX', 'PUNCT']","Weg der , was mein mit sich machen haben .",ADP PRON PUNCT PRON PRON ADP PRON VERB AUX PUNCT
Dark__S01E06.srt,Dark,Dark S01,Dark E06,232,"0:22:51,333","0:22:55,542",Sonst hätte er mich nicht begleitet und wäre nicht durch den Wald gegangen.,sonst hätte er mich nicht begleitet und wäre nicht durch den wald gegangen.,"['mich', 'hätte', 'gegangen', 'sonst', 'durch', 'begleitet', 'wäre', 'den', 'nicht', 'wald', 'und', 'er']","['Sonst', 'hätte', 'er', 'mich', 'nicht', 'begleitet', 'und', 'wäre', 'nicht', 'durch', 'den', 'Wald', 'gegangen']","['Sonst', 'hätte', 'er', 'mich', 'nicht', 'begleitet', 'und', 'wäre', 'nicht', 'durch', 'den', 'Wald', 'gegangen', '.']","['Sonst', 'haben', 'ich', 'sich', 'nicht', 'begleiten', 'und', 'sein', 'nicht', 'durch', 'der', 'Wald', 'gehen', '.']","['ADV', 'AUX', 'PRON', 'PRON', 'PART', 'VERB', 'CCONJ', 'AUX', 'PART', 'ADP', 'DET', 'NOUN', 'VERB', 'PUNCT']",Sonst haben ich sich nicht begleiten und sein nicht durch der Wald gehen .,ADV AUX PRON PRON PART VERB CCONJ AUX PART ADP DET NOUN VERB PUNCT
Dark__S01E06.srt,Dark,Dark S01,Dark E06,233,"0:22:55,625","0:22:58,458",Und das Ganze wäre wahrscheinlich nie passiert.,und das ganze wäre wahrscheinlich nie passiert.,"['das', 'passiert', 'nie', 'wahrscheinlich', 'wäre', 'und', 'ganze']","['Und', 'das', 'Ganze', 'wäre', 'wahrscheinlich', 'nie', 'passiert']","['Und', 'das', 'Ganze', 'wäre', 'wahrscheinlich', 'nie', 'passiert', '.']","['und', 'der', 'ganz', 'sein', 'wahrscheinlich', 'nie', 'passieren', '.']","['CCONJ', 'DET', 'NOUN', 'AUX', 'ADV', 'ADV', 'VERB', 'PUNCT']",und der ganz sein wahrscheinlich nie passieren .,CCONJ DET NOUN AUX ADV ADV VERB PUNCT
Dark__S01E06.srt,Dark,Dark S01,Dark E06,234,"0:22:58,542","0:23:0,667",Das damals im Wald...,das damals im wald...,"['im', 'wald', 'damals', 'das']","['Das', 'damals', 'im', 'Wald']","['Das', 'damals', 'im', 'Wald', '...']","['der', 'damals', 'im', 'Wald', '...']","['DET', 'ADV', 'ADP', 'NOUN', 'PUNCT']",der damals im Wald ...,DET ADV ADP NOUN PUNCT
Dark__S01E06.srt,Dark,Dark S01,Dark E06,235,"0:23:1,125","0:23:4,375","Das war ein Spiel. Wir waren Kinder, haben Fehler gemacht.","das war ein spiel. wir waren kinder, haben fehler gemacht.","['kinder', 'spiel', 'wir', 'das', 'fehler', 'gemacht', 'ein', 'waren', 'haben', 'war']","['Das', 'war', 'ein', 'Spiel', 'Wir', 'waren', 'Kinder', 'haben', 'Fehler', 'gemacht']","['Das', 'war', 'ein', 'Spiel', '.', 'Wir', 'waren', 'Kinder', ',', 'haben', 'Fehler', 'gemacht', '.']","['der', 'sein', 'einen', 'Spiel', '.', 'ich', 'sein', 'Kind', ',', 'haben', 'Fehler', 'machen', '.']","['PRON', 'AUX', 'DET', 'NOUN', 'PUNCT', 'PRON', 'AUX', 'NOUN', 'PUNCT', 'AUX', 'NOUN', 'VERB', 'PUNCT']","der sein einen Spiel . ich sein Kind , haben Fehler machen .",PRON AUX DET NOUN PUNCT PRON AUX NOUN PUNCT AUX NOUN VERB PUNCT
Dark__S01E06.srt,Dark,Dark S01,Dark E06,236,"0:23:4,458","0:23:8,542",Und du hast dich nie entschuldigt. Es geht dir um eine Entschuldigung?,und du hast dich nie entschuldigt. es geht dir um eine entschuldigung?,"['entschuldigung', 'du', 'nie', 'dich', 'eine', 'entschuldigt', 'dir', 'um', 'hast', 'geht', 'und', 'es']","['Und', 'du', 'hast', 'dich', 'nie', 'entschuldigt', 'Es', 'geht', 'dir', 'um', 'eine', 'Entschuldigung']","['Und', 'du', 'hast', 'dich', 'nie', 'entschuldigt', '.', 'Es', 'geht', 'dir', 'um', 'eine', 'Entschuldigung', '?']","['und', 'du', 'haben', 'sich', 'nie', 'entschuldigen', '.', 'ich', 'gehen', 'sich', 'um', 'einen', 'Entschuldigung', '?']","['CCONJ', 'PRON', 'AUX', 'PRON', 'ADV', 'VERB', 'PUNCT', 'PRON', 'VERB', 'PRON', 'ADP', 'DET', 'NOUN', 'PUNCT']",und du haben sich nie entschuldigen . ich gehen sich um einen Entschuldigung ?,CCONJ PRON AUX PRON ADV VERB PUNCT PRON VERB PRON ADP DET NOUN PUNCT
Dark__S01E06.srt,Dark,Dark S01,Dark E06,237,"0:23:8,625","0:23:12,250","So siehst du dich, oder? Als Opfer. Die arme, unschuldige Regina.","so siehst du dich, oder? als opfer. die arme, unschuldige regina.","['so', 'siehst', 'opfer', 'oder', 'arme', 'du', 'dich', 'die', 'unschuldige', 'als', 'regina']","['So', 'siehst', 'du', 'dich', 'oder', 'Als', 'Opfer', 'Die', 'arme', 'unschuldige', 'Regina']","['So', 'siehst', 'du', 'dich', ',', 'oder', '?', 'Als', 'Opfer', '.', 'Die', 'arme', ',', 'unschuldige', 'Regina', '.']","['so', 'sehen', 'du', 'sich', ',', 'oder', '?', 'als', 'Opfer', '.', 'der', 'arme', ',', 'unschuldig', 'Regina', '.']","['ADV', 'VERB', 'PRON', 'PRON', 'PUNCT', 'CCONJ', 'PUNCT', 'ADP', 'NOUN', 'PUNCT', 'DET', 'ADJ', 'PUNCT', 'ADJ', 'PROPN', 'PUNCT']","so sehen du sich , oder ? als Opfer . der arme , unschuldig Regina .",ADV VERB PRON PRON PUNCT CCONJ PUNCT ADP NOUN PUNCT DET ADJ PUNCT ADJ PROPN PUNCT
Dark__S01E06.srt,Dark,Dark S01,Dark E06,238,"0:23:12,667","0:23:15,292","Du bist so verlogen, dass ich kotzen könnte.","du bist so verlogen, dass ich kotzen könnte.","['so', 'du', 'kotzen', 'dass', 'ich', 'könnte', 'bist', 'verlogen']","['Du', 'bist', 'so', 'verlogen', 'dass', 'ich', 'kotzen', 'könnte']","['Du', 'bist', 'so', 'verlogen', ',', 'dass', 'ich', 'kotzen', 'könnte', '.']","['Du', 'sein', 'so', 'verlogen', ',', 'dass', 'ich', 'kotzen', 'können', '.']","['PRON', 'AUX', 'ADV', 'VERB', 'PUNCT', 'SCONJ', 'PRON', 'VERB', 'AUX', 'PUNCT']","Du sein so verlogen , dass ich kotzen können .",PRON AUX ADV VERB PUNCT SCONJ PRON VERB AUX PUNCT
Dark__S01E06.srt,Dark,Dark S01,Dark E06,239,"0:23:15,375","0:23:19,958","Du hast deinem versoffenen Opa erzählt, ich hätte Katharina vergewaltigt.","du hast deinem versoffenen opa erzählt, ich hätte katharina vergewaltigt.","['versoffenen', 'hätte', 'opa', 'du', 'erzählt', 'hast', 'vergewaltigt', 'katharina', 'ich', 'deinem']","['Du', 'hast', 'deinem', 'versoffenen', 'Opa', 'erzählt', 'ich', 'hätte', 'Katharina', 'vergewaltigt']","['Du', 'hast', 'deinem', 'versoffenen', 'Opa', 'erzählt', ',', 'ich', 'hätte', 'Katharina', 'vergewaltigt', '.']","['Du', 'haben', 'mein', 'versoffen', 'Opa', 'erzählen', ',', 'ich', 'haben', 'Katharina', 'vergewaltigen', '.']","['PRON', 'AUX', 'DET', 'ADJ', 'NOUN', 'VERB', 'PUNCT', 'PRON', 'AUX', 'PROPN', 'VERB', 'PUNCT']","Du haben mein versoffen Opa erzählen , ich haben Katharina vergewaltigen .",PRON AUX DET ADJ NOUN VERB PUNCT PRON AUX PROPN VERB PUNCT
Dark__S01E06.srt,Dark,Dark S01,Dark E06,240,"0:23:22,167","0:23:24,125",Das habt ihr geglaubt?,das habt ihr geglaubt?,"['ihr', 'geglaubt', 'habt', 'das']","['Das', 'habt', 'ihr', 'geglaubt']","['Das', 'habt', 'ihr', 'geglaubt', '?']","['der', 'haben', 'mein', 'glauben', '?']","['PRON', 'AUX', 'PRON', 'VERB', 'PUNCT']",der haben mein glauben ?,PRON AUX PRON VERB PUNCT
Dark__S01E06.srt,Dark,Dark S01,Dark E06,241,"0:23:30,917","0:23:32,708",Hannah hat dich gesehen damals.,hannah hat dich gesehen damals.,"['damals', 'dich', 'gesehen', 'hannah', 'hat']","['Hannah', 'hat', 'dich', 'gesehen', 'damals']","['Hannah', 'hat', 'dich', 'gesehen', 'damals', '.']","['Hannah', 'haben', 'sich', 'sehen', 'damals', '.']","['PROPN', 'AUX', 'PRON', 'VERB', 'ADV', 'PUNCT']",Hannah haben sich sehen damals .,PROPN AUX PRON VERB ADV PUNCT
Dark__S01E06.srt,Dark,Dark S01,Dark E06,242,"0:23:33,750","0:23:35,542",Auf der Wache.,auf der wache.,"['der', 'wache', 'auf']","['Auf', 'der', 'Wache']","['Auf', 'der', 'Wache', '.']","['Auf', 'der', 'Wache', '.']","['ADP', 'DET', 'NOUN', 'PUNCT']",Auf der Wache .,ADP DET NOUN PUNCT
Dark__S01E06.srt,Dark,Dark S01,Dark E06,243,"0:23:35,625","0:23:37,208",Hannah.,hannah.,['hannah'],['Hannah'],"['Hannah', '.']","['Hannah', '.']","['PROPN', 'PUNCT']",Hannah .,PROPN PUNCT
Dark__S01E06.srt,Dark,Dark S01,Dark E06,244,"0:23:37,292","0:23:39,792","Die Hannah, die mit 14 so in dich verliebt war,","die hannah, die mit 14 so in dich verliebt war,","['so', 'verliebt', 'dich', 'die', '14', 'in', 'hannah', 'mit', 'war']","['Die', 'Hannah', 'die', 'mit', '14', 'so', 'in', 'dich', 'verliebt', 'war']","['Die', 'Hannah', ',', 'die', 'mit', '14', 'so', 'in', 'dich', 'verliebt', 'war', ',']","['der', 'Hannah', ',', 'der', 'mit', '14', 'so', 'in', 'sich', 'verlieben', 'sein', ',']","['DET', 'PROPN', 'PUNCT', 'PRON', 'ADP', 'NUM', 'ADV', 'ADP', 'PRON', 'VERB', 'AUX', 'PUNCT']","der Hannah , der mit 14 so in sich verlieben sein ,",DET PROPN PUNCT PRON ADP NUM ADV ADP PRON VERB AUX PUNCT
Dark__S01E06.srt,Dark,Dark S01,Dark E06,245,"0:23:39,875","0:23:42,458","dass sie alles getan hätte, um dich zu kriegen.","dass sie alles getan hätte, um dich zu kriegen.","['hätte', 'sie', 'zu', 'dich', 'dass', 'um', 'getan', 'alles', 'kriegen']","['dass', 'sie', 'alles', 'getan', 'hätte', 'um', 'dich', 'zu', 'kriegen']","['dass', 'sie', 'alles', 'getan', 'hätte', ',', 'um', 'dich', 'zu', 'kriegen', '.']","['dass', 'ich', 'alle', 'tun', 'haben', ',', 'um', 'sich', 'zu', 'kriegen', '.']","['SCONJ', 'PRON', 'PRON', 'VERB', 'AUX', 'PUNCT', 'SCONJ', 'PRON', 'PART', 'VERB', 'PUNCT']","dass ich alle tun haben , um sich zu kriegen .",SCONJ PRON PRON VERB AUX PUNCT SCONJ PRON PART VERB PUNCT
Dark__S01E06.srt,Dark,Dark S01,Dark E06,246,"0:23:43,833","0:23:46,583",Aber daran hat sich ja nicht viel geändert.,aber daran hat sich ja nicht viel geändert.,"['geändert', 'sich', 'ja', 'aber', 'daran', 'nicht', 'viel', 'hat']","['Aber', 'daran', 'hat', 'sich', 'ja', 'nicht', 'viel', 'geändert']","['Aber', 'daran', 'hat', 'sich', 'ja', 'nicht', 'viel', 'geändert', '.']","['aber', 'daran', 'haben', 'sich', 'ja', 'nicht', 'viel', 'ändern', '.']","['CCONJ', 'ADV', 'AUX', 'PRON', 'ADV', 'PART', 'PRON', 'VERB', 'PUNCT']",aber daran haben sich ja nicht viel ändern .,CCONJ ADV AUX PRON ADV PART PRON VERB PUNCT
Dark__S01E06.srt,Dark,Dark S01,Dark E06,247,"0:23:47,917","0:23:51,292","Das hast du all die Jahre gedacht, dass ich das erzählt habe?","das hast du all die jahre gedacht, dass ich das erzählt habe?","['jahre', 'das', 'du', 'die', 'dass', 'gedacht', 'erzählt', 'hast', 'habe', 'all', 'ich']","['Das', 'hast', 'du', 'all', 'die', 'Jahre', 'gedacht', 'dass', 'ich', 'das', 'erzählt', 'habe']","['Das', 'hast', 'du', 'all', 'die', 'Jahre', 'gedacht', ',', 'dass', 'ich', 'das', 'erzählt', 'habe', '?']","['der', 'haben', 'du', 'all', 'der', 'Jahr', 'gedenken', ',', 'dass', 'ich', 'der', 'erzählen', 'habe', '?']","['PRON', 'AUX', 'PRON', 'DET', 'DET', 'NOUN', 'VERB', 'PUNCT', 'SCONJ', 'PRON', 'PRON', 'VERB', 'AUX', 'PUNCT']","der haben du all der Jahr gedenken , dass ich der erzählen habe ?",PRON AUX PRON DET DET NOUN VERB PUNCT SCONJ PRON PRON VERB AUX PUNCT
Dark__S01E06.srt,Dark,Dark S01,Dark E06,248,"0:23:53,292","0:23:55,333",Warum sollte ich so was tun?,warum sollte ich so was tun?,"['so', 'was', 'tun', 'sollte', 'warum', 'ich']","['Warum', 'sollte', 'ich', 'so', 'was', 'tun']","['Warum', 'sollte', 'ich', 'so', 'was', 'tun', '?']","['warum', 'sollen', 'ich', 'so', 'was', 'tun', '?']","['ADV', 'AUX', 'PRON', 'ADV', 'PRON', 'VERB', 'PUNCT']",warum sollen ich so was tun ?,ADV AUX PRON ADV PRON VERB PUNCT
Dark__S01E06.srt,Dark,Dark S01,Dark E06,249,"0:23:56,667","0:23:59,458",Ich bin nicht halb so ein schlechter Mensch wie du.,ich bin nicht halb so ein schlechter mensch wie du.,"['so', 'du', 'bin', 'ein', 'schlechter', 'wie', 'halb', 'mensch', 'nicht', 'ich']","['Ich', 'bin', 'nicht', 'halb', 'so', 'ein', 'schlechter', 'Mensch', 'wie', 'du']","['Ich', 'bin', 'nicht', 'halb', 'so', 'ein', 'schlechter', 'Mensch', 'wie', 'du', '.']","['Ich', 'sein', 'nicht', 'halb', 'so', 'einen', 'schlecht', 'Mensch', 'wie', 'du', '.']","['PRON', 'AUX', 'PART', 'ADV', 'ADV', 'DET', 'ADJ', 'NOUN', 'ADP', 'PRON', 'PUNCT']",Ich sein nicht halb so einen schlecht Mensch wie du .,PRON AUX PART ADV ADV DET ADJ NOUN ADP PRON PUNCT
Dark__S01E06.srt,Dark,Dark S01,Dark E06,251,"0:24:18,250","0:24:22,667",Die Polizei Winden hat den Fund einer Kinderleiche bestätigt.,die polizei winden hat den fund einer kinderleiche bestätigt.,"['polizei', 'winden', 'bestätigt', 'die', 'fund', 'den', 'einer', 'kinderleiche', 'hat']","['Die', 'Polizei', 'Winden', 'hat', 'den', 'Fund', 'einer', 'Kinderleiche', 'bestätigt']","['Die', 'Polizei', 'Winden', 'hat', 'den', 'Fund', 'einer', 'Kinderleiche', 'bestätigt', '.']","['der', 'Polizei', 'Winde', 'haben', 'der', 'Fund', 'einer', 'Kinderleiche', 'bestätigen', '.']","['DET', 'NOUN', 'PROPN', 'AUX', 'DET', 'NOUN', 'DET', 'NOUN', 'VERB', 'PUNCT']",der Polizei Winde haben der Fund einer Kinderleiche bestätigen .,DET NOUN PROPN AUX DET NOUN DET NOUN VERB PUNCT
Dark__S01E06.srt,Dark,Dark S01,Dark E06,252,"0:24:22,750","0:24:26,333",Es handle sich wohl nicht um eines der drei in Winden vermissten Kinder.,es handle sich wohl nicht um eines der drei in winden vermissten kinder.,"['kinder', 'winden', 'vermissten', 'sich', 'der', 'eines', 'um', 'drei', 'in', 'nicht', 'wohl', 'handle', 'es']","['Es', 'handle', 'sich', 'wohl', 'nicht', 'um', 'eines', 'der', 'drei', 'in', 'Winden', 'vermissten', 'Kinder']","['Es', 'handle', 'sich', 'wohl', 'nicht', 'um', 'eines', 'der', 'drei', 'in', 'Winden', 'vermissten', 'Kinder', '.']","['ich', 'handeln', 'sich', 'wohl', 'nicht', 'um', 'ein', 'der', 'drei', 'in', 'Winde', 'vermissten', 'Kind', '.']","['PRON', 'VERB', 'PRON', 'ADV', 'PART', 'ADP', 'PRON', 'DET', 'NUM', 'ADP', 'NOUN', 'ADJ', 'NOUN', 'PUNCT']",ich handeln sich wohl nicht um ein der drei in Winde vermissten Kind .,PRON VERB PRON ADV PART ADP PRON DET NUM ADP NOUN ADJ NOUN PUNCT
Dark__S01E06.srt,Dark,Dark S01,Dark E06,253,"0:24:26,792","0:24:29,958",Versagt unsere Polizei? Sind unsere Kinder sicher?,versagt unsere polizei? sind unsere kinder sicher?,"['kinder', 'polizei', 'sicher', 'sind', 'unsere', 'versagt']","['Versagt', 'unsere', 'Polizei', 'Sind', 'unsere', 'Kinder', 'sicher']","['Versagt', 'unsere', 'Polizei', '?', 'Sind', 'unsere', 'Kinder', 'sicher', '?']","['Versagt', 'mein', 'Polizei', '?', 'sein', 'mein', 'Kind', 'sichern', '?']","['VERB', 'DET', 'NOUN', 'PUNCT', 'AUX', 'DET', 'NOUN', 'ADV', 'PUNCT']",Versagt mein Polizei ? sein mein Kind sichern ?,VERB DET NOUN PUNCT AUX DET NOUN ADV PUNCT
Dark__S01E06.srt,Dark,Dark S01,Dark E06,254,"0:24:30,42","0:24:32,625",Darüber diskutiere ich gern weiter mit Ihnen.,darüber diskutiere ich gern weiter mit ihnen.,"['gern', 'diskutiere', 'ihnen', 'darüber', 'weiter', 'mit', 'ich']","['Darüber', 'diskutiere', 'ich', 'gern', 'weiter', 'mit', 'Ihnen']","['Darüber', 'diskutiere', 'ich', 'gern', 'weiter', 'mit', 'Ihnen', '.']","['Darüber', 'diskutieren', 'ich', 'gern', 'weit', 'mit', 'ich', '.']","['ADV', 'VERB', 'PRON', 'ADV', 'ADV', 'ADP', 'PRON', 'PUNCT']",Darüber diskutieren ich gern weit mit ich .,ADV VERB PRON ADV ADV ADP PRON PUNCT
Dark__S01E06.srt,Dark,Dark S01,Dark E06,255,"0:24:32,708","0:24:37,417","Die Nummer unserer Hotline, 0800 64 82 64 82.","die nummer unserer hotline, 0800 64 82 64 82.","['64', 'unserer', 'nummer', '0800', '82.', 'die', '82', 'hotline']","['Die', 'Nummer', 'unserer', 'Hotline', '0800', '64', '82', '64', '82.']","['Die', 'Nummer', 'unserer', 'Hotline', ',', '0800', '64', '82', '64', '82.']","['der', 'Nummer', 'mein', 'Hotline', ',', '0800', '64', '82', '64', '82.']","['DET', 'NOUN', 'DET', 'NOUN', 'PUNCT', 'NUM', 'NUM', 'NUM', 'NUM', 'ADJ']","der Nummer mein Hotline , 0800 64 82 64 82.",DET NOUN DET NOUN PUNCT NUM NUM NUM NUM ADJ
Dark__S01E06.srt,Dark,Dark S01,Dark E06,256,"0:24:38,125","0:24:43,333","Aktuelle Infos auch auf unserer Webseite, und ein eigens eingerichtetes Forum...","aktuelle infos auch auf unserer webseite, und ein eigens eingerichtetes forum...","['forum', 'unserer', 'webseite', 'auch', 'eingerichtetes', 'infos', 'ein', 'aktuelle', 'eigens', 'und', 'auf']","['Aktuelle', 'Infos', 'auch', 'auf', 'unserer', 'Webseite', 'und', 'ein', 'eigens', 'eingerichtetes', 'Forum']","['Aktuelle', 'Infos', 'auch', 'auf', 'unserer', 'Webseite', ',', 'und', 'ein', 'eigens', 'eingerichtetes', 'Forum', '...']","['Aktuelle', 'Info', 'auch', 'auf', 'mein', 'Webseite', ',', 'und', 'einen', 'eigens', 'eingerichtet', 'Forum', '...']","['ADJ', 'NOUN', 'ADV', 'ADP', 'DET', 'NOUN', 'PUNCT', 'CCONJ', 'DET', 'ADV', 'ADJ', 'NOUN', 'PUNCT']","Aktuelle Info auch auf mein Webseite , und einen eigens eingerichtet Forum ...",ADJ NOUN ADV ADP DET NOUN PUNCT CCONJ DET ADV ADJ NOUN PUNCT
Dark__S01E06.srt,Dark,Dark S01,Dark E06,257,"0:24:43,417","0:24:45,417",Hier ist Katharina Nielsen.,hier ist katharina nielsen.,"['katharina', 'nielsen', 'hier', 'ist']","['Hier', 'ist', 'Katharina', 'Nielsen']","['Hier', 'ist', 'Katharina', 'Nielsen', '.']","['Hier', 'sein', 'Katharina', 'Nielsen', '.']","['ADV', 'AUX', 'PROPN', 'PROPN', 'PUNCT']",Hier sein Katharina Nielsen .,ADV AUX PROPN PROPN PUNCT
Dark__S01E06.srt,Dark,Dark S01,Dark E06,258,"0:24:45,500","0:24:48,833","Ich bin die Mutter von Mikkel Nielsen, einem der Kinder...","ich bin die mutter von mikkel nielsen, einem der kinder...","['kinder', 'nielsen', 'der', 'bin', 'mutter', 'einem', 'die', 'mikkel', 'ich', 'von']","['Ich', 'bin', 'die', 'Mutter', 'von', 'Mikkel', 'Nielsen', 'einem', 'der', 'Kinder']","['Ich', 'bin', 'die', 'Mutter', 'von', 'Mikkel', 'Nielsen', ',', 'einem', 'der', 'Kinder', '...']","['Ich', 'sein', 'der', 'Mutter', 'von', 'Mikkel', 'Nielsen', ',', 'einer', 'der', 'Kind', '...']","['PRON', 'AUX', 'DET', 'NOUN', 'ADP', 'PROPN', 'PROPN', 'PUNCT', 'PRON', 'DET', 'NOUN', 'PUNCT']","Ich sein der Mutter von Mikkel Nielsen , einer der Kind ...",PRON AUX DET NOUN ADP PROPN PROPN PUNCT PRON DET NOUN PUNCT
Dark__S01E06.srt,Dark,Dark S01,Dark E06,259,"0:24:49,500","0:24:52,83","Ja, genau. Sind Bürgerwehren sinnvoll?","ja, genau. sind bürgerwehren sinnvoll?","['bürgerwehren', 'ja', 'sind', 'genau', 'sinnvoll']","['Ja', 'genau', 'Sind', 'Bürgerwehren', 'sinnvoll']","['Ja', ',', 'genau', '.', 'Sind', 'Bürgerwehren', 'sinnvoll', '?']","['Ja', ',', 'genau', '.', 'sein', 'Bürgerwehren', 'sinnvoll', '?']","['PART', 'PUNCT', 'ADV', 'PUNCT', 'AUX', 'NOUN', 'ADV', 'PUNCT']","Ja , genau . sein Bürgerwehren sinnvoll ?",PART PUNCT ADV PUNCT AUX NOUN ADV PUNCT
Dark__S01E06.srt,Dark,Dark S01,Dark E06,260,"0:24:52,167","0:24:56,83","Okay, ich warte. Das möchten wir mit Ihnen diskutieren.","okay, ich warte. das möchten wir mit ihnen diskutieren.","['wir', 'möchten', 'das', 'ihnen', 'okay', 'warte', 'diskutieren', 'mit', 'ich']","['Okay', 'ich', 'warte', 'Das', 'möchten', 'wir', 'mit', 'Ihnen', 'diskutieren']","['Okay', ',', 'ich', 'warte', '.', 'Das', 'möchten', 'wir', 'mit', 'Ihnen', 'diskutieren', '.']","['Okay', ',', 'ich', 'warten', '.', 'der', 'mögen', 'ich', 'mit', 'ich', 'diskutieren', '.']","['PROPN', 'PUNCT', 'PRON', 'VERB', 'PUNCT', 'PRON', 'AUX', 'PRON', 'ADP', 'PRON', 'VERB', 'PUNCT']","Okay , ich warten . der mögen ich mit ich diskutieren .",PROPN PUNCT PRON VERB PUNCT PRON AUX PRON ADP PRON VERB PUNCT
Dark__S01E06.srt,Dark,Dark S01,Dark E06,261,"0:24:56,167","0:24:58,417","Ah, wir haben jemanden in der Leitung.","ah, wir haben jemanden in der leitung.","['jemanden', 'wir', 'ah', 'der', 'leitung', 'haben', 'in']","['Ah', 'wir', 'haben', 'jemanden', 'in', 'der', 'Leitung']","['Ah', ',', 'wir', 'haben', 'jemanden', 'in', 'der', 'Leitung', '.']","['Ah', ',', 'ich', 'haben', 'jemand', 'in', 'der', 'Leitung', '.']","['PROPN', 'PUNCT', 'PRON', 'AUX', 'PRON', 'ADP', 'DET', 'NOUN', 'PUNCT']","Ah , ich haben jemand in der Leitung .",PROPN PUNCT PRON AUX PRON ADP DET NOUN PUNCT
