Unique_ID,Show_Name,Season,Episode,Line_Index,Start,End,Dialogue,Dialogue_lower,Dialogue_Set_Words,Dialogue_Words,Dialogue_Tokens_Text,Dialogue_Tokens_Lemmas,Dialogue_Tokens_POS_Tags,Dialogue_Lemmas_Pattern,Dialogue_POS_Tags_Pattern
Dark__S01E06.srt,Dark,Dark S01,Dark E06,262,"0:24:58,500","0:25:2,0",Frau Nielsen ist die Mutter eines der vermissten Kinder.,frau nielsen ist die mutter eines der vermissten kinder.,"['kinder', 'nielsen', 'ist', 'vermissten', 'der', 'mutter', 'eines', 'die', 'frau']","['Frau', 'Nielsen', 'ist', 'die', 'Mutter', 'eines', 'der', 'vermissten', 'Kinder']","['Frau', 'Nielsen', 'ist', 'die', 'Mutter', 'eines', 'der', 'vermissten', 'Kinder', '.']","['Frau', 'Nielsen', 'sein', 'der', 'Mutter', 'ein', 'der', 'vermissten', 'Kind', '.']","['NOUN', 'PROPN', 'AUX', 'DET', 'NOUN', 'PRON', 'DET', 'ADJ', 'NOUN', 'PUNCT']",Frau Nielsen sein der Mutter ein der vermissten Kind .,NOUN PROPN AUX DET NOUN PRON DET ADJ NOUN PUNCT
Dark__S01E06.srt,Dark,Dark S01,Dark E06,263,"0:25:2,83","0:25:6,292",Sie möchte mit uns über die tragischen Ereignisse sprechen.,sie möchte mit uns über die tragischen ereignisse sprechen.,"['ereignisse', 'möchte', 'sie', 'sprechen', 'die', 'uns', 'über', 'mit', 'tragischen']","['Sie', 'möchte', 'mit', 'uns', 'über', 'die', 'tragischen', 'Ereignisse', 'sprechen']","['Sie', 'möchte', 'mit', 'uns', 'über', 'die', 'tragischen', 'Ereignisse', 'sprechen', '.']","['ich', 'mögen', 'mit', 'sich', 'über', 'der', 'tragisch', 'Ereignis', 'sprechen', '.']","['PRON', 'AUX', 'ADP', 'PRON', 'ADP', 'DET', 'ADJ', 'NOUN', 'VERB', 'PUNCT']",ich mögen mit sich über der tragisch Ereignis sprechen .,PRON AUX ADP PRON ADP DET ADJ NOUN VERB PUNCT
Dark__S01E06.srt,Dark,Dark S01,Dark E06,264,"0:25:6,375","0:25:7,375",Frau Nielsen?,frau nielsen?,"['frau', 'nielsen']","['Frau', 'Nielsen']","['Frau', 'Nielsen', '?']","['Frau', 'Nielsen', '?']","['NOUN', 'PROPN', 'PUNCT']",Frau Nielsen ?,NOUN PROPN PUNCT
Dark__S01E06.srt,Dark,Dark S01,Dark E06,265,"0:25:7,458","0:25:10,500","Ich will, dass die Leute begreifen, was hier passiert.","ich will, dass die leute begreifen, was hier passiert.","['was', 'passiert', 'hier', 'die', 'dass', 'will', 'begreifen', 'leute', 'ich']","['Ich', 'will', 'dass', 'die', 'Leute', 'begreifen', 'was', 'hier', 'passiert']","['Ich', 'will', ',', 'dass', 'die', 'Leute', 'begreifen', ',', 'was', 'hier', 'passiert', '.']","['Ich', 'wollen', ',', 'dass', 'der', 'Leute', 'begreifen', ',', 'was', 'hier', 'passieren', '.']","['PRON', 'VERB', 'PUNCT', 'SCONJ', 'DET', 'NOUN', 'VERB', 'PUNCT', 'PRON', 'ADV', 'VERB', 'PUNCT']","Ich wollen , dass der Leute begreifen , was hier passieren .",PRON VERB PUNCT SCONJ DET NOUN VERB PUNCT PRON ADV VERB PUNCT
Dark__S01E06.srt,Dark,Dark S01,Dark E06,266,"0:25:11,833","0:25:13,542",Wir sind so blind.,wir sind so blind.,"['blind', 'so', 'sind', 'wir']","['Wir', 'sind', 'so', 'blind']","['Wir', 'sind', 'so', 'blind', '.']","['ich', 'sein', 'so', 'blind', '.']","['PRON', 'AUX', 'ADV', 'ADV', 'PUNCT']",ich sein so blind .,PRON AUX ADV ADV PUNCT
Dark__S01E06.srt,Dark,Dark S01,Dark E06,267,"0:25:15,458","0:25:17,417",Unter uns ist ein Mörder.,unter uns ist ein mörder.,"['ist', 'ein', 'uns', 'unter', 'mörder']","['Unter', 'uns', 'ist', 'ein', 'Mörder']","['Unter', 'uns', 'ist', 'ein', 'Mörder', '.']","['Unter', 'sich', 'sein', 'einen', 'Mörder', '.']","['ADP', 'PRON', 'AUX', 'DET', 'NOUN', 'PUNCT']",Unter sich sein einen Mörder .,ADP PRON AUX DET NOUN PUNCT
Dark__S01E06.srt,Dark,Dark S01,Dark E06,268,"0:25:19,375","0:25:21,375","Keiner wagt es, das auszusprechen.","keiner wagt es, das auszusprechen.","['das', 'auszusprechen', 'wagt', 'keiner', 'es']","['Keiner', 'wagt', 'es', 'das', 'auszusprechen']","['Keiner', 'wagt', 'es', ',', 'das', 'auszusprechen', '.']","['kein', 'wagen', 'ich', ',', 'der', 'aussprechen', '.']","['PRON', 'VERB', 'PRON', 'PUNCT', 'PRON', 'VERB', 'PUNCT']","kein wagen ich , der aussprechen .",PRON VERB PRON PUNCT PRON VERB PUNCT
Dark__S01E06.srt,Dark,Dark S01,Dark E06,269,"0:25:22,375","0:25:23,875",Aber es ist die Wahrheit.,aber es ist die wahrheit.,"['wahrheit', 'ist', 'die', 'aber', 'es']","['Aber', 'es', 'ist', 'die', 'Wahrheit']","['Aber', 'es', 'ist', 'die', 'Wahrheit', '.']","['aber', 'ich', 'sein', 'der', 'Wahrheit', '.']","['CCONJ', 'PRON', 'AUX', 'DET', 'NOUN', 'PUNCT']",aber ich sein der Wahrheit .,CCONJ PRON AUX DET NOUN PUNCT
Dark__S01E06.srt,Dark,Dark S01,Dark E06,270,"0:25:25,750","0:25:28,833","Wir hoffen, dass so etwas bei uns nicht passiert.","wir hoffen, dass so etwas bei uns nicht passiert.","['so', 'wir', 'passiert', 'dass', 'uns', 'bei', 'hoffen', 'etwas', 'nicht']","['Wir', 'hoffen', 'dass', 'so', 'etwas', 'bei', 'uns', 'nicht', 'passiert']","['Wir', 'hoffen', ',', 'dass', 'so', 'etwas', 'bei', 'uns', 'nicht', 'passiert', '.']","['ich', 'hoffen', ',', 'dass', 'so', 'etwas', 'bei', 'sich', 'nicht', 'passieren', '.']","['PRON', 'VERB', 'PUNCT', 'SCONJ', 'ADV', 'PRON', 'ADP', 'PRON', 'PART', 'VERB', 'PUNCT']","ich hoffen , dass so etwas bei sich nicht passieren .",PRON VERB PUNCT SCONJ ADV PRON ADP PRON PART VERB PUNCT
Dark__S01E06.srt,Dark,Dark S01,Dark E06,271,"0:25:30,708","0:25:32,83",Wir kennen uns doch alle.,wir kennen uns doch alle.,"['kennen', 'doch', 'wir', 'alle', 'uns']","['Wir', 'kennen', 'uns', 'doch', 'alle']","['Wir', 'kennen', 'uns', 'doch', 'alle', '.']","['ich', 'kennen', 'sich', 'doch', 'all', '.']","['PRON', 'VERB', 'PRON', 'ADV', 'PRON', 'PUNCT']",ich kennen sich doch all .,PRON VERB PRON ADV PRON PUNCT
Dark__S01E06.srt,Dark,Dark S01,Dark E06,272,"0:25:36,125","0:25:38,833","Wir glauben, wir wissen alles über den anderen.","wir glauben, wir wissen alles über den anderen.","['wir', 'den', 'anderen', 'glauben', 'alles', 'über', 'wissen']","['Wir', 'glauben', 'wir', 'wissen', 'alles', 'über', 'den', 'anderen']","['Wir', 'glauben', ',', 'wir', 'wissen', 'alles', 'über', 'den', 'anderen', '.']","['ich', 'glauben', ',', 'ich', 'wissen', 'alle', 'über', 'der', 'ander', '.']","['PRON', 'VERB', 'PUNCT', 'PRON', 'VERB', 'PRON', 'ADP', 'DET', 'PRON', 'PUNCT']","ich glauben , ich wissen alle über der ander .",PRON VERB PUNCT PRON VERB PRON ADP DET PRON PUNCT
Dark__S01E06.srt,Dark,Dark S01,Dark E06,273,"0:25:39,958","0:25:41,667",Aber tun wir das wirklich?,aber tun wir das wirklich?,"['tun', 'wir', 'das', 'aber', 'wirklich']","['Aber', 'tun', 'wir', 'das', 'wirklich']","['Aber', 'tun', 'wir', 'das', 'wirklich', '?']","['aber', 'tun', 'ich', 'der', 'wirklich', '?']","['CCONJ', 'VERB', 'PRON', 'PRON', 'ADV', 'PUNCT']",aber tun ich der wirklich ?,CCONJ VERB PRON PRON ADV PUNCT
Dark__S01E06.srt,Dark,Dark S01,Dark E06,274,"0:25:42,375","0:25:44,83","Wir leben Tür an Tür mit Leuten,","wir leben tür an tür mit leuten,","['an', 'leuten', 'wir', 'leben', 'tür', 'mit']","['Wir', 'leben', 'Tür', 'an', 'Tür', 'mit', 'Leuten']","['Wir', 'leben', 'Tür', 'an', 'Tür', 'mit', 'Leuten', ',']","['ich', 'leben', 'Tür', 'an', 'Tür', 'mit', 'Leute', ',']","['PRON', 'VERB', 'NOUN', 'ADP', 'NOUN', 'ADP', 'NOUN', 'PUNCT']","ich leben Tür an Tür mit Leute ,",PRON VERB NOUN ADP NOUN ADP NOUN PUNCT
Dark__S01E06.srt,Dark,Dark S01,Dark E06,275,"0:25:44,167","0:25:46,375",die wir im Grunde nicht kennen.,die wir im grunde nicht kennen.,"['kennen', 'wir', 'im', 'die', 'grunde', 'nicht']","['die', 'wir', 'im', 'Grunde', 'nicht', 'kennen']","['die', 'wir', 'im', 'Grunde', 'nicht', 'kennen', '.']","['der', 'ich', 'im', 'Grund', 'nicht', 'kennen', '.']","['DET', 'PRON', 'ADP', 'NOUN', 'PART', 'VERB', 'PUNCT']",der ich im Grund nicht kennen .,DET PRON ADP NOUN PART VERB PUNCT
Dark__S01E06.srt,Dark,Dark S01,Dark E06,276,"0:25:48,667","0:25:50,667",Und hinter einer dieser Türen...,und hinter einer dieser türen...,"['hinter', 'dieser', 'türen', 'einer', 'und']","['Und', 'hinter', 'einer', 'dieser', 'Türen']","['Und', 'hinter', 'einer', 'dieser', 'Türen', '...']","['und', 'hinter', 'einer', 'dies', 'Türe', '...']","['CCONJ', 'ADP', 'PRON', 'DET', 'NOUN', 'PUNCT']",und hinter einer dies Türe ...,CCONJ ADP PRON DET NOUN PUNCT
Dark__S01E06.srt,Dark,Dark S01,Dark E06,277,"0:25:51,583","0:25:53,250",...ist mein Sohn.,...ist mein sohn.,"['sohn', 'mein', 'ist']","['ist', 'mein', 'Sohn']","['...', 'ist', 'mein', 'Sohn', '.']","['...', 'sein', 'meinen', 'Sohn', '.']","['PUNCT', 'AUX', 'DET', 'NOUN', 'PUNCT']",... sein meinen Sohn .,PUNCT AUX DET NOUN PUNCT
Dark__S01E06.srt,Dark,Dark S01,Dark E06,279,"0:25:55,458","0:25:57,625",Sie könnte jedem gehören.,sie könnte jedem gehören.,"['jedem', 'gehören', 'sie', 'könnte']","['Sie', 'könnte', 'jedem', 'gehören']","['Sie', 'könnte', 'jedem', 'gehören', '.']","['ich', 'können', 'jed', 'gehören', '.']","['PRON', 'AUX', 'PRON', 'VERB', 'PUNCT']",ich können jed gehören .,PRON AUX PRON VERB PUNCT
Dark__S01E06.srt,Dark,Dark S01,Dark E06,280,"0:25:57,708","0:25:59,750",Dem Mann an der Kasse.,dem mann an der kasse.,"['an', 'dem', 'der', 'mann', 'kasse']","['Dem', 'Mann', 'an', 'der', 'Kasse']","['Dem', 'Mann', 'an', 'der', 'Kasse', '.']","['der', 'Mann', 'an', 'der', 'Kasse', '.']","['DET', 'NOUN', 'ADP', 'DET', 'NOUN', 'PUNCT']",der Mann an der Kasse .,DET NOUN ADP DET NOUN PUNCT
Dark__S01E06.srt,Dark,Dark S01,Dark E06,281,"0:25:59,833","0:26:4,875","Oder jemandem, den wir sonntags einladen, der mit unseren Kindern spielt.","oder jemandem, den wir sonntags einladen, der mit unseren kindern spielt.","['wir', 'oder', 'der', 'einladen', 'kindern', 'jemandem', 'sonntags', 'den', 'spielt', 'mit', 'unseren']","['Oder', 'jemandem', 'den', 'wir', 'sonntags', 'einladen', 'der', 'mit', 'unseren', 'Kindern', 'spielt']","['Oder', 'jemandem', ',', 'den', 'wir', 'sonntags', 'einladen', ',', 'der', 'mit', 'unseren', 'Kindern', 'spielt', '.']","['Oder', 'jemand', ',', 'der', 'ich', 'sonntags', 'einladen', ',', 'der', 'mit', 'mein', 'Kind', 'spielen', '.']","['CCONJ', 'PRON', 'PUNCT', 'PRON', 'PRON', 'ADV', 'VERB', 'PUNCT', 'PRON', 'ADP', 'DET', 'NOUN', 'VERB', 'PUNCT']","Oder jemand , der ich sonntags einladen , der mit mein Kind spielen .",CCONJ PRON PUNCT PRON PRON ADV VERB PUNCT PRON ADP DET NOUN VERB PUNCT
Dark__S01E06.srt,Dark,Dark S01,Dark E06,282,"0:26:9,333","0:26:11,125",Ich will nicht mehr wegsehen.,ich will nicht mehr wegsehen.,"['mehr', 'wegsehen', 'will', 'nicht', 'ich']","['Ich', 'will', 'nicht', 'mehr', 'wegsehen']","['Ich', 'will', 'nicht', 'mehr', 'wegsehen', '.']","['Ich', 'wollen', 'nicht', 'mehr', 'wegsehen', '.']","['PRON', 'AUX', 'PART', 'ADV', 'VERB', 'PUNCT']",Ich wollen nicht mehr wegsehen .,PRON AUX PART ADV VERB PUNCT
Dark__S01E06.srt,Dark,Dark S01,Dark E06,283,"0:26:11,208","0:26:13,500",Und ihr solltet das auch nicht.,und ihr solltet das auch nicht.,"['auch', 'solltet', 'das', 'nicht', 'ihr', 'und']","['Und', 'ihr', 'solltet', 'das', 'auch', 'nicht']","['Und', 'ihr', 'solltet', 'das', 'auch', 'nicht', '.']","['und', 'mein', 'sollen', 'der', 'auch', 'nicht', '.']","['CCONJ', 'PRON', 'VERB', 'PRON', 'ADV', 'PART', 'PUNCT']",und mein sollen der auch nicht .,CCONJ PRON VERB PRON ADV PART PUNCT
Dark__S01E06.srt,Dark,Dark S01,Dark E06,284,"0:26:14,375","0:26:16,208",Diese Stadt ist krank.,diese stadt ist krank.,"['krank', 'stadt', 'ist', 'diese']","['Diese', 'Stadt', 'ist', 'krank']","['Diese', 'Stadt', 'ist', 'krank', '.']","['Diese', 'Stadt', 'sein', 'kranken', '.']","['DET', 'NOUN', 'AUX', 'ADV', 'PUNCT']",Diese Stadt sein kranken .,DET NOUN AUX ADV PUNCT
Dark__S01E06.srt,Dark,Dark S01,Dark E06,285,"0:26:17,542","0:26:21,417",Winden ist wie ein Geschwür. Und wir alle sind ein Teil davon.,winden ist wie ein geschwür. und wir alle sind ein teil davon.,"['teil', 'winden', 'wir', 'ist', 'alle', 'geschwür', 'ein', 'wie', 'sind', 'davon', 'und']","['Winden', 'ist', 'wie', 'ein', 'Geschwür', 'Und', 'wir', 'alle', 'sind', 'ein', 'Teil', 'davon']","['Winden', 'ist', 'wie', 'ein', 'Geschwür', '.', 'Und', 'wir', 'alle', 'sind', 'ein', 'Teil', 'davon', '.']","['Winde', 'sein', 'wie', 'einen', 'Geschwür', '.', 'und', 'ich', 'all', 'sein', 'einen', 'Teil', 'davon', '.']","['NOUN', 'AUX', 'ADP', 'DET', 'NOUN', 'PUNCT', 'CCONJ', 'PRON', 'PRON', 'AUX', 'DET', 'NOUN', 'ADV', 'PUNCT']",Winde sein wie einen Geschwür . und ich all sein einen Teil davon .,NOUN AUX ADP DET NOUN PUNCT CCONJ PRON PRON AUX DET NOUN ADV PUNCT
Dark__S01E06.srt,Dark,Dark S01,Dark E06,287,"0:26:36,292","0:26:38,42",MammografieZentrum.,mammografiezentrum.,['mammografiezentrum'],['MammografieZentrum'],"['MammografieZentrum', '.']","['MammografieZentrum', '.']","['PROPN', 'PUNCT']",MammografieZentrum .,PROPN PUNCT
Dark__S01E06.srt,Dark,Dark S01,Dark E06,288,"0:26:38,125","0:26:39,917","Ja, guten Tag, Tiedemann hier.","ja, guten tag, tiedemann hier.","['guten', 'ja', 'hier', 'tiedemann', 'tag']","['Ja', 'guten', 'Tag', 'Tiedemann', 'hier']","['Ja', ',', 'guten', 'Tag', ',', 'Tiedemann', 'hier', '.']","['Ja', ',', 'gut', 'Tag', ',', 'Tiedemann', 'hier', '.']","['PART', 'PUNCT', 'ADJ', 'NOUN', 'PUNCT', 'PROPN', 'ADV', 'PUNCT']","Ja , gut Tag , Tiedemann hier .",PART PUNCT ADJ NOUN PUNCT PROPN ADV PUNCT
Dark__S01E06.srt,Dark,Dark S01,Dark E06,289,"0:26:40,42","0:26:44,250",Meine Frau war bei Ihnen am 27. Oktober zur Krebsuntersuchung.,meine frau war bei ihnen am 27. oktober zur krebsuntersuchung.,"['meine', 'krebsuntersuchung', '27.', 'bei', 'frau', 'ihnen', 'zur', 'oktober', 'war', 'am']","['Meine', 'Frau', 'war', 'bei', 'Ihnen', 'am', '27.', 'Oktober', 'zur', 'Krebsuntersuchung']","['Meine', 'Frau', 'war', 'bei', 'Ihnen', 'am', '27.', 'Oktober', 'zur', 'Krebsuntersuchung', '.']","['Meine', 'Frau', 'sein', 'bei', 'ich', 'am', '27.', 'Oktober', 'zur', 'Krebsuntersuchung', '.']","['DET', 'NOUN', 'AUX', 'ADP', 'PRON', 'ADP', 'ADJ', 'NOUN', 'ADP', 'NOUN', 'PUNCT']",Meine Frau sein bei ich am 27. Oktober zur Krebsuntersuchung .,DET NOUN AUX ADP PRON ADP ADJ NOUN ADP NOUN PUNCT
Dark__S01E06.srt,Dark,Dark S01,Dark E06,290,"0:26:44,875","0:26:47,42",Wir haben aber noch keinen Befund.,wir haben aber noch keinen befund.,"['keinen', 'wir', 'aber', 'haben', 'befund', 'noch']","['Wir', 'haben', 'aber', 'noch', 'keinen', 'Befund']","['Wir', 'haben', 'aber', 'noch', 'keinen', 'Befund', '.']","['ich', 'haben', 'aber', 'noch', 'kein', 'Befund', '.']","['PRON', 'VERB', 'ADV', 'ADV', 'DET', 'NOUN', 'PUNCT']",ich haben aber noch kein Befund .,PRON VERB ADV ADV DET NOUN PUNCT
Dark__S01E06.srt,Dark,Dark S01,Dark E06,291,"0:26:47,125","0:26:48,750",Wie war noch mal ihr Name?,wie war noch mal ihr name?,"['mal', 'noch', 'wie', 'ihr', 'name', 'war']","['Wie', 'war', 'noch', 'mal', 'ihr', 'Name']","['Wie', 'war', 'noch', 'mal', 'ihr', 'Name', '?']","['Wie', 'sein', 'noch', 'mal', 'mein', 'Name', '?']","['ADV', 'AUX', 'ADV', 'ADV', 'DET', 'NOUN', 'PUNCT']",Wie sein noch mal mein Name ?,ADV AUX ADV ADV DET NOUN PUNCT
Dark__S01E06.srt,Dark,Dark S01,Dark E06,292,"0:26:48,833","0:26:50,792",Tiedemann. Regina Tiedemann.,tiedemann. regina tiedemann.,"['tiedemann', 'regina']","['Tiedemann', 'Regina', 'Tiedemann']","['Tiedemann', '.', 'Regina', 'Tiedemann', '.']","['Tiedemann', '.', 'Regina', 'Tiedemann', '.']","['PROPN', 'PUNCT', 'PROPN', 'PROPN', 'PUNCT']",Tiedemann . Regina Tiedemann .,PROPN PUNCT PROPN PROPN PUNCT
Dark__S01E06.srt,Dark,Dark S01,Dark E06,293,"0:26:52,542","0:26:56,250",Das ist komisch. Der Befund ist schon vorgestern raus.,das ist komisch. der befund ist schon vorgestern raus.,"['ist', 'das', 'der', 'raus', 'schon', 'vorgestern', 'komisch', 'befund']","['Das', 'ist', 'komisch', 'Der', 'Befund', 'ist', 'schon', 'vorgestern', 'raus']","['Das', 'ist', 'komisch', '.', 'Der', 'Befund', 'ist', 'schon', 'vorgestern', 'raus', '.']","['der', 'sein', 'komisch', '.', 'der', 'Befund', 'sein', 'schon', 'vorgestern', 'raus', '.']","['PRON', 'AUX', 'ADV', 'PUNCT', 'DET', 'NOUN', 'AUX', 'ADV', 'ADV', 'ADV', 'PUNCT']",der sein komisch . der Befund sein schon vorgestern raus .,PRON AUX ADV PUNCT DET NOUN AUX ADV ADV ADV PUNCT
Dark__S01E06.srt,Dark,Dark S01,Dark E06,294,"0:26:56,333","0:27:0,333",Bei Ihrer Frau wurden schon vor Wochen invasive Karzinome festgestellt.,bei ihrer frau wurden schon vor wochen invasive karzinome festgestellt.,"['karzinome', 'festgestellt', 'invasive', 'schon', 'bei', 'frau', 'vor', 'ihrer', 'wurden', 'wochen']","['Bei', 'Ihrer', 'Frau', 'wurden', 'schon', 'vor', 'Wochen', 'invasive', 'Karzinome', 'festgestellt']","['Bei', 'Ihrer', 'Frau', 'wurden', 'schon', 'vor', 'Wochen', 'invasive', 'Karzinome', 'festgestellt', '.']","['Bei', 'sich', 'Frau', 'werden', 'schon', 'vor', 'Woche', 'invasive', 'Karzinome', 'feststellen', '.']","['ADP', 'DET', 'NOUN', 'AUX', 'ADV', 'ADP', 'NOUN', 'ADJ', 'NOUN', 'VERB', 'PUNCT']",Bei sich Frau werden schon vor Woche invasive Karzinome feststellen .,ADP DET NOUN AUX ADV ADP NOUN ADJ NOUN VERB PUNCT
Dark__S01E06.srt,Dark,Dark S01,Dark E06,295,"0:27:0,417","0:27:3,125",Und nach neuestem Befund haben diese gestreut.,und nach neuestem befund haben diese gestreut.,"['neuestem', 'gestreut', 'haben', 'diese', 'befund', 'und', 'nach']","['Und', 'nach', 'neuestem', 'Befund', 'haben', 'diese', 'gestreut']","['Und', 'nach', 'neuestem', 'Befund', 'haben', 'diese', 'gestreut', '.']","['und', 'nach', 'neuestem', 'Befund', 'haben', 'dies', 'streuen', '.']","['CCONJ', 'ADP', 'ADJ', 'NOUN', 'AUX', 'PRON', 'VERB', 'PUNCT']",und nach neuestem Befund haben dies streuen .,CCONJ ADP ADJ NOUN AUX PRON VERB PUNCT
Dark__S01E06.srt,Dark,Dark S01,Dark E06,296,"0:27:3,208","0:27:7,292",Sie sollten schnellstmöglich einen Termin mit Dr. Urman vereinbaren.,sie sollten schnellstmöglich einen termin mit dr. urman vereinbaren.,"['termin', 'vereinbaren', 'sie', 'dr.', 'einen', 'sollten', 'urman', 'mit', 'schnellstmöglich']","['Sie', 'sollten', 'schnellstmöglich', 'einen', 'Termin', 'mit', 'Dr.', 'Urman', 'vereinbaren']","['Sie', 'sollten', 'schnellstmöglich', 'einen', 'Termin', 'mit', 'Dr.', 'Urman', 'vereinbaren', '.']","['ich', 'sollen', 'schnellstmöglich', 'ein', 'Termin', 'mit', 'Dr.', 'Urman', 'vereinbaren', '.']","['PRON', 'AUX', 'ADV', 'DET', 'NOUN', 'ADP', 'NOUN', 'PROPN', 'VERB', 'PUNCT']",ich sollen schnellstmöglich ein Termin mit Dr. Urman vereinbaren .,PRON AUX ADV DET NOUN ADP NOUN PROPN VERB PUNCT
Dark__S01E06.srt,Dark,Dark S01,Dark E06,297,"0:27:8,42","0:27:9,208",Hallo?,hallo?,['hallo'],['Hallo'],"['Hallo', '?']","['Hallo', '?']","['PROPN', 'PUNCT']",Hallo ?,PROPN PUNCT
Dark__S01E06.srt,Dark,Dark S01,Dark E06,298,"0:27:10,208","0:27:11,500",Herr Tiedemann?,herr tiedemann?,"['herr', 'tiedemann']","['Herr', 'Tiedemann']","['Herr', 'Tiedemann', '?']","['Herr', 'Tiedemann', '?']","['NOUN', 'PROPN', 'PUNCT']",Herr Tiedemann ?,NOUN PROPN PUNCT
Dark__S01E06.srt,Dark,Dark S01,Dark E06,305,"0:28:17,208","0:28:18,500",Ulrich!,ulrich!,['ulrich'],['Ulrich'],"['Ulrich', '!']","['Ulrich', '!']","['PROPN', 'PUNCT']",Ulrich !,PROPN PUNCT
Dark__S01E06.srt,Dark,Dark S01,Dark E06,306,"0:28:19,167","0:28:22,417",Was machst du hier? Ich... Was willst du von mir?,was machst du hier? ich... was willst du von mir?,"['was', 'mir', 'du', 'willst', 'hier', 'machst', 'ich', 'von']","['Was', 'machst', 'du', 'hier', 'Ich', 'Was', 'willst', 'du', 'von', 'mir']","['Was', 'machst', 'du', 'hier', '?', 'Ich', '...', 'Was', 'willst', 'du', 'von', 'mir', '?']","['Was', 'machen', 'du', 'hier', '?', 'Ich', '...', 'Was', 'wollen', 'du', 'von', 'sich', '?']","['PRON', 'VERB', 'PRON', 'ADV', 'PUNCT', 'PRON', 'PUNCT', 'PRON', 'VERB', 'PRON', 'ADP', 'PRON', 'PUNCT']",Was machen du hier ? Ich ... Was wollen du von sich ?,PRON VERB PRON ADV PUNCT PRON PUNCT PRON VERB PRON ADP PRON PUNCT
Dark__S01E06.srt,Dark,Dark S01,Dark E06,307,"0:28:23,333","0:28:25,500",Was? Was du von mir willst.,was? was du von mir willst.,"['was', 'mir', 'du', 'willst', 'von']","['Was', 'Was', 'du', 'von', 'mir', 'willst']","['Was', '?', 'Was', 'du', 'von', 'mir', 'willst', '.']","['Was', '?', 'Was', 'du', 'von', 'sich', 'wollen', '.']","['PRON', 'PUNCT', 'PRON', 'PRON', 'ADP', 'PRON', 'VERB', 'PUNCT']",Was ? Was du von sich wollen .,PRON PUNCT PRON PRON ADP PRON VERB PUNCT
Dark__S01E06.srt,Dark,Dark S01,Dark E06,308,"0:28:30,375","0:28:31,958",Du warst das '86.,du warst das '86.,"['du', 'warst', '86.', 'das']","['Du', 'warst', 'das', '86.']","['Du', 'warst', 'das', ""'"", '86.']","['Du', 'sein', 'der', ""'"", '86.']","['PRON', 'VERB', 'DET', 'PUNCT', 'ADJ']",Du sein der ' 86.,PRON VERB DET PUNCT ADJ
Dark__S01E06.srt,Dark,Dark S01,Dark E06,309,"0:28:32,542","0:28:35,167",Du hast mich wegen Vergewaltigung angezeigt.,du hast mich wegen vergewaltigung angezeigt.,"['mich', 'wegen', 'vergewaltigung', 'du', 'hast', 'angezeigt']","['Du', 'hast', 'mich', 'wegen', 'Vergewaltigung', 'angezeigt']","['Du', 'hast', 'mich', 'wegen', 'Vergewaltigung', 'angezeigt', '.']","['Du', 'haben', 'sich', 'wegen', 'Vergewaltigung', 'anzeigen', '.']","['PRON', 'AUX', 'PRON', 'ADP', 'NOUN', 'VERB', 'PUNCT']",Du haben sich wegen Vergewaltigung anzeigen .,PRON AUX PRON ADP NOUN VERB PUNCT
Dark__S01E06.srt,Dark,Dark S01,Dark E06,310,"0:28:37,500","0:28:38,917",Wie krank bist du?,wie krank bist du?,"['du', 'krank', 'wie', 'bist']","['Wie', 'krank', 'bist', 'du']","['Wie', 'krank', 'bist', 'du', '?']","['Wie', 'kranken', 'sein', 'du', '?']","['ADV', 'ADV', 'AUX', 'PRON', 'PUNCT']",Wie kranken sein du ?,ADV ADV AUX PRON PUNCT
Dark__S01E06.srt,Dark,Dark S01,Dark E06,311,"0:28:40,292","0:28:42,333",Du tust mir weh!,du tust mir weh!,"['du', 'weh', 'mir', 'tust']","['Du', 'tust', 'mir', 'weh']","['Du', 'tust', 'mir', 'weh', '!']","['Du', 'tun', 'sich', 'weh', '!']","['PRON', 'VERB', 'PRON', 'ADV', 'PUNCT']",Du tun sich weh !,PRON VERB PRON ADV PUNCT
Dark__S01E06.srt,Dark,Dark S01,Dark E06,312,"0:28:42,875","0:28:44,500",Willst du mich fertigmachen?,willst du mich fertigmachen?,"['du', 'willst', 'fertigmachen', 'mich']","['Willst', 'du', 'mich', 'fertigmachen']","['Willst', 'du', 'mich', 'fertigmachen', '?']","['wollen', 'du', 'sich', 'fertigmachen', '?']","['VERB', 'PRON', 'PRON', 'VERB', 'PUNCT']",wollen du sich fertigmachen ?,VERB PRON PRON VERB PUNCT
Dark__S01E06.srt,Dark,Dark S01,Dark E06,313,"0:28:45,625","0:28:48,500",Willst du meine Familie kaputtmachen? Ist es das?,willst du meine familie kaputtmachen? ist es das?,"['meine', 'ist', 'das', 'du', 'willst', 'familie', 'kaputtmachen', 'es']","['Willst', 'du', 'meine', 'Familie', 'kaputtmachen', 'Ist', 'es', 'das']","['Willst', 'du', 'meine', 'Familie', 'kaputtmachen', '?', 'Ist', 'es', 'das', '?']","['wollen', 'du', 'meinen', 'Familie', 'kaputtmachen', '?', 'sein', 'ich', 'der', '?']","['VERB', 'PRON', 'DET', 'NOUN', 'VERB', 'PUNCT', 'AUX', 'PRON', 'PRON', 'PUNCT']",wollen du meinen Familie kaputtmachen ? sein ich der ?,VERB PRON DET NOUN VERB PUNCT AUX PRON PRON PUNCT
Dark__S01E06.srt,Dark,Dark S01,Dark E06,314,"0:28:50,833","0:28:52,542",Was willst du?,was willst du?,"['du', 'willst', 'was']","['Was', 'willst', 'du']","['Was', 'willst', 'du', '?']","['Was', 'wollen', 'du', '?']","['PRON', 'VERB', 'PRON', 'PUNCT']",Was wollen du ?,PRON VERB PRON PUNCT
Dark__S01E06.srt,Dark,Dark S01,Dark E06,315,"0:28:54,583","0:28:55,792",Dich.,dich.,['dich'],['Dich'],"['Dich', '.']","['sich', '.']","['PRON', 'PUNCT']",sich .,PRON PUNCT
Dark__S01E06.srt,Dark,Dark S01,Dark E06,317,"0:29:4,417","0:29:6,208","Du bist Gift, weißt du das?","du bist gift, weißt du das?","['gift', 'das', 'du', 'weißt', 'bist']","['Du', 'bist', 'Gift', 'weißt', 'du', 'das']","['Du', 'bist', 'Gift', ',', 'weißt', 'du', 'das', '?']","['Du', 'sein', 'Gift', ',', 'wissen', 'du', 'der', '?']","['PRON', 'AUX', 'NOUN', 'PUNCT', 'VERB', 'PRON', 'PRON', 'PUNCT']","Du sein Gift , wissen du der ?",PRON AUX NOUN PUNCT VERB PRON PRON PUNCT
Dark__S01E06.srt,Dark,Dark S01,Dark E06,318,"0:29:6,292","0:29:9,417","Schmiegst dich an wie Honig, aber da ist nur Gift.","schmiegst dich an wie honig, aber da ist nur gift.","['an', 'schmiegst', 'ist', 'nur', 'gift', 'dich', 'wie', 'aber', 'da', 'honig']","['Schmiegst', 'dich', 'an', 'wie', 'Honig', 'aber', 'da', 'ist', 'nur', 'Gift']","['Schmiegst', 'dich', 'an', 'wie', 'Honig', ',', 'aber', 'da', 'ist', 'nur', 'Gift', '.']","['Schmiegst', 'sich', 'an', 'wie', 'Honig', ',', 'aber', 'da', 'sein', 'nur', 'Gift', '.']","['ADV', 'PRON', 'ADP', 'ADP', 'NOUN', 'PUNCT', 'CCONJ', 'ADV', 'AUX', 'ADV', 'NOUN', 'PUNCT']","Schmiegst sich an wie Honig , aber da sein nur Gift .",ADV PRON ADP ADP NOUN PUNCT CCONJ ADV AUX ADV NOUN PUNCT
Dark__S01E06.srt,Dark,Dark S01,Dark E06,319,"0:29:11,292","0:29:13,583",Wie hat es dein Mann so lang ausgehalten?,wie hat es dein mann so lang ausgehalten?,"['ausgehalten', 'so', 'mann', 'wie', 'dein', 'lang', 'hat', 'es']","['Wie', 'hat', 'es', 'dein', 'Mann', 'so', 'lang', 'ausgehalten']","['Wie', 'hat', 'es', 'dein', 'Mann', 'so', 'lang', 'ausgehalten', '?']","['Wie', 'haben', 'ich', 'mein', 'Mann', 'so', 'langen', 'aushalten', '?']","['ADV', 'AUX', 'PRON', 'DET', 'NOUN', 'ADV', 'ADV', 'VERB', 'PUNCT']",Wie haben ich mein Mann so langen aushalten ?,ADV AUX PRON DET NOUN ADV ADV VERB PUNCT
Dark__S01E06.srt,Dark,Dark S01,Dark E06,320,"0:29:13,667","0:29:16,250","Kein Wunder, dass er am Ende nicht mehr konnte.","kein wunder, dass er am ende nicht mehr konnte.","['kein', 'wunder', 'ende', 'konnte', 'mehr', 'dass', 'nicht', 'er', 'am']","['Kein', 'Wunder', 'dass', 'er', 'am', 'Ende', 'nicht', 'mehr', 'konnte']","['Kein', 'Wunder', ',', 'dass', 'er', 'am', 'Ende', 'nicht', 'mehr', 'konnte', '.']","['kein', 'wund', ',', 'dass', 'ich', 'am', 'Ende', 'nicht', 'mehr', 'können', '.']","['DET', 'NOUN', 'PUNCT', 'SCONJ', 'PRON', 'ADP', 'NOUN', 'PART', 'ADV', 'AUX', 'PUNCT']","kein wund , dass ich am Ende nicht mehr können .",DET NOUN PUNCT SCONJ PRON ADP NOUN PART ADV AUX PUNCT
