Unique_ID,Show_Name,Season,Episode,Line_Index,Start,End,Dialogue,Dialogue_lower,Dialogue_Set_Words,Dialogue_Words,Dialogue_Tokens_Text,Dialogue_Tokens_Lemmas,Dialogue_Tokens_POS_Tags,Dialogue_Lemmas_Pattern,Dialogue_POS_Tags_Pattern
Dark__S01E07.srt,Dark,Dark S01,Dark E07,155,"0:13:52,208","0:13:56,542","""Warum nicht Waldweg?"" Helge soll also '86 Mads entführt haben?","""warum nicht waldweg?"" helge soll also '86 mads entführt haben?","['also', 'waldweg', 'entführt', 'haben', 'warum', 'soll', 'helge', 'nicht', 'mads', '86']","['Warum', 'nicht', 'Waldweg', 'Helge', 'soll', 'also', '86', 'Mads', 'entführt', 'haben']","['""', 'Warum', 'nicht', 'Waldweg', '?', '""', 'Helge', 'soll', 'also', ""'"", '86', 'Mads', 'entführt', 'haben', '?']","['""', 'warum', 'nicht', 'Waldweg', '?', '""', 'Helge', 'soll', 'also', ""'"", '86', 'Mads', 'entführen', 'haben', '?']","['PUNCT', 'ADV', 'PART', 'NOUN', 'PUNCT', 'PUNCT', 'NOUN', 'AUX', 'ADV', 'PUNCT', 'NUM', 'NOUN', 'VERB', 'AUX', 'PUNCT']",""" warum nicht Waldweg ? "" Helge soll also ' 86 Mads entführen haben ?",PUNCT ADV PART NOUN PUNCT PUNCT NOUN AUX ADV PUNCT NUM NOUN VERB AUX PUNCT
Dark__S01E07.srt,Dark,Dark S01,Dark E07,156,"0:13:56,625","0:13:59,0",Und 33 Jahre später Mikkel und die anderen?,und 33 jahre später mikkel und die anderen?,"['33', 'jahre', 'mikkel', 'später', 'die', 'anderen', 'und']","['Und', '33', 'Jahre', 'später', 'Mikkel', 'und', 'die', 'anderen']","['Und', '33', 'Jahre', 'später', 'Mikkel', 'und', 'die', 'anderen', '?']","['und', '33', 'Jahr', 'spät', 'Mikkel', 'und', 'der', 'ander', '?']","['CCONJ', 'NUM', 'NOUN', 'ADV', 'PROPN', 'CCONJ', 'DET', 'PRON', 'PUNCT']",und 33 Jahr spät Mikkel und der ander ?,CCONJ NUM NOUN ADV PROPN CCONJ DET PRON PUNCT
Dark__S01E07.srt,Dark,Dark S01,Dark E07,157,"0:13:59,83","0:14:2,375",Wo ist Helge jetzt? Im Pflegeheim. Ulrich!,wo ist helge jetzt? im pflegeheim. ulrich!,"['ulrich', 'ist', 'pflegeheim', 'im', 'jetzt', 'helge', 'wo']","['Wo', 'ist', 'Helge', 'jetzt', 'Im', 'Pflegeheim', 'Ulrich']","['Wo', 'ist', 'Helge', 'jetzt', '?', 'Im', 'Pflegeheim', '.', 'Ulrich', '!']","['wo', 'sein', 'Helge', 'jetzt', '?', 'Im', 'Pflegeheim', '.', 'Ulrich', '!']","['ADV', 'AUX', 'PROPN', 'ADV', 'PUNCT', 'ADP', 'PROPN', 'PUNCT', 'PROPN', 'PUNCT']",wo sein Helge jetzt ? Im Pflegeheim . Ulrich !,ADV AUX PROPN ADV PUNCT ADP PROPN PUNCT PROPN PUNCT
Dark__S01E07.srt,Dark,Dark S01,Dark E07,158,"0:14:2,458","0:14:5,83",Er ist 75 Jahre alt. Dement.,er ist 75 jahre alt. dement.,"['jahre', 'ist', 'alt', '75', 'dement', 'er']","['Er', 'ist', '75', 'Jahre', 'alt', 'Dement']","['Er', 'ist', '75', 'Jahre', 'alt', '.', 'Dement', '.']","['ich', 'sein', '75', 'Jahr', 'alt', '.', 'Dement', '.']","['PRON', 'AUX', 'NUM', 'NOUN', 'ADV', 'PUNCT', 'NOUN', 'PUNCT']",ich sein 75 Jahr alt . Dement .,PRON AUX NUM NOUN ADV PUNCT NOUN PUNCT
Dark__S01E07.srt,Dark,Dark S01,Dark E07,159,"0:14:5,667","0:14:9,42","Und als Mikkel verschwunden ist, da war Helge bei mir.","und als mikkel verschwunden ist, da war helge bei mir.","['mir', 'mikkel', 'ist', 'verschwunden', 'da', 'bei', 'als', 'helge', 'und', 'war']","['Und', 'als', 'Mikkel', 'verschwunden', 'ist', 'da', 'war', 'Helge', 'bei', 'mir']","['Und', 'als', 'Mikkel', 'verschwunden', 'ist', ',', 'da', 'war', 'Helge', 'bei', 'mir', '.']","['und', 'als', 'Mikkel', 'verschwinden', 'sein', ',', 'da', 'sein', 'Helge', 'bei', 'sich', '.']","['CCONJ', 'ADP', 'NOUN', 'VERB', 'AUX', 'PUNCT', 'ADV', 'AUX', 'NOUN', 'ADP', 'PRON', 'PUNCT']","und als Mikkel verschwinden sein , da sein Helge bei sich .",CCONJ ADP NOUN VERB AUX PUNCT ADV AUX NOUN ADP PRON PUNCT
Dark__S01E07.srt,Dark,Dark S01,Dark E07,160,"0:14:9,125","0:14:12,750","Aber am Abend, bevor Yasin verschwand, fand Wöller Helge im Wald.","aber am abend, bevor yasin verschwand, fand wöller helge im wald.","['abend', 'wöller', 'im', 'aber', 'yasin', 'helge', 'bevor', 'wald', 'fand', 'verschwand', 'am']","['Aber', 'am', 'Abend', 'bevor', 'Yasin', 'verschwand', 'fand', 'Wöller', 'Helge', 'im', 'Wald']","['Aber', 'am', 'Abend', ',', 'bevor', 'Yasin', 'verschwand', ',', 'fand', 'Wöller', 'Helge', 'im', 'Wald', '.']","['aber', 'am', 'Abend', ',', 'bevor', 'Yasin', 'verschwinden', ',', 'finden', 'Wöller', 'Helge', 'im', 'Wald', '.']","['CCONJ', 'ADP', 'NOUN', 'PUNCT', 'SCONJ', 'PROPN', 'VERB', 'PUNCT', 'VERB', 'NOUN', 'PROPN', 'ADP', 'NOUN', 'PUNCT']","aber am Abend , bevor Yasin verschwinden , finden Wöller Helge im Wald .",CCONJ ADP NOUN PUNCT SCONJ PROPN VERB PUNCT VERB NOUN PROPN ADP NOUN PUNCT
Dark__S01E07.srt,Dark,Dark S01,Dark E07,161,"0:14:12,833","0:14:17,500",Und brachte ihn wieder zurück ins Heim. Das hat alles irgendwie mit Mads zu tun.,und brachte ihn wieder zurück ins heim. das hat alles irgendwie mit mads zu tun.,"['zurück', 'tun', 'das', 'irgendwie', 'heim', 'zu', 'alles', 'ins', 'mads', 'brachte', 'wieder', 'ihn', 'und', 'mit', 'hat']","['Und', 'brachte', 'ihn', 'wieder', 'zurück', 'ins', 'Heim', 'Das', 'hat', 'alles', 'irgendwie', 'mit', 'Mads', 'zu', 'tun']","['Und', 'brachte', 'ihn', 'wieder', 'zurück', 'ins', 'Heim', '.', 'Das', 'hat', 'alles', 'irgendwie', 'mit', 'Mads', 'zu', 'tun', '.']","['und', 'bringen', 'ich', 'wieder', 'zurück', 'ins', 'Heim', '.', 'der', 'haben', 'alle', 'irgendwie', 'mit', 'Mads', 'zu', 'tun', '.']","['CCONJ', 'VERB', 'PRON', 'ADV', 'ADV', 'ADP', 'NOUN', 'PUNCT', 'PRON', 'VERB', 'PRON', 'ADV', 'ADP', 'NOUN', 'PART', 'VERB', 'PUNCT']",und bringen ich wieder zurück ins Heim . der haben alle irgendwie mit Mads zu tun .,CCONJ VERB PRON ADV ADV ADP NOUN PUNCT PRON VERB PRON ADV ADP NOUN PART VERB PUNCT
Dark__S01E07.srt,Dark,Dark S01,Dark E07,162,"0:14:17,583","0:14:20,667",Du verrennst dich da in etwas. Vielleicht.,du verrennst dich da in etwas. vielleicht.,"['verrennst', 'du', 'dich', 'da', 'vielleicht', 'in', 'etwas']","['Du', 'verrennst', 'dich', 'da', 'in', 'etwas', 'Vielleicht']","['Du', 'verrennst', 'dich', 'da', 'in', 'etwas', '.', 'Vielleicht', '.']","['Du', 'verrennen', 'sich', 'da', 'in', 'etwas', '.', 'Vielleicht', '.']","['PRON', 'VERB', 'PRON', 'ADV', 'ADP', 'PRON', 'PUNCT', 'ADV', 'PUNCT']",Du verrennen sich da in etwas . Vielleicht .,PRON VERB PRON ADV ADP PRON PUNCT ADV PUNCT
Dark__S01E07.srt,Dark,Dark S01,Dark E07,163,"0:14:20,750","0:14:22,167",Vielleicht auch nicht.,vielleicht auch nicht.,"['nicht', 'vielleicht', 'auch']","['Vielleicht', 'auch', 'nicht']","['Vielleicht', 'auch', 'nicht', '.']","['Vielleicht', 'auch', 'nicht', '.']","['ADV', 'ADV', 'PART', 'PUNCT']",Vielleicht auch nicht .,ADV ADV PART PUNCT
Dark__S01E07.srt,Dark,Dark S01,Dark E07,166,"0:14:51,958","0:14:53,750",Wie heißt du denn?,wie heißt du denn?,"['du', 'heißt', 'wie', 'denn']","['Wie', 'heißt', 'du', 'denn']","['Wie', 'heißt', 'du', 'denn', '?']","['Wie', 'heißen', 'du', 'denn', '?']","['ADV', 'VERB', 'PRON', 'ADV', 'PUNCT']",Wie heißen du denn ?,ADV VERB PRON ADV PUNCT
Dark__S01E07.srt,Dark,Dark S01,Dark E07,167,"0:14:54,875","0:14:56,375",Jonas.,jonas.,['jonas'],['Jonas'],"['Jonas', '.']","['Jonas', '.']","['PROPN', 'PUNCT']",Jonas .,PROPN PUNCT
Dark__S01E07.srt,Dark,Dark S01,Dark E07,168,"0:14:58,542","0:15:1,750",Und warum lässt du dich nicht von deinen Eltern fahren?,und warum lässt du dich nicht von deinen eltern fahren?,"['eltern', 'du', 'dich', 'deinen', 'warum', 'fahren', 'nicht', 'und', 'von', 'lässt']","['Und', 'warum', 'lässt', 'du', 'dich', 'nicht', 'von', 'deinen', 'Eltern', 'fahren']","['Und', 'warum', 'lässt', 'du', 'dich', 'nicht', 'von', 'deinen', 'Eltern', 'fahren', '?']","['und', 'warum', 'lässt', 'du', 'sich', 'nicht', 'von', 'mein', 'Eltern', 'fahren', '?']","['CCONJ', 'ADV', 'VERB', 'PRON', 'PRON', 'PART', 'ADP', 'ADJ', 'NOUN', 'VERB', 'PUNCT']",und warum lässt du sich nicht von mein Eltern fahren ?,CCONJ ADV VERB PRON PRON PART ADP ADJ NOUN VERB PUNCT
Dark__S01E07.srt,Dark,Dark S01,Dark E07,169,"0:15:7,42","0:15:8,667",Meine Mutter ist arbeiten.,meine mutter ist arbeiten.,"['arbeiten', 'mutter', 'meine', 'ist']","['Meine', 'Mutter', 'ist', 'arbeiten']","['Meine', 'Mutter', 'ist', 'arbeiten', '.']","['Meine', 'Mutter', 'sein', 'arbeiten', '.']","['DET', 'NOUN', 'AUX', 'VERB', 'PUNCT']",Meine Mutter sein arbeiten .,DET NOUN AUX VERB PUNCT
Dark__S01E07.srt,Dark,Dark S01,Dark E07,170,"0:15:9,958","0:15:11,250",Und mein Vater ist tot.,und mein vater ist tot.,"['tot', 'ist', 'vater', 'mein', 'und']","['Und', 'mein', 'Vater', 'ist', 'tot']","['Und', 'mein', 'Vater', 'ist', 'tot', '.']","['und', 'meinen', 'Vater', 'sein', 'tot', '.']","['CCONJ', 'DET', 'NOUN', 'AUX', 'ADV', 'PUNCT']",und meinen Vater sein tot .,CCONJ DET NOUN AUX ADV PUNCT
Dark__S01E07.srt,Dark,Dark S01,Dark E07,171,"0:15:14,500","0:15:15,958",Wo arbeitet deine Mutter?,wo arbeitet deine mutter?,"['deine', 'wo', 'mutter', 'arbeitet']","['Wo', 'arbeitet', 'deine', 'Mutter']","['Wo', 'arbeitet', 'deine', 'Mutter', '?']","['wo', 'arbeiten', 'mein', 'Mutter', '?']","['ADV', 'VERB', 'DET', 'NOUN', 'PUNCT']",wo arbeiten mein Mutter ?,ADV VERB DET NOUN PUNCT
Dark__S01E07.srt,Dark,Dark S01,Dark E07,172,"0:15:17,750","0:15:19,417",Im Kernkraftwerk.,im kernkraftwerk.,"['kernkraftwerk', 'im']","['Im', 'Kernkraftwerk']","['Im', 'Kernkraftwerk', '.']","['Im', 'Kernkraftwerk', '.']","['ADP', 'NOUN', 'PUNCT']",Im Kernkraftwerk .,ADP NOUN PUNCT
Dark__S01E07.srt,Dark,Dark S01,Dark E07,173,"0:15:20,375","0:15:24,208",Das AKW hat Winden verändert.,das akw hat winden verändert.,"['winden', 'das', 'verändert', 'akw', 'hat']","['Das', 'AKW', 'hat', 'Winden', 'verändert']","['Das', 'AKW', 'hat', 'Winden', 'verändert', '.']","['der', 'AKW', 'haben', 'Winde', 'verändern', '.']","['DET', 'NOUN', 'AUX', 'NOUN', 'VERB', 'PUNCT']",der AKW haben Winde verändern .,DET NOUN AUX NOUN VERB PUNCT
Dark__S01E07.srt,Dark,Dark S01,Dark E07,174,"0:15:24,708","0:15:26,792",Früher sah es hier anders aus.,früher sah es hier anders aus.,"['hier', 'aus', 'sah', 'früher', 'anders', 'es']","['Früher', 'sah', 'es', 'hier', 'anders', 'aus']","['Früher', 'sah', 'es', 'hier', 'anders', 'aus', '.']","['Früher', 'sehen', 'ich', 'hier', 'anders', 'aus', '.']","['ADV', 'VERB', 'PRON', 'ADV', 'ADV', 'ADP', 'PUNCT']",Früher sehen ich hier anders aus .,ADV VERB PRON ADV ADV ADP PUNCT
Dark__S01E07.srt,Dark,Dark S01,Dark E07,175,"0:15:32,42","0:15:33,500",Was ist denn das da?,was ist denn das da?,"['was', 'das', 'ist', 'da', 'denn']","['Was', 'ist', 'denn', 'das', 'da']","['Was', 'ist', 'denn', 'das', 'da', '?']","['Was', 'sein', 'denn', 'der', 'da', '?']","['PRON', 'AUX', 'ADV', 'PRON', 'ADV', 'PUNCT']",Was sein denn der da ?,PRON AUX ADV PRON ADV PUNCT
Dark__S01E07.srt,Dark,Dark S01,Dark E07,176,"0:15:38,417","0:15:39,833",Das sind Kopfhörer.,das sind kopfhörer.,"['kopfhörer', 'sind', 'das']","['Das', 'sind', 'Kopfhörer']","['Das', 'sind', 'Kopfhörer', '.']","['der', 'sein', 'Kopfhörer', '.']","['PRON', 'AUX', 'NOUN', 'PUNCT']",der sein Kopfhörer .,PRON AUX NOUN PUNCT
Dark__S01E07.srt,Dark,Dark S01,Dark E07,177,"0:15:41,83","0:15:44,42",Pff! Das sind doch keine Kopfhörer!,pff! das sind doch keine kopfhörer!,"['keine', 'doch', 'pff', 'das', 'sind', 'kopfhörer']","['Pff', 'Das', 'sind', 'doch', 'keine', 'Kopfhörer']","['Pff', '!', 'Das', 'sind', 'doch', 'keine', 'Kopfhörer', '!']","['Pff', '!', 'der', 'sein', 'doch', 'kein', 'Kopfhörer', '!']","['NOUN', 'PUNCT', 'PRON', 'AUX', 'ADV', 'DET', 'NOUN', 'PUNCT']",Pff ! der sein doch kein Kopfhörer !,NOUN PUNCT PRON AUX ADV DET NOUN PUNCT
Dark__S01E07.srt,Dark,Dark S01,Dark E07,178,"0:15:47,917","0:15:50,708",Die steckt man sich so in die Ohren.,die steckt man sich so in die ohren.,"['steckt', 'so', 'sich', 'die', 'man', 'in', 'ohren']","['Die', 'steckt', 'man', 'sich', 'so', 'in', 'die', 'Ohren']","['Die', 'steckt', 'man', 'sich', 'so', 'in', 'die', 'Ohren', '.']","['der', 'stecken', 'man', 'sich', 'so', 'in', 'der', 'Ohr', '.']","['PRON', 'VERB', 'PRON', 'PRON', 'ADV', 'ADP', 'DET', 'NOUN', 'PUNCT']",der stecken man sich so in der Ohr .,PRON VERB PRON PRON ADV ADP DET NOUN PUNCT
Dark__S01E07.srt,Dark,Dark S01,Dark E07,179,"0:15:54,125","0:15:55,875",Dinge gibt's.,dinge gibt's.,"[""gibt's"", 'dinge']","['Dinge', ""gibt's""]","['Dinge', ""gibt's"", '.']","['Ding', ""gibt's"", '.']","['NOUN', 'VERB', 'PUNCT']",Ding gibt's .,NOUN VERB PUNCT
Dark__S01E07.srt,Dark,Dark S01,Dark E07,180,"0:16:4,667","0:16:6,333",Hier.,hier.,['hier'],['Hier'],"['Hier', '.']","['Hier', '.']","['ADV', 'PUNCT']",Hier .,ADV PUNCT
Dark__S01E07.srt,Dark,Dark S01,Dark E07,181,"0:16:6,417","0:16:7,750",Ist eine Abkürzung.,ist eine abkürzung.,"['abkürzung', 'eine', 'ist']","['Ist', 'eine', 'Abkürzung']","['Ist', 'eine', 'Abkürzung', '.']","['sein', 'einen', 'Abkürzung', '.']","['AUX', 'DET', 'NOUN', 'PUNCT']",sein einen Abkürzung .,AUX DET NOUN PUNCT
Dark__S01E07.srt,Dark,Dark S01,Dark E07,186,"0:17:6,333","0:17:7,583","So, da wären wir.","so, da wären wir.","['da', 'so', 'wären', 'wir']","['So', 'da', 'wären', 'wir']","['So', ',', 'da', 'wären', 'wir', '.']","['so', ',', 'da', 'sein', 'ich', '.']","['ADV', 'PUNCT', 'ADV', 'AUX', 'PRON', 'PUNCT']","so , da sein ich .",ADV PUNCT ADV AUX PRON PUNCT
Dark__S01E07.srt,Dark,Dark S01,Dark E07,187,"0:17:9,875","0:17:11,125",Warte.,warte.,['warte'],['Warte'],"['Warte', '.']","['Warte', '.']","['NOUN', 'PUNCT']",Warte .,NOUN PUNCT
Dark__S01E07.srt,Dark,Dark S01,Dark E07,188,"0:17:11,958","0:17:14,250","Unter euch Teenagern,","unter euch teenagern,","['euch', 'teenagern', 'unter']","['Unter', 'euch', 'Teenagern']","['Unter', 'euch', 'Teenagern', ',']","['Unter', 'sich', 'Teenager', ',']","['ADP', 'PRON', 'NOUN', 'PUNCT']","Unter sich Teenager ,",ADP PRON NOUN PUNCT
Dark__S01E07.srt,Dark,Dark S01,Dark E07,189,"0:17:14,333","0:17:15,500",ist da...,ist da...,"['da', 'ist']","['ist', 'da']","['ist', 'da', '...']","['sein', 'da', '...']","['AUX', 'ADV', 'PUNCT']",sein da ...,AUX ADV PUNCT
Dark__S01E07.srt,Dark,Dark S01,Dark E07,190,"0:17:16,375","0:17:18,125",Ist da Satanismus ein Ding?,ist da satanismus ein ding?,"['satanismus', 'ist', 'ein', 'da', 'ding']","['Ist', 'da', 'Satanismus', 'ein', 'Ding']","['Ist', 'da', 'Satanismus', 'ein', 'Ding', '?']","['sein', 'da', 'Satanismus', 'einen', 'Ding', '?']","['AUX', 'ADV', 'NOUN', 'DET', 'NOUN', 'PUNCT']",sein da Satanismus einen Ding ?,AUX ADV NOUN DET NOUN PUNCT
Dark__S01E07.srt,Dark,Dark S01,Dark E07,191,"0:17:19,333","0:17:20,458",Keine Ahnung.,keine ahnung.,"['keine', 'ahnung']","['Keine', 'Ahnung']","['Keine', 'Ahnung', '.']","['kein', 'Ahnung', '.']","['DET', 'NOUN', 'PUNCT']",kein Ahnung .,DET NOUN PUNCT
Dark__S01E07.srt,Dark,Dark S01,Dark E07,192,"0:17:24,667","0:17:26,917","Nee, ich weiß nicht, ich glaub nicht.","nee, ich weiß nicht, ich glaub nicht.","['glaub', 'weiß', 'nee', 'nicht', 'ich']","['Nee', 'ich', 'weiß', 'nicht', 'ich', 'glaub', 'nicht']","['Nee', ',', 'ich', 'weiß', 'nicht', ',', 'ich', 'glaub', 'nicht', '.']","['Nee', ',', 'ich', 'weiß', 'nicht', ',', 'ich', 'glaub', 'nicht', '.']","['NOUN', 'PUNCT', 'PRON', 'VERB', 'PART', 'PUNCT', 'PRON', 'ADV', 'PART', 'PUNCT']","Nee , ich weiß nicht , ich glaub nicht .",NOUN PUNCT PRON VERB PART PUNCT PRON ADV PART PUNCT
Dark__S01E07.srt,Dark,Dark S01,Dark E07,193,"0:17:29,458","0:17:31,500",Lass dich von deiner Mutter abholen.,lass dich von deiner mutter abholen.,"['deiner', 'dich', 'mutter', 'lass', 'abholen', 'von']","['Lass', 'dich', 'von', 'deiner', 'Mutter', 'abholen']","['Lass', 'dich', 'von', 'deiner', 'Mutter', 'abholen', '.']","['Lass', 'sich', 'von', 'sich', 'Mutter', 'abholen', '.']","['PROPN', 'PRON', 'ADP', 'DET', 'NOUN', 'VERB', 'PUNCT']",Lass sich von sich Mutter abholen .,PROPN PRON ADP DET NOUN VERB PUNCT
Dark__S01E07.srt,Dark,Dark S01,Dark E07,194,"0:17:32,125","0:17:35,667",Du solltest jetzt besser nicht alleine durch den Wald.,du solltest jetzt besser nicht alleine durch den wald.,"['besser', 'du', 'alleine', 'durch', 'den', 'jetzt', 'solltest', 'nicht', 'wald']","['Du', 'solltest', 'jetzt', 'besser', 'nicht', 'alleine', 'durch', 'den', 'Wald']","['Du', 'solltest', 'jetzt', 'besser', 'nicht', 'alleine', 'durch', 'den', 'Wald', '.']","['Du', 'sollen', 'jetzt', 'gut', 'nicht', 'alleine', 'durch', 'der', 'Wald', '.']","['PRON', 'VERB', 'ADV', 'ADV', 'PART', 'ADV', 'ADP', 'DET', 'NOUN', 'PUNCT']",Du sollen jetzt gut nicht alleine durch der Wald .,PRON VERB ADV ADV PART ADV ADP DET NOUN PUNCT
Dark__S01E07.srt,Dark,Dark S01,Dark E07,195,"0:17:42,792","0:17:43,917",Danke.,danke.,['danke'],['Danke'],"['Danke', '.']","['Dank', '.']","['NOUN', 'PUNCT']",Dank .,NOUN PUNCT
Dark__S01E07.srt,Dark,Dark S01,Dark E07,198,"0:19:37,667","0:19:39,583",Ich suche Ines Kahnwald.,ich suche ines kahnwald.,"['ines', 'kahnwald', 'ich', 'suche']","['Ich', 'suche', 'Ines', 'Kahnwald']","['Ich', 'suche', 'Ines', 'Kahnwald', '.']","['Ich', 'suche', 'Ines', 'Kahnwald', '.']","['PRON', 'VERB', 'PROPN', 'PROPN', 'PUNCT']",Ich suche Ines Kahnwald .,PRON VERB PROPN PROPN PUNCT
Dark__S01E07.srt,Dark,Dark S01,Dark E07,199,"0:19:40,500","0:19:43,583",Die war eben draußen mit dem Jungen. Was für ein Junge?,die war eben draußen mit dem jungen. was für ein junge?,"['für', 'dem', 'was', 'ein', 'die', 'jungen', 'draußen', 'eben', 'mit', 'war', 'junge']","['Die', 'war', 'eben', 'draußen', 'mit', 'dem', 'Jungen', 'Was', 'für', 'ein', 'Junge']","['Die', 'war', 'eben', 'draußen', 'mit', 'dem', 'Jungen', '.', 'Was', 'für', 'ein', 'Junge', '?']","['der', 'sein', 'eben', 'draußen', 'mit', 'der', 'Junge', '.', 'Was', 'für', 'einen', 'Junge', '?']","['PRON', 'AUX', 'ADV', 'ADV', 'ADP', 'DET', 'NOUN', 'PUNCT', 'PRON', 'ADP', 'DET', 'NOUN', 'PUNCT']",der sein eben draußen mit der Junge . Was für einen Junge ?,PRON AUX ADV ADV ADP DET NOUN PUNCT PRON ADP DET NOUN PUNCT
Dark__S01E07.srt,Dark,Dark S01,Dark E07,200,"0:19:44,833","0:19:46,83",Was willst du von Ines?,was willst du von ines?,"['was', 'du', 'willst', 'ines', 'von']","['Was', 'willst', 'du', 'von', 'Ines']","['Was', 'willst', 'du', 'von', 'Ines', '?']","['Was', 'wollen', 'du', 'von', 'Ines', '?']","['PRON', 'VERB', 'PRON', 'ADP', 'PROPN', 'PUNCT']",Was wollen du von Ines ?,PRON VERB PRON ADP PROPN PUNCT
Dark__S01E07.srt,Dark,Dark S01,Dark E07,201,"0:19:47,417","0:19:49,667",Ich bin zu Besuch. Hab mich ausgesperrt.,ich bin zu besuch. hab mich ausgesperrt.,"['besuch', 'mich', 'bin', 'ausgesperrt', 'zu', 'hab', 'ich']","['Ich', 'bin', 'zu', 'Besuch', 'Hab', 'mich', 'ausgesperrt']","['Ich', 'bin', 'zu', 'Besuch', '.', 'Hab', 'mich', 'ausgesperrt', '.']","['Ich', 'sein', 'zu', 'Besuch', '.', 'Hab', 'sich', 'aussperren', '.']","['PRON', 'AUX', 'ADP', 'NOUN', 'PUNCT', 'NOUN', 'PRON', 'VERB', 'PUNCT']",Ich sein zu Besuch . Hab sich aussperren .,PRON AUX ADP NOUN PUNCT NOUN PRON VERB PUNCT
Dark__S01E07.srt,Dark,Dark S01,Dark E07,202,"0:19:50,333","0:19:52,42",Ines sagte nichts von Besuch.,ines sagte nichts von besuch.,"['besuch', 'sagte', 'nichts', 'ines', 'von']","['Ines', 'sagte', 'nichts', 'von', 'Besuch']","['Ines', 'sagte', 'nichts', 'von', 'Besuch', '.']","['Ines', 'sagen', 'nichts', 'von', 'Besuch', '.']","['PROPN', 'VERB', 'PRON', 'ADP', 'NOUN', 'PUNCT']",Ines sagen nichts von Besuch .,PROPN VERB PRON ADP NOUN PUNCT
Dark__S01E07.srt,Dark,Dark S01,Dark E07,203,"0:19:54,42","0:19:55,417",Seid ihr verwandt?,seid ihr verwandt?,"['seid', 'verwandt', 'ihr']","['Seid', 'ihr', 'verwandt']","['Seid', 'ihr', 'verwandt', '?']","['sein', 'mein', 'verwenden', '?']","['AUX', 'PRON', 'VERB', 'PUNCT']",sein mein verwenden ?,AUX PRON VERB PUNCT
Dark__S01E07.srt,Dark,Dark S01,Dark E07,204,"0:19:56,625","0:19:57,792","Ja, kann man so sagen.","ja, kann man so sagen.","['so', 'sagen', 'ja', 'man', 'kann']","['Ja', 'kann', 'man', 'so', 'sagen']","['Ja', ',', 'kann', 'man', 'so', 'sagen', '.']","['Ja', ',', 'können', 'man', 'so', 'sagen', '.']","['PART', 'PUNCT', 'AUX', 'PRON', 'ADV', 'VERB', 'PUNCT']","Ja , können man so sagen .",PART PUNCT AUX PRON ADV VERB PUNCT
Dark__S01E07.srt,Dark,Dark S01,Dark E07,205,"0:20:0,458","0:20:2,0",Vielleicht ist sie hinten.,vielleicht ist sie hinten.,"['vielleicht', 'hinten', 'sie', 'ist']","['Vielleicht', 'ist', 'sie', 'hinten']","['Vielleicht', 'ist', 'sie', 'hinten', '.']","['Vielleicht', 'sein', 'ich', 'hinten', '.']","['ADV', 'AUX', 'PRON', 'ADV', 'PUNCT']",Vielleicht sein ich hinten .,ADV AUX PRON ADV PUNCT
Dark__S01E07.srt,Dark,Dark S01,Dark E07,206,"0:20:4,83","0:20:8,375","Ansonsten sage ich ihr Bescheid. Nein, machen Sie sich keine Umstände.","ansonsten sage ich ihr bescheid. nein, machen sie sich keine umstände.","['keine', 'sage', 'nein', 'sie', 'bescheid', 'sich', 'machen', 'ansonsten', 'ihr', 'umstände', 'ich']","['Ansonsten', 'sage', 'ich', 'ihr', 'Bescheid', 'Nein', 'machen', 'Sie', 'sich', 'keine', 'Umstände']","['Ansonsten', 'sage', 'ich', 'ihr', 'Bescheid', '.', 'Nein', ',', 'machen', 'Sie', 'sich', 'keine', 'Umstände', '.']","['Ansonsten', 'sage', 'ich', 'mein', 'Bescheid', '.', 'Nein', ',', 'machen', 'ich', 'sich', 'kein', 'Umstand', '.']","['ADV', 'VERB', 'PRON', 'DET', 'NOUN', 'PUNCT', 'PART', 'PUNCT', 'VERB', 'PRON', 'PRON', 'DET', 'NOUN', 'PUNCT']","Ansonsten sage ich mein Bescheid . Nein , machen ich sich kein Umstand .",ADV VERB PRON DET NOUN PUNCT PART PUNCT VERB PRON PRON DET NOUN PUNCT
Dark__S01E07.srt,Dark,Dark S01,Dark E07,211,"0:21:10,625","0:21:11,625",Herr Doppler?,herr doppler?,"['herr', 'doppler']","['Herr', 'Doppler']","['Herr', 'Doppler', '?']","['Herr', 'Doppler', '?']","['NOUN', 'PROPN', 'PUNCT']",Herr Doppler ?,NOUN PROPN PUNCT
Dark__S01E07.srt,Dark,Dark S01,Dark E07,212,"0:21:12,583","0:21:13,708",Herr Doppler?,herr doppler?,"['herr', 'doppler']","['Herr', 'Doppler']","['Herr', 'Doppler', '?']","['Herr', 'Doppler', '?']","['NOUN', 'PROPN', 'PUNCT']",Herr Doppler ?,NOUN PROPN PUNCT
Dark__S01E07.srt,Dark,Dark S01,Dark E07,213,"0:21:15,0","0:21:17,875",Mein Name ist Ulrich Nielsen. Ich bin Polizist.,mein name ist ulrich nielsen. ich bin polizist.,"['ulrich', 'nielsen', 'ist', 'bin', 'mein', 'polizist', 'name', 'ich']","['Mein', 'Name', 'ist', 'Ulrich', 'Nielsen', 'Ich', 'bin', 'Polizist']","['Mein', 'Name', 'ist', 'Ulrich', 'Nielsen', '.', 'Ich', 'bin', 'Polizist', '.']","['mein', 'Name', 'sein', 'Ulrich', 'Nielsen', '.', 'Ich', 'sein', 'Polizist', '.']","['DET', 'NOUN', 'AUX', 'PROPN', 'PROPN', 'PUNCT', 'PRON', 'AUX', 'NOUN', 'PUNCT']",mein Name sein Ulrich Nielsen . Ich sein Polizist .,DET NOUN AUX PROPN PROPN PUNCT PRON AUX NOUN PUNCT
Dark__S01E07.srt,Dark,Dark S01,Dark E07,214,"0:21:17,958","0:21:21,42","Keine Angst, ich habe nur ein paar Fragen.","keine angst, ich habe nur ein paar fragen.","['keine', 'nur', 'ein', 'angst', 'paar', 'fragen', 'habe', 'ich']","['Keine', 'Angst', 'ich', 'habe', 'nur', 'ein', 'paar', 'Fragen']","['Keine', 'Angst', ',', 'ich', 'habe', 'nur', 'ein', 'paar', 'Fragen', '.']","['kein', 'Angst', ',', 'ich', 'habe', 'nur', 'einen', 'paar', 'Frage', '.']","['DET', 'NOUN', 'PUNCT', 'PRON', 'AUX', 'ADV', 'DET', 'DET', 'NOUN', 'PUNCT']","kein Angst , ich habe nur einen paar Frage .",DET NOUN PUNCT PRON AUX ADV DET DET NOUN PUNCT
Dark__S01E07.srt,Dark,Dark S01,Dark E07,215,"0:21:21,125","0:21:23,750",1986 ist in Winden ein Junge verschwunden.,1986 ist in winden ein junge verschwunden.,"['winden', 'ist', 'ein', 'verschwunden', 'in', '1986', 'junge']","['1986', 'ist', 'in', 'Winden', 'ein', 'Junge', 'verschwunden']","['1986', 'ist', 'in', 'Winden', 'ein', 'Junge', 'verschwunden', '.']","['1986', 'sein', 'in', 'Winde', 'einen', 'Junge', 'verschwinden', '.']","['NUM', 'AUX', 'ADP', 'PROPN', 'DET', 'NOUN', 'VERB', 'PUNCT']",1986 sein in Winde einen Junge verschwinden .,NUM AUX ADP PROPN DET NOUN VERB PUNCT
Dark__S01E07.srt,Dark,Dark S01,Dark E07,216,"0:21:23,833","0:21:26,375",Mads Nielsen.,mads nielsen.,"['mads', 'nielsen']","['Mads', 'Nielsen']","['Mads', 'Nielsen', '.']","['Mads', 'Nielsen', '.']","['PROPN', 'PROPN', 'PUNCT']",Mads Nielsen .,PROPN PROPN PUNCT
Dark__S01E07.srt,Dark,Dark S01,Dark E07,217,"0:21:26,458","0:21:29,708","Sie waren damals vorgeladen, aber es gibt kein Protokoll.","sie waren damals vorgeladen, aber es gibt kein protokoll.","['kein', 'sie', 'damals', 'protokoll', 'aber', 'waren', 'vorgeladen', 'gibt', 'es']","['Sie', 'waren', 'damals', 'vorgeladen', 'aber', 'es', 'gibt', 'kein', 'Protokoll']","['Sie', 'waren', 'damals', 'vorgeladen', ',', 'aber', 'es', 'gibt', 'kein', 'Protokoll', '.']","['ich', 'sein', 'damals', 'vorladen', ',', 'aber', 'ich', 'geben', 'kein', 'Protokoll', '.']","['PRON', 'AUX', 'ADV', 'VERB', 'PUNCT', 'CCONJ', 'PRON', 'VERB', 'DET', 'NOUN', 'PUNCT']","ich sein damals vorladen , aber ich geben kein Protokoll .",PRON AUX ADV VERB PUNCT CCONJ PRON VERB DET NOUN PUNCT
Dark__S01E07.srt,Dark,Dark S01,Dark E07,218,"0:21:29,792","0:21:32,917","Was heißt ""Warum nicht Waldweg""?","was heißt ""warum nicht waldweg""?","['was', 'waldweg', 'heißt', 'warum', 'nicht']","['Was', 'heißt', 'Warum', 'nicht', 'Waldweg']","['Was', 'heißt', '""', 'Warum', 'nicht', 'Waldweg', '""', '?']","['Was', 'heißen', '""', 'warum', 'nicht', 'Waldweg', '""', '?']","['PRON', 'VERB', 'PUNCT', 'ADV', 'PART', 'NOUN', 'PUNCT', 'PUNCT']","Was heißen "" warum nicht Waldweg "" ?",PRON VERB PUNCT ADV PART NOUN PUNCT PUNCT
Dark__S01E07.srt,Dark,Dark S01,Dark E07,220,"0:21:35,917","0:21:39,208",Er ist es!  Was machen Sie hier?,er ist es!  was machen sie hier?,"['was', 'sie', 'ist', 'hier', 'machen', 'er', 'es']","['Er', 'ist', 'es', 'Was', 'machen', 'Sie', 'hier']","['Er', 'ist', 'es', '!', ' ', 'Was', 'machen', 'Sie', 'hier', '?']","['ich', 'sein', 'ich', '!', ' ', 'Was', 'machen', 'ich', 'hier', '?']","['PRON', 'AUX', 'PRON', 'PUNCT', 'SPACE', 'PRON', 'VERB', 'PRON', 'ADV', 'PUNCT']",ich sein ich !   Was machen ich hier ?,PRON AUX PRON PUNCT SPACE PRON VERB PRON ADV PUNCT
