Unique_ID,Show_Name,Season,Episode,Line_Index,Start,End,Dialogue,Dialogue_lower,Dialogue_Set_Words,Dialogue_Words,Dialogue_Tokens_Text,Dialogue_Tokens_Lemmas,Dialogue_Tokens_POS_Tags,Dialogue_Lemmas_Pattern,Dialogue_POS_Tags_Pattern
Dark__S02E07.srt,Dark,Dark S02,Dark E07,2,"0:0:15,963","0:0:18,755",Der Mensch ist ein eigenartiges Geschöpf.,der mensch ist ein eigenartiges geschöpf.,"['ist', 'der', 'ein', 'geschöpf', 'mensch', 'eigenartiges']","['Der', 'Mensch', 'ist', 'ein', 'eigenartiges', 'Geschöpf']","['Der', 'Mensch', 'ist', 'ein', 'eigenartiges', 'Geschöpf', '.']","['der', 'Mensch', 'sein', 'einen', 'eigenartig', 'Geschöpf', '.']","['DET', 'NOUN', 'AUX', 'DET', 'ADJ', 'NOUN', 'PUNCT']",der Mensch sein einen eigenartig Geschöpf .,DET NOUN AUX DET ADJ NOUN PUNCT
Dark__S02E07.srt,Dark,Dark S02,Dark E07,3,"0:0:22,47","0:0:24,797","All sein Handeln ist motiviert aus Verlangen,","all sein handeln ist motiviert aus verlangen,","['sein', 'verlangen', 'ist', 'aus', 'handeln', 'motiviert', 'all']","['All', 'sein', 'Handeln', 'ist', 'motiviert', 'aus', 'Verlangen']","['All', 'sein', 'Handeln', 'ist', 'motiviert', 'aus', 'Verlangen', ',']","['All', 'mein', 'Handeln', 'sein', 'motivieren', 'aus', 'Verlangen', ',']","['NOUN', 'DET', 'NOUN', 'AUX', 'VERB', 'ADP', 'NOUN', 'PUNCT']","All mein Handeln sein motivieren aus Verlangen ,",NOUN DET NOUN AUX VERB ADP NOUN PUNCT
Dark__S02E07.srt,Dark,Dark S02,Dark E07,4,"0:0:27,755","0:0:30,172",sein Charakter geschmiedet aus Schmerz.,sein charakter geschmiedet aus schmerz.,"['schmerz', 'sein', 'charakter', 'geschmiedet', 'aus']","['sein', 'Charakter', 'geschmiedet', 'aus', 'Schmerz']","['sein', 'Charakter', 'geschmiedet', 'aus', 'Schmerz', '.']","['mein', 'Charakter', 'schmieden', 'aus', 'Schmerz', '.']","['DET', 'NOUN', 'VERB', 'ADP', 'NOUN', 'PUNCT']",mein Charakter schmieden aus Schmerz .,DET NOUN VERB ADP NOUN PUNCT
Dark__S02E07.srt,Dark,Dark S02,Dark E07,5,"0:0:37,380","0:0:40,588","So sehr er auch versucht, den Schmerz zu verdrängen,","so sehr er auch versucht, den schmerz zu verdrängen,","['schmerz', 'so', 'versucht', 'sehr', 'auch', 'verdrängen', 'den', 'zu', 'er']","['So', 'sehr', 'er', 'auch', 'versucht', 'den', 'Schmerz', 'zu', 'verdrängen']","['So', 'sehr', 'er', 'auch', 'versucht', ',', 'den', 'Schmerz', 'zu', 'verdrängen', ',']","['so', 'sehr', 'ich', 'auch', 'versuchen', ',', 'der', 'Schmerz', 'zu', 'verdrängen', ',']","['ADV', 'ADV', 'PRON', 'ADV', 'VERB', 'PUNCT', 'DET', 'NOUN', 'PART', 'VERB', 'PUNCT']","so sehr ich auch versuchen , der Schmerz zu verdrängen ,",ADV ADV PRON ADV VERB PUNCT DET NOUN PART VERB PUNCT
Dark__S02E07.srt,Dark,Dark S02,Dark E07,6,"0:0:42,213","0:0:44,88","das Verlangen zu unterdrücken,","das verlangen zu unterdrücken,","['zu', 'verlangen', 'unterdrücken', 'das']","['das', 'Verlangen', 'zu', 'unterdrücken']","['das', 'Verlangen', 'zu', 'unterdrücken', ',']","['der', 'Verlangen', 'zu', 'unterdrücken', ',']","['DET', 'NOUN', 'PART', 'VERB', 'PUNCT']","der Verlangen zu unterdrücken ,",DET NOUN PART VERB PUNCT
Dark__S02E07.srt,Dark,Dark S02,Dark E07,7,"0:0:46,255","0:0:48,630",so wenig kann er sich doch freimachen,so wenig kann er sich doch freimachen,"['doch', 'so', 'wenig', 'freimachen', 'sich', 'kann', 'er']","['so', 'wenig', 'kann', 'er', 'sich', 'doch', 'freimachen']","['so', 'wenig', 'kann', 'er', 'sich', 'doch', 'freimachen']","['so', 'wenig', 'können', 'ich', 'sich', 'doch', 'freimachen']","['ADV', 'ADV', 'AUX', 'PRON', 'PRON', 'ADV', 'VERB']",so wenig können ich sich doch freimachen,ADV ADV AUX PRON PRON ADV VERB
Dark__S02E07.srt,Dark,Dark S02,Dark E07,8,"0:0:49,297","0:0:51,880",von der ewigen Knechtschaft seiner Gefühle.,von der ewigen knechtschaft seiner gefühle.,"['der', 'ewigen', 'seiner', 'gefühle', 'knechtschaft', 'von']","['von', 'der', 'ewigen', 'Knechtschaft', 'seiner', 'Gefühle']","['von', 'der', 'ewigen', 'Knechtschaft', 'seiner', 'Gefühle', '.']","['von', 'der', 'ewig', 'Knechtschaft', 'sich', 'Gefühl', '.']","['ADP', 'DET', 'ADJ', 'NOUN', 'DET', 'NOUN', 'PUNCT']",von der ewig Knechtschaft sich Gefühl .,ADP DET ADJ NOUN DET NOUN PUNCT
Dark__S02E07.srt,Dark,Dark S02,Dark E07,9,"0:0:57,505","0:1:0,5","Denn solange der Sturm in ihm tobt,","denn solange der sturm in ihm tobt,","['sturm', 'der', 'in', 'denn', 'ihm', 'solange', 'tobt']","['Denn', 'solange', 'der', 'Sturm', 'in', 'ihm', 'tobt']","['Denn', 'solange', 'der', 'Sturm', 'in', 'ihm', 'tobt', ',']","['denn', 'solange', 'der', 'Sturm', 'in', 'ich', 'toben', ',']","['CCONJ', 'SCONJ', 'DET', 'NOUN', 'ADP', 'PRON', 'VERB', 'PUNCT']","denn solange der Sturm in ich toben ,",CCONJ SCONJ DET NOUN ADP PRON VERB PUNCT
Dark__S02E07.srt,Dark,Dark S02,Dark E07,10,"0:1:1,713","0:1:3,547",kann er keinen Frieden finden.,kann er keinen frieden finden.,"['keinen', 'finden', 'frieden', 'kann', 'er']","['kann', 'er', 'keinen', 'Frieden', 'finden']","['kann', 'er', 'keinen', 'Frieden', 'finden', '.']","['können', 'ich', 'kein', 'Friede', 'finden', '.']","['AUX', 'PRON', 'DET', 'NOUN', 'VERB', 'PUNCT']",können ich kein Friede finden .,AUX PRON DET NOUN VERB PUNCT
Dark__S02E07.srt,Dark,Dark S02,Dark E07,11,"0:1:5,338","0:1:6,963","Nicht im Leben,","nicht im leben,","['nicht', 'im', 'leben']","['Nicht', 'im', 'Leben']","['Nicht', 'im', 'Leben', ',']","['Nicht', 'im', 'Leben', ',']","['PART', 'ADP', 'NOUN', 'PUNCT']","Nicht im Leben ,",PART ADP NOUN PUNCT
Dark__S02E07.srt,Dark,Dark S02,Dark E07,12,"0:1:9,297","0:1:10,880",nicht im Tod.,nicht im tod.,"['nicht', 'im', 'tod']","['nicht', 'im', 'Tod']","['nicht', 'im', 'Tod', '.']","['nicht', 'im', 'Tod', '.']","['PART', 'ADP', 'NOUN', 'PUNCT']",nicht im Tod .,PART ADP NOUN PUNCT
Dark__S02E07.srt,Dark,Dark S02,Dark E07,13,"0:1:13,922","0:1:17,172","Und so wird er Tag für Tag alles tun, was nötig ist.","und so wird er tag für tag alles tun, was nötig ist.","['so', 'für', 'was', 'tun', 'ist', 'wird', 'alles', 'nötig', 'und', 'er', 'tag']","['Und', 'so', 'wird', 'er', 'Tag', 'für', 'Tag', 'alles', 'tun', 'was', 'nötig', 'ist']","['Und', 'so', 'wird', 'er', 'Tag', 'für', 'Tag', 'alles', 'tun', ',', 'was', 'nötig', 'ist', '.']","['und', 'so', 'werden', 'ich', 'Tag', 'für', 'Tag', 'alle', 'tun', ',', 'was', 'nötigen', 'sein', '.']","['CCONJ', 'ADV', 'AUX', 'PRON', 'NOUN', 'ADP', 'NOUN', 'PRON', 'VERB', 'PUNCT', 'PRON', 'ADV', 'AUX', 'PUNCT']","und so werden ich Tag für Tag alle tun , was nötigen sein .",CCONJ ADV AUX PRON NOUN ADP NOUN PRON VERB PUNCT PRON ADV AUX PUNCT
Dark__S02E07.srt,Dark,Dark S02,Dark E07,14,"0:1:18,130","0:1:19,755","Der Schmerz sein Schiff,","der schmerz sein schiff,","['schmerz', 'der', 'sein', 'schiff']","['Der', 'Schmerz', 'sein', 'Schiff']","['Der', 'Schmerz', 'sein', 'Schiff', ',']","['der', 'Schmerz', 'mein', 'Schiff', ',']","['DET', 'NOUN', 'DET', 'NOUN', 'PUNCT']","der Schmerz mein Schiff ,",DET NOUN DET NOUN PUNCT
Dark__S02E07.srt,Dark,Dark S02,Dark E07,15,"0:1:21,213","0:1:22,922",das Verlangen sein Kompass.,das verlangen sein kompass.,"['kompass', 'sein', 'verlangen', 'das']","['das', 'Verlangen', 'sein', 'Kompass']","['das', 'Verlangen', 'sein', 'Kompass', '.']","['der', 'Verlangen', 'mein', 'Kompass', '.']","['DET', 'NOUN', 'DET', 'NOUN', 'PUNCT']",der Verlangen mein Kompass .,DET NOUN DET NOUN PUNCT
Dark__S02E07.srt,Dark,Dark S02,Dark E07,16,"0:1:26,713","0:1:29,47",Wozu der Mensch doch fähig ist.,wozu der mensch doch fähig ist.,"['doch', 'ist', 'der', 'mensch', 'wozu', 'fähig']","['Wozu', 'der', 'Mensch', 'doch', 'fähig', 'ist']","['Wozu', 'der', 'Mensch', 'doch', 'fähig', 'ist', '.']","['wozu', 'der', 'Mensch', 'doch', 'fähig', 'sein', '.']","['ADV', 'DET', 'NOUN', 'ADV', 'ADV', 'AUX', 'PUNCT']",wozu der Mensch doch fähig sein .,ADV DET NOUN ADV ADV AUX PUNCT
Dark__S02E07.srt,Dark,Dark S02,Dark E07,35,"0:3:7,5","0:3:9,338","Die Tote ist 1,72 m.","die tote ist 1,72 m.","['ist', 'm.', 'die', 'tote', '1,72']","['Die', 'Tote', 'ist', '1,72', 'm.']","['Die', 'Tote', 'ist', '1,72', 'm.']","['der', 'Tote', 'sein', '1,72', 'm.']","['DET', 'NOUN', 'AUX', 'NUM', 'ADV']","der Tote sein 1,72 m.",DET NOUN AUX NUM ADV
Dark__S02E07.srt,Dark,Dark S02,Dark E07,36,"0:3:9,422","0:3:11,547",Europide Rasse.,europide rasse.,"['europide', 'rasse']","['Europide', 'Rasse']","['Europide', 'Rasse', '.']","['Europide', 'Rasse', '.']","['PROPN', 'PROPN', 'PUNCT']",Europide Rasse .,PROPN PROPN PUNCT
Dark__S02E07.srt,Dark,Dark S02,Dark E07,37,"0:3:11,630","0:3:15,172","Wahrscheinlich 75, 80 Jahre alt.","wahrscheinlich 75, 80 jahre alt.","['80', 'jahre', 'alt', '75', 'wahrscheinlich']","['Wahrscheinlich', '75', '80', 'Jahre', 'alt']","['Wahrscheinlich', '75', ',', '80', 'Jahre', 'alt', '.']","['Wahrscheinlich', '75', ',', '80', 'Jahr', 'alt', '.']","['ADV', 'NUM', 'PUNCT', 'NUM', 'NOUN', 'ADV', 'PUNCT']","Wahrscheinlich 75 , 80 Jahr alt .",ADV NUM PUNCT NUM NOUN ADV PUNCT
Dark__S02E07.srt,Dark,Dark S02,Dark E07,38,"0:3:15,672","0:3:18,255","Todesursache, Schuss in die Brust.","todesursache, schuss in die brust.","['schuss', 'todesursache', 'die', 'brust', 'in']","['Todesursache', 'Schuss', 'in', 'die', 'Brust']","['Todesursache', ',', 'Schuss', 'in', 'die', 'Brust', '.']","['Todesursache', ',', 'Schuss', 'in', 'der', 'Brust', '.']","['NOUN', 'PUNCT', 'NOUN', 'ADP', 'DET', 'NOUN', 'PUNCT']","Todesursache , Schuss in der Brust .",NOUN PUNCT NOUN ADP DET NOUN PUNCT
Dark__S02E07.srt,Dark,Dark S02,Dark E07,39,"0:3:19,547","0:3:21,422",Auffällig sind noch die Augen.,auffällig sind noch die augen.,"['augen', 'sind', 'die', 'auffällig', 'noch']","['Auffällig', 'sind', 'noch', 'die', 'Augen']","['Auffällig', 'sind', 'noch', 'die', 'Augen', '.']","['Auffällig', 'sein', 'noch', 'der', 'Auge', '.']","['ADV', 'AUX', 'ADV', 'DET', 'NOUN', 'PUNCT']",Auffällig sein noch der Auge .,ADV AUX ADV DET NOUN PUNCT
Dark__S02E07.srt,Dark,Dark S02,Dark E07,40,"0:3:22,297","0:3:24,130","Ein blaues, ein braunes.","ein blaues, ein braunes.","['braunes', 'blaues', 'ein']","['Ein', 'blaues', 'ein', 'braunes']","['Ein', 'blaues', ',', 'ein', 'braunes', '.']","['Ein', 'blau', ',', 'einen', 'braun', '.']","['DET', 'ADJ', 'PUNCT', 'DET', 'ADJ', 'PUNCT']","Ein blau , einen braun .",DET ADJ PUNCT DET ADJ PUNCT
Dark__S02E07.srt,Dark,Dark S02,Dark E07,41,"0:3:25,255","0:3:26,880",Nennt sich Heterochromie.,nennt sich heterochromie.,"['nennt', 'sich', 'heterochromie']","['Nennt', 'sich', 'Heterochromie']","['Nennt', 'sich', 'Heterochromie', '.']","['Nennt', 'sich', 'Heterochromie', '.']","['VERB', 'PRON', 'NOUN', 'PUNCT']",Nennt sich Heterochromie .,VERB PRON NOUN PUNCT
Dark__S02E07.srt,Dark,Dark S02,Dark E07,42,"0:3:32,797","0:3:34,422","Diese Frau, sie...","diese frau, sie...","['frau', 'sie', 'diese']","['Diese', 'Frau', 'sie']","['Diese', 'Frau', ',', 'sie', '...']","['Diese', 'Frau', ',', 'ich', '...']","['DET', 'NOUN', 'PUNCT', 'PRON', 'PUNCT']","Diese Frau , ich ...",DET NOUN PUNCT PRON PUNCT
Dark__S02E07.srt,Dark,Dark S02,Dark E07,43,"0:3:36,755","0:3:38,588",Sie war auf dem Polizeirevier.,sie war auf dem polizeirevier.,"['dem', 'sie', 'polizeirevier', 'auf', 'war']","['Sie', 'war', 'auf', 'dem', 'Polizeirevier']","['Sie', 'war', 'auf', 'dem', 'Polizeirevier', '.']","['ich', 'sein', 'auf', 'der', 'Polizeirevier', '.']","['PRON', 'AUX', 'ADP', 'DET', 'NOUN', 'PUNCT']",ich sein auf der Polizeirevier .,PRON AUX ADP DET NOUN PUNCT
Dark__S02E07.srt,Dark,Dark S02,Dark E07,44,"0:3:39,797","0:3:42,380","An dem Tag, als der kleine Helge wieder auftauchte.","an dem tag, als der kleine helge wieder auftauchte.","['an', 'dem', 'auftauchte', 'der', 'als', 'wieder', 'helge', 'tag', 'kleine']","['An', 'dem', 'Tag', 'als', 'der', 'kleine', 'Helge', 'wieder', 'auftauchte']","['An', 'dem', 'Tag', ',', 'als', 'der', 'kleine', 'Helge', 'wieder', 'auftauchte', '.']","['an', 'der', 'Tag', ',', 'als', 'der', 'kleine', 'Helge', 'wieder', 'auftauchen', '.']","['ADP', 'DET', 'NOUN', 'PUNCT', 'SCONJ', 'DET', 'ADJ', 'NOUN', 'ADV', 'VERB', 'PUNCT']","an der Tag , als der kleine Helge wieder auftauchen .",ADP DET NOUN PUNCT SCONJ DET ADJ NOUN ADV VERB PUNCT
Dark__S02E07.srt,Dark,Dark S02,Dark E07,45,"0:3:43,922","0:3:45,213",Und?,und?,['und'],['Und'],"['Und', '?']","['und', '?']","['CCONJ', 'PUNCT']",und ?,CCONJ PUNCT
Dark__S02E07.srt,Dark,Dark S02,Dark E07,46,"0:3:45,297","0:3:46,797",Sie war verwirrt.,sie war verwirrt.,"['war', 'verwirrt', 'sie']","['Sie', 'war', 'verwirrt']","['Sie', 'war', 'verwirrt', '.']","['ich', 'sein', 'verwirren', '.']","['PRON', 'AUX', 'ADV', 'PUNCT']",ich sein verwirren .,PRON AUX ADV PUNCT
Dark__S02E07.srt,Dark,Dark S02,Dark E07,47,"0:3:47,505","0:3:49,130",Nicht ganz bei sich.,nicht ganz bei sich.,"['ganz', 'nicht', 'bei', 'sich']","['Nicht', 'ganz', 'bei', 'sich']","['Nicht', 'ganz', 'bei', 'sich', '.']","['Nicht', 'ganz', 'bei', 'sich', '.']","['PART', 'ADV', 'ADP', 'PRON', 'PUNCT']",Nicht ganz bei sich .,PART ADV ADP PRON PUNCT
Dark__S02E07.srt,Dark,Dark S02,Dark E07,48,"0:3:50,630","0:3:53,255","Sie hat sich für irgendwas entschuldigt, ich...","sie hat sich für irgendwas entschuldigt, ich...","['für', 'sie', 'sich', 'irgendwas', 'entschuldigt', 'ich', 'hat']","['Sie', 'hat', 'sich', 'für', 'irgendwas', 'entschuldigt', 'ich']","['Sie', 'hat', 'sich', 'für', 'irgendwas', 'entschuldigt', ',', 'ich', '...']","['ich', 'haben', 'sich', 'für', 'irgendwas', 'entschuldigen', ',', 'ich', '...']","['PRON', 'AUX', 'PRON', 'ADP', 'ADV', 'VERB', 'PUNCT', 'PRON', 'PUNCT']","ich haben sich für irgendwas entschuldigen , ich ...",PRON AUX PRON ADP ADV VERB PUNCT PRON PUNCT
Dark__S02E07.srt,Dark,Dark S02,Dark E07,49,"0:3:54,797","0:3:56,463","...hab nicht verstanden, wofür.","...hab nicht verstanden, wofür.","['hab', 'verstanden', 'wofür', 'nicht']","['hab', 'nicht', 'verstanden', 'wofür']","['...', 'hab', 'nicht', 'verstanden', ',', 'wofür', '.']","['...', 'hab', 'nicht', 'verstehen', ',', 'wofür', '.']","['PUNCT', 'VERB', 'PART', 'VERB', 'PUNCT', 'ADV', 'PUNCT']","... hab nicht verstehen , wofür .",PUNCT VERB PART VERB PUNCT ADV PUNCT
Dark__S02E07.srt,Dark,Dark S02,Dark E07,50,"0:3:58,213","0:4:0,547","Am gleichen Tag, als Helge zurückgekommen ist?","am gleichen tag, als helge zurückgekommen ist?","['gleichen', 'am', 'ist', 'als', 'zurückgekommen', 'helge', 'tag']","['Am', 'gleichen', 'Tag', 'als', 'Helge', 'zurückgekommen', 'ist']","['Am', 'gleichen', 'Tag', ',', 'als', 'Helge', 'zurückgekommen', 'ist', '?']","['Am', 'gleich', 'Tag', ',', 'als', 'Helge', 'zurückkommen', 'sein', '?']","['ADP', 'ADJ', 'NOUN', 'PUNCT', 'ADP', 'NOUN', 'VERB', 'AUX', 'PUNCT']","Am gleich Tag , als Helge zurückkommen sein ?",ADP ADJ NOUN PUNCT ADP NOUN VERB AUX PUNCT
Dark__S02E07.srt,Dark,Dark S02,Dark E07,51,"0:4:5,5","0:4:9,755",Vielleicht ist sie die Komplizin von dem Verrückten. Könnte seine Mutter sein.,vielleicht ist sie die komplizin von dem verrückten. könnte seine mutter sein.,"['komplizin', 'sein', 'dem', 'sie', 'ist', 'seine', 'mutter', 'die', 'verrückten', 'vielleicht', 'könnte', 'von']","['Vielleicht', 'ist', 'sie', 'die', 'Komplizin', 'von', 'dem', 'Verrückten', 'Könnte', 'seine', 'Mutter', 'sein']","['Vielleicht', 'ist', 'sie', 'die', 'Komplizin', 'von', 'dem', 'Verrückten', '.', 'Könnte', 'seine', 'Mutter', 'sein', '.']","['Vielleicht', 'sein', 'ich', 'der', 'Komplizin', 'von', 'der', 'Verrückte', '.', 'können', 'mein', 'Mutter', 'mein', '.']","['ADV', 'AUX', 'PRON', 'DET', 'NOUN', 'ADP', 'DET', 'NOUN', 'PUNCT', 'AUX', 'DET', 'NOUN', 'AUX', 'PUNCT']",Vielleicht sein ich der Komplizin von der Verrückte . können mein Mutter mein .,ADV AUX PRON DET NOUN ADP DET NOUN PUNCT AUX DET NOUN AUX PUNCT
Dark__S02E07.srt,Dark,Dark S02,Dark E07,52,"0:4:10,880","0:4:13,338","Hat Helge bei sich gehabt, die ganze Zeit.","hat helge bei sich gehabt, die ganze zeit.","['zeit', 'gehabt', 'ganze', 'sich', 'die', 'bei', 'helge', 'hat']","['Hat', 'Helge', 'bei', 'sich', 'gehabt', 'die', 'ganze', 'Zeit']","['Hat', 'Helge', 'bei', 'sich', 'gehabt', ',', 'die', 'ganze', 'Zeit', '.']","['haben', 'Helge', 'bei', 'sich', 'haben', ',', 'der', 'ganze', 'Zeit', '.']","['VERB', 'PROPN', 'ADP', 'PRON', 'VERB', 'PUNCT', 'DET', 'ADJ', 'NOUN', 'PUNCT']","haben Helge bei sich haben , der ganze Zeit .",VERB PROPN ADP PRON VERB PUNCT DET ADJ NOUN PUNCT
Dark__S02E07.srt,Dark,Dark S02,Dark E07,53,"0:4:14,505","0:4:16,713",Da ist noch was anderes.,da ist noch was anderes.,"['was', 'ist', 'anderes', 'da', 'noch']","['Da', 'ist', 'noch', 'was', 'anderes']","['Da', 'ist', 'noch', 'was', 'anderes', '.']","['da', 'sein', 'noch', 'was', 'ander', '.']","['ADV', 'AUX', 'ADV', 'DET', 'PRON', 'PUNCT']",da sein noch was ander .,ADV AUX ADV DET PRON PUNCT
Dark__S02E07.srt,Dark,Dark S02,Dark E07,54,"0:4:17,755","0:4:19,880",Ich bin nur zufällig drauf gestoßen.,ich bin nur zufällig drauf gestoßen.,"['gestoßen', 'nur', 'zufällig', 'bin', 'drauf', 'ich']","['Ich', 'bin', 'nur', 'zufällig', 'drauf', 'gestoßen']","['Ich', 'bin', 'nur', 'zufällig', 'drauf', 'gestoßen', '.']","['Ich', 'sein', 'nur', 'zufällig', 'drauf', 'stoßen', '.']","['PRON', 'AUX', 'ADV', 'ADV', 'ADV', 'VERB', 'PUNCT']",Ich sein nur zufällig drauf stoßen .,PRON AUX ADV ADV ADV VERB PUNCT
Dark__S02E07.srt,Dark,Dark S02,Dark E07,55,"0:4:21,380","0:4:22,380",Der Körper,der körper,"['der', 'körper']","['Der', 'Körper']","['Der', 'Körper']","['der', 'Körper']","['DET', 'NOUN']",der Körper,DET NOUN
Dark__S02E07.srt,Dark,Dark S02,Dark E07,56,"0:4:23,88","0:4:24,630",ist völlig verstrahlt.,ist völlig verstrahlt.,"['völlig', 'verstrahlt', 'ist']","['ist', 'völlig', 'verstrahlt']","['ist', 'völlig', 'verstrahlt', '.']","['sein', 'völlig', 'verstrahlen', '.']","['AUX', 'ADV', 'VERB', 'PUNCT']",sein völlig verstrahlen .,AUX ADV VERB PUNCT
Dark__S02E07.srt,Dark,Dark S02,Dark E07,58,"0:4:28,630","0:4:30,630",Hier.,hier.,['hier'],['Hier'],"['Hier', '.']","['Hier', '.']","['ADV', 'PUNCT']",Hier .,ADV PUNCT
Dark__S02E07.srt,Dark,Dark S02,Dark E07,59,"0:4:31,880","0:4:33,88",Überall.,überall.,['überall'],['Überall'],"['Überall', '.']","['Überall', '.']","['ADV', 'PUNCT']",Überall .,ADV PUNCT
Dark__S02E07.srt,Dark,Dark S02,Dark E07,60,"0:4:34,838","0:4:39,380",Sie muss über längere Zeit einer starken Strahlung ausgesetzt gewesen sein.,sie muss über längere zeit einer starken strahlung ausgesetzt gewesen sein.,"['sein', 'zeit', 'sie', 'gewesen', 'längere', 'muss', 'strahlung', 'einer', 'ausgesetzt', 'über', 'starken']","['Sie', 'muss', 'über', 'längere', 'Zeit', 'einer', 'starken', 'Strahlung', 'ausgesetzt', 'gewesen', 'sein']","['Sie', 'muss', 'über', 'längere', 'Zeit', 'einer', 'starken', 'Strahlung', 'ausgesetzt', 'gewesen', 'sein', '.']","['ich', 'muss', 'über', 'lang', 'Zeit', 'einer', 'stark', 'Strahlung', 'aussetzen', 'sein', 'mein', '.']","['PRON', 'VERB', 'ADP', 'ADJ', 'NOUN', 'DET', 'ADJ', 'NOUN', 'VERB', 'AUX', 'AUX', 'PUNCT']",ich muss über lang Zeit einer stark Strahlung aussetzen sein mein .,PRON VERB ADP ADJ NOUN DET ADJ NOUN VERB AUX AUX PUNCT
Dark__S02E07.srt,Dark,Dark S02,Dark E07,61,"0:4:39,463","0:4:40,880","Na, eigenartig.","na, eigenartig.","['eigenartig', 'na']","['Na', 'eigenartig']","['Na', ',', 'eigenartig', '.']","['Na', ',', 'eigenartig', '.']","['PROPN', 'PUNCT', 'ADV', 'PUNCT']","Na , eigenartig .",PROPN PUNCT ADV PUNCT
Dark__S02E07.srt,Dark,Dark S02,Dark E07,62,"0:4:40,963","0:4:43,963",Hat vielleicht als Röntgentechnikerin gearbeitet.,hat vielleicht als röntgentechnikerin gearbeitet.,"['gearbeitet', 'vielleicht', 'als', 'röntgentechnikerin', 'hat']","['Hat', 'vielleicht', 'als', 'Röntgentechnikerin', 'gearbeitet']","['Hat', 'vielleicht', 'als', 'Röntgentechnikerin', 'gearbeitet', '.']","['haben', 'vielleicht', 'als', 'Röntgentechnikerin', 'arbeiten', '.']","['AUX', 'ADV', 'ADP', 'NOUN', 'VERB', 'PUNCT']",haben vielleicht als Röntgentechnikerin arbeiten .,AUX ADV ADP NOUN VERB PUNCT
Dark__S02E07.srt,Dark,Dark S02,Dark E07,63,"0:4:44,630","0:4:46,463",Röntgentechnikerin?,röntgentechnikerin?,['röntgentechnikerin'],['Röntgentechnikerin'],"['Röntgentechnikerin', '?']","['Röntgentechnikerin', '?']","['NOUN', 'PUNCT']",Röntgentechnikerin ?,NOUN PUNCT
Dark__S02E07.srt,Dark,Dark S02,Dark E07,64,"0:4:49,505","0:4:53,880",Zeig dem DopplerJungen ein Foto von ihr. Vielleicht erkennt er sie ja wieder.,zeig dem dopplerjungen ein foto von ihr. vielleicht erkennt er sie ja wieder.,"['dem', 'sie', 'dopplerjungen', 'zeig', 'ja', 'ein', 'vielleicht', 'foto', 'wieder', 'erkennt', 'ihr', 'er', 'von']","['Zeig', 'dem', 'DopplerJungen', 'ein', 'Foto', 'von', 'ihr', 'Vielleicht', 'erkennt', 'er', 'sie', 'ja', 'wieder']","['Zeig', 'dem', 'DopplerJungen', 'ein', 'Foto', 'von', 'ihr', '.', 'Vielleicht', 'erkennt', 'er', 'sie', 'ja', 'wieder', '.']","['Zeig', 'der', 'DopplerJungen', 'einen', 'Foto', 'von', 'mein', '.', 'Vielleicht', 'erkennen', 'ich', 'ich', 'ja', 'wieder', '.']","['NOUN', 'DET', 'NOUN', 'DET', 'NOUN', 'ADP', 'PRON', 'PUNCT', 'ADV', 'VERB', 'PRON', 'PRON', 'ADV', 'ADV', 'PUNCT']",Zeig der DopplerJungen einen Foto von mein . Vielleicht erkennen ich ich ja wieder .,NOUN DET NOUN DET NOUN ADP PRON PUNCT ADV VERB PRON PRON ADV ADV PUNCT
Dark__S02E07.srt,Dark,Dark S02,Dark E07,65,"0:5:5,130","0:5:6,880","Die Daten legen nahe,","die daten legen nahe,","['legen', 'nahe', 'daten', 'die']","['Die', 'Daten', 'legen', 'nahe']","['Die', 'Daten', 'legen', 'nahe', ',']","['der', 'Datum', 'legen', 'nahe', ',']","['DET', 'NOUN', 'VERB', 'ADP', 'PUNCT']","der Datum legen nahe ,",DET NOUN VERB ADP PUNCT
Dark__S02E07.srt,Dark,Dark S02,Dark E07,66,"0:5:6,963","0:5:10,130",dass das Partikel regelmäßig in zwei Protonen zerfällt.,dass das partikel regelmäßig in zwei protonen zerfällt.,"['partikel', 'das', 'zerfällt', 'protonen', 'dass', 'in', 'zwei', 'regelmäßig']","['dass', 'das', 'Partikel', 'regelmäßig', 'in', 'zwei', 'Protonen', 'zerfällt']","['dass', 'das', 'Partikel', 'regelmäßig', 'in', 'zwei', 'Protonen', 'zerfällt', '.']","['dass', 'der', 'Partikel', 'regelmäßig', 'in', 'zwei', 'Protonen', 'zerfallen', '.']","['SCONJ', 'DET', 'NOUN', 'ADV', 'ADP', 'NUM', 'NOUN', 'VERB', 'PUNCT']",dass der Partikel regelmäßig in zwei Protonen zerfallen .,SCONJ DET NOUN ADV ADP NUM NOUN VERB PUNCT
Dark__S02E07.srt,Dark,Dark S02,Dark E07,67,"0:5:11,88","0:5:12,338","Masse,","masse,",['masse'],['Masse'],"['Masse', ',']","['Masse', ',']","['NOUN', 'PUNCT']","Masse ,",NOUN PUNCT
Dark__S02E07.srt,Dark,Dark S02,Dark E07,68,"0:5:12,922","0:5:15,130",125 Gigaelektronenvolt.,125 gigaelektronenvolt.,"['125', 'gigaelektronenvolt']","['125', 'Gigaelektronenvolt']","['125', 'Gigaelektronenvolt', '.']","['125', 'Gigaelektronenvolt', '.']","['NUM', 'NOUN', 'PUNCT']",125 Gigaelektronenvolt .,NUM NOUN PUNCT
Dark__S02E07.srt,Dark,Dark S02,Dark E07,69,"0:5:23,255","0:5:27,463",In einem anderen Fall ist es allerdings in vier Myonen zerfallen.,in einem anderen fall ist es allerdings in vier myonen zerfallen.,"['vier', 'ist', 'allerdings', 'myonen', 'zerfallen', 'anderen', 'in', 'fall', 'einem', 'es']","['In', 'einem', 'anderen', 'Fall', 'ist', 'es', 'allerdings', 'in', 'vier', 'Myonen', 'zerfallen']","['In', 'einem', 'anderen', 'Fall', 'ist', 'es', 'allerdings', 'in', 'vier', 'Myonen', 'zerfallen', '.']","['In', 'einer', 'ander', 'Fall', 'sein', 'ich', 'allerdings', 'in', 'vier', 'Myonen', 'zerfallen', '.']","['ADP', 'DET', 'ADJ', 'NOUN', 'AUX', 'PRON', 'ADV', 'ADP', 'NUM', 'NOUN', 'VERB', 'PUNCT']",In einer ander Fall sein ich allerdings in vier Myonen zerfallen .,ADP DET ADJ NOUN AUX PRON ADV ADP NUM NOUN VERB PUNCT
Dark__S02E07.srt,Dark,Dark S02,Dark E07,70,"0:5:28,963","0:5:30,713","Oh, Sie sind schon hier?","oh, sie sind schon hier?","['oh', 'sie', 'sind', 'hier', 'schon']","['Oh', 'Sie', 'sind', 'schon', 'hier']","['Oh', ',', 'Sie', 'sind', 'schon', 'hier', '?']","['Oh', ',', 'ich', 'sein', 'schon', 'hier', '?']","['PROPN', 'PUNCT', 'PRON', 'AUX', 'ADV', 'ADV', 'PUNCT']","Oh , ich sein schon hier ?",PROPN PUNCT PRON AUX ADV ADV PUNCT
Dark__S02E07.srt,Dark,Dark S02,Dark E07,71,"0:5:33,838","0:5:35,838",Ich muss die Zeit vergessen haben.,ich muss die zeit vergessen haben.,"['zeit', 'vergessen', 'muss', 'die', 'haben', 'ich']","['Ich', 'muss', 'die', 'Zeit', 'vergessen', 'haben']","['Ich', 'muss', 'die', 'Zeit', 'vergessen', 'haben', '.']","['Ich', 'muss', 'der', 'Zeit', 'vergessen', 'haben', '.']","['PRON', 'AUX', 'DET', 'NOUN', 'VERB', 'AUX', 'PUNCT']",Ich muss der Zeit vergessen haben .,PRON AUX DET NOUN VERB AUX PUNCT
Dark__S02E07.srt,Dark,Dark S02,Dark E07,72,"0:5:37,130","0:5:38,838",Welcher Tag ist heute?,welcher tag ist heute?,"['welcher', 'heute', 'tag', 'ist']","['Welcher', 'Tag', 'ist', 'heute']","['Welcher', 'Tag', 'ist', 'heute', '?']","['welch', 'Tag', 'sein', 'heute', '?']","['DET', 'NOUN', 'AUX', 'ADV', 'PUNCT']",welch Tag sein heute ?,DET NOUN AUX ADV PUNCT
Dark__S02E07.srt,Dark,Dark S02,Dark E07,73,"0:5:39,338","0:5:40,588",Ähm...,ähm...,['ähm'],['Ähm'],"['Ähm', '...']","['Ähm', '...']","['NOUN', 'PUNCT']",Ähm ...,NOUN PUNCT
Dark__S02E07.srt,Dark,Dark S02,Dark E07,74,"0:5:40,672","0:5:41,922",Der...,der...,['der'],['Der'],"['Der', '...']","['der', '...']","['DET', 'PUNCT']",der ...,DET PUNCT
Dark__S02E07.srt,Dark,Dark S02,Dark E07,75,"0:5:42,5","0:5:43,672",26. Juni.,26. juni.,"['26.', 'juni']","['26.', 'Juni']","['26.', 'Juni', '.']","['26.', 'Juni', '.']","['ADJ', 'NOUN', 'PUNCT']",26. Juni .,ADJ NOUN PUNCT
Dark__S02E07.srt,Dark,Dark S02,Dark E07,76,"0:5:44,797","0:5:46,630",Waren Sie die ganze Nacht hier?,waren sie die ganze nacht hier?,"['sie', 'hier', 'die', 'waren', 'nacht', 'ganze']","['Waren', 'Sie', 'die', 'ganze', 'Nacht', 'hier']","['Waren', 'Sie', 'die', 'ganze', 'Nacht', 'hier', '?']","['Ware', 'ich', 'der', 'ganze', 'Nacht', 'hier', '?']","['AUX', 'PRON', 'DET', 'ADJ', 'NOUN', 'ADV', 'PUNCT']",Ware ich der ganze Nacht hier ?,AUX PRON DET ADJ NOUN ADV PUNCT
